title,url,time_published,summary,ticker,relevance_score,ticker_sentiment_score,ticker_sentiment_label
How Is The Market Feeling About American Electric Power? - American Electric Power  ( NASDAQ:AEP ) ,https://www.benzinga.com/short-sellers/23/06/33047880/how-is-the-market-feeling-about-american-electric-power,2023-06-28 17:45:29,"American Electric Power's AEP short percent of float has fallen 3.17% since its last report. The company recently reported that it has 6.28 million shares sold short, which is 1.22% of all regular shares that are available for trading.",AEP,0.218817,0.080451,Neutral
American Electric Power  ( AEP )  Stock Sinks As Market Gains: What You Should Know,https://www.zacks.com/stock/news/2113904/american-electric-power-aep-stock-sinks-as-market-gains-what-you-should-know,2023-06-27 22:15:24,"American Electric Power (AEP) closed at $83.44 in the latest trading session, marking a -0.41% move from the prior day.",AEP,0.605266,0.394185,Bullish
P/E Ratio Insights for American Electric Power - American Electric Power  ( NASDAQ:AEP ) ,https://www.benzinga.com/news/23/06/32987014/pe-ratio-insights-for-american-electric-power,2023-06-23 15:31:07,"In the current market session, American Electric Power Inc. AEP share price is at $84.53, after a 0.67% drop. Over the past month, the stock went up by 2.70%, but over the past year, it actually fell by 11.00%.",AEP,0.33628,-0.095426,Neutral
Where American Electric Power Stands With Analysts,https://markets.businessinsider.com/news/stocks/where-american-electric-power-stands-with-analysts-1032407190,2023-06-23 15:22:23,"Analysts have provided the following ratings for American Electric Power ( NASDAQ:AEP ) within the last quarter: In the last 3 months, 11 analysts have offered 12-month price targets for American Electric Power. The company has an average price target of $99.86 with a high of $113.00 and a low ...",AEP,0.601928,0.194807,Somewhat-Bullish
What Does American Electric Power's Debt Look Like? - American Electric Power  ( NASDAQ:AEP ) ,https://www.benzinga.com/news/23/06/32985583/what-does-american-electric-powers-debt-look-like,2023-06-23 14:45:37,"Over the past three months, shares of American Electric Power Inc. AEP decreased by 4.72%. When understanding a companies price change over a time period like 3 months, it could be helpful to look at its financials.",AEP,0.267804,-0.023067,Neutral
"Blackstone Injects $1B More Into Invenergy, Raising Total Stake To $4B To Propel Business Initiatives - Blackstone  ( NYSE:BX ) , American Electric Power  ( NASDAQ:AEP ) ",https://www.benzinga.com/news/large-cap/23/06/32971360/blackstone-injects-1b-more-into-invenergy-raising-total-stake-to-4b-to-propel-business-initiatives,2023-06-22 16:40:39,"Chicago-based Invenergy, a privately-held developer, owner and operator of sustainable energy solutions, announced on Wednesday that funds managed by Blackstone Infrastructure Partners BX made an additional $1 billion equity investment in the company.",AEP,0.204072,0.037456,Neutral
Why This 1 Momentum Stock Could Be a Great Addition to Your Portfolio,https://www.zacks.com/stock/news/2111798/why-this-1-momentum-stock-could-be-a-great-addition-to-your-portfolio,2023-06-22 13:50:07,"Wondering how to pick strong, market-beating stocks for your investment portfolio? Look no further than the Zacks Style Scores.",AEP,0.361802,0.185886,Somewhat-Bullish
"Jim Cramer Deems This 5% Yield Stock 'Too Risky For Me': He Prefers These 2 Alternatives - Dominion Energy  ( NYSE:D ) , American Electric Power  ( NASDAQ:AEP ) ",https://www.benzinga.com/trading-ideas/long-ideas/23/06/32916647/jim-cramer-deems-this-5-yield-stock-too-risky-for-me-he-prefers-these-2-alternatives,2023-06-20 12:46:31,"On CNBC's ""Mad Money Lightning Round,"" Jim Cramer said Dominion Energy, Inc. D with a 5% yield is a ""little too risky for me I prefer American Electric Power Company Inc AEP or I prefer Duke Energy Corp DUK."" Cramer said he likes UiPath Inc.",AEP,0.31282,-0.047299,Neutral
MSC INDUSTRIAL SUPPLY CO. ANNOUNCES RYAN MILLS AS HEAD OF INVESTOR RELATIONS,https://www.prnewswire.com/news-releases/msc-industrial-supply-co-announces-ryan-mills-as-head-of-investor-relations-301853407.html,2023-06-16 19:16:00,"MELVILLE, N.Y. and DAVIDSON, N.C., June 16, 2023 /PRNewswire/ -- MSC INDUSTRIAL SUPPLY CO. ( NYSE: MSM ) , ""MSC,"" ""MSC Industrial"" or the ""Company,"" a leading North American distributor of a broad range of metalworking and maintenance, repair and operations ( MRO ) products and services, today ...",AEP,0.03157,0.050023,Neutral
"EDP Renewables Honors Indiana Leaders and Community Partners, Donates $100K at Global Wind Day Event",https://www.benzinga.com/pressreleases/23/06/g32893096/edp-renewables-honors-indiana-leaders-and-community-partners-donates-100k-at-global-wind-day-event,2023-06-16 13:47:45,"Indianapolis, Indiana, June 16, 2023 ( GLOBE NEWSWIRE ) -- EDP Renewables North America ( EDPR NA ) , the leading renewable energy developer and operator in Indiana and a top five renewable energy operator in North America, honored the local Randolph County, Indiana, community and its partners ...",AEP,0.283422,0.326555,Somewhat-Bullish
"EDP Renewables Honors Indiana Leaders and Community Partners, Donates $100K at Global Wind Day Event",https://www.globenewswire.com/news-release/2023/06/16/2689774/0/en/EDP-Renewables-Honors-Indiana-Leaders-and-Community-Partners-Donates-100K-at-Global-Wind-Day-Event.html,2023-06-16 13:47:00,EDP Renewables hosted an event to commemorate Indiana's renewable energy success and recognize its statewide partnerships with its critical stakeholders. EDP Renewables hosted an event to commemorate Indiana's renewable energy success and recognize its statewide partnerships with its critical ...,AEP,0.270673,0.328356,Somewhat-Bullish
"Evergy  ( EVRG )  to Gain From Clean Asset Additions, Acquisitions",https://www.zacks.com/stock/news/2109312/evergy-evrg-to-gain-from-clean-asset-additions-acquisitions,2023-06-16 11:52:00,Evergy (EVRG) to boost profitability by investing $11.6 billion through 2027 to add clean sources to generate electricity and strengthen infrastructure to serve customers.,AEP,0.081276,0.12372,Neutral
5 Top No-Load Mutual Funds to Build a Solid Portfolio,https://www.zacks.com/stock/news/2109251/5-top-no-load-mutual-funds-to-build-a-solid-portfolio,2023-06-16 10:58:00,"Invest in these no-load mutual funds like FSELX, DLDRX, VSMIX, MIRSX and VGPMX to ensure high returns.",AEP,0.03463,0.048111,Neutral
American Electric Power  ( AEP )  Stock Sinks As Market Gains: What You Should Know,https://www.zacks.com/stock/news/2107913/american-electric-power-aep-stock-sinks-as-market-gains-what-you-should-know,2023-06-13 22:15:21,"In the latest trading session, American Electric Power (AEP) closed at $83.13, marking a -0.67% move from the previous day.",AEP,0.612033,0.340697,Somewhat-Bullish
"Company News for Jun 12, 2023",https://www.zacks.com/stock/news/2106975/company-news-for-jun-12-2023,2023-06-12 13:32:00,"Companies in The News Are: MRO, TGT, ...",AEP,0.674691,-0.175956,Somewhat-Bearish
"Goldman Sachs On 10 Utilities Stocks: What To Buy, Sell And Is Neutral - Dominion Energy  ( NYSE:D ) , American Electric Power  ( NASDAQ:AEP ) ",https://www.benzinga.com/analyst-ratings/analyst-color/23/06/32796791/goldman-sachs-on-10-utilities-stocks-what-to-buy-sell-and-is-neutral,2023-06-09 15:48:37,"Shares of companies in the utilities sector were under pressure in early trading on Friday. The next phase for U.S. utilities has begun, with many companies becoming ""decarbonization enablers"" and their models could ""drive value from several clear mega-themes,"" according to Goldman Sachs.",AEP,0.316846,0.381058,Bullish
"Benzinga's Top Ratings Upgrades, Downgrades For June 8, 2023",https://markets.businessinsider.com/news/stocks/benzinga-s-top-ratings-upgrades-downgrades-for-june-8-2023-1032378854,2023-06-08 15:19:43,"According to Wolfe Research, the prior rating for T-Mobile US Inc ( NASDAQ:TMUS ) was changed from Peer Perform to Outperform. For the first quarter, T-Mobile US had an EPS of $1.58, compared to year-ago quarter EPS of $0.57. At the moment, the stock has a 52-week-high of $154.29 and a ...",AEP,0.059897,0.0,Neutral
American Electric Power  ( AEP )  Gains As Market Dips: What You Should Know,https://www.zacks.com/stock/news/2105436/american-electric-power-aep-gains-as-market-dips-what-you-should-know,2023-06-07 22:15:12,"American Electric Power (AEP) closed the most recent trading day at $84.58, moving +1.37% from the previous trading session.",AEP,0.420083,0.148782,Neutral
American Electric Power  ( AEP )  Stock Sinks As Market Gains: What You Should Know,https://www.zacks.com/stock/news/2102890/american-electric-power-aep-stock-sinks-as-market-gains-what-you-should-know,2023-06-01 22:15:19,"American Electric Power (AEP) closed at $82.02 in the latest trading session, marking a -1.32% move from the prior day.",AEP,0.672055,0.304811,Somewhat-Bullish
PAUL WERTH ASSOCIATES MARKS 60 YEARS IN BUSINESS,https://www.prnewswire.com/news-releases/paul-werth-associates-marks-60-years-in-business-301838903.html,2023-05-31 15:47:00,Communications firm outlives its 1963 competitors while operating under same family ownership,AEP,0.080188,0.213327,Somewhat-Bullish
"Looking For Passive Income? Morgan Stanley Sees Major Upside In These Dividend Stocks Yielding Up To 9.6% - American Electric Power  ( NASDAQ:AEP ) , Energy Transfer  ( NYSE:ET ) ",https://www.benzinga.com/news/23/05/32577278/looking-for-passive-income-morgan-stanley-sees-major-upside-in-these-dividend-stocks-yielding-up-to,2023-05-25 15:06:43,"The timeless adage ""buy low, sell high"" has attracted countless people to participate in the stock market. But as many discover the hard way, the strategy is easier said than done. Stocks don't always go up. Even though the S&P 500 is up 7% in 2023, it's still down 14% compared to where it was at ...",AEP,0.048621,0.0,Neutral
A Look Into American Electric Power's Debt - American Electric Power  ( NASDAQ:AEP ) ,https://www.benzinga.com/news/23/05/32508523/a-look-into-american-electric-powers-debt,2023-05-22 13:45:42,"Shares of American Electric Power Inc. AEP decreased by 3.92% in the past three months. When understanding a companies price change over a time period like 3 months, it could be helpful to look at its financials.",AEP,0.359447,0.093235,Neutral
American Electric Power  ( NYSE:AEP )  Now Covered by Analysts at StockNews.com,https://www.defenseworld.net/2023/05/22/american-electric-power-nyseaep-now-covered-by-analysts-at-stocknews-com.html,2023-05-22 09:26:48,American Electric Power ( NYSE:AEP ) Now Covered by Analysts at ... Defense World ...,AEP,0.969227,0.40998,Bullish
12 Analysts Have This to Say About American Electric Power,https://markets.businessinsider.com/news/stocks/12-analysts-have-this-to-say-about-american-electric-power-1032340386,2023-05-19 18:02:14,"American Electric Power ( NASDAQ:AEP ) has observed the following analyst ratings within the last quarter: According to 12 analyst offering 12-month price targets in the last 3 months, American Electric Power has an average price target of $100.96 with a high of $113.00 and a low of $82.50.",AEP,0.502207,0.182843,Somewhat-Bullish
"Top 4 Utilities Stocks That Could Lead To Your Biggest Gains In Q2 - Exelon  ( NASDAQ:EXC ) , American Electric Power  ( NASDAQ:AEP ) ",https://www.benzinga.com/trading-ideas/long-ideas/23/05/32465068/top-4-utilities-stocks-that-could-lead-to-your-biggest-gains-in-q2,2023-05-18 12:55:31,"The most oversold stocks in the utilities sector presents an opportunity to buy into undervalued companies. The RSI is a momentum indicator, which compares a stock's strength on days when prices go up to its strength on days when prices go down.",AEP,0.367412,0.300008,Somewhat-Bullish
"NextEra Energy: Buy, Sell, or Hold?",https://www.fool.com/investing/2023/05/15/nextera-energy-buy-sell-or-hold/,2023-05-15 10:48:00,"The giant utility is telling investors to expect more growth ahead, which should please investors interested in dividend growth.",AEP,0.09989,0.133387,Neutral
Canada's Algonquin starts strategic review of renewable energy group,https://www.reuters.com/business/energy/canadas-algonquin-starts-strategic-review-renewable-energy-group-2023-05-11/,2023-05-11 11:00:57,"May 11 ( Reuters ) - Algonquin Power & Utilities Corp ( AQN.TO ) said on Thursday it had initiated a strategic review of its renewable energy group, following a push by Corvex Management and other activist firms for changes.",AEP,0.205807,-0.290336,Somewhat-Bearish
Algonquin Power & Utilities Corp. Announces 2023 First Quarter Financial Results,https://www.newswire.ca/news-releases/algonquin-power-amp-utilities-corp-announces-2023-first-quarter-financial-results-897516428.html,2023-05-11 10:30:00,Algonquin Power & Utilities Corp. Announces 2023 First Quarter ... Canada ...,AEP,0.068846,0.171106,Somewhat-Bullish
Algonquin Power & Utilities Corp. Announces 2023 First Quarter Financial Results,https://www.prnewswire.com/news-releases/algonquin-power--utilities-corp-announces-2023-first-quarter-financial-results-301821832.html,2023-05-11 10:30:00,Algonquin Power & Utilities Corp. Announces 2023 First Quarter ... PR ...,AEP,0.064885,0.086085,Neutral
EPA issues plan to clamp down on power plant carbon emissions,https://www.axios.com/2023/05/11/epa-issues-plan-to-clamp-down-on-power-plant-carbon-emissions,2023-05-11 09:00:00,"The American Electric Power Mountaineer coal plant in Letart, West Virginia. Photo: Ty Wright via Getty Images EPA unveiled draft regulations Thursday to slash carbon emissions from the nation's huge fleet of coal- and gas-fired power plants.",AEP,0.06179,0.167086,Somewhat-Bullish
IBDRY vs. AEP: Which Stock Is the Better Value Option?,https://www.zacks.com/stock/news/2093616/ibdry-vs-aep-which-stock-is-the-better-value-option,2023-05-10 15:40:10,Investors looking for stocks in the Utility - Electric Power sector might want to consider either Iberdrola S.A. ( IBDRY Quick QuoteIBDRY - ) or American Electric Power ( AEP Quick QuoteAEP - ) . But which of these two stocks is more attractive to value investors? We'll need to take a closer look ...,AEP,0.618426,0.507019,Bullish
How Is The Market Feeling About American Electric Power? - American Electric Power  ( NASDAQ:AEP ) ,https://www.benzinga.com/short-sellers/23/05/32319525/how-is-the-market-feeling-about-american-electric-power,2023-05-10 15:15:29,"American Electric Power's AEP short percent of float has fallen 15.49% since its last report. The company recently reported that it has 6.19 million shares sold short, which is 1.2% of all regular shares that are available for trading.",AEP,0.218817,0.080451,Neutral
What Does American Electric Power's Debt Look Like? - American Electric Power  ( NASDAQ:AEP ) ,https://www.benzinga.com/news/23/05/32266515/what-does-american-electric-powers-debt-look-like,2023-05-08 14:45:37,"Over the past three months, shares of American Electric Power Inc. AEP moved higher by 3.96%. Before having a look at the importance of debt, let's look at how much debt American Electric Power has.",AEP,0.299478,-0.018461,Neutral
"American Electric  ( AEP )  Q1 Earnings Lag Estimates, Sales Beat",https://www.zacks.com/stock/news/2090362/american-electric-aep-q1-earnings-lag-estimates-sales-beat,2023-05-04 19:23:00,"American Electric Power's (AEP) first-quarter earnings are lower than expected, but revenues surpassed estimates. AEP continues with its long-term investment plan to strengthen operations.",AEP,0.401331,-0.057356,Neutral
"Last Hike Appears To Be In - Apple  ( NASDAQ:AAPL ) , American Electric Power  ( NASDAQ:AEP ) ",https://www.benzinga.com/economics/macro-economic-events/23/05/32217386/last-hike-appears-to-be-in,2023-05-04 15:19:41,Stop me if you've heard this one before: regional banks are down again this morning. Gold has hit an all-time high. GDP is slowing. Inflation is still too high. And the FED just raised rates into what is likely going to be a recession.,AEP,0.085173,0.0,Neutral
"American Electric Power Q1 EPS In-Line With Estimates, Guidance Reiterated - American Electric Power  ( NASDAQ:AEP ) ",https://www.benzinga.com/news/earnings/23/05/32211274/american-electric-power-q1-eps-in-line-with-estimates-guidance-reiterated,2023-05-04 13:24:08,"American Electric Power Co Inc AEP reported Q1 2023 operating EPS of $1.11, down from $1.22, which came in line with the consensus. Revenues of $4.7 billion came slightly above $4.6 billion a year ago and missed the consensus of $4.71 billion.",AEP,0.755086,0.314441,Somewhat-Bullish
American Electric Power  ( AEP )  Misses Q1 Earnings Estimates,https://www.zacks.com/stock/news/2089798/american-electric-power-aep-misses-q1-earnings-estimates,2023-05-04 12:15:19,"AEP (AEP) delivered earnings and revenue surprises of -2.63% and 3.26%, respectively, for the quarter ended March 2023. Do the numbers hold clues to what lies ahead for the stock?",AEP,0.399204,0.155673,Somewhat-Bullish
"AEP REPORTS FIRST-QUARTER EARNINGS, REAFFIRMS 2023 GUIDANCE",https://www.prnewswire.com/news-releases/aep-reports-first-quarter-earnings-reaffirms-2023-guidance-301815453.html,2023-05-04 10:57:00,"AEP REPORTS FIRST-QUARTER EARNINGS, REAFFIRMS 2023 ... PR ...",AEP,0.483888,0.28556,Somewhat-Bullish
P/E Ratio Insights for American Electric Power - American Electric Power  ( NASDAQ:AEP ) ,https://www.benzinga.com/news/23/05/32197792/pe-ratio-insights-for-american-electric-power,2023-05-03 20:15:26,"In the current session, American Electric Power Inc. AEP is trading at $90.87, after a 0.45% drop. Over the past month, the stock fell by 3.88%, and in the past year, by 8.82%. With performance like this, long-term shareholders are more likely to start looking into the company's price-to-earnings ...",AEP,0.371523,-0.203065,Somewhat-Bearish
"NiSource  ( NI )  Q1 Earnings In Line With Estimates, Sales Beat",https://www.zacks.com/stock/news/2089317/nisource-ni-q1-earnings-in-line-with-estimates-sales-beat,2023-05-03 17:24:00,"NiSource's (NI) first-quarter 2023 earnings are on par with estimates, while revenues surpass the same.",AEP,0.16849,0.181863,Somewhat-Bullish
Exelon  ( EXC )  Q1 Earnings and Revenues Surpass Estimates,https://www.zacks.com/stock/news/2088802/exelon-exc-q1-earnings-and-revenues-surpass-estimates,2023-05-03 12:05:09,"Exelon (EXC) delivered earnings and revenue surprises of 6.06% and 0.81%, respectively, for the quarter ended March 2023. Do the numbers hold clues to what lies ahead for the stock?",AEP,0.138066,0.0,Neutral
"SAI.TECH Announces co-host of a Ribbon Cut Event with SE Ohio Port Authority for Computing Heat Recycle Center - SAI.TECH Global  ( NASDAQ:SAI ) , SAI.TECH Global  ( NASDAQ:SAITW ) ",https://www.benzinga.com/pressreleases/23/05/g32177232/sai-tech-announces-co-host-of-a-ribbon-cut-event-with-se-ohio-port-authority-for-computing-heat-re,2023-05-02 22:56:58,"SINGAPORE, May 02, 2023 ( GLOBE NEWSWIRE ) -- SAI.TECH Global Corporation ( ( "", SAI.TECH"", OR "", SAI"", or the "", Company"", , NASDAQ:SAI ) , a Sustainable Bitverse Operator announced co-host of a Ribbon Cut Event with Southeastern Ohio Port Authority for Computing Heat Technology Development ...",AEP,0.071784,0.082931,Neutral
SAI.TECH Announces co-host of a Ribbon Cut Event with SE Ohio Port Authority for Computing Heat Recycle Center,https://www.globenewswire.com/news-release/2023/05/02/2659891/0/en/SAI-TECH-Announces-co-host-of-a-Ribbon-Cut-Event-with-SE-Ohio-Port-Authority-for-Computing-Heat-Recycle-Center.html,2023-05-02 22:56:00,"SINGAPORE, May 02, 2023 ( GLOBE NEWSWIRE ) -- SAI.TECH Global Corporation ( ""SAI.TECH"" OR ""SAI"" or the ""Company"", NASDAQ: SAI ) , a Sustainable Bitverse Operator announced co-host of a Ribbon Cut Event with Southeastern Ohio Port Authority for Computing Heat Technology Development Recycle Center ...",AEP,0.073659,0.044822,Neutral
What's in Store for American Electric  ( AEP )  in Q1 Earnings?,https://www.zacks.com/stock/news/2087366/whats-in-store-for-american-electric-aep-in-q1-earnings,2023-05-01 12:55:00,American Electric's (AEP) Q1 results are likely to reflect the impact of adverse weather patterns on its earnings.,AEP,0.317254,0.0,Neutral
Activist investor Corvex amasses stake in power utility Algonquin -sources,https://www.reuters.com/markets/deals/activist-investor-corvex-amasses-stake-power-utility-algonquin-sources-2023-04-28/,2023-04-28 19:22:00,Activist investor Corvex amasses stake in power utility Algonquin ... ...,AEP,0.118064,0.094391,Neutral
AES  ( AES )  Earnings Expected to Grow: Should You Buy?,https://www.zacks.com/stock/news/2086909/aes-aes-earnings-expected-to-grow-should-you-buy,2023-04-28 14:00:38,AES (AES) doesn't possess the right combination of the two key ingredients for a likely earnings beat in its upcoming report. Get prepared with the key expectations.,AEP,0.174903,0.021179,Neutral
"Zacks Industry Outlook Highlights NextEra Energy, American Electric Power Xcel Energy and Consolidated Edison",https://www.zacks.com/stock/news/2086651/zacks-industry-outlook-highlights-nextera-energy-american-electric-power-xcel-energy-and-consolidated-edison,2023-04-28 09:00:00,"NextEra Energy, American Electric Power Xcel Energy and Consolidated Edison have been highlighted in this Industry Outlook article.",AEP,0.183297,0.122381,Neutral
American Electric Power  ( AEP )  Gains But Lags Market: What You Should Know,https://www.zacks.com/stock/news/2086531/american-electric-power-aep-gains-but-lags-market-what-you-should-know,2023-04-27 22:15:14,"American Electric Power (AEP) closed at $92.81 in the latest trading session, marking a +0.61% move from the prior day.",AEP,0.658245,0.245316,Somewhat-Bullish
4 Stocks to Watch From the Promising Electric Power Industry,https://www.zacks.com/commentary/2086167/4-stocks-to-watch-from-the-promising-electric-power-industry,2023-04-27 14:17:00,"Amid the ongoing transition in the utility space, electric power utilities like NEE, AEP, XEL and ED have well-chalked-out capital investment plans to upgrade infrastructure and add clean assets to their generation portfolio to provide efficient services.",AEP,0.164095,0.169919,Somewhat-Bullish
Analysts Estimate American Electric Power  ( AEP )  to Report a Decline in Earnings: What to Look Out for,https://www.zacks.com/stock/news/2086046/analysts-estimate-american-electric-power-aep-to-report-a-decline-in-earnings-what-to-look-out-for,2023-04-27 14:02:56,AEP (AEP) doesn't possess the right combination of the two key ingredients for a likely earnings beat in its upcoming report. Get prepared with the key expectations.,AEP,0.299478,-0.006651,Neutral
Utility M&A's: Just Taking A Breather,https://www.forbes.com/sites/greatspeculations/2023/04/22/utility-mas-just-taking-a-breather/,2023-04-22 12:00:29,"On October 26, 2021, Algonquin Power & Utilities announced it would buy American Electric Power's Kentucky Power and Kentucky Transco units. 14 months later, FERC formally rejected the deal, on the grounds the parties couldn't guarantee there wouldn't be an impact on transmission rates.",AEP,0.125242,-0.054921,Neutral
American Electric Power  ( AEP )  Stock Moves -0.03%: What You Should Know,https://www.zacks.com/stock/news/2082493/american-electric-power-aep-stock-moves--003-what-you-should-know,2023-04-20 22:15:23,"In the latest trading session, American Electric Power (AEP) closed at $93.51, marking a -0.03% move from the previous day.",AEP,0.641573,0.047591,Neutral
PG&E Corp.  ( PCG )  Secures 24% Reduction in Gas Emissions,https://www.zacks.com/stock/news/2080997/pge-corp-pcg-secures-24-reduction-in-gas-emissions,2023-04-19 13:42:00,PG&E Corp. (PCG) announces the attainment of a 24% reduction in emissions from its natural gas pipeline system.,AEP,0.20698,0.221689,Somewhat-Bullish
What Does American Electric Power's Debt Look Like? - American Electric Power  ( NASDAQ:AEP ) ,https://www.benzinga.com/news/23/04/31864248/what-does-american-electric-powers-debt-look-like,2023-04-18 17:00:33,"Shares of American Electric Power Inc. AEP moved higher by 0.28% in the past three months. When understanding a companies price change over a time period like 3 months, it could be helpful to look at its financials.",AEP,0.28008,-0.021701,Neutral
AEP OUTLINES STRATEGIC FOCUS ON KENTUCKY,https://www.prnewswire.com/news-releases/aep-outlines-strategic-focus-on-kentucky-301798522.html,2023-04-17 10:59:00,Parties have agreed to terminate the transaction under which AEP would sell its Kentucky operations to Liberty AEP is committed to providing reliable service to Kentucky customers and ensuring the financial health of the utility as part of the state's economic and energy future.,AEP,0.620083,0.367751,Bullish
Algonquin Power & Utilities Corp. and American Electric Power Mutually Agree to Terminate Kentucky Power Transaction,https://www.prnewswire.com/news-releases/algonquin-power--utilities-corp-and-american-electric-power-mutually-agree-to-terminate-kentucky-power-transaction-301798512.html,2023-04-17 10:59:00,Algonquin Power & Utilities Corp. and American Electric Power ... PR ...,AEP,0.149285,0.360125,Bullish
Algonquin Power & Utilities Corp. and American Electric Power Mutually Agree to Terminate Kentucky Power Transaction,https://www.newswire.ca/news-releases/algonquin-power-amp-utilities-corp-and-american-electric-power-mutually-agree-to-terminate-kentucky-power-transaction-807131634.html,2023-04-17 10:59:00,Algonquin Power & Utilities Corp. and American Electric Power ... Canada ...,AEP,0.149285,0.360125,Bullish
