title,url,time_published,summary,ticker,relevance_score,ticker_sentiment_score,ticker_sentiment_label
P/E Ratio Insights for American Electric Power - American Electric Power  ( NASDAQ:AEP ) ,https://www.benzinga.com/news/23/04/31810339/pe-ratio-insights-for-american-electric-power,2023-04-14 16:45:20,"In the current market session, American Electric Power Inc. AEP share price is at $92.63, after a 1.43% drop. Over the past month, the stock spiked by 1.84%, but over the past year, it actually decreased by 8.88%.",AEP,0.410059,-0.078314,Neutral
Evergy  ( EVRG )  Gains From Steady Investment in Infrastructure,https://www.zacks.com/stock/news/2079199/evergy-evrg-gains-from-steady-investment-in-infrastructure,2023-04-14 15:50:00,Evergy (EVRG) is likely to benefit from systematic capital investments and expanding operations in the transmission market.,AEP,0.108958,0.17705,Somewhat-Bullish
Building a Defensive Portfolio: 3 Utilities Stocks to Consider,https://www.zacks.com/commentary/2076505/building-a-defensive-portfolio-3-utilities-stocks-to-consider,2023-04-10 18:46:00,"The Zacks Utilities sector has displayed relative strength over the last month, outperforming the S&P 500. Can this recent momentum continue?",AEP,0.413587,0.267907,Somewhat-Bullish
"Kohner, Mann & Kailas, S.C., Perkins Coie LLP and Polsinelli PC Announce A Class Action Settlement For Those Who Purchased Natural Gas in Wisconsin Between January 1, 2000 and October 31, 2002",https://markets.businessinsider.com/news/stocks/kohner-mann-kailas-s-c-perkins-coie-llp-and-polsinelli-pc-announce-a-class-action-settlement-for-those-who-purchased-natural-gas-in-wisconsin-between-january-1-2000-and-october-31-2002-1032220717,2023-04-07 14:00:00,"Kohner, Mann & Kailas, S.C., Perkins Coie LLP and Polsinelli PC Announce A Class Action Settlement For Those Who Purchased Natural Gas in Wisconsin Between January 1, 2000 and October ...",AEP,0.027571,0.184238,Somewhat-Bullish
"Kohner, Mann & Kailas, S.C., Perkins Coie LLP and Polsinelli PC Announce A Class Action Settlement For Those Who Purchased Natural Gas in Wisconsin Between January 1, 2000 and October 31, 2002",https://www.prnewswire.com/news-releases/kohner-mann--kailas-sc-perkins-coie-llp-and-polsinelli-pc-announce-a-class-action-settlement-for-those-who-purchased-natural-gas-in-wisconsin-between-january-1-2000-and-october-31-2002-301790793.html,2023-04-07 14:00:00,"Kohner, Mann & Kailas, S.C., Perkins Coie LLP and Polsinelli PC ... PR ...",AEP,0.027539,0.184213,Somewhat-Bullish
Why AEP  ( AEP )  is Poised to Beat Earnings Estimates Again,https://www.zacks.com/stock/news/2075691/why-aep-aep-is-poised-to-beat-earnings-estimates-again,2023-04-06 16:10:13,AEP (AEP) has an impressive earnings surprise history and currently possesses the right combination of the two key ingredients for a likely beat in its next quarterly report.,AEP,0.409171,0.434743,Bullish
"AEP NAMES SMYTH EXECUTIVE VICE PRESIDENT GRID SOLUTIONS & GOVERNMENT AFFAIRS, ANNOUNCES ORGANIZATIONAL CHANGES",https://www.prnewswire.com/news-releases/aep-names-smyth-executive-vice-president-grid-solutions--government-affairs-announces-organizational-changes-301791634.html,2023-04-06 12:00:00,AEP NAMES SMYTH EXECUTIVE VICE PRESIDENT GRID ... PR ...,AEP,0.655534,0.52245,Bullish
"Nasdaq Tumbles 150 Points; Liminal BioSciences Shares Spike Higher - Nuburu  ( AMEX:BURU ) , American Electric Power  ( NASDAQ:AEP ) ",https://www.benzinga.com/news/earnings/23/04/31683180/nasdaq-tumbles-150-points-liminal-biosciences-shares-spike-higher,2023-04-05 16:04:50,"U.S. stocks traded mostly lower midway through trading, with the Nasdaq Composite dropping around 150 points on Wednesday. The Dow traded up 0.07% to 33,425.80 while the NASDAQ fell 1.27% to 11,972.78. The S&P 500, also fell, dropping, 0.48% to 4,080.74. Utilities shares rose by 1.8% on ...",AEP,0.114682,0.178476,Somewhat-Bullish
Dow Jones Rises But Big Tech Gets Sold; Gold Holds $2000; Johnson & Johnson Settles Baby Powder Claims,https://www.investors.com/market-trend/stock-market-today/dow-jones-rises-but-big-tech-gets-sold-gold-holds-2000-johnson-johnson-settles-baby-powder-claims/,2023-04-05 14:50:00,Dow Jones Rises But Big Tech Gets Sold. Gold Holds $2000 ... Investor's Business Daily ...,AEP,0.130217,0.225322,Somewhat-Bullish
American Electric Power  ( AEP )  Gains As Market Dips: What You Should Know,https://www.zacks.com/stock/news/2074580/american-electric-power-aep-gains-as-market-dips-what-you-should-know,2023-04-04 22:15:23,"American Electric Power (AEP) closed the most recent trading day at $91.17, moving +0.3% from the previous trading session.",AEP,0.605266,0.154922,Somewhat-Bullish
Short Volatility Alert: American Electric Power Inc - American Electric Power  ( NASDAQ:AEP ) ,https://www.benzinga.com/23/04/31656545/short-volatility-alert-american-electric-power-inc,2023-04-04 13:17:13,"On Monday, shares of American Electric Power Inc AEP experienced volatile short activity. After the activity, the stock price went up +0.62% to $90.99. The overall sentiment for AEP has been Bearish. The signal from the volatility alert is trending Bullish. Therefore, the recommendation is to ...",AEP,0.34729,-0.202853,Somewhat-Bearish
American Electric Power's Debt Overview - American Electric Power  ( NASDAQ:AEP ) ,https://www.benzinga.com/news/23/03/31590615/american-electric-powers-debt-overview,2023-03-30 17:15:27,"Shares of American Electric Power Inc. AEP fell by 4.70% in the past three months. Before having a look at the importance of debt, let's look at how much debt American Electric Power has.",AEP,0.293506,-0.196402,Somewhat-Bearish
Want Better Returns? Don?t Ignore These 2 Utilities Stocks Set to Beat Earnings,https://www.zacks.com/stock/news/2072321/want-better-returns-dont-ignore-these-2-utilities-stocks-set-to-beat-earnings,2023-03-30 12:50:07,The Zacks Earnings ESP is a great way to find potential earnings surprises. Why investors should take advantage now.,AEP,0.320557,0.28639,Somewhat-Bullish
American Electric Power  ( AEP )  Gains But Lags Market: What You Should Know,https://www.zacks.com/stock/news/2072152/american-electric-power-aep-gains-but-lags-market-what-you-should-know,2023-03-29 22:15:21,"American Electric Power (AEP) closed at $90.10 in the latest trading session, marking a +1.32% move from the prior day.",AEP,0.651499,0.359932,Bullish
P/E Ratio Insights for American Electric Power - American Electric Power  ( NASDAQ:AEP ) ,https://www.benzinga.com/news/23/03/31561485/pe-ratio-insights-for-american-electric-power,2023-03-29 20:30:18,"Looking into the current session, American Electric Power Inc. AEP shares are trading at $90.10, after a 1.32% increase. Moreover, over the past month, the stock increased by 4.33%, but in the past year, fell by 9.69%.",AEP,0.414559,-0.011381,Neutral
"AEP RECOGNIZED FOR EMPLOYEE ENGAGEMENT EFFORTS, RECEIVES GALLUP'S EXCEPTIONAL WORKPLACE AWARD",https://www.prnewswire.com/news-releases/aep-recognized-for-employee-engagement-efforts-receives-gallups-exceptional-workplace-award-301784898.html,2023-03-29 16:05:00,AEP RECOGNIZED FOR EMPLOYEE ENGAGEMENT EFFORTS ... PR ...,AEP,0.834295,0.758787,Bullish
"Don't Run! Capitalize On Bank Fears With These ""Buys""",https://www.forbes.com/sites/moneyshow/2023/03/28/dont-run-capitalize-on-bank-fears-with-these-buys/,2023-03-28 18:48:20,"Banking sector problems keep grabbing headlines. But rather than run for the hills, savvy investors can use that volatility to add ""Buys"" ELSEWHERE. These three MoneyShow contributors name their favorite names.",AEP,0.192438,0.205253,Somewhat-Bullish
FirstEnergy Picks Brian X. Tierney As Its New CEO - FirstEnergy  ( NYSE:FE ) ,https://www.benzinga.com/news/23/03/31512110/firstenergy-picks-brian-x-tierney-as-its-new-ceo,2023-03-27 15:46:37,"FirstEnergy Corp. FE has appointed Brian X. Tierney as its president and chief executive officer, effective June 1, 2023. Tierney succeeds interim President and Chief Executive Officer John W. Somerhalder II. Somerhalder also serves as chair of FirstEnergy's board, a position he will continue to ...",AEP,0.391923,0.107708,Neutral
FirstEnergy appoints Blackstone executive as CEO,https://www.reuters.com/business/energy/firstenergy-appoints-blackstone-executive-ceo-2023-03-27/,2023-03-27 15:40:00,"March 27 ( Reuters ) - FirstEnergy Corp ( FE.N ) said on Monday it appointed Blackstone Inc ( BX.N ) executive Brian Tierney as its president and chief executive officer, effective June 1. Tierney, 55, would take charge from interim chief John Somerhalder II, who would continue to serve as ...",AEP,0.21686,0.120105,Neutral
FirstEnergy Names Brian X. Tierney President and Chief Executive Officer,https://www.prnewswire.com/news-releases/firstenergy-names-brian-x-tierney-president-and-chief-executive-officer-301781985.html,2023-03-27 12:30:00,FirstEnergy Names Brian X. Tierney President and Chief Executive ... PR ...,AEP,0.19661,0.055561,Neutral
"The Zacks Analyst Blog Highlights Valero Energy, Roper Technologies, American Electric Power, CrowdStrike Holdings and Walgreens Boots Alliance",https://www.zacks.com/stock/news/2070640/the-zacks-analyst-blog-highlights-valero-energy-roper-technologies-american-electric-power-crowdstrike-holdings-and-walgreens-boots-alliance,2023-03-27 11:23:00,"Valero Energy, Roper Technologies, American Electric Power, CrowdStrike Holdings and Walgreens Boots Alliance are included in this Analyst Blog.",AEP,0.674691,0.0,Neutral
"Top Research Reports for Valero Energy, Roper Technologies & American Electric Power",https://www.zacks.com/research-daily/2070065/top-research-reports-for-valero-energy-roper-technologies-american-electric-power,2023-03-24 15:36:00,"Today's Research Daily features new research reports on 16 major stocks, including Valero Energy Corporation (VLO), Roper Technologies, Inc. (ROP) and American Electric Power Company, Inc. (AEP).",AEP,0.233556,0.162651,Somewhat-Bullish
American Electric Power  ( AEP )  Stock Sinks As Market Gains: What You Should Know,https://www.zacks.com/stock/news/2069917/american-electric-power-aep-stock-sinks-as-market-gains-what-you-should-know,2023-03-23 22:15:24,"American Electric Power (AEP) closed the most recent trading day at $85.41, moving -1.66% from the previous trading session.",AEP,0.659949,0.289491,Somewhat-Bullish
"Company News for Mar 22, 2023",https://www.zacks.com/stock/news/2068999/company-news-for-mar-22-2023,2023-03-22 13:47:00,"Companies in The News Are: TSLA, PACW, COP, ...",AEP,0.733479,-0.66031,Bearish
"On Holding, Beazer Homes rise; ProFrac, AEP fall",https://apnews.com/article/financial-markets-stocks-5b7b5f73ea544b7eece1166962ba4314,2023-03-21 20:16:38,"On Holding, Beazer Homes rise. ProFrac, AEP fall The Associated Press ...",AEP,0.205807,0.0,Neutral
Can Utilities Rise To The Challenges Presented By Decarbonization?,https://www.forbes.com/sites/kensilverstein/2023/03/20/can-utilities-rise-to-the-challenges-presented-by-decarbonization/,2023-03-20 13:00:00,"About 70% of the largest U.S. utilities have net-zero goals. While it will generate more revenues, it will also require a capital investment in transmission, and distribution.",AEP,0.031907,0.111339,Neutral
American Electric Power  ( NASDAQ:AEP )  Coverage Initiated at StockNews.com,https://www.defenseworld.net/2023/03/19/american-electric-power-nasdaqaep-coverage-initiated-at-stocknews-com.html,2023-03-19 06:00:45,American Electric Power ( NASDAQ:AEP ) Coverage Initiated at ... Defense World ...,AEP,0.754172,0.361273,Bullish
American Electric Power  ( AEP )  Dips More Than Broader Markets: What You Should Know,https://www.zacks.com/stock/news/2067610/american-electric-power-aep-dips-more-than-broader-markets-what-you-should-know,2023-03-17 22:00:23,"American Electric Power (AEP) closed the most recent trading day at $90.70, moving -1.42% from the previous trading session.",AEP,0.658245,0.200548,Somewhat-Bullish
Entergy  ( ETR )  Requests Approval to Add 3GW Solar in Louisiana,https://www.zacks.com/stock/news/2067521/entergy-etr-requests-approval-to-add-3gw-solar-in-louisiana,2023-03-17 16:55:00,Entergy (ETR) seeks approval to add 3GW of solar energy to its renewable generation portfolio. This initiative is in sync with its aim to achieve net-zero carbon emission by 2050.,AEP,0.103109,0.07923,Neutral
Algonquin Power & Utilities Corp. Announces 2022 Fourth Quarter and Full Year Financial Results,https://www.newswire.ca/news-releases/algonquin-power-amp-utilities-corp-announces-2022-fourth-quarter-and-full-year-financial-results-802281658.html,2023-03-17 10:30:00,Algonquin Power & Utilities Corp. Announces 2022 Fourth Quarter ... Canada ...,AEP,0.063216,0.145244,Neutral
Algonquin Power & Utilities Corp. Announces 2022 Fourth Quarter and Full Year Financial Results,https://www.prnewswire.com/news-releases/algonquin-power--utilities-corp-announces-2022-fourth-quarter-and-full-year-financial-results-301774818.html,2023-03-17 10:30:00,Algonquin Power & Utilities Corp. Announces 2022 Fourth Quarter ... PR ...,AEP,0.055046,0.12,Neutral
American Electric Power  ( AEP )  Stock Sinks As Market Gains: What You Should Know,https://www.zacks.com/stock/news/2067030/american-electric-power-aep-stock-sinks-as-market-gains-what-you-should-know,2023-03-16 22:15:22,"In the latest trading session, American Electric Power (AEP) closed at $92.01, marking a -0.63% move from the previous day.",AEP,0.624172,0.340581,Somewhat-Bullish
How Is The Market Feeling About American Electric Power? - American Electric Power  ( NASDAQ:AEP ) ,https://www.benzinga.com/short-sellers/23/03/31384252/how-is-the-market-feeling-about-american-electric-power,2023-03-16 16:30:30,"American Electric Power's AEP short percent of float has risen 11.81% since its last report. The company recently reported that it has 7.30 million shares sold short, which is 1.42% of all regular shares that are available for trading.",AEP,0.218817,0.152146,Somewhat-Bullish
American Electric Power  ( NYSE:AEP )  Coverage Initiated by Analysts at StockNews.com,https://www.defenseworld.net/2023/03/16/american-electric-power-nyseaep-coverage-initiated-by-analysts-at-stocknews-com.html,2023-03-16 05:34:44,American Electric Power ( NYSE:AEP ) Coverage Initiated by ... Defense World ...,AEP,0.982136,0.530517,Bullish
P/E Ratio Insights for American Electric Power - American Electric Power  ( NASDAQ:AEP ) ,https://www.benzinga.com/news/23/03/31347188/pe-ratio-insights-for-american-electric-power,2023-03-14 18:06:00,"In the current market session, American Electric Power Inc. AEP price is at $89.65, after a 0.30% increase. However, over the past month, the stock fell by 0.92%, and in the past year, by 5.70%.",AEP,0.355588,-0.07271,Neutral
American Electric Power's Debt Overview - American Electric Power  ( NASDAQ:AEP ) ,https://www.benzinga.com/news/23/03/31344463/american-electric-powers-debt-overview,2023-03-14 15:30:45,"Shares of American Electric Power Inc. AEP moved lower by 3.82% in the past three months. Before having a look at the importance of debt, let's look at how much debt American Electric Power has.",AEP,0.297061,-0.150774,Somewhat-Bearish
EBR vs. AEP: Which Stock Should Value Investors Buy Now?,https://www.zacks.com/stock/news/2064849/ebr-vs-aep-which-stock-should-value-investors-buy-now,2023-03-13 15:40:11,EBR vs. AEP: Which Stock Is the Better Value Option?,AEP,0.620415,0.510376,Bullish
What Makes Alphabet A Value Stock?,https://www.forbes.com/sites/baldwin/2023/03/13/tech-stock-friendly-value-investing/,2023-03-13 10:30:00,"Tom Cole says you should toss out the old fundamentals, like book value, and look at a different one more attuned to the 21st century. Works for him.",AEP,0.034381,0.046017,Neutral
American Electric Power  ( AEP )  Stock Moves -0.6%: What You Should Know,https://www.zacks.com/stock/news/2063842/american-electric-power-aep-stock-moves--06-what-you-should-know,2023-03-09 23:00:09,"In the latest trading session, American Electric Power (AEP) closed at $88.76, marking a -0.6% move from the previous day.",AEP,0.659949,0.257218,Somewhat-Bullish
"50/50 Women on Boards Launches ""50 Women to Watch for Boards"" Initiative",https://www.prnewswire.com/news-releases/5050-women-on-boards-launches-50-women-to-watch-for-boards-initiative-301765193.html,2023-03-08 14:00:00,"50/50 Women on Boards Launches ""50 Women to Watch for Boards ... PR ...",AEP,0.060848,0.078001,Neutral
Duke Energy begins operation of its largest solar plant,https://www.prnewswire.com/news-releases/duke-energy-begins-operation-of-its-largest-solar-plant-301765696.html,2023-03-08 13:29:00,"CHARLOTTE, N.C., March 8, 2023 /PRNewswire/ -- Duke Energy Sustainable Solutions ( DESS ) , a nonregulated commercial brand of Duke Energy ( NYSE: DUK ) , is now operating its largest solar power plant ever - the 250-megawatt ( MW ) Pisgah Ridge Solar project in Navarro County, Texas.",AEP,0.051003,0.329761,Somewhat-Bullish
American Electric Power  ( AEP )  Gains But Lags Market: What You Should Know,https://www.zacks.com/stock/news/2061765/american-electric-power-aep-gains-but-lags-market-what-you-should-know,2023-03-03 23:00:10,"American Electric Power (AEP) closed at $89.09 in the latest trading session, marking a +1.25% move from the prior day.",AEP,0.576289,0.286819,Somewhat-Bullish
"Company News for Mar 1, 2023",https://www.zacks.com/stock/news/2060407/company-news-for-mar-1-2023,2023-03-01 14:27:00,"Companies in The News Are: META, NCLH, TGT, ...",AEP,0.622414,-0.424455,Bearish
Bath & Body Works Board of Directors Sends Letter to Shareholders Highlighting Transformative Value-Creating Actions and Responding to Third Point's Potential Proxy Contest,https://www.globenewswire.com/news-release/2023/02/27/2615993/0/en/Bath-Body-Works-Board-of-Directors-Sends-Letter-to-Shareholders-Highlighting-Transformative-Value-Creating-Actions-and-Responding-to-Third-Point-s-Potential-Proxy-Contest.html,2023-02-27 12:30:00,Bath & Body Works Has Undertaken Significant Changes to Become a Leading Standalone Personal Care and Home Fragrance Brand ...,AEP,0.005271,0.082705,Neutral
"Invenergy-Led Consortium To Acquire American Electric Power's Unregulated Renewables Portfolio - Bank of America  ( NYSE:BAC ) , Blackstone  ( NYSE:BX ) ",https://www.benzinga.com/news/23/02/31041648/invenergy-led-consortium-to-acquire-american-electric-powers-unregulated-renewables-portfolio,2023-02-24 01:22:19,"Invenergy announced IRG Acquisition Holdings entered into an agreement with American Electric Power ( AEP ) . Details: As part of the agreement, IRG Acquisition Holdings ( IRGAH ) will acquire AEP's 1,365-megawatt ( MW ) unregulated, contracted renewables portfolio for $1.5B enterprise value ...",AEP,0.436009,0.522986,Bullish
AEP  ( AEP )  Q4 Earnings: Taking a Look at Key Metrics Versus Estimates,https://www.zacks.com/stock/news/2058329/aep-aep-q4-earnings-taking-a-look-at-key-metrics-versus-estimates,2023-02-23 17:37:00,"The headline numbers for AEP (AEP) give insight into how the company performed in the quarter ended December 2022, but it may be worthwhile to compare some of its key metrics to Wall Street estimates and the year-ago actuals.",AEP,0.679474,0.055135,Neutral
"American Electric's  ( AEP )  Q4 Earnings Beat, Revenues Up Y/Y",https://www.zacks.com/stock/news/2058231/american-electrics-aep-q4-earnings-beat-revenues-up-yy,2023-02-23 15:59:00,"American Electric's fourth-quarter operating revenues of $4,994.8 million beat the Zacks Consensus Estimate by 17.4%. The reported figure also increased 22.3% from the year-ago quarter's tally.",AEP,0.404563,0.090523,Neutral
American Electric Power  ( AEP )  Q4 Earnings and Revenues Top Estimates,https://www.zacks.com/stock/news/2058041/american-electric-power-aep-q4-earnings-and-revenues-top-estimates,2023-02-23 13:55:07,"AEP (AEP) delivered earnings and revenue surprises of 6.06% and 14.69%, respectively, for the quarter ended December 2022. Do the numbers hold clues to what lies ahead for the stock?",AEP,0.401331,0.145852,Neutral
AEP REPORTS STRONG 2022 EARNINGS RESULTS,https://www.prnewswire.com/news-releases/aep-reports-strong-2022-earnings-results-301754061.html,2023-02-23 11:57:00,"Year-end 2022 GAAP earnings of $4.51 per share; operating earnings of $5.09 per share Company advances strategic initiatives including sales agreement for contracted renewables, new FERC 203 filing for Kentucky sale and continued strategic review of retail business",AEP,0.432701,0.255765,Somewhat-Bullish
AEP SIGNS AGREEMENT TO SELL UNREGULATED RENEWABLES ASSETS,https://www.prnewswire.com/news-releases/aep-signs-agreement-to-sell-unregulated-renewables-assets-301753768.html,2023-02-22 22:56:00,AEP SIGNS AGREEMENT TO SELL UNREGULATED ... PR ...,AEP,0.594776,0.297556,Somewhat-Bullish
Why a U.S. national electric grid would be great for the climate - and is nearly impossible,https://www.cnbc.com/2023/02/22/why-we-need-nationwide-electric-grid-in-the-us-but-dont-have-one.html,2023-02-22 20:48:24,A macro grid would decrease the cost of reducing emissions and improve the reliability of the electric grid. But it's an almost impossible task for the U.S.,AEP,0.020491,0.0,Neutral
"Utilities Stocks' Q4 Earnings on Feb 23: AEP, PCG & More",https://www.zacks.com/stock/news/2057374/utilities-stocks-q4-earnings-on-feb-23-aep-pcg-more,2023-02-22 13:58:00,"Total Q4 earnings of Utility stocks are expected to improve 3.1% year over year, while revenues are likely to increase 3.1%.",AEP,0.226301,0.09358,Neutral
What's in Store for American Electric  ( AEP )  in Q4 Earnings?,https://www.zacks.com/stock/news/2056701/whats-in-store-for-american-electric-aep-in-q4-earnings,2023-02-21 13:04:00,"American Electric's (AEP) Q4 results are likely to reflect mixed weather pattern, along with favorable operating margin performance.",AEP,0.32478,0.234814,Somewhat-Bullish
Penny Stocks & The Stock Market This Week Feb. 21-24,https://pennystocks.com/featured/2023/02/20/penny-stocks-the-stock-market-this-week-feb-21-24/,2023-02-20 18:51:53,"Whether you're looking for penny stocks to buy or the best high-dividend stocks to invest in for 2023, we're at the start of another big week in the stock market. The start of February was a volatile one with an underlying bearish trend. The Dow marked its third consecutive week of trading lower.",AEP,0.068995,0.0,Neutral
Why America's outdated energy grid is a climate problem,https://www.cnbc.com/2023/02/17/why-americas-outdated-energy-grid-is-a-climate-problem.html,2023-02-17 13:00:01,The transmission system in the U.S. is a major problem because it is old and because it is not set up for energy systems of the future.,AEP,0.035821,0.049322,Neutral
What's in Store for CenterPoint Energy  ( CNP )  in Q4 Earnings?,https://www.zacks.com/stock/news/2055426/whats-in-store-for-centerpoint-energy-cnp-in-q4-earnings,2023-02-16 15:12:00,"CenterPoint Energy's (CNP) Q4 results are likely to reflect the impact of tornadoes and thunderstorms on its service areas, as well as that of increased interest expenses.",AEP,0.202932,0.178092,Somewhat-Bullish
American Electric Power  ( AEP )  Reports Next Week: Wall Street Expects Earnings Growth,https://www.zacks.com/stock/news/2055392/american-electric-power-aep-reports-next-week-wall-street-expects-earnings-growth,2023-02-16 15:01:04,AEP (AEP) doesn't possess the right combination of the two key ingredients for a likely earnings beat in its upcoming report. Get prepared with the key expectations.,AEP,0.298264,0.070587,Neutral
NRG Energy  ( NRG )  to Post Q4 Earnings: What's in the Offing?,https://www.zacks.com/stock/news/2054509/nrg-energy-nrg-to-post-q4-earnings-whats-in-the-offing,2023-02-15 13:13:00,NRG Energy's (NRG) fourth-quarter earnings are likely to have gained from recurring synergies from Direct Energy integration and lower shares outstanding.,AEP,0.326283,0.174484,Somewhat-Bullish
"FirstEnergy's  ( FE )  Q4 Earnings Miss Estimates, Revenues Beat",https://www.zacks.com/stock/news/2054114/firstenergys-fe-q4-earnings-miss-estimates-revenues-beat,2023-02-14 15:13:00,"FirstEnergy's (FE) fourth-quarter earnings miss estimates, while revenues surpass the same.",AEP,0.149656,0.173882,Somewhat-Bullish
American Electric Power  ( AEP )  Gains But Lags Market: What You Should Know,https://www.zacks.com/stock/news/2053705/american-electric-power-aep-gains-but-lags-market-what-you-should-know,2023-02-13 23:00:20,"In the latest trading session, American Electric Power (AEP) closed at $91.09, marking a +0.6% move from the previous day.",AEP,0.728189,0.434507,Bullish
Entergy  ( ETR )  to Report Q4 Earnings: What's in the Cards?,https://www.zacks.com/stock/news/2053313/entergy-etr-to-report-q4-earnings-whats-in-the-cards,2023-02-13 13:41:00,Entergy's (ETR) Q4 results are likely to reflect adverse impacts of tornadoes that affected its service territories. Higher operating expenses are likely to have hurt earnings.,AEP,0.205225,0.176477,Somewhat-Bullish
What's in Store for Consolidated Edison  ( ED )  in Q4 Earnings?,https://www.zacks.com/stock/news/2053315/whats-in-store-for-consolidated-edison-ed-in-q4-earnings,2023-02-13 13:40:00,Consolidated Edison's (ED) Q4 results are likely to reflect moderate weather pattern amid snowstorm impacts.,AEP,0.219477,0.185832,Somewhat-Bullish
"MDU Resources  ( MDU )  Q4 Earnings Top Estimates, Revenues Up Y/Y",https://www.zacks.com/stock/news/2052532/mdu-resources-mdu-q4-earnings-top-estimates-revenues-up-yy,2023-02-09 18:21:00,"MDU Resources Group (MDU) fourth-quarter earnings beat the estimates. MDU reports increased revenues from electric, natural gas distribution and regulated pipeline.",AEP,0.140076,0.161348,Somewhat-Bullish
