title,url,time_published,summary,ticker,relevance_score,ticker_sentiment_score,ticker_sentiment_label
American Electric Power  ( NASDAQ:AEP )  Stock Rating Upgraded by StockNews.com,https://www.defenseworld.net/2023/10/13/american-electric-power-nasdaqaep-stock-rating-upgraded-by-stocknews-com.html,2023-10-13 06:26:46,American Electric Power ( NASDAQ:AEP ) Stock Rating Upgraded by ... Defense World ...,AEP,0.853391,0.441526,Bullish
"Jim Cramer On This Stock Up Over 50% YTD: 'Buy Some Here And Then You Buy Some If It Comes Lower' - Gray Television  ( NYSE:GTN ) , American Electric Power  ( NASDAQ:AEP ) ",https://www.benzinga.com/trading-ideas/long-ideas/23/10/35155536/buy-some-here-and-then-you-buy-some-if-it-comes-lower-jim-cramer-on-this-stock-up-over-5,2023-10-10 13:16:06,"On CNBC's ""Mad Money Lightning Round,"" Jim Cramer said Veeva Systems Inc. VEEV is a buy, even though it's a ""high price to earnings multiple."" When asked about Marvell Technology, Inc. MRVL, he said, ""I think you buy some here, and then you buy some if it comes lower."" The company's shares surged ...",AEP,0.371523,0.215315,Somewhat-Bullish
Carbon Credit Trading Platform Market size to grow by USD 187.03 million between 2022 - 2027 | Growth driven by ... - PR Newswire,https://www.prnewswire.com/news-releases/carbon-credit-trading-platform-market-size-to-grow-by-usd-187-03-million-between-2022---2027--growth-driven-by-increasing-adoption-of-policies-on-carbon-emissions---technavio-301949668.html,2023-10-09 02:15:00,Carbon Credit Trading Platform Market size to grow by USD 187.03 million between 2022 - 2027 | Growth driven by ... PR ...,AEP,0.062761,0.152186,Somewhat-Bullish
Top Wall Street analysts expect these dividend stocks to boost portfolio returns,https://www.cnbc.com/2023/10/08/top-wall-street-analysts-say-buy-these-dividend-stocks.html,2023-10-08 11:30:18,"TipRanks' analyst ranking service pinpoints Wall Street's best-performing stocks, including Exxon and Darden.",AEP,0.194502,0.161124,Somewhat-Bullish
CMS Energy  ( CMS )  to Transform Coal Farm Into 85 MW Solar Project,https://www.zacks.com/stock/news/2160620/cms-energy-cms-to-transform-coal-farm-into-85-mw-solar-project,2023-10-05 12:38:00,CMS Energy (CMS) announces an 85 MW solar array project to expand its renewable energy source exposure.,AEP,0.215415,0.173395,Somewhat-Bullish
P/E Ratio Insights for American Electric Power - American Electric Power  ( NASDAQ:AEP ) ,https://www.benzinga.com/news/23/10/35094195/pe-ratio-insights-for-american-electric-power,2023-10-04 17:15:16,"In the current market session, American Electric Power Inc. AEP price is at $72.88, after a 0.10% increase. However, over the past month, the stock fell by 4.79%, and in the past year, by 13.95%.",AEP,0.345674,-0.007451,Neutral
"Company News for Oct 4, 2023",https://www.zacks.com/stock/news/2159950/company-news-for-oct-4-2023,2023-10-04 13:26:00,Companies in The News Are: ...,AEP,0.636698,0.655412,Bullish
"Exelon's  ( EXC )  ComEd, Millennium Garages to Add 300 EV Chargers",https://www.zacks.com/stock/news/2159834/exelons-exc-comed-millennium-garages-to-add-300-ev-chargers,2023-10-04 10:46:00,Exelon's (EXC) unit ComEd is undertaking various initiatives to develop solutions to electrify fleet vehicles and embrace cleaner technologies in the United States.,AEP,0.251032,0.107316,Neutral
"American Electric Power  ( NASDAQ:AEP )  Downgraded by StockNews.com to ""Sell""",https://www.defenseworld.net/2023/10/04/american-electric-power-nasdaqaep-downgraded-by-stocknews-com-to-sell-2.html,2023-10-04 08:28:52,American Electric Power ( NASDAQ:AEP ) Downgraded by ... Defense World ...,AEP,0.826342,0.377818,Bullish
"Company News for Oct 3, 2023",https://www.zacks.com/stock/news/2159135/company-news-for-oct-3-2023,2023-10-03 13:24:00,"Companies in The News Are: FANG, META, NVDA, GS, ...",AEP,0.659096,-0.639377,Bearish
American Electric Power Appoints Charles Zebula As Finance Chief; Reaffirms Guidance - American Electric Power  ( NASDAQ:AEP ) ,https://www.benzinga.com/markets/equities/23/10/35029721/american-electric-power-appoints-charles-zebula-as-finance-chief-reaffirms-guidance,2023-10-02 14:02:38,"American Electric Power Company Inc AEP has appointed Charles E. Zebula as executive vice president and chief financial officer, effective immediately. Zebula previously served as AEP's executive vice president, Portfolio Optimization. He succeeds Ann P. Kelly, who is departing the company.",AEP,0.656549,0.01145,Neutral
AEP APPOINTS CHARLES E. ZEBULA CHIEF FINANCIAL OFFICER - PR Newswire,https://www.prnewswire.com/news-releases/aep-appoints-charles-e-zebula-chief-financial-officer-301944351.html,2023-10-02 12:00:00,AEP APPOINTS CHARLES E. ZEBULA CHIEF FINANCIAL OFFICER PR ...,AEP,0.494565,0.20148,Somewhat-Bullish
 ( AEP )  - Analyzing American Electric Power's Short Interest - American Electric Power  ( NASDAQ:AEP ) ,https://www.benzinga.com/short-sellers/23/09/34950179/aep-analyzing-american-electric-powers-short-interest,2023-09-27 14:00:20,"American Electric Power's AEP short percent of float has fallen 10.78% since its last report. The company recently reported that it has 4.67 million shares sold short, which is 0.91% of all regular shares that are available for trading.",AEP,0.218817,0.080451,Neutral
Worried About a Stock Market Sell-Off? Consider These Dividend Stocks,https://www.fool.com/investing/2023/09/27/stock-market-sell-off-consider-dividend-stocks/,2023-09-27 09:45:00,"American Electric Power, Dominion Energy, and RTX should turn out just fine if the economy takes a turn for the worse.",AEP,0.210884,0.061352,Neutral
This Is The Worst Stock Market Sector Of The Year,https://www.investors.com/research/utility-sector-the-worst-stock-market-performer-of-the-year/,2023-09-19 12:00:00,Utility Sector: The Worst Stock Market Performer Of The Year Investor's Business Daily ...,AEP,0.15347,-0.215252,Somewhat-Bearish
American Electric Power  ( NASDAQ:AEP )  Raised to Hold at StockNews.com,https://www.defenseworld.net/2023/09/16/american-electric-power-nasdaqaep-raised-to-hold-at-stocknews-com.html,2023-09-16 07:10:41,American Electric Power ( NASDAQ:AEP ) Raised to Hold at ... Defense World ...,AEP,0.902741,0.356119,Bullish
"Company News for Sep 14, 2023",https://www.zacks.com/stock/news/2148832/company-news-for-sep-14-2023,2023-09-14 13:41:00,Companies in The News Are: ...,AEP,0.541149,0.313851,Somewhat-Bullish
"Jim Cramer Says Skip This 'Very Strange Stock,' Buy DraftKings Instead - Churchill Downs  ( NASDAQ:CHDN ) , American Electric Power  ( NASDAQ:AEP ) ",https://www.benzinga.com/trading-ideas/long-ideas/23/09/34425827/jim-cramer-says-skip-this-very-strange-stock-and-buy-draftkings-instead,2023-09-11 12:27:19,"On CNBC's ""Mad Money Lightning Round,"" Jim Cramer said he is a buyer of American Electric Power Company, Inc. AEP. ""This won't just be a smooth ride, 4.2% yield is good. A lot of people sold this stock because the short term rates have gone so high because the Fed has raised rates so rapidly.",AEP,0.524949,0.164615,Somewhat-Bullish
American Electric Power  ( NASDAQ:AEP )  Downgraded by StockNews.com to Sell,https://www.defenseworld.net/2023/09/10/american-electric-power-nasdaqaep-downgraded-by-stocknews-com-to-sell.html,2023-09-10 07:24:44,American Electric Power ( NASDAQ:AEP ) Downgraded by ... Defense World ...,AEP,0.882012,0.374123,Bullish
Stocks Could Revive In September - But Don't Count On It,https://www.investors.com/etfs-and-funds/personal-finance/best-funds-stocks-could-revive-september/,2023-09-08 11:00:00,"Despite a late-month rally, both the S&P 500 and Nasdaq saw their five-month winning streaks snapped in August. The market suffered a broad but mild pullback, hurting even the best funds. The only stock fund sector to post a gain was natural resources, while the previously white-hot science and ...",AEP,0.057628,0.0861,Neutral
Peering Into American Electric Power's Recent Short Interest - American Electric Power  ( NASDAQ:AEP ) ,https://www.benzinga.com/short-sellers/23/09/34318580/peering-into-american-electric-powers-recent-short-interest,2023-09-07 13:15:16,"American Electric Power's AEP short percent of float has risen 31.03% since its last report. The company recently reported that it has 9.78 million shares sold short, which is 1.9% of all regular shares that are available for trading.",AEP,0.218817,0.152146,Somewhat-Bullish
Is the Options Market Predicting a Spike in American Electric  ( AEP )  Stock?,https://www.zacks.com/stock/news/2144696/is-the-options-market-predicting-a-spike-in-american-electric-aep-stock,2023-09-05 12:32:00,Investors need to pay close attention to American Electric (AEP) stock based on the movements in the options market lately.,AEP,0.246582,0.0,Neutral
"American Electric Power  ( NASDAQ:AEP )  Lowered to ""Sell"" at StockNews.com",https://www.defenseworld.net/2023/09/05/american-electric-power-nasdaqaep-lowered-to-sell-at-stocknews-com.html,2023-09-05 06:52:42,"American Electric Power ( NASDAQ:AEP ) Lowered to ""Sell"" at ... Defense World ...",AEP,0.823603,0.451182,Bullish
Exelon  ( EXC )  to Gain From Cost Management & $31B Investment,https://www.zacks.com/stock/news/2143246/exelon-exc-to-gain-from-cost-management-31b-investment,2023-08-31 17:45:00,"Exelon Corporation (EXC) is poised for growth, courtesy of its strong long-term investment plans and a stable cash flow from operations.",AEP,0.130926,0.101255,Neutral
The 'Steel Curtain' Won't Stop Electra's Pursuit Of Decarbonization,https://www.forbes.com/sites/kensilverstein/2023/08/27/the-steel-curtain-wont-stop-electras-pursuit-of-decarbonization/,2023-08-27 22:00:00,"As economies grow, steel demand will also grow - a product used in everything from buildings to bridges to automobiles. Can the sector decarbonize?",AEP,0.034882,0.059626,Neutral
2 Stocks to Buy That Offer Dividends Yielding More Than 3%,https://www.fool.com/investing/2023/08/23/stocks-buy-dividends-yielding-3-percent-plus/,2023-08-23 09:40:00,The dividend yields of these two stocks range from 4.2% to 6.5%.,AEP,0.263942,0.280227,Somewhat-Bullish
StockNews.com Begins Coverage on American Electric Power  ( NASDAQ:AEP ) ,https://www.defenseworld.net/2023/08/23/stocknews-com-begins-coverage-on-american-electric-power-nasdaqaep.html,2023-08-23 05:24:51,StockNews.com Begins Coverage on American Electric Power ... Defense World ...,AEP,0.833487,0.489618,Bullish
"AEP BOARD ELECTS SLOAT CHAIR, NAMES STODDARD BOARD MEMBER",https://www.prnewswire.com/news-releases/aep-board-elects-sloat-chair-names-stoddard-board-member-301905560.html,2023-08-21 12:00:00,"COLUMBUS, Ohio, Aug. 21, 2023 /PRNewswire/ -- The Board of Directors of American Electric Power ( Nasdaq: AEP ) has elected Julie Sloat chair of the Board, effective Oct. 2. Sloat is AEP's president and chief executive officer.",AEP,0.712997,0.605349,Bullish
Duke Energy  ( DUK )  Proposes Plan to Promote Green Energy in NC,https://www.zacks.com/stock/news/2138052/duke-energy-duk-proposes-plan-to-promote-green-energy-in-nc,2023-08-18 13:50:00,Duke Energy (DUK) proposes and files a new CPIRP for North Carolina.,AEP,0.201244,0.176974,Somewhat-Bullish
How Is The Market Feeling About American Electric Power? - American Electric Power  ( NASDAQ:AEP ) ,https://www.benzinga.com/short-sellers/23/08/33901574/how-is-the-market-feeling-about-american-electric-power,2023-08-17 20:15:22,"American Electric Power's AEP short percent of float has risen 12.4% since its last report. The company recently reported that it has 7.44 million shares sold short, which is 1.45% of all regular shares that are available for trading.",AEP,0.218817,0.152146,Somewhat-Bullish
"Invenergy Buys American Electric Power's Renewables Portfolio For $1.5B - Blackstone  ( NYSE:BX ) , American Electric Power  ( NASDAQ:AEP ) ",https://www.benzinga.com/markets/equities/23/08/33877076/invenergy-buys-american-electric-powers-renewables-portfolio-for-1-5b,2023-08-16 15:08:52,"Invenergy disclosed it has closed the buyout of American Electric Power Co. Inc.'s AEP 1,365-megawatt ( MW ) unregulated, contracted renewables portfolio for $1.5 billion, including project debt.",AEP,0.595343,0.076639,Neutral
Climate Change Litigation Detracts From Actually Addressing It,https://www.forbes.com/sites/ikebrannon/2023/08/11/climate-change-litigation-detracts-from-actually-addressing-it/,2023-08-11 13:15:00,"These days, many communities across the country are pursuing a politically-charged, socially-unproductive agenda-this time over climate change.",AEP,0.041828,0.125637,Neutral
"SAI.TECH Announces the successful conclusion of its ""2nd Bit Heat Day"" Event on August 9th at its U.S. R&D Center SAI NODE Marietta in Ohio",https://www.globenewswire.com/news-release/2023/08/11/2723482/0/en/SAI-TECH-Announces-the-successful-conclusion-of-its-2nd-Bit-Heat-Day-Event-on-August-9th-at-its-U-S-R-D-Center-SAI-NODE-Marietta-in-Ohio.html,2023-08-11 12:00:00,"SINGAPORE, Aug. 11, 2023 ( GLOBE NEWSWIRE ) -- SAI.TECH Global Corporation ( ""SAI.TECH"" or ""SAI"" or the ""Company"", NASDAQ: SAI, SAITW ) announced Wednesday that its 2nd ""Bit Heat Day"" ended with a grand finale with the presence and blessing of many friends and supporters at SAI NODE Marietta.",AEP,0.038162,0.0,Neutral
"OGE Energy  ( OGE )  Q2 Earnings Miss, Revenues Decline Y/Y",https://www.zacks.com/stock/news/2135208/oge-energy-oge-q2-earnings-miss-revenues-decline-yy,2023-08-10 14:42:00,OGE Energy's (OGE) Q2 operating revenues of $605 million declined 24.7% from the prior-year quarter's level. The top line also missed the Zacks Consensus Estimate by 29.3%.,AEP,0.135347,-0.15965,Somewhat-Bearish
Exelon's  ( EXC )  Unit ComEd Launches EV Adoption Programs,https://www.zacks.com/stock/news/2135130/exelons-exc-unit-comed-launches-ev-adoption-programs,2023-08-10 13:16:00,Exelon's (EXC) unit ComEd is on track to remove barriers to electrification and make EV ownership affordable to everyone.,AEP,0.281422,0.210155,Somewhat-Bullish
"Canada's Algonquin mulls sale of renewable energy unit, CEO exits",https://www.reuters.com/business/energy/algonquin-considers-sale-renewable-energy-unit-ceo-steps-down-2023-08-10/,2023-08-10 13:02:00,"Aug 10 ( Reuters ) - Canada's Algonquin Power & Utilities ( AQN.TO ) said on Thursday it was considering a sale of its renewable energy business to reduce debt, and announced the resignation of CEO Arun Banskota.",AEP,0.115787,-0.295316,Somewhat-Bearish
"Duke Energy  ( DUK )  Q2 Earnings Miss Estimates, Revenues Rise Y/Y",https://www.zacks.com/stock/news/2133619/duke-energy-duk-q2-earnings-miss-estimates-revenues-rise-yy,2023-08-08 13:37:00,"Duke Energy's (DUK) Q2 operating revenues come in at $6,578 million, highlighting a year-over-year improvement of 0.2%. The reported top line also beats the Zacks Consensus Estimate by 0.2%.",AEP,0.108466,-0.074582,Neutral
"AES Q2 Earnings Fall Short of Estimates, Revenues Decline Y/Y",https://www.zacks.com/stock/news/2132711/aes-q2-earnings-fall-short-of-estimates-revenues-decline-yy,2023-08-04 12:56:00,"AES' Q2 revenues of $3,027 million decline 1.7% year over year. The top line, however, beats the Zacks Consensus Estimate by 5.2%.",AEP,0.143843,-0.173701,Somewhat-Bearish
"Black Hills: Buy, Sell, or Hold?",https://www.fool.com/investing/2023/08/04/black-hills-buy-sell-or-hold/,2023-08-04 09:31:00,This modestly sized utility has a dividend record that's hard to beat and operates in markets with strong demand.,AEP,0.058903,0.120999,Neutral
"Sempra  ( SRE )  Q2 Earnings Beat Estimates, Revenues Fall Y/Y",https://www.zacks.com/stock/news/2132091/sempra-sre-q2-earnings-beat-estimates-revenues-fall-yy,2023-08-03 14:49:00,"Sempra's (SRE) Q2 revenues of $3,335 million decline 6% from the year-ago quarter's level. The top line also misses the Zacks Consensus Estimate by 8.3%.",AEP,0.131284,-0.165541,Somewhat-Bearish
PG&E  ( PCG )  Gets a Buy from RBC Capital,https://markets.businessinsider.com/news/stocks/pg-e-pcg-gets-a-buy-from-rbc-capital-1032509183,2023-08-03 01:46:57,PG&E (PCG) Gets a Buy from RBC Capital - Markets Insider ...,AEP,0.185306,0.226181,Somewhat-Bullish
Price Over Earnings Overview: American Electric Power - American Electric Power  ( NASDAQ:AEP ) ,https://www.benzinga.com/news/23/08/33524896/price-over-earnings-overview-american-electric-power,2023-08-02 15:30:18,"In the current market session, American Electric Power Inc. AEP price is at $84.09, after a 0.07% spike. However, over the past month, the stock decreased by 1.99%, and in the past year, by 15.87%.",AEP,0.401331,-0.065054,Neutral
"Entergy's  ( ETR )  Q2 Earnings Beat Estimates, Revenues Fall Y/Y",https://www.zacks.com/stock/news/2131140/entergys-etr-q2-earnings-beat-estimates-revenues-fall-yy,2023-08-02 13:09:00,"Entergy's (ETR) Q2 revenues of $2,846 million miss the Zacks Consensus Estimate by 12.6%. The figure also declines 16.2% from the year-ago quarter's level.",AEP,0.149192,-0.177379,Somewhat-Bearish
AEP RECOGNIZED AS ONE OF THE BEST COMPANIES TO WORK FOR,https://www.prnewswire.com/news-releases/aep-recognized-as-one-of-the-best-companies-to-work-for-301890432.html,2023-08-01 13:20:00,"COLUMBUS, Ohio, Aug. 1, 2023 /PRNewswire/ -- American Electric Power ( Nasdaq: AEP ) was named one of the 2023-2024 Best Companies to Work For by U.S. News & World Report. The inaugural list consists of 200 companies in 11 industries.",AEP,0.854393,0.733001,Bullish
"AMERICAN ELECTRIC POWER COMPANY, INC. TO REDEEM SENIOR NOTES",https://www.prnewswire.com/news-releases/american-electric-power-company-inc-to-redeem-senior-notes-301889598.html,2023-07-31 20:00:00,"COLUMBUS, Ohio, July 31, 2023 /PRNewswire/ -- American Electric Power Company, Inc. ( Nasdaq: AEP ) , announced that on Aug. 30, 2023, it will redeem the entire outstanding $600 million principal amount of its Floating Rate Notes, Series A, due 2023 ( CUSIP NO. 025537 AS0 ) .",AEP,0.89767,0.670532,Bullish
2 High-Yield Dividend Stocks to Buy Hand Over Fist and Hold Forever,https://www.fool.com/investing/2023/07/29/2-high-yield-dividend-stocks-to-buy-hand-over-fist/,2023-07-29 09:18:00,"If you're ready to click the buy button, these two stocks can power your passive income for the coming decades.",AEP,0.504646,0.491102,Bullish
Here's Why Black Hills Corporation Is a No-Brainer Dividend Stock,https://www.fool.com/investing/2023/07/28/heres-why-black-hills-corporation-is-a-no-brainer/,2023-07-28 09:51:00,Utility Black Hills operates in growing markets and has long rewarded investors with reliable dividend growth.,AEP,0.132004,0.04322,Neutral
"American Electric Power Q2: Mixed Performance, 2023 EPS Outlook Reaffirmed - American Electric Power  ( NASDAQ:AEP ) ",https://www.benzinga.com/news/earnings/23/07/33419314/american-electric-power-q2-mixed-performance-2023-eps-outlook-reaffirmed,2023-07-27 14:45:01,"American Electric Power Co Inc AEP reported Q2 2023 operating EPS of $1.13, down from $1.20, beating the consensus of $1.12. Revenues of $4.40 billion came below $4.6 billion a year ago and missed the consensus of $4.76 billion. Results reflect the timing of higher interest and O&M expenses and ...",AEP,0.783279,0.067724,Neutral
"American Electric  ( AEP )  Lags Q2 Earnings, Reaffirms 2023 View",https://www.zacks.com/stock/news/2128785/american-electric-aep-lags-q2-earnings-reaffirms-2023-view,2023-07-27 13:43:00,"American Electric's (AEP) second-quarter 2023 operating earnings miss the Zacks Consensus Estimate by 0.9%. Revenues decrease 5.8% from the year-ago quarter's $4,639.7 million.",AEP,0.348592,-0.10784,Neutral
"CenterPoint Energy  ( CNP )  Q2 Earnings Miss, Revenues Down Y/Y",https://www.zacks.com/stock/news/2128737/centerpoint-energy-cnp-q2-earnings-miss-revenues-down-yy,2023-07-27 13:37:00,CenterPoint Energy's (CNP) second-quarter 2023 adjusted earnings lag the Zacks Consensus Estimate by 3.4%. Revenues decline by 3.5% from the year-ago figure.,AEP,0.154951,-0.089404,Neutral
American Electric Power  ( AEP )  Lags Q2 Earnings and Revenue Estimates,https://www.zacks.com/stock/news/2128660/american-electric-power-aep-lags-q2-earnings-and-revenue-estimates,2023-07-27 12:35:12,"AEP (AEP) delivered earnings and revenue surprises of -0.88% and 6.71%, respectively, for the quarter ended June 2023. Do the numbers hold clues to what lies ahead for the stock?",AEP,0.398148,0.095207,Neutral
AEP REPORTS SECOND-QUARTER 2023 EARNINGS; REAFFIRMS 2023 GUIDANCE,https://www.prnewswire.com/news-releases/aep-reports-second-quarter-2023-earnings-reaffirms-2023-guidance-301887043.html,2023-07-27 10:57:00,AEP REPORTS SECOND-QUARTER 2023 EARNINGS. REAFFIRMS 2023 GUIDANCE PR ...,AEP,0.454267,0.2416,Somewhat-Bullish
What's in Store for American Electric  ( AEP )  in Q2 Earnings?,https://www.zacks.com/stock/news/2126726/whats-in-store-for-american-electric-aep-in-q2-earnings,2023-07-25 12:33:00,American Electric's (AEP) Q2 results are likely to reflect the impacts of favorable weather patterns on its top line.,AEP,0.31006,0.0,Neutral
Eversource Energy  ( ES )  Reports Next Week: Wall Street Expects Earnings Growth,https://www.zacks.com/stock/news/2126162/eversource-energy-es-reports-next-week-wall-street-expects-earnings-growth,2023-07-24 14:00:34,Eversource (ES) possesses the right combination of the two key ingredients for a likely earnings beat in its upcoming report. Get prepared with the key expectations.,AEP,0.174903,0.021179,Neutral
American Electric Power  ( AEP )  Earnings Expected to Grow: Should You Buy?,https://www.zacks.com/stock/news/2124641/american-electric-power-aep-earnings-expected-to-grow-should-you-buy,2023-07-20 14:02:20,AEP (AEP) doesn't possess the right combination of the two key ingredients for a likely earnings beat in its upcoming report. Get prepared with the key expectations.,AEP,0.299478,0.064178,Neutral
Duke Energy  ( DUK )  Rewards Shareholders With 2% Dividend Hike,https://www.zacks.com/stock/news/2122635/duke-energy-duk-rewards-shareholders-with-2-dividend-hike,2023-07-18 11:42:00,"Duke Energy (DUK) increases the quarterly dividend to $1.025 per share, reflecting a rise of 2% from the previous payout.",AEP,0.144275,0.22139,Somewhat-Bullish
 ( AEP )  - Analyzing American Electric Power's Short Interest - American Electric Power  ( NASDAQ:AEP ) ,https://www.benzinga.com/short-sellers/23/07/33254441/aep-analyzing-american-electric-powers-short-interest,2023-07-17 18:00:24,"American Electric Power's AEP short percent of float has risen 5.74% since its last report. The company recently reported that it has 6.64 million shares sold short, which is 1.29% of all regular shares that are available for trading.",AEP,0.218817,0.152146,Somewhat-Bullish
CMS Energy  ( CMS )  Arm Launches Community EV Charging Program,https://www.zacks.com/stock/news/2121212/cms-energy-cms-arm-launches-community-ev-charging-program,2023-07-14 12:05:00,CMS Energy's (CMS) unit Consumers Energy is on track to make EV ownership and charging stations accessible to everyone.,AEP,0.202932,0.196747,Somewhat-Bullish
The Energy Transition Is Underway. Fossil Fuel Workers Could Be Left Behind.,https://www.nytimes.com/2023/07/12/us/politics/coal-gas-workers-transition.html,2023-07-12 07:00:15,"The Biden administration is trying to increase renewable energy investments in distressed regions, but some are skeptical those measures would be enough to make up for job losses.",AEP,0.028626,0.005614,Neutral
Are Options Traders Betting on a Big Move in American Electric  ( AEP )  Stock?,https://www.zacks.com/stock/news/2119004/are-options-traders-betting-on-a-big-move-in-american-electric-aep-stock,2023-07-11 12:32:00,Investors need to pay close attention to American Electric (AEP) stock based on the movements in the options market lately.,AEP,0.25168,-0.135308,Neutral
American Electric Power's Debt Overview - American Electric Power  ( NASDAQ:AEP ) ,https://www.benzinga.com/news/23/07/33147677/american-electric-powers-debt-overview,2023-07-07 13:45:39,"Shares of American Electric Power Inc. AEP fell by 10.15% in the past three months. When understanding a companies price change over a time period like 3 months, it could be helpful to look at its financials.",AEP,0.36472,0.04492,Neutral
California Water Service Group Announces Election of Charles R. Patton to Board of Directors,https://www.globenewswire.com/news-release/2023/07/05/2699937/0/en/California-Water-Service-Group-Announces-Election-of-Charles-R-Patton-to-Board-of-Directors.html,2023-07-05 20:15:00,"SAN JOSE, Calif., July 05, 2023 ( GLOBE NEWSWIRE ) -- California Water Service Group ( Group ) ( NYSE: CWT ) today announced the election of Charles R. Patton, 64, to the Group's Board of Directors, effective July 1, 2023.",AEP,0.18046,0.210368,Somewhat-Bullish
California Water Service Group Announces Election of Charles R. Patton to Board of Directors - California Water Servs Gr  ( NYSE:CWT ) ,https://www.benzinga.com/pressreleases/23/07/g33122904/california-water-service-group-announces-election-of-charles-r-patton-to-board-of-directors,2023-07-05 20:15:00,"SAN JOSE, Calif., July 05, 2023 ( GLOBE NEWSWIRE ) -- California Water Service Group ( Group ) CWT today announced the election of Charles R. Patton, 64, to the Group's Board of Directors, effective July 1, 2023.",AEP,0.173333,0.203073,Somewhat-Bullish
American Electric  ( AEP )  Arm Gets Nod to Buy 999MW Clean Energy,https://www.zacks.com/stock/news/2115293/american-electric-aep-arm-gets-nod-to-buy-999mw-clean-energy,2023-06-30 12:06:00,American Electric's (AEP) unit Southwestern Electric Power wins the regulatory nod to acquire three clean energy projects with a total generation capacity of 999MW.,AEP,0.458593,0.340458,Somewhat-Bullish
