title,url,time_published,summary,ticker,relevance_score,ticker_sentiment_score,ticker_sentiment_label
"Cloud Parting: Microsoft, Alphabet Drift Different Ways After Earnings, With Implications for Meta, Amazon Results - General Motors  ( NYSE:GM ) , Boeing  ( NYSE:BA ) ",https://www.benzinga.com/markets/23/10/35423554/cloud-parting-microsoft-alphabet-drift-different-ways-after-earnings-with-implications-for-meta-amaz,2023-10-25 18:55:29,( Wednesday market open ) Cloud computing dominates the proceedings this morning as Microsoft ( NASDAQ: MSFT ) and Alphabet ( NASDAQ: GOOGL ) drift in different directions following their earnings reports. A disappointing cloud performance from Alphabet clashed with sunnier tidings from Microsoft.,CVX,0.039944,0.054986,Neutral
"Betting On An Oil crisis? These Top Oil Stocks Could Generate Double-Digit Returns - Chevron  ( NYSE:CVX ) , ConocoPhillips  ( NYSE:COP ) , Exxon Mobil  ( NYSE:XOM ) ",https://www.benzinga.com/general/23/10/35419127/betting-on-an-oil-crisis-these-top-oil-stocks-could-generate-double-digit-returns,2023-10-25 15:30:11,"Escalating tensions in the Middle East have caused oil prices to spiral again, with West Texas Intermediate crude rising by nearly 2% earlier this week. As the Israel-Hamas fight intensifies, many analysts predict regional oil production to be significantly impacted in the near term.",CVX,0.203729,0.062668,Neutral
5 Must See Earnings Charts,https://www.zacks.com/stock/news/2171818/5-must-see-earnings-charts,2023-10-25 14:43:00,Retailers and energy seem like unlikely pairings but all eyes will be on them this week.,CVX,0.466811,0.064507,Neutral
"Hess  ( HES )  Beats on Q3 Earnings, Raises '23 Production Outlook",https://www.zacks.com/stock/news/2171840/hess-hes-beats-on-q3-earnings-raises-23-production-outlook,2023-10-25 14:19:00,Higher oil equivalent production volumes aid Hess' (HES) earnings in Q3.,CVX,0.184951,0.263343,Somewhat-Bullish
Chevron target Hess beats quarterly profit estimates on production boost,https://www.reuters.com/business/energy/chevron-target-hess-beats-quarterly-profit-estimates-production-boost-2023-10-25/,2023-10-25 13:53:00,"Hess logo is seen displayed in this illustration taken April 10, 2023. REUTERS/Dado Ruvic/Illustration/File Photo Acquire Licensing Rights",CVX,0.122894,0.098812,Neutral
Chevron  ( CVX )  to Acquire Hess in a $53-Billion All-Stock Deal,https://www.zacks.com/stock/news/2171435/chevron-cvx-to-acquire-hess-in-a-53-billion-all-stock-deal,2023-10-25 12:15:00,"Chevron (CVX) is set to acquire Hess for $53 billion, gaining valuable assets in Guyana and Bakken.",CVX,0.615462,0.479014,Bullish
Is a Beat in the Offing for MPLX This Earnings Season?,https://www.zacks.com/stock/news/2171360/is-a-beat-in-the-offing-for-mplx-this-earnings-season,2023-10-25 11:29:00,"MPLX is likely to have generated stable fee-based revenues in Q3, banking on its huge network of midstream assets.",CVX,0.229872,0.084412,Neutral
"Tech Takes On Yields: Market's Attention Pulled Away From Treasuries As Microsoft, Alphabet To Report - Alphabet  ( NASDAQ:GOOGL ) , Amazon.com  ( NASDAQ:AMZN ) ",https://www.benzinga.com/markets/23/10/35401474/tech-takes-on-yields-markets-attention-pulled-away-from-treasuries-as-microsoft-alphabet-to-report,2023-10-24 18:29:10,( Tuesday market open ) Treasury yields suddenly find themselves sharing the spotlight. The next few days will test whether investors can pry their eyes away from yields that recently hovered at the highest levels since the second George W.,CVX,0.041145,0.055213,Neutral
Chevron Unusual Options Activity For October 24 - Chevron  ( NYSE:CVX ) ,https://www.benzinga.com/markets/options/23/10/35397189/chevron-unusual-options-activity-for-october-24,2023-10-24 15:16:13,"Someone with a lot of money to spend has taken a bearish stance on Chevron CVX. We noticed this today when the big position showed up on publicly available options history that we track here at Benzinga. Whether this is an institution or just a wealthy individual, we don't know.",CVX,0.809819,0.123223,Neutral
"3 Permian Basin Hotshots Near Buy Points Amid Takeover Fever After ExxonMobil, Chevron Deals",https://www.investors.com/news/energy-stocks-near-buy-points-amid-takeover-fever-after-exxonmobil-chevron-deals/,2023-10-24 14:38:00,3 Permian Basin Hotshots Near Buy Points Amid Takeover Fever ... Investor's Business Daily ...,CVX,0.29234,0.327475,Somewhat-Bullish
"Moore Kuehn Encourages INVO, ESMT, HES, and TGH Investors to Contact Law Firm - Engagesmart  ( NYSE:ESMT ) , Hess  ( NYSE:HES ) ",https://www.benzinga.com/pressreleases/23/10/g35395224/moore-kuehn-encourages-invo-esmt-hes-and-tgh-investors-to-contact-law-firm,2023-10-24 14:08:40,"NEW YORK, Oct. 24, 2023 ( GLOBE NEWSWIRE ) -- Moore Kuehn, PLLC, a law firm focusing in securities litigation located on Wall Street in downtown New York City, is investigating potential claims concerning whether the following proposed mergers are fair to shareholders.",CVX,0.107978,0.279254,Somewhat-Bullish
"Company News for Oct 24, 2023",https://www.zacks.com/stock/news/2170740/company-news-for-oct-24-2023,2023-10-24 13:29:00,"Companies in The News Are: CBRE, CVX, HES, BOH, OKTA ...",CVX,0.615462,0.234586,Somewhat-Bullish
Jim Cramer's top 10 things to watch in the stock market Tuesday,https://www.cnbc.com/2023/10/24/jim-cramers-top-10-things-to-watch-in-the-stock-market-tuesday.html,2023-10-24 12:47:07,Stock futures are up this morning as Wall Street awaits earnings from Big Tech companies Microsoft and Alphabet.,CVX,0.146025,-0.175188,Somewhat-Bearish
3 Passive Income Powerhouses With 30-Plus Years of Dividend Raises,https://www.fool.com/investing/2023/10/24/3-passive-income-stocks-years-of-dividend-increase/,2023-10-24 10:45:00,Investing in these three companies can boost your dividend income while helping you rest easy at night.,CVX,0.404267,0.573063,Bullish
Enphase Energy  ( ENPH )  to Post Q3 Earnings: What's in Store?,https://www.zacks.com/stock/news/2170612/enphase-energy-enph-to-post-q3-earnings-whats-in-store,2023-10-24 10:20:00,"Enphase Energy's (ENPH) Q3 results are likely to reflect a slowdown in its U.S. business, thus negatively impacting its top line.",CVX,0.140076,-0.085268,Neutral
"Chevron Quickly Responds to ExxonMobil, Buys Hess in a $60 Billion Deal",https://www.fool.com/investing/2023/10/24/chevron-quickly-responds-to-exxonmobil-buys-hess-i/,2023-10-24 09:36:00,The deal will significantly enhance the oil giant's free cash flow and growth profile.,CVX,0.671304,0.477466,Bullish
"'Unstoppable' energy transition means demand for oil, gas, and coal set to peak by 2030 | Business",https://www.cnn.com/2023/10/24/energy/iea-oil-gas-coal-demand-peak-2030/index.html,2023-10-24 09:09:17,"'Unstoppable' energy transition means demand for oil, gas, and coal set to peak by ...",CVX,0.127119,0.160661,Somewhat-Bullish
"'Unstoppable' energy transition means demand for oil, gas, and coal set to peak by 2030 | Business",https://edition.cnn.com/2023/10/24/energy/iea-oil-gas-coal-demand-peak-2030/index.html,2023-10-24 09:09:00,"'Unstoppable' energy transition means demand for oil, gas, and coal set to peak by 2030 CNN International ...",CVX,0.172713,0.191867,Somewhat-Bullish
"IEA: 'Unstoppable' energy transition means demand for oil, gas, and coal to peak by 2030 | Business",https://amp.cnn.com/cnn/2023/10/24/energy/iea-oil-gas-coal-demand-peak-2030/index.html,2023-10-24 09:09:00,"'Unstoppable' energy transition means demand for oil, gas, and coal set to peak by ...",CVX,0.127119,0.160661,Somewhat-Bullish
"Investor Fear Eases Slightly Ahead Of Big Earnings - Chevron  ( NYSE:CVX ) , General Motors  ( NYSE:GM ) ",https://www.benzinga.com/news/earnings/23/10/35387029/investor-fear-eases-slightly-ahead-of-big-earnings,2023-10-24 08:26:46,"The CNN Money Fear and Greed index showed some easing in the overall fear level but remained in the ""Fear"" zone on Monday. The Nasdaq Composite settled higher on Monday ahead of earnings reports from several major companies. Investors are awaiting earnings results from Alphabet Inc.",CVX,0.29234,-0.075539,Neutral
"SHAREHOLDER INVESTIGATION: Halper Sadeh LLC Investigates HES, FAZE, TGH - FaZe Hldgs  ( NASDAQ:FAZE ) , Hess  ( NYSE:HES ) ",https://www.benzinga.com/pressreleases/23/10/g35386051/shareholder-investigation-halper-sadeh-llc-investigates-hes-faze-tgh,2023-10-24 00:22:15,"NEW YORK, Oct. 23, 2023 ( GLOBE NEWSWIRE ) -- Halper Sadeh LLC, an investor rights law firm, is investigating the following companies for potential violations of the federal securities laws and/or breaches of fiduciary duties to shareholders relating to:",CVX,0.156461,0.177314,Somewhat-Bullish
Stock Market Today: Stocks Finish Mixed as Treasury Yields Stabilize,https://www.kiplinger.com/investing/stocks/stock-market-today-stocks-finish-mixed-as-treasury-yields-stabilize,2023-10-23 20:11:41,"All eyes were on government bonds Monday as the 10-year Treasury yield topped the 5% level for the first time since mid-2007. This sent stocks lower at the open, though the main indexes were in positive territory by lunchtime as yields on Treasury bonds pulled back.",CVX,0.406901,0.317025,Somewhat-Bullish
Dow Jones Dips As Bill Ackman Unwinds This Big Bet; Tesla Stock Fights For Key Level,https://www.investors.com/market-trend/stock-market-today/dow-jones-dips-as-bill-ackman-unwinds-this-big-bet-tesla-stock-fights-for-key-level-okta-stock-plunges-microsoft-stock-apple-stock/,2023-10-23 19:30:00,Dow Jones Dips As Bill Ackman Unwinds This Big Bet. Tesla Stock ... Investor's Business Daily ...,CVX,0.082963,0.094473,Neutral
Is Black Stone  ( BSM )  Poised for an Earnings Beat in Q3?,https://www.zacks.com/stock/news/2170407/is-black-stone-bsm-poised-for-an-earnings-beat-in-q3,2023-10-23 19:09:00,Robust oil realizations and production are likely to have boosted Black Stone Minerals' (BSM) profit levels in the third quarter.,CVX,0.241085,0.011158,Neutral
CVR Energy's  ( CVI )  Q3 Earnings Preview: Factors to Consider,https://www.zacks.com/stock/news/2170404/cvr-energys-cvi-q3-earnings-preview-factors-to-consider,2023-10-23 18:40:00,"Strong crack spreads and lower costs are likely to have buoyed the third-quarter earnings of CVR Energy (CVI), only to be offset by a weak fertilizer market.",CVX,0.203215,0.009744,Neutral
"October Blues: Interest Rate Concerns Keep Stocks Under Pressure From Ahead of Big Tech Earnings - American Express  ( NYSE:AXP ) , Amazon.com  ( NASDAQ:AMZN ) ",https://www.benzinga.com/markets/23/10/35380514/october-blues-interest-rate-concerns-keep-stocks-under-pressure-from-ahead-of-big-tech-earnings,2023-10-23 18:06:19,Wall Street's red October is poised to get redder as concern over elevated interest rates and geopolitical tensions continue to burden the stock market. Futures based on the S&P 500 Index ( SPX ) and the Nasdaq Composite ( COMP ) were down about 0.4% near the close of overnight trading after ...,CVX,0.123526,0.079634,Neutral
HES Alert: Monsey Firm of Wohl & Fruchter Investigating Fairness of the Proposed Sale of Hess Corporation to Chevron - Hess  ( NYSE:HES ) ,https://www.benzinga.com/pressreleases/23/10/g35379966/hes-alert-monsey-firm-of-wohl-fruchter-investigating-fairness-of-the-proposed-sale-of-hess-corpora,2023-10-23 17:37:20,"MONSEY, N.Y., Oct. 23, 2023 ( GLOBE NEWSWIRE ) -- The law firm of Wohl & Fruchter LLP is investigating the fairness of the proposed sale of Hess Corporation HES ( ""Hess"" ) to Chevron Corporation ( ""Chevron"" ) in an all-stock transaction valued at $171.00 per share.",CVX,0.128135,0.183613,Somewhat-Bullish
Dow Jones looks for gains as 10-year Treasury yield pulls back from 5%,https://www.marketwatch.com/story/u-s-stock-futures-fall-as-10-year-treasury-yield-hits-5-c576c30a,2023-10-23 16:54:00,The Dow attempts to eke out gains after erasing earlier losses as investors monitor efforts to contain the Israel-Hamas war.,CVX,0.120632,0.032585,Neutral
"No More Holiday Hess Truck? Mega Oil Merger Could Induce Gift-Giving Chaos - Chevron  ( NYSE:CVX ) , Hess  ( NYSE:HES ) ",https://www.benzinga.com/m-a/23/10/35378464/no-more-holiday-hess-truck-mega-oil-merger-could-induce-gift-giving-chaos,2023-10-23 16:52:58,"The famous Holiday Hess Truck could be in danger following Chevron Corporation's CVX acquisition of Hess Corp. HES, announced Monday. Chevron did not specify if Hess's brand, and the truck, will live on post-merger, but Hess CEO John Hess told CNBC the tradition will continue.",CVX,0.55533,0.114676,Neutral
"Chevron, Hess CEOs See 'A Lot Of Upside' For Shareholders Following $53B Deal - Chevron  ( NYSE:CVX ) ",https://www.benzinga.com/m-a/23/10/35376520/chevron-hess-ceos-see-a-lot-of-upside-for-shareholders-following-53b-deal,2023-10-23 15:42:26,Chevron Corp CVX unveiled plans to buy Hess Corp HES on Monday. Executives from the both oil giants discussed details of the deal shortly after it was announced. What Happened: Chevron entered into a definitive agreement to acquire Hess in an all-stock transaction valued at $53 billion.,CVX,0.832645,0.421342,Bullish
Why Chevron Stock Is Running on Empty Today,https://www.fool.com/investing/2023/10/23/why-chevron-stock-is-running-on-empty-today/,2023-10-23 15:41:05,The company is bulking up with a massive all-stock acquisition.,CVX,0.904419,0.449995,Bullish
Inversion of Yield Curve Tight at 14 bps,https://www.zacks.com/stock/news/2170346/inversion-of-yield-curve-tight-at-14-bps,2023-10-23 14:58:00,"We kick off the busiest week in Q3 earnings season so far relatively quietly, with no marquee stock names posting results today. There are also no big economic prints forthcoming until Tuesday, either, but it's not stopping pre-market futures from sagging yet again.",CVX,0.283323,0.004147,Neutral
Stock Market Trims Losses As Benchmark Yield Backs Off From 5%; Investors Face These Risks,https://www.investors.com/market-trend/stock-market-today/stock-market-trims-losses-as-benchmark-yield-backs-off-from-5-investors-face-these-risks/,2023-10-23 14:47:00,Stock Market Trims Losses As Benchmark Yield Backs Off From 5 ... Investor's Business Daily ...,CVX,0.196344,0.198026,Somewhat-Bullish
"Busy Week for Q3, Economic Reports Starts Slowly",https://www.zacks.com/stock/news/2170338/busy-week-for-q3-economic-reports-starts-slowly,2023-10-23 14:32:00,"Off mid-October highs, all major indices are down roughly -0.4%: the Dow -160 points, the S&P 500 -17 and the Nasdaq -57.",CVX,0.276909,0.00407,Neutral
TotalEnergies  ( TTE )  to Post Q3 Earnings: What's in the Offing?,https://www.zacks.com/stock/news/2170351/totalenergies-tte-to-post-q3-earnings-whats-in-the-offing,2023-10-23 14:12:00,TotalEnergies' (TTE) third-quarter earnings per share are expected to have benefited from acquired assets' contributions and strong demand for petroleum products.,CVX,0.332883,0.113746,Neutral
"BRODSKY & SMITH SHAREHOLDER UPDATE: Notifying Investors of the Following Investigations: EngageSmart, Inc.  ( NYSE - ESMT ) , Hess Corporation  ( NYSE - HES ) , Textainer Group Holdings Limited  ( NYSE - TGH ) , INVO Bioscience, Inc.  ( Nasdaq - INVO ) ",https://www.benzinga.com/pressreleases/23/10/g35374364/brodsky-smith-shareholder-update-notifying-investors-of-the-following-investigations-engagesmart-i,2023-10-23 13:56:05,"BALA CYNWYD, Pa., Oct. 23, 2023 ( GLOBE NEWSWIRE ) -- Brodsky & Smith reminds investors of the following investigations. If you own shares and wish to discuss the investigation, contact Jason Brodsky ( jbrodsky@brodskysmith.com ) or Marc Ackerman ( mackerman@brodskysmith.com ) at 855-576-4847.",CVX,0.395012,0.369819,Bullish
Investors Heavily Search Chevron Corporation  ( CVX ) : Here is What You Need to Know,https://www.zacks.com/stock/news/2170152/investors-heavily-search-chevron-corporation-cvx-here-is-what-you-need-to-know,2023-10-23 13:00:12,"Chevron (CVX) has been one of the stocks most watched by Zacks.com users lately. So, it is worth exploring what lies ahead for the stock.",CVX,0.53074,0.132866,Neutral
The 2 Monday Mergers to Watch on Wall Street,https://www.fool.com/investing/2023/10/23/the-2-monday-mergers-to-watch-on-wall-street/,2023-10-23 12:54:59,Only one is getting a positive reception from investors.,CVX,0.375251,0.364072,Bullish
These 2 Oils and Energy Stocks Could Beat Earnings: Why They Should Be on Your Radar,https://www.zacks.com/stock/news/2170141/these-2-oils-and-energy-stocks-could-beat-earnings-why-they-should-be-on-your-radar,2023-10-23 12:50:06,The Zacks Earnings ESP is a great way to find potential earnings surprises. Why investors should take advantage now.,CVX,0.388879,0.361678,Bullish
Chevron Responds To ExxonMobil With $53 Billion Deal To Buy Hess,https://www.investors.com/news/chevron-stock-energy-giant-responds-to-exxonmobil-with-53-billion-deal-to-buy-hess/,2023-10-23 12:47:00,"Chevron ( CVX ) agreed on Monday to purchase Hess ( HES ) for $53 billion, the latest move by an U.S. oil major to solidify its hold on the oil production as the sector heads into uncertain territory. Dow Jones component CVX edged down early Monday while HES advanced.",CVX,0.744473,0.297841,Somewhat-Bullish
Futures Slide As Yields Top 5%,https://www.investors.com/market-trend/stock-market-today/dow-jones-futures-slide-as-yields-top-5-tesla-stock-extends-losses/,2023-10-23 12:18:00,Dow Jones Futures Slide 200 Points As Yields Top 5%. Tesla Stock ... Investor's Business Daily ...,CVX,0.099202,0.160549,Somewhat-Bullish
"Myriad of Problems, Dysfunctional DC, Charting Equites, Earnings, Week Ahead",https://realmoney.thestreet.com/investing/myriad-of-problems-dysfunctional-dc-charting-equites-earnings-week-ahead-16136139,2023-10-23 11:41:35,"The problems are still there. They haven't changed. Much. They seem almost to stagnate. Every once in a while something unforeseen up until that point happens and another log is thrown upon the fire. Existing problems seem to linger, unresolved, as newer problems are introduced and force a split ...",CVX,0.027603,0.120541,Neutral
"US Stock Futures Slump As Rising Bond Yields Rattle Investors Ahead Of Big Tech Earnings Deluge - Alphabet  ( NASDAQ:GOOG ) , Alphabet  ( NASDAQ:GOOGL ) , Meta Platforms  ( NASDAQ:META ) , NVIDIA  ( NASDAQ:NVDA ) ",https://www.benzinga.com/news/earnings/23/10/35370004/us-stock-futures-slump-as-rising-bond-yields-rattle-investors-ahead-of-big-tech-earnings-deluge,2023-10-23 11:27:24,"The new trading week is poised to face a trifecta of challenges - earnings concerns, fears of rate hikes, and geopolitical tensions, all likely to impact the market. Stock futures indicate a moderately lower market opening on Monday. Four major corporations, including Alphabet, Inc.",CVX,0.099066,0.0,Neutral
VIEW Chevron to buy Hess Corp for $53 bln in all-stock deal,https://www.reuters.com/markets/deals/view-chevron-buy-hess-corp-53-bln-all-stock-deal-2023-10-23/,2023-10-23 11:17:00,"A 3D printed natural gas pipeline is placed in front of displayed Chevron logo in this illustration taken Feb. 8, 2022. REUTERS/Dado Ruvic/Illustration/File Photo Acquire Licensing Rights",CVX,0.068112,-0.037321,Neutral
Chevron to buy Hess for $53 bn as biggest US oil firms get even bigger,https://www.business-standard.com/world-news/chevron-to-buy-hess-for-53-bn-as-biggest-us-oil-firms-get-even-bigger-123102300550_1.html,2023-10-23 11:14:23,"Chevron Corp said on Monday it will buy smaller rival Hess Corp in a $53-billion all-stock deal, as the oil major looks to increase its footprint in oil-rich Guyana. The deal puts two of the top oil giants, Chevron and Exxon Mobil, head-to-head in two of the world's fastest growing oil basins - ...",CVX,0.155451,0.025641,Neutral
Oil & Gas Giant Chevron Agrees To Acquire Hess Corp At A Premium - Chevron  ( NYSE:CVX ) ,https://www.benzinga.com/markets/equities/23/10/35369568/oil-gas-giant-chevron-agrees-to-acquire-hess-corp-at-a-premium,2023-10-23 11:11:14,"Chevron Corp CVX shares are trading lower by around 3% after it penned a deal to acquire Hess Corp HES for $53 billion or $171 per share in an all-stock transaction. The transaction price represents a premium of 10.3% on a 20-day average based on closing prices on October 20, 2023.",CVX,0.751437,0.629684,Bullish
Chevron to acquire Hess in $53 billion deal,https://www.foxbusiness.com/markets/chevron-acquire-hess-53-billion-deal,2023-10-23 10:56:49,"Chevron Corporation announced Monday that it has reached an agreement to acquire competitor Hess Corporation in an all-stock deal valued at $53 billion. The energy company says the acquisition ""upgrades and diversifies Chevron's already advantaged portfolio.""",CVX,0.087824,0.305413,Somewhat-Bullish
Futures Fall As Yields Top 5%; Titans Lead Earnings Wave,https://www.investors.com/market-trend/stock-market-today/dow-jones-futures-fall-10-year-treasury-yield-tops-5-microsoft-meta-lead-earnings-wave/,2023-10-23 10:54:00,Dow Jones Futures Fall As 10-Year Treasury Yield Tops 5 ... Investor's Business Daily ...,CVX,0.115676,0.168932,Somewhat-Bullish
Chevron agrees to buy Hess for $53 billion | Business,https://www.cnn.com/2023/10/23/investing/chevron-hess/index.html,2023-10-23 10:47:00,Chevron agrees to buy Hess for $53 billion ...,CVX,0.777888,0.56785,Bullish
"Chevron buys Hess for $53 billion, 2nd buyout among major producers this month as oil prices surge",https://apnews.com/article/chevron-hess-exxon-oil-merger-acquisition-37ff382d6fa713b7a1e887c7be5f1e93,2023-10-23 10:12:00,Chevron to buy Hess for $53 billion as the biggest US oil companies get even bigger The Associated Press ...,CVX,0.156461,-0.057514,Neutral
"Commodity plastics market to grow by USD 159.09 billion from 2022 to 2027, BASF SE, Braskem SA, Chevron Corp ... - PR Newswire",https://www.prnewswire.com/news-releases/commodity-plastics-market-to-grow-by-usd-159-09-billion-from-2022-to-2027--basf-se-braskem-sa-chevron-corp-and-more-among-key-companies--technavio-301962501.html,2023-10-23 09:15:00,"Commodity plastics market to grow by USD 159.09 billion from 2022 to 2027, BASF SE, Braskem SA, Chevron Corp ... PR ...",CVX,0.057079,0.0,Neutral
Chevron to buy Hess Corp for $53 bln in all-stock deal,https://www.reuters.com/markets/deals/chevron-buy-hess-corp-53-bln-stock-2023-10-23/,2023-10-23 09:15:00,"The Chevron logo is pictured after the U.S. government granted a six-month license allowing Chevron to boost oil output in U.S.-sanctioned Venezuela, in Caracas, Venezuela, December 2, 2022. REUTERS/Gaby Oraa/File photo Acquire Licensing Rights",CVX,0.275867,-0.199033,Somewhat-Bearish
3 Foundational Blue Chip Dow Dividend Stocks for Building Generational Wealth,https://www.fool.com/investing/2023/10/22/3-foundational-blue-chip-dow-dividend-stocks/,2023-10-22 09:03:00,Dow stocks can provide the confidence needed to hold through periods of volatility.,CVX,0.414559,0.210604,Somewhat-Bullish
"Iraqi Prime Minister Sounds Alarm On Israel-Hamas Conflict's Impact On Oil Supply - Chevron  ( NYSE:CVX ) , Exxon Mobil  ( NYSE:XOM ) ",https://www.benzinga.com/news/23/10/35362439/iraqi-prime-minister-sounds-alarm-on-israel-hamas-conflicts-impact-on-oil-supply,2023-10-21 18:04:58,"Iraqi Prime Minister Mohammed Shia al-Sudani issued a stark warning on the potential consequences of the Israel-Hamas conflict extending into neighboring regions. What Happened: Speaking at an international summit in Egypt on Saturday, the prime minister voiced concerns about the impact such a ...",CVX,0.268294,0.016299,Neutral
"Stock Market Outlook Clouded With Amazon, Microsoft, Meta, Alphabet Set To Report",https://www.investors.com/research/investing-action-plan/middle-east-house-leadership-cloud-stock-market-outlook-with-amazon-microsoft-meta-and-alphabet-to-report/,2023-10-20 22:22:00,"Stock Market Outlook Clouded With Amazon, Microsoft, Meta ... Investor's Business Daily ...",CVX,0.076553,-0.042143,Neutral
Point Break For Market? Four Titans Lead Earnings Wave,https://www.investors.com/market-trend/stock-market-today/dow-jones-futures-point-break-for-stock-market-microsoft-meta-lead-earnings-wave/,2023-10-20 22:08:00,"Dow Jones Futures: Point Break For Stock Market? Microsoft, Meta ... Investor's Business Daily ...",CVX,0.048084,0.076094,Neutral
Car Care Products Market size to grow by USD 3585.56 million | The market is estimated to grow at a CAGR of 5.48 ... - PR Newswire,https://www.prnewswire.com/news-releases/car-care-products-market-size-to-grow-by-usd-3585-56-million--the-market-is-estimated-to-grow-at-a-cagr-of-5-48-during-the-forecast-period-----technavio-301963203.html,2023-10-20 21:45:00,Car Care Products Market size to grow by USD 3585.56 million | The market is estimated to grow at a CAGR of 5.48 ... PR ...,CVX,0.043342,0.0,Neutral
Lubricants Market For Mining And Quarry Applications Market size to increase by USD 660.59 million between 2022 to ... - PR Newswire,https://www.prnewswire.com/news-releases/lubricants-market-for-mining-and-quarry-applications-market-size-to-increase-by-usd-660-59-million-between-2022-to-2027-the-adoption-of-smart-mining-equipment-drives-the-market-growth---technavio-301962278.html,2023-10-20 21:15:00,Lubricants Market For Mining And Quarry Applications Market size to increase by USD 660.59 million between 2022 to ... PR ...,CVX,0.052112,0.0,Neutral
"Investor Risk Sentiment Wavers Amid War, Interest Rate Concerns; Tesla Earnings Disappoint: The Week In The Markets - Alphabet  ( NASDAQ:GOOGL ) , Chevron  ( NYSE:CVX ) , Verizon Communications  ( NYSE:VZ ) , Merck & Co  ( NYSE:MRK ) ",https://www.benzinga.com/markets/asia/23/10/35358005/investor-risk-sentiment-wavers-amid-war-interest-rate-concerns-tesla-earnings-disappoint-the-week-in,2023-10-20 20:08:03,"Volatility notably returned to the markets this week as investors navigated the escalating conflict between Israel and Hamas, remarks from Federal Reserve Chair Jerome Powell and mixed earning reports from leading U.S. corporations.",CVX,0.097854,0.0,Neutral
