title,url,time_published,summary,ticker,relevance_score,ticker_sentiment_score,ticker_sentiment_label
Chevron  ( CVX )  Outpaces Stock Market Gains: What You Should Know,https://www.zacks.com/stock/news/2071002/chevron-cvx-outpaces-stock-market-gains-what-you-should-know,2023-03-27 21:45:23,"Chevron (CVX) closed the most recent trading day at $157.65, moving +1.02% from the previous trading session.",CVX,0.624172,0.336476,Somewhat-Bullish
Warren Buffett Owns More of These 8 Stocks Than Anyone Else on the Planet,https://www.fool.com/investing/2023/03/27/warren-buffett-owns-more-of-these-8-stocks-than-an/,2023-03-27 09:50:00,These aren't the only stocks in which Buffett's Berkshire Hathaway owns huge stakes. But they're the ones that are generating massive profits.,CVX,0.170275,-0.087934,Neutral
A Bull Market Is Coming: 3 Stocks to Buy With Dividend Yields Over 4%,https://www.fool.com/investing/2023/03/26/bull-market-coming-3-stocks-to-buy-dividend-yield/,2023-03-26 10:48:00,These three stocks are worth buying even if they keep falling.,CVX,0.377581,0.243458,Somewhat-Bullish
"Dow Jones, Financial Stocks Climb Off Lows Despite Economic Jitters; Baidu, ELF Beauty Show Strength",https://www.investors.com/market-trend/stock-market-today/dow-jones-financial-stocks-take-more-heat-amid-economic-worries-sellers-hit-coinbase/,2023-03-24 16:10:54,"Dow Jones, Financial Stocks Climb Off Lows Despite Economic ... Investor's Business Daily ...",CVX,0.117774,-0.256441,Somewhat-Bearish
This Is What Whales Are Betting On Chevron - Chevron  ( NYSE:CVX ) ,https://www.benzinga.com/markets/options/23/03/31493325/this-is-what-whales-are-betting-on-chevron,2023-03-24 15:16:10,"A whale with a lot of money to spend has taken a noticeably bearish stance on Chevron. Looking at options history for Chevron CVX we detected 12 strange trades. If we consider the specifics of each trade, it is accurate to state that 16% of the investors opened trades with bullish expectations ...",CVX,0.7887,0.055957,Neutral
"The Good, Bad and Ugly: What Happening and What Investors Need to Do",https://realmoney.thestreet.com/investing/the-good-bad-and-ugly-what-s-happening-and-what-investors-need-to-do-16119308,2023-03-24 14:45:00,"The Good, Bad and Ugly: What Happening and What Investors ... ...",CVX,0.121804,-0.013111,Neutral
86% of Warren Buffett's $322 Billion Portfolio Is Invested in Only 8 Stocks,https://www.fool.com/investing/2023/03/24/86-warren-buffett-portfolio-invested-in-8-stocks/,2023-03-24 09:06:00,The Oracle of Omaha's long-term success has been dependent on portfolio concentration.,CVX,0.222582,0.079048,Neutral
"Fat Profits Of Exxon, Chevron & Co. To Get Fatter? Oil 'Big Winner' Thanks To China's Reopening - iPath Pure Beta Crude Oil ETN  ( ARCA:OIL ) , Chevron  ( NYSE:CVX ) , Exxon Mobil  ( NYSE:XOM ) ",https://www.benzinga.com/trading-ideas/long-ideas/23/03/31474139/fat-profits-of-exxon-chevron-co-to-get-fatter-oil-big-winner-thanks-to-chinas-reopening,2023-03-23 13:38:23,Oil rallied through the first half of 2022 and peaked at $123.68 on June 14. The commodity trimmed its gain in the second half but ended the year with roughly a 7% gain as opposed to the losses experienced by most other asset classes.,CVX,0.152018,0.203769,Somewhat-Bullish
BP Stock Jumped 20% After Trimming Climate Targets - A Black Eye For ESG Investing?,https://www.investors.com/news/bp-stock-jumped-20-percent-after-trimming-climate-targets-a-black-eye-for-esg-investing/,2023-03-23 12:00:53,BP Stock Jumped 20% After Trimming Climate Targets - A Black ... Investor's Business Daily ...,CVX,0.079656,-0.011332,Neutral
News Exclusive | Big Oil Eyes New Deals in North Africa Amid Rising Energy Demand,https://www.wsj.com/articles/big-oil-eyes-new-deals-in-north-africa-amid-rising-energy-demand-cd33e47f,2023-03-23 09:00:00,"Halliburton and Honeywell are in advanced talks to develop oil fields and refineries in Libya, while Eni is importing more oil and gas from Algeria.",CVX,0.382925,0.050402,Neutral
Looking At Chevron's Recent Unusual Options Activity - Chevron  ( NYSE:CVX ) ,https://www.benzinga.com/markets/options/23/03/31459784/looking-at-chevrons-recent-unusual-options-activity,2023-03-22 15:46:37,"Someone with a lot of money to spend has taken a bullish stance on Chevron CVX. We noticed this today when the big position showed up on publicly available options history that we track here at Benzinga. Whether this is an institution or just a wealthy individual, we don't know.",CVX,0.82927,0.366154,Bullish
Chevron  ( CVX )  Halts Production in Thailand Post Fatal Explosion,https://www.zacks.com/stock/news/2068874/chevron-cvx-halts-production-in-thailand-post-fatal-explosion,2023-03-22 10:34:00,"Chevron (CVX) stops producing oil in Benchamas, Thailand following an accident where seawater entered an oil storage vessel, causing the death of one crew member.",CVX,0.535653,0.251168,Somewhat-Bullish
The 1 Stock Warren Buffett Is Almost Certain to Keep Buying -- and It's Not Occidental Petroleum,https://www.fool.com/investing/2023/03/22/1-stock-warren-buffett-almost-certain-keep-buying/,2023-03-22 09:06:00,The Oracle of Omaha has bought this stock every single quarter since mid-2018.,CVX,0.128822,0.07121,Neutral
Chevron  ( CVX )  Outpaces Stock Market Gains: What You Should Know,https://www.zacks.com/stock/news/2076539/chevron-cvx-outpaces-stock-market-gains-what-you-should-know,2023-04-10 21:45:23,"In the latest trading session, Chevron (CVX) closed at $168.29, marking a +0.38% move from the previous day.",CVX,0.672055,0.343259,Somewhat-Bullish
"Exxon Mobil, Pioneer rumors spark fracking M&A talk",https://www.foxbusiness.com/markets/exxonmobil-pioneer-rumors-spark-fracking-ma-talk,2023-04-10 20:50:24,"Exxon Mobil is reportedly in preliminary discussions to acquire Pioneer Natural Resources as part of the company's Permian Basin strategy, analysts say.",CVX,0.15347,0.067998,Neutral
Pioneer Natural jumps on report of buyout talks with Exxon,https://www.reuters.com/business/energy/pioneer-natural-jumps-report-buyout-talks-with-exxon-2023-04-10/,2023-04-10 16:08:00,April 10 ( Reuters ) - Pioneer Natural Resources Co's ( PXD.N ) shares rose as much as 8.5% on Monday following a report that Exxon Mobil Corp ( XOM.N ) held preliminary talks with the U.S. shale oil producer about a possible acquisition.,CVX,0.122894,0.089116,Neutral
Dow Jones Even But Big Tech Falls; Warren Buffett Stocks Set Off Ripples As Q1 Earnings Unfold,https://www.investors.com/market-trend/stock-market-today/dow-jones-even-but-big-tech-falls-warren-buffett-stocks-set-off-ripples-as-q1-earnings-unfold/,2023-04-10 14:52:00,Dow Jones Even But Big Tech Falls. Warren Buffett Stocks Set Off ... Investor's Business Daily ...,CVX,0.129516,0.067378,Neutral
Ominous Death Cross Forms On Chevron's Chart - Chevron  ( NYSE:CVX ) ,https://www.benzinga.com/markets/23/04/31727941/ominous-death-cross-forms-on-chevrons-chart,2023-04-10 14:48:03,"If history is any guide, there may be trouble ahead for shares of Chevron CVX. A so-called ""death cross"" has formed on its chart and, not surprisingly, this could be bearish for the stock. What To Know: Many traders use moving average crossover systems to make their decisions.",CVX,0.570165,-0.461617,Bearish
Oil on the Rise: 5 Compelling Arguments Supporting a Bullish Market Outlook into Year End,https://www.zacks.com/commentary/2076013/oil-on-the-rise-5-compelling-arguments-supporting-a-bullish-market-outlook-into-year-end,2023-04-10 12:30:00,"Market factors such as supply constraints, geopolitical tensions, and strong price and volume action should act as a confidence booster for prospective oil investors. Furthermore, the historically low levels in the SPR mixed with OPEC's agressive su ...",CVX,0.08197,0.192372,Somewhat-Bullish
3 Great Stocks That Are Oozing Cash Flow,https://www.fool.com/investing/2023/04/10/3-great-stocks-that-are-oozing-cash-flow/,2023-04-10 12:28:12,These three companies are set to generate vast amounts of free cash flow in 2023.,CVX,0.334978,0.048673,Neutral
The Best Energy Dividend Stocks For 2023,https://www.forbes.com/sites/brettowens/2023/04/07/the-best-energy-dividend-stocks-for-2023/,2023-04-07 13:30:00,Looking to profit from oil-powered dividends? Look no further than this discounted payer dishing 9.6%.,CVX,0.076479,0.140765,Neutral
Is iShares Core High Dividend ETF  ( HDV )  a Strong ETF Right Now?,https://www.zacks.com/stock/news/2075896/is-ishares-core-high-dividend-etf-hdv-a-strong-etf-right-now,2023-04-07 10:20:09,Smart Beta ETF report for ...,CVX,0.112008,0.060445,Neutral
What to Watch for in Q1 Earnings Season,https://www.zacks.com/stock/news/2075739/what-to-watch-for-in-q1-earnings-season,2023-04-06 16:55:00,"Tracey and Sheraz discuss bank earnings, tech, and the underdog energy sector.",CVX,0.308891,-0.016182,Neutral
PFE: 3 Low P/E Stocks Gearing Up to Rebound This Year,https://stocknews.com/news/pfe-cvx-t-3-low-p-e-stocks-gearing-up-to-rebound-this-year/,2023-04-06 15:01:44,"Investor sentiment has been significantly affected due to the Fed's monetary tightening and the recent bank collapses. However, a down market provides attractive opportunities to invest in undervalued stocks, whose prices tend to trend back upward in the near future.",CVX,0.24267,0.15852,Somewhat-Bullish
Here's Why Chevron Is a No-Brainer Dividend Stock,https://www.fool.com/investing/2023/04/06/heres-why-chevron-is-a-no-brainer-dividend-stock/,2023-04-06 12:45:00,The integrated oil giant has proven it knows how to handle adversity while continuing to grow its dividend.,CVX,0.550151,0.339664,Somewhat-Bullish
ETFs to Play on Surprise Output Cut Decision By OPEC+,https://www.zacks.com/stock/news/2075238/etfs-to-play-on-surprise-output-cut-decision-by-opec-,2023-04-05 23:35:00,The surprise decision of OPEC+ to cut its production supply caused oil prices to rise. Check how energy ETFs are affected ...,CVX,0.082111,0.153221,Somewhat-Bullish
Top Stocks To Buy Now? 2 Dividend Stocks To Watch,https://stockmarket.com/featured/top-stocks-to-buy-now-2-dividend-stocks-to-watch-2023-04-05,2023-04-05 20:30:00,"In the realm of investing, a dividend is a payment made by a corporation to its shareholders, typically in the form of cash or additional shares of stock. This distribution, often derived from the company's earnings, serves as a reward for investors who hold the company's stock.",CVX,0.570165,0.439288,Bullish
15 oil and gas stocks expected to be backed by ample cash flow through 2024,https://www.marketwatch.com/story/15-oil-and-gas-stocks-expected-to-be-backed-by-ample-cash-flow-through-2024-4de6aae8,2023-04-05 16:05:00,These companies are expected to have very high free cash flow yields.,CVX,0.098054,0.043207,Neutral
These Stocks Are Warren Buffett's 3 Largest AI-Fueled Investments,https://www.fool.com/investing/2023/04/05/stocks-warren-buffett-largest-ai-investments/,2023-04-05 14:00:43,"Berkshire Hathaway's team invested in many ""AI stocks"" -- and not all of them are in the tech sector.",CVX,0.186738,0.180634,Somewhat-Bullish
These are the only stocks that matter right now | Business,https://www.cnn.com/2023/04/05/investing/premarket-stocks-trading/index.html,2023-04-05 11:33:00,These are the only stocks that matter right now ...,CVX,0.072435,0.049276,Neutral
"STANDARD INDUSTRIES APPOINTS BOB PATEL TO NEW POSITION OF PRESIDENT, STANDARD INDUSTRIES",https://www.prnewswire.com/news-releases/standard-industries-appoints-bob-patel-to-new-position-of-president-standard-industries-301790660.html,2023-04-05 11:12:00,STANDARD INDUSTRIES APPOINTS BOB PATEL TO NEW ... PR ...,CVX,0.049835,0.111215,Neutral
These 3 Stocks Just Made Warren Buffett $2.9 Billion in 1 Day,https://www.fool.com/investing/2023/04/05/these-3-stocks-just-made-warren-buffett-29-billion/,2023-04-05 09:51:00,Are these big winners for Buffett smart picks for investors to buy now?,CVX,0.445569,0.27472,Somewhat-Bullish
Shell Stock Crosses Winning Threshold; Q4 Profits Leapt 67%,https://www.investors.com/news/stocks-to-watch-shell-adr-sees-rs-rating-jump-to-81/,2023-04-04 23:01:00,Shell Stock Crosses Winning Threshold. Q4 Profits Leapt 67% Investor's Business Daily ...,CVX,0.151539,-0.08069,Neutral
Chevron  ( CVX )  Stock Moves -0.54%: What You Should Know,https://www.zacks.com/stock/news/2074516/chevron-cvx-stock-moves--054-what-you-should-know,2023-04-04 21:45:24,"In the latest trading session, Chevron (CVX) closed at $169.04, marking a -0.54% move from the previous day.",CVX,0.722944,0.209642,Somewhat-Bullish
Rising Oil Prices? 3 Stocks Worth Considering,https://www.zacks.com/commentary/2074489/rising-oil-prices-3-stocks-worth-considering,2023-04-04 18:59:00,"Energy stocks are seeing increased attention from investors following a surprise production cut from OPEC on Sunday. After retreating in 2023 and particularly so throughout March, oil prices surged on the news. Where do energy stocks go from here?",CVX,0.453501,0.534929,Bullish
"Stock Market News for Apr 4, 2023",https://www.zacks.com/stock/news/2074231/stock-market-news-for-apr-4-2023,2023-04-04 13:24:00,Wall Street closed mixed to start second quarter of 2023.,CVX,0.116631,0.155921,Somewhat-Bullish
"Chevron, UnitedHealth, SPDR Gold Trust And This ETF On CNBC's 'Final Trades' - Chevron  ( NYSE:CVX ) , SPDR Gold Trust  ( ARCA:GLD ) ",https://www.benzinga.com/trading-ideas/long-ideas/23/04/31648531/chevron-unitedhealth-spdr-gold-trust-and-this-etf-on-cnbcs-final-trades,2023-04-04 13:08:55,"On CNBC's ""Halftime Report Final Trades,"" Liz Young of BNY Mellon Investment Management said she is selling VanEck Semiconductor ETF SMH, which traded slightly lower on Monday.",CVX,0.694939,0.142502,Neutral
Futures Rise Ahead Of Economic Data; Tesla Bounces,https://www.investors.com/market-trend/stock-market-today/dow-jones-futures-rise-ahead-of-economic-data-tesla-bounces-amid-china-sales/,2023-04-04 12:19:00,Futures Rise Ahead Of Economic Data. Tesla Bounces Investor's Business Daily ...,CVX,0.091977,0.197554,Somewhat-Bullish
These Warren Buffett Stocks Are Getting a Big Boost From an Unexpected Source,https://www.fool.com/investing/2023/04/04/these-warren-buffett-stocks-are-getting-a-big-boos/,2023-04-04 12:05:00,Buffett's bold bet on higher oil prices appears poised to pay off.,CVX,0.334762,0.074911,Neutral
"Nasdaq, S&P 500 Futures Point To Higher Open On Strong Momentum - Invesco QQQ Trust, Series 1  ( NASDAQ:QQQ ) , SPDR S&P 500  ( ARCA:SPY ) ",https://www.benzinga.com/news/earnings/23/04/31650748/us-stocks-set-to-open-higher-today-on-strong-momentum-analyst-says-next-fed-rate-decision-could-be-,2023-04-04 11:12:23,"Trading in the index futures suggests stocks may get off to a modestly positive start on Tuesday after an upbeat close in the previous session. The recent soft data point to a potential pause by the Federal Reserve and this should encourage traders to stay invested, and the lack of any first-tier ...",CVX,0.108958,0.0,Neutral
"Venezuela's March oil exports rise on more supertankers, Chevron cargoes",https://www.reuters.com/markets/commodities/venezuelas-march-oil-exports-rise-more-supertankers-chevron-cargoes-2023-04-04/,2023-04-04 11:01:53,"Venezuela's March oil exports rise on more supertankers, Chevron ... ...",CVX,0.088147,0.085624,Neutral
Futures edge higher as tech and growth stocks gain; focus on jobs data,https://www.reuters.com/markets/us/futures-edge-higher-tech-growth-stocks-gain-focus-jobs-data-2023-04-04/,2023-04-04 10:13:00,Futures edge higher as tech and growth stocks gain. focus on jobs ... ...,CVX,0.077094,0.312581,Somewhat-Bullish
"Asia stocks wobble as OPEC+ output cuts, weak US data raise uncertainty | The Financial Express",https://www.financialexpress.com/market/asia-stocks-wobble-as-opec-output-cuts-weak-us-data-raise-uncertainty/3032540/,2023-04-04 03:37:54,"Asia stocks wobble as OPEC+ output cuts, weak US data raise ... The Financial Express ...",CVX,0.066598,0.203754,Somewhat-Bullish
"Asia stocks wobble as OPEC+ output cuts, weak US data raise uncertainty",https://www.moneycontrol.com/news/business/markets/asia-stocks-wobble-as-opec-output-cuts-weak-us-data-raise-uncertainty-10359011.html,2023-04-04 02:28:41,"An announcement on Sunday of output target cuts by the Organization of the Petroleum Exporting Countries ( OPEC ) and its allies, known as OPEC , propelled oil prices higher and complicated the inflation outlook. Brent crude was up 0.5% to $85.39 per barrel, after jumping over 6% overnight.",CVX,0.065506,0.110166,Neutral
"Asia stocks wobble as OPEC+ output cuts, weak US data raise uncertainty",https://www.reuters.com/markets/global-markets-wrapup-1-2023-04-04/,2023-04-04 02:17:00,"Asia stocks wobble as OPEC+ output cuts, weak US data raise ... ...",CVX,0.059488,0.104,Neutral
"Tesla, Apple, AMC, Chevron, Nio: Top Trending Stocks - Apple  ( NASDAQ:AAPL ) , Tesla  ( NASDAQ:TSLA ) , Chevron  ( NYSE:CVX ) , NIO  ( NYSE:NIO ) ",https://www.benzinga.com/news/23/04/31647609/tesla-apple-amc-chevron-nio-why-these-5-stocks-are-drawing-investors-attention-today,2023-04-04 01:21:26,U.S. markets ended mixed on Monday as Wall Street refused to pare gains made last week in response to The Organization of the Petroleum Exporting Countries and its allies announcing a surprise reduction in oil production by 1.16 million barrels per day beginning May.,CVX,0.252987,0.16334,Somewhat-Bullish
S&P 500 ends higher as oil stocks rally; Tesla tumbles,https://www.moneycontrol.com/news/business/markets/s-tesla-tumbles-10358701.html,2023-04-04 00:35:06,"Tesla Inc ( TSLA.O ) dropped 6.1% after disclosing March-quarter deliveries rose just 4% from the previous quarter, even after CEO Elon Musk slashed car prices in January to boost demand.",CVX,0.085629,-0.050971,Neutral
Why the Dow Crushed the Rest of the Stock Market Monday,https://www.fool.com/investing/2023/04/03/why-the-dow-crushed-the-rest-of-the-stock-market-m/,2023-04-03 22:28:00,A couple of stocks played key roles.,CVX,0.367865,0.399683,Bullish
Futures: Stocks End At Day Highs; What To Do Now,https://www.investors.com/market-trend/stock-market-today/dow-jones-futures-tesla-stock-dives-below-latest-buy-point-on-deliveries-miss-what-to-do-now/,2023-04-03 20:57:00,Dow Jones Futures: Tesla Dives Below Latest Buy Point On ... Investor's Business Daily ...,CVX,0.094143,0.19861,Somewhat-Bullish
Chevron Unusual Options Activity For April 03 - Chevron  ( NYSE:CVX ) ,https://www.benzinga.com/markets/options/23/04/31644452/chevron-unusual-options-activity-for-april-03,2023-04-03 20:45:49,"Someone with a lot of money to spend has taken a bearish stance on Chevron CVX. We noticed this today when the big position showed up on publicly available options history that we track here at Benzinga. Whether this is an institution or just a wealthy individual, we don't know.",CVX,0.744646,0.146009,Neutral
Dow Jones Gains As Stocks Fight Back; Tesla Dives On Deliveries; WWE Slammed On UFC Hook-Up,https://www.investors.com/market-trend/stock-market-today/dow-jones-gains-as-benchmarks-struggle-tesla-dives-on-deliveries-wwe-gets-slammed-on-ufc-hook-up/,2023-04-03 20:20:00,Dow Jones Gains As Stocks Fight Back. Tesla Dives On Deliveries ... Investor's Business Daily ...,CVX,0.098659,0.172073,Somewhat-Bullish
Stock Market Today: Stocks Finish Mixed After Surprise OPEC+ Announcement,https://www.kiplinger.com/investing/stocks/stock-market-today-stocks-finish-mixed-after-surprise-opec-announcement,2023-04-03 20:14:54,Stock Market Today: Stocks Finish Mixed After Surprise OPEC+ ... Kiplinger's Personal Finance ...,CVX,0.125134,0.005904,Neutral
Why Energy Stocks Like ExxonMobil and Chevron Are Rallying on Monday,https://www.fool.com/investing/2023/04/03/why-energy-stocks-like-exxonmobil-and-chevron-are/,2023-04-03 18:12:36,Crude oil prices caught a major tailwind from an announcement about tightening worldwide supply.,CVX,0.318074,0.197511,Somewhat-Bullish
Oil-production cuts could force Fed to raise interest rates even higher to fight inflation,https://www.marketwatch.com/story/oil-production-cuts-could-force-fed-to-raise-interest-rates-even-higher-to-fight-inflation-c460ff18,2023-04-03 18:10:00,"A surprise production cut by Saudi Arabia and its OPEC+ partners complicates the outlook for stocks, bonds and currencies.",CVX,0.060161,0.153195,Somewhat-Bullish
Week Ahead: Oil Rallies and McDonalds Falters,https://www.zacks.com/commentary/2073924/week-ahead-oil-rallies-and-mcdonalds-falters,2023-04-03 17:44:00,"If you were hoping the action might slow after the first quarter, forget it, because over the weekend OPEC+ made a major announcement about crude oil production rates ...",CVX,0.109455,0.075285,Neutral
Dow Jones Rises On Mixed Economic Data; Oil Stocks Jump On OPEC Cut; Tesla Falls After Deliveries Miss,https://www.investors.com/market-trend/stock-market-today/dow-jones-rises-on-mixed-economic-data-oil-stocks-jump-on-opec-cut-tesla-falls-after-deliveries-miss/,2023-04-03 14:49:00,Dow Jones Rises On Mixed Economic Data. Oil Stocks Jump On ... Investor's Business Daily ...,CVX,0.147366,0.0,Neutral
Stick With Exxon as the U.S. Gets Smacked by Foreign Oil Producers,https://realmoney.thestreet.com/investing/stick-with-exxon-as-the-u-s-gets-smacked-by-foreign-oil-producers-16120055,2023-04-03 14:31:00,"Despite officially meeting on Monday ( this morning ) , OPEC+ did not wait. Russia had announced weeks ago in March that engaged in an offensive war inside neighboring Ukraine, and struggling with a weakened energy commodity export-reliant economy, the nation would cut oil production by 500K per ...",CVX,0.17868,0.150381,Somewhat-Bullish
Surprise Cut In Oil Output Sends Crude Prices Higher,https://www.forbes.com/sites/jjkinahan/2023/04/03/surprise-cut-in-oil-output-sends-crude-prices-higher/,2023-04-03 13:10:22,"This week is filled with various employment reports, with the grandaddy of them all, the Employment Situation, due out Friday.",CVX,0.044551,-0.048444,Neutral
Black Gold,https://www.forbes.com/sites/jjkinahan/2023/04/03/black-gold/,2023-04-03 13:10:22,"This week is filled with various employment reports, with the grandaddy of them all, the Employment Situation, due out Friday.",CVX,0.044551,-0.048444,Neutral
"What's Fueling The Move In ConocoPhillips, Chevron and BP Shares Today? - Chevron  ( NYSE:CVX ) ",https://www.benzinga.com/news/23/04/31632376/whats-fueling-the-move-in-conocophillips-chevron-and-bp-shares-today,2023-04-03 13:07:47,"ConocoPhillips COP, Chevron Corp CVX and BP P.L.C. BP shares are trading higher Monday after OPEC+ made a surprise announcement to slash oil output. What To Know: A group of several countries that export oil, known as OPEC+, announced plans to cut oil production by approximately 1.16 million ...",CVX,0.511256,0.236882,Somewhat-Bullish
"Oil Prices, Energy Stocks Jump On Surprise OPEC+ Production Cut",https://www.investors.com/news/chevron-energy-stocks-surge-after-opec-surprise-production-cut/,2023-04-03 12:20:00,"Chevron, Energy Stocks Surge After OPEC+ Surprise Production ... Investor's Business Daily ...",CVX,0.459624,0.270544,Somewhat-Bullish
"Underweight stocks now, says JPMorgan, because there's a risk-free alternative paying 5%",https://www.marketwatch.com/story/underweight-stocks-now-says-jpmorgan-because-theres-a-risk-free-alternative-paying-5-ee030be6,2023-04-03 11:23:00,JPMorgan wants to know why you are still holding U.S. stocks.,CVX,0.073886,-0.048607,Neutral
"Nasdaq, S&P 500 Futures Down As Caution Clouds Traders' View - Invesco QQQ Trust, Series 1  ( NASDAQ:QQQ ) , SPDR S&P 500  ( ARCA:SPY ) ",https://www.benzinga.com/news/23/04/31628582/nasdaq-s-p-500-futures-down-as-caution-clouds-traders-view-but-analyst-suggests-april-might-not-be-g,2023-04-03 10:51:13,"Caution is writ all over the face of the market ahead of the start of a new trading week. Traders may prefer to move to the sidelines wary of recent gains, which have pushed the averages past the neutral zone and toward the oversold territory.",CVX,0.105836,-0.120064,Neutral
"S&P, Nasdaq futures fall on inflation worries after OPEC+ output cut",https://www.reuters.com/markets/us/sp-nasdaq-futures-fall-inflation-worries-after-opec-output-cut-2023-04-03/,2023-04-03 10:00:52,"April 3 ( Reuters ) - Futures tracking the S&P 500 and the Nasdaq fell on Monday as soaring oil prices renewed worries of persistent inflationary pressures, while energy stocks surged at the start of the week.",CVX,0.096283,0.201836,Somewhat-Bullish
U.S. stock futures mostly lower after surprise OPEC move on oil,https://www.marketwatch.com/story/u-s-stock-futures-mostly-lower-after-surprise-opec-move-on-oil-136fceac,2023-04-03 09:00:00,U.S. stock futures were mostly lower Monday as investors reacted to a surge in oil prices after a surprise production cut was announced by Saudi Arabia and its allies.,CVX,0.2872,-0.03242,Neutral
OPEC+ Just Announced Oil Output Cuts In A Surprise Move. Here's How It Could Really Affect You. - United States Oil Fund  ( ARCA:USO ) ,https://www.benzinga.com/news/23/04/31624195/opec-just-announced-oil-output-cuts-in-a-surprise-move-heres-how-it-could-really-affect-you,2023-04-02 16:30:24,"OPEC+, a consortium comprising 22 oil-producing nations, announced Sunday an unexpected production cut that will likely give a further boost to oil prices bouncing off their recent lows. What Happened: The combined cut announced by the oil consortium will be around 1.16 million barrels per day, ...",CVX,0.164468,0.007076,Neutral
Value Investing Is Back,https://www.kiplinger.com/investing/stocks/value-investing-is-back,2023-04-01 13:30:00,"It looks like value investing is making a comeback. Growth stocks clobbered value for about a decade. In 2020, they beat value by more than 30 percentage points - the widest margin since at least 1927. Then, in 2022, growth took a sickening dive.",CVX,0.050894,-0.054961,Neutral
