title,url,time_published,summary,ticker,relevance_score,ticker_sentiment_score,ticker_sentiment_label
"Moore Kuehn Encourages DICE, PDCE, EMAN, and NETI Investors to Contact Law Firm - eMagin  ( AMEX:EMAN ) , DICE Therapeutics  ( NASDAQ:DICE ) ",https://www.benzinga.com/pressreleases/23/07/g33135222/moore-kuehn-encourages-dice-pdce-eman-and-neti-investors-to-contact-law-firm,2023-07-06 15:15:04,"NEW YORK, July 06, 2023 ( GLOBE NEWSWIRE ) -- Moore Kuehn, PLLC, a law firm focusing in securities litigation located on Wall Street in downtown New York City, is investigating potential claims concerning whether the following proposed mergers are fair to shareholders.",CVX,0.109455,0.291593,Somewhat-Bullish
Here is What to Know Beyond Why Chevron Corporation  ( CVX )  is a Trending Stock,https://www.zacks.com/stock/news/2117425/here-is-what-to-know-beyond-why-chevron-corporation-cvx-is-a-trending-stock,2023-07-06 13:00:13,"Zacks.com users have recently been watching Chevron (CVX) quite a bit. Thus, it is worth knowing the facts that could determine the stock's prospects.",CVX,0.527831,0.147749,Neutral
3 Elite Dividend Stocks Yielding 3%-Plus to Buy Without Hesitation in July,https://www.fool.com/investing/2023/07/06/3-elite-dividend-stocks-yielding-3-to-buy-without/,2023-07-06 12:15:00,These companies offer attractive and steadily rising income streams.,CVX,0.233556,0.279961,Somewhat-Bullish
"The Ultimate Warren Buffett Stock Is In A Buy Zone, But Should You Buy It?",https://www.investors.com/research/berkshire-hathaway-stock-buy-now-warren-buffett-stock/,2023-07-05 18:52:00,"Warren Buffett is widely regarded as one of the greatest investors of all time. One way to share in his success is to invest in his firm, Berkshire Hathaway ( BRKB ) , which sits near an entry. But is Berkshire a good buy for you now?",CVX,0.059292,0.147002,Neutral
"Bunge And Chevron Buy Argentina Seed Business, Step Towards Lower-Carbon Energy Future - Bunge  ( NYSE:BG ) ",https://www.benzinga.com/markets/equities/23/07/33115509/bunge-and-chevron-buy-argentina-seed-business-step-towards-lower-carbon-energy-future,2023-07-05 13:48:15,"Bunge Ltd BG, along with Chevron Corp's CVX subsidiary Renewable Energy Group Inc., disclosed the acquisition of Argentina-based Chacraservicios S.r.l for an undisclosed term. In particular, Bunge and Chevron bought Chacraservicios from the Italy-based Adamant Group.",CVX,0.479683,0.009304,Neutral
2 Buffett Stocks I Don't Want to Own: A Personal Perspective,https://www.fool.com/investing/2023/07/05/2-buffett-stocks-i-dont-want-to-own-a-personal-per/,2023-07-05 13:21:00,"You shouldn't buy everything Warren Buffett buys. Here's why, along with a better way to make the most of Buffett's investing genius.",CVX,0.102231,0.060676,Neutral
Chevron  ( CVX )  & Partners Add Third Pipeline to Leviathan Project,https://www.zacks.com/stock/news/2116902/chevron-cvx-partners-add-third-pipeline-to-leviathan-project,2023-07-05 12:25:00,"Chevron (CVX) and its Israeli partners plan to add a third pipeline to the Leviathan gas field, boosting its production capacity and meeting growing energy demands.",CVX,0.286193,0.379738,Bullish
Vacuum Gas Oil Market size to grow by USD 111.59 billion from 2022 to 2027|Rise in refinery upgradation in the oil and gas industry to be one of the major market trends - Technavio,https://www.prnewswire.com/news-releases/vacuum-gas-oil-market-size-to-grow-by-usd-111-59-billion-from-2022-to-2027rise-in-refinery-upgradation-in-the-oil-and-gas-industry-to-be-one-of-the-major-market-trends---technavio-301869621.html,2023-07-05 06:15:00,Vacuum Gas Oil Market size to grow by USD 111.59 billion from 2022 to 2027|Rise in refinery upgradation in the oil ... PR ...,CVX,0.029581,0.0252,Neutral
4 Integrated Energy Stocks to Gain From a Promising Industry,https://www.zacks.com/commentary/2116452/4-integrated-energy-stocks-to-gain-from-a-promising-industry,2023-07-04 12:39:00,"From upstream activities to midstream, prospects for companies are rosy now, enhancing the outlook for the Zacks Oil and Gas Integrated International industry. XOM, CVX, BP and SSL will make the most of the favorable business scenario.",CVX,0.167322,0.268239,Somewhat-Bullish
Is Vident U.S. Equity Strategy ETF  ( VUSE )  a Strong ETF Right Now?,https://www.zacks.com/stock/news/2116341/is-vident-us-equity-strategy-etf-vuse-a-strong-etf-right-now,2023-07-04 10:20:07,Smart Beta ETF report for ...,CVX,0.113062,0.057332,Neutral
Chevron  ( CVX )  Stock Sinks As Market Gains: What You Should Know,https://www.zacks.com/stock/news/2116223/chevron-cvx-stock-sinks-as-market-gains-what-you-should-know,2023-07-03 21:45:17,"In the latest trading session, Chevron (CVX) closed at $157.21, marking a -0.09% move from the previous day.",CVX,0.620664,0.318179,Somewhat-Bullish
Warren Buffett Has Over $270 Billion Invested in These 5 Dividend Stocks,https://www.fool.com/investing/2023/07/03/warren-buffett-270-billion-dividend-stocks/,2023-07-03 09:50:00,The Oracle of Omaha really likes these dividend stocks.,CVX,0.192183,0.241683,Somewhat-Bullish
2 Tremendous Stocks to Buy Hand Over Fist in July,https://www.fool.com/investing/2023/07/02/2-tremendous-stocks-to-buy-hand-over-fist-in-july/,2023-07-02 14:15:00,These exceptional companies have value-creating catalysts on the horizon.,CVX,0.108712,0.067408,Neutral
"You Can't Control Oil Prices, but You Can Control What You Do About Them",https://www.fool.com/investing/2023/07/01/cant-control-oil-prices-can-control-buy-stock/,2023-07-01 11:20:00,"Energy prices are highly volatile, and investors interested in energy companies need to take that into account.",CVX,0.145437,0.161335,Somewhat-Bullish
"Friday's ETF Winners And Losers: Large-Cap Returns - XLE Gains 3.5% On The Week - Chevron  ( NYSE:CVX ) , NextEra Energy  ( NYSE:NEE ) ",https://www.benzinga.com/news/large-cap/23/06/33082011/fridays-etf-winners-and-losers-large-cap-returns-xle-gains-3-5-on-the-week,2023-06-30 17:52:11,"We performed a screening of large-cap ETFs - defined as having Assets Under Management ( AUM ) over $10 billion - to determine what funds had the largest positive and negative returns on the week, according to data from etfdb.com. Only non-leveraged funds were considered.",CVX,0.163909,0.166485,Somewhat-Bullish
"Chevron Mulls Sale Of Oil And Gas Properties In New Mexico, Texas To Reduce Acreage: Report - Chevron  ( NYSE:CVX ) ",https://www.benzinga.com/markets/equities/23/06/33076803/chevron-mulls-sale-of-oil-and-gas-properties-in-new-mexico-texas-to-reduce-acreage-report,2023-06-30 13:33:40,"Chevron Corporation CVX is reportedly mulling a sale of several oil and gas properties in New Mexico and Texas to reduce acreage. The company has been divesting properties in the Permian Basin of West Texas and New Mexico, where it is the most prominent publicly-traded oil and gas producer, ...",CVX,0.889454,0.174958,Somewhat-Bullish
Chevron  ( CVX )  Puts New Mexico & Texas Properties Up for Sale,https://www.zacks.com/stock/news/2115403/chevron-cvx-puts-new-mexico-texas-properties-up-for-sale,2023-06-30 13:29:00,Chevron (CVX) plans to reduce its assets after making significant shale acquisitions over the last few years.,CVX,0.532556,0.218964,Somewhat-Bullish
"Energy Stocks And Industry News: Oil, Gas, Solar, Coal | Stock News & Stock Market Analysis - IBD",https://www.investors.com/news/oil-gas-stocks-industry-news-oil-prices-opec-exxon-haliburton-schlumberger-chevron-continental-resources/,2023-06-30 12:04:00,"U.S. shale companies like Diamondback Energy ( FANG ) , Continental Resources ( CLR ) and EOG Resources ( EOG ) are becoming the new swing producers for the global oil market, rising to compete with and take market share from the industry's traditional powerhouses, Saudi Arabia and Russia.",CVX,0.411176,0.555034,Bullish
Why Wall Street is bullish on beaten-down energy stocks | Business,https://www.cnn.com/2023/06/30/investing/premarket-stocks-trading/index.html,2023-06-30 11:44:00,Why Wall Street is bullish on beaten-down energy stocks ...,CVX,0.147818,0.074588,Neutral
Should You Go Against This Advice From Warren Buffett?,https://www.fool.com/investing/2023/06/30/should-you-go-against-this-advice-from-buffett/,2023-06-30 10:00:00,Buffett has a difficult-to-beat track record.,CVX,0.059194,0.053989,Neutral
77% of Warren Buffett's $366 Billion Portfolio Is Invested in Only 6 Stocks,https://www.fool.com/investing/2023/06/30/77-warren-buffett-portfolio-invested-in-6-stocks/,2023-06-30 09:06:00,The Oracle of Omaha has $282 billion collectively invested in a half-dozen stocks.,CVX,0.276719,0.16305,Somewhat-Bullish
This Is What Whales Are Betting On Chevron - Chevron  ( NYSE:CVX ) ,https://www.benzinga.com/markets/options/23/07/33290524/this-is-what-whales-are-betting-on-chevron,2023-07-19 18:15:56,"A whale with a lot of money to spend has taken a noticeably bearish stance on Chevron. Looking at options history for Chevron CVX we detected 11 strange trades. If we consider the specifics of each trade, it is accurate to state that 45% of the investors opened trades with bullish expectations ...",CVX,0.850784,0.09768,Neutral
Chevron  ( CVX )  Uses Mini ROVs for Offshore Angola Inspections,https://www.zacks.com/stock/news/2123624/chevron-cvx-uses-mini-rovs-for-offshore-angola-inspections,2023-07-19 12:32:00,Chevron's (CVX) journey with mini remotely operated vehicles started in Angola in 2020. It plans to conduct more than 150 surveys in the next three years.,CVX,0.385137,0.601328,Bullish
Chevron  ( CVX )  Gains But Lags Market: What You Should Know,https://www.zacks.com/stock/news/2123239/chevron-cvx-gains-but-lags-market-what-you-should-know,2023-07-18 21:45:22,"Chevron (CVX) closed at $153.75 in the latest trading session, marking a +0.2% move from the prior day.",CVX,0.612033,0.309613,Somewhat-Bullish
Investors Heavily Search Chevron Corporation  ( CVX ) : Here is What You Need to Know,https://www.zacks.com/stock/news/2122731/investors-heavily-search-chevron-corporation-cvx-here-is-what-you-need-to-know,2023-07-18 13:00:12,"Zacks.com users have recently been watching Chevron (CVX) quite a bit. Thus, it is worth knowing the facts that could determine the stock's prospects.",CVX,0.524949,0.096784,Neutral
"ALERT: The M&A Class Action Firm Continues Investigating the Merger - PDCE, SGTX, CFMS, SYNH",https://www.benzinga.com/pressreleases/23/07/g33257352/alert-the-m-a-class-action-firm-continues-investigating-the-merger-pdce-sgtx-cfms-synh,2023-07-17 21:16:03,"NEW YORK, July 17, 2023 ( GLOBE NEWSWIRE ) -- Juan Monteverde, founder and managing partner of the class action firm Monteverde & Associates PC ( the ""M&A Class Action Firm"" ) , a national securities firm rated Top 50 in the 2018-2021 ISS Securities Class Action Services Report and headquartered ...",CVX,0.067347,0.156268,Somewhat-Bullish
This Is What Whales Are Betting On Chevron - Chevron  ( NYSE:CVX ) ,https://www.benzinga.com/markets/options/23/07/33254597/this-is-what-whales-are-betting-on-chevron,2023-07-17 18:16:06,"Someone with a lot of money to spend has taken a bearish stance on Chevron CVX. We noticed this today when the big position showed up on publicly available options history that we track here at Benzinga. Whether this is an institution or just a wealthy individual, we don't know.",CVX,0.809819,0.181882,Somewhat-Bullish
Meta Platforms vs. Alphabet: Which big tech stock is a better buy?,https://www.marketwatch.com/story/meta-platforms-vs-alphabet-which-big-tech-stock-is-a-better-buy-42a391c6,2023-07-17 13:22:00,"Investors can compare the Google and Facebook parent companies on key metrics, but the choice quickly becomes 'extraordinarily subjective.' ...",CVX,0.096769,0.046167,Neutral
Should You Invest in the Vanguard Energy ETF  ( VDE ) ?,https://www.zacks.com/stock/news/2121858/should-you-invest-in-the-vanguard-energy-etf-vde,2023-07-17 10:20:07,Sector ETF report for ...,CVX,0.135729,0.071814,Neutral
Meet the 2 Warren Buffett Holdings That Would Have Made Investors Money 104 Out of 104 Times Since 1900  ( With a Catch ) ,https://www.fool.com/investing/2023/07/17/2-warren-buffett-investments-made-money-104-times/,2023-07-17 09:06:00,"When given the proper amount of time, these Berkshire Hathaway holdings have a, thus far, flawless track record of making investors richer.",CVX,0.091335,0.258311,Somewhat-Bullish
"CVX, COP, or SLB: Which Energy Stock is the Best Pick?",https://markets.businessinsider.com/news/stocks/cvx-cop-or-slb-which-energy-stock-is-the-best-pick-1032448743,2023-07-15 21:38:40,"Oil and natural gas prices have fallen from the elevated levels seen in 2022 due to the Russia-Ukraine conflict. Oil prices in recent weeks have benefited from supply disruption in Africa and lower shipments from Russia, both tightening the market.",CVX,0.377142,0.11049,Neutral
Better Dividend Buy: Devon Energy vs. Chevron vs. Enterprise Products Partners,https://www.fool.com/investing/2023/07/15/better-dividend-buy-devon-energy-vs-chevron-vs-ent/,2023-07-15 13:04:00,Which of these three U.S. energy companies is right for your portfolio depends on your income needs and risk tolerance.,CVX,0.226583,0.281862,Somewhat-Bullish
Best Dividend Stocks to Buy: Devon Energy vs. Chevron,https://www.fool.com/investing/2023/07/15/best-dividend-stocks-to-buy-devon-energy-stock-vs/,2023-07-15 09:00:00,The two energy companies have excellent prospects in the near term.,CVX,0.978984,0.807709,Bullish
Weekly Roundup,https://aap.thestreet.com/story/16128771/1/weekly-roundup.html,2023-07-14 22:01:00,"Following the strong rally in the market in the second quarter, questions over the next move for the major market indexes were in focus this week -- one that brought the latest prints for key inflation data and the real start of second-quarter earnings season.",CVX,0.00631,0.018715,Neutral
"Chevron opted to buy vs build US LNG processing, gas executive says",https://www.reuters.com/business/energy/chevron-opted-buy-vs-build-us-lng-processing-gas-executive-2023-07-14/,2023-07-14 21:18:00,Chevron opted to buy vs build US LNG processing - gas executive ...,CVX,0.101582,0.271847,Somewhat-Bullish
90% of Warren Buffett's $372 Billion Portfolio Is Invested in Only 14 Stocks,https://www.fool.com/investing/2023/07/14/90-warren-buffett-portfolio-invested-in-14-stocks/,2023-07-14 09:06:00,Nearly $334 billion of Berkshire Hathaway's $372 billion investment portfolio is invested in just over a dozen companies.,CVX,0.105604,0.013541,Neutral
Chevron Is Betting Big on U.S. Oil,https://www.fool.com/investing/2023/07/13/chevron-is-betting-big-on-us-oil/,2023-07-13 13:00:00,"The integrated energy giant is pushing to increase its oil production, and the U.S. is going to be a key driver.",CVX,0.615462,0.554635,Bullish
Is WisdomTree U.S. High Dividend ETF  ( DHS )  a Strong ETF Right Now?,https://www.zacks.com/stock/news/2120350/is-wisdomtree-us-high-dividend-etf-dhs-a-strong-etf-right-now,2023-07-13 10:20:07,Smart Beta ETF report for ...,CVX,0.116914,0.067048,Neutral
Chevron  ( CVX )  Outpaces Stock Market Gains: What You Should Know,https://www.zacks.com/stock/news/2120207/chevron-cvx-outpaces-stock-market-gains-what-you-should-know,2023-07-12 21:45:25,"Chevron (CVX) closed the most recent trading day at $159.64, moving +0.96% from the previous trading session.",CVX,0.556576,0.329885,Somewhat-Bullish
"Bernie Sanders Doesn't Own Individual Stocks But His Mutual Fund Holdings Include Stakes In Companies He's Criticized, Including Tesla - Apple  ( NASDAQ:AAPL ) , American Tower  ( NYSE:AMT ) ",https://www.benzinga.com/markets/mutual-funds/23/07/33202142/bernie-sanders-doesnt-own-individual-stocks-but-his-mutual-fund-holdings-include-stakes-in-c,2023-07-12 17:49:32,"U.S. Sen. Bernie Sanders has made waves over the years for targeting the ultra-wealthy, with some of the billionaires accumulating their wealth through stock investments. While many members of Congress have owned stocks that are publicly disclosed, Sanders has famously avoided this investment ...",CVX,0.08183,0.113255,Neutral
Warren Buffett Just Got $3 Billion Deeper Into Energy Stocks. Is This Sector Hiding in Plain Sight?,https://www.fool.com/investing/2023/07/12/warren-buffett-billion-deeper-in-energy-stocks/,2023-07-12 15:38:58,Energy stocks lagged behind the rest of the market in the first half of 2023.,CVX,0.234119,0.198923,Somewhat-Bullish
Oil & Gas Stock Roundup: Shell's Q2 Update & Chevron's Acquisition in Focus,https://www.zacks.com/stock/news/2119877/oil-gas-stock-roundup-shells-q2-update-chevrons-acquisition-in-focus,2023-07-12 12:50:00,"Shell (SHEL), Chevron (CVX), Patterson-UTI Energy (PTEN), TC Energy (TRP) and Expro Group Holdings (XPRO) were the energy headline makers during the week.",CVX,0.177802,0.13328,Neutral
Is First Trust NASDAQ Oil & Gas ETF  ( FTXN )  a Strong ETF Right Now?,https://www.zacks.com/stock/news/2119622/is-first-trust-nasdaq-oil-gas-etf-ftxn-a-strong-etf-right-now,2023-07-12 10:20:07,Smart Beta ETF report for ...,CVX,0.119532,0.061995,Neutral
Warren Buffett Is Betting Another $3.3 Billion on a Fossil Fuel-Filled Future,https://www.fool.com/investing/2023/07/12/warren-buffett-is-betting-another-33-billion-on-a/,2023-07-12 10:08:00,Buffett continues to put money behind the belief that fossil fuels will remain vital for a long time.,CVX,0.224903,0.181006,Somewhat-Bullish
Neutral But Noteworthy: Analyst Discusses Chevron's Improving Well Productivity And Future Prospects - Chevron  ( NYSE:CVX ) ,https://www.benzinga.com/analyst-ratings/analyst-color/23/07/33188873/neutral-but-noteworthy-analyst-discusses-chevrons-improving-well-productivity-and-f,2023-07-11 18:43:52,"Mizuho Securities USA analyst Nitin Kumar reiterated a Neutral rating on the shares of Chevron Corporation CVX and raised the price target from $202 to $205. For 2Q23 earnings, in the analyst's opinion, well performance in the Permian will continue to be the main focus for investors, following ...",CVX,0.532941,0.440804,Bullish
Chevron Unusual Options Activity For July 11 - Chevron  ( NYSE:CVX ) ,https://www.benzinga.com/markets/options/23/07/33189780/chevron-unusual-options-activity-for-july-11,2023-07-11 18:17:01,"Someone with a lot of money to spend has taken a bearish stance on Chevron CVX. We noticed this today when the big position showed up on publicly available options history that we track here at Benzinga. Whether this is an institution or just a wealthy individual, we don't know.",CVX,0.825367,0.06857,Neutral
Warren Buffett Bets On LNG Despite Low Prices With This $3 Billion Deal,https://www.investors.com/news/warren-buffett-bets-on-lng-despite-low-gas-prices-with-this-3-billion-deal/,2023-07-11 13:22:00,"Warren Buffett added to his bet on liquefied natural gas late Monday, with Berkshire Hathaway ( BKRA ) agreeing to buy Dominion Energy's ( D ) share of the Maryland-based Cove Point LNG export plant in a $3.3 billion deal.",CVX,0.352223,0.284026,Somewhat-Bullish
"TotalEnergies  ( TTE ) , SOCAR Start Production in Absheron Gas Field",https://www.zacks.com/stock/news/2119142/totalenergies-tte-socar-start-production-in-absheron-gas-field,2023-07-11 12:30:00,TotalEnergies (TTE) and its partner start production of the first development phase of the Absheron gas and condensate field in the Caspian Sea.,CVX,0.308504,0.409663,Bullish
"Automotive Coolant Aftermarket Market Projected to Reach USD 1.69 Billion, at a 4.19% CAGR by 2032 - Report by Market Research Future  ( MRFR ) ",https://www.benzinga.com/pressreleases/23/07/g33182287/automotive-coolant-aftermarket-market-projected-to-reach-usd-1-69-billion-at-a-4-19-cagr-by-2032-r,2023-07-11 12:21:18,"New York, US, July 11, 2023 ( GLOBE NEWSWIRE ) -- According to a Comprehensive Report by MRFR/Market Research Future ( MRFR ) , ""Automotive Coolant Aftermarket Market Information by Technology, Product, Vehicle Type, and Region - Forecast till 2032"", The will be increasing from USD 1.16 Billion ...",CVX,0.029765,0.0,Neutral
Here's Why You Should Retain Chevron  ( CVX )  Stock for Now,https://www.zacks.com/stock/news/2119085/heres-why-you-should-retain-chevron-cvx-stock-for-now,2023-07-11 12:18:00,Chevron's (CVX) upstream operations benefit from a favorable oil price.,CVX,0.368383,0.425415,Bullish
Should You Invest in the First Trust NASDAQ Oil & Gas ETF  ( FTXN ) ?,https://www.zacks.com/stock/news/2118936/should-you-invest-in-the-first-trust-nasdaq-oil-gas-etf-ftxn,2023-07-11 10:20:07,Sector ETF report for ...,CVX,0.134968,0.071604,Neutral
"STOCKHOLDER ALERT: The M&A Class Action Firm Continues Investigating the Merger - CIR, PDCE, TALS, QUOT",https://www.benzinga.com/pressreleases/23/07/g33176990/stockholder-alert-the-m-a-class-action-firm-continues-investigating-the-merger-cir-pdce-tals-quot,2023-07-11 01:28:45,"NEW YORK, July 10, 2023 ( GLOBE NEWSWIRE ) -- Juan Monteverde, founder and managing partner of the class action firm Monteverde & Associates PC ( the ""M&A Class Action Firm"" ) , a national securities firm rated Top 50 in the 2018-2021 ISS Securities Class Action Services Report and headquartered ...",CVX,0.069294,0.15664,Somewhat-Bullish
Why Chevron Stock Slumped 12.3% in the First Half of 2023,https://www.fool.com/investing/2023/07/10/why-chevron-stock-slumped-123-in-the-first-half-of/,2023-07-10 18:14:57,Lower oil prices have weighed on the oil producer this year.,CVX,0.692465,0.309441,Somewhat-Bullish
"Chevron Stock Down 13% Over Six Months, What's Next?",https://www.forbes.com/sites/greatspeculations/2023/07/10/chevron-stock-down-13-over-six-months-whats-next/,2023-07-10 15:00:56,"CVX stock has declined from around $175 to $153 in the last six months, as oil prices have been surprisingly lower than expected this year.",CVX,0.419153,0.12572,Neutral
The Earnings and Events to Watch the Week of July 31,https://moneymorning.com/2023/07/29/the-earnings-and-events-to-watch-the-week-of-july-31/,2023-07-29 20:09:46,"postcards from the florida republic: An independent and profitable state of mind. At the pub this week, we got word of two Florida fishermen who caught a small shark. But As they pulled the first catch of the day closer to the boat, a jealous thief decided to swoop in and snatch the prize",CVX,0.110717,0.108654,Neutral
Weekly Roundup,https://aap.thestreet.com/story/16129862/1/weekly-roundup.html,2023-07-28 22:56:00,"We had a jam-packed week filled with earnings both in and out of the Action Alerts PLUS portfolio, as well as the latest Fed policy meeting that, as expected, saw the central bank lift the Fed Funds rate another quarter-percentage point.",CVX,0.006666,0.07836,Neutral
Chevron  ( CVX )  Q2 2023 Earnings Call Transcript,https://www.fool.com/earnings/call-transcripts/2023/07/28/chevron-cvx-q2-2023-earnings-call-transcript/,2023-07-28 22:00:23,"CVX earnings call for the period ending June 30, 2023.",CVX,0.040019,0.11093,Neutral
Here's Why CEO Mike Wirth's Extension Is Great News for Chevron Stock,https://www.fool.com/investing/2023/07/28/ceo-mike-wirth-extension-great-buy-chevron-stock/,2023-07-28 21:36:00,Chevron shareholders can be confident knowing Wirth will be at the helm for at least another two years.,CVX,0.738893,0.262155,Somewhat-Bullish
Chevron: The Bottom-Line Decline Was Expected,https://www.fool.com/investing/2023/07/28/chevron-the-bottom-line-decline-was-expected/,2023-07-28 18:35:22,"Chevron's falling earnings shouldn't have surprised anyone, but it's a good thing the energy giant is built to handle the industry's ups and downs.",CVX,0.47379,0.453281,Bullish
"Stock Market Rallies Amid Earnings Wave, Fed Hike: Weekly Review",https://www.investors.com/news/stock-market-rallies-amid-huge-earnings-fed-rate-hike-inflation-data-weekly-review/,2023-07-28 18:06:00,"The stock market rally advanced amid a massive wave of earnings reports, a new Fed rate hike and tame inflation data, though the Dow Jones ended a long winning streak. Microsoft ( MSFT ) guidance disappointed, hitting many related stocks.",CVX,0.028023,-0.045613,Neutral
"Energy ETFs in Focus Post Exxon, Chevron Q2 Earnings",https://www.zacks.com/stock/news/2129594/energy-etfs-in-focus-post-exxon-chevron-q2-earnings,2023-07-28 16:05:00,The two energy behemoths ??? Exxon Mobil Corp. (XOM) and Chevron Corp. (CVX) ??? reported weak profitability. Exxon Mobil reported a 56% slump in second-quarter profit while Chevron???s profit fell 48%.,CVX,0.456884,0.374546,Bullish
"Exxon Mobil, Chevron's stocks dip as leaner times arrive",https://www.marketwatch.com/story/exxon-mobils-stock-dips-premarket-after-profit-miss-83e2b929,2023-07-28 15:45:00,Exxon Mobil Corp. and Chevron Corp. reported quarterly earnings that showed that sobering times have arrived.,CVX,0.344473,0.083208,Neutral
"Dow Jones Rally Sparked By Surging Intel Stock; Nasdaq 100 Leaders Include Tesla, Dexcom, KLAC",https://www.investors.com/market-trend/stock-market-today/dow-jones-rally-sparked-by-surging-intel-stock-nasdaq-100-leaders-tesla-tsla-dexcom-dxcm-klacs/,2023-07-28 14:50:00,"Dow Jones Rally Sparked By Surging Intel Stock. Nasdaq 100 Leaders Include Tesla, Dexcom, KLAC Investor's Business Daily ...",CVX,0.104683,-0.225203,Somewhat-Bearish
"Top Stories Friday, July 28: iPhone US Shipments Take A Hit, Does Social Media Algorithm Impact Political Beliefs? Research Reveals Answer, Disney Joins Netflix To Crack Down Password Sharing In India - Apple  ( NASDAQ:AAPL ) , American Airlines Group  ( NASDAQ:AAL ) ",https://www.benzinga.com/news/23/07/33443528/iphone-us-shipments-take-a-hit-does-social-media-algorithm-impact-political-beliefs-research-reveals,2023-07-28 14:24:31,DoorDash Inc DASH has leveraged an artificial intelligence-based chatbot to speed up ordering and help customers find food options. The Uber Technologies Inc UBER rival is working on a system called DashAI that it's testing in a limited capacity.,CVX,0.078354,-0.043409,Neutral
