title,url,time_published,summary,ticker,relevance_score,ticker_sentiment_score,ticker_sentiment_label
AiDash raises $50 million to safeguard infrastructure from climate change-related threats,https://www.financialexpress.com/business/digital-transformation-aidash-raises-50-million-to-safeguard-infrastructure-from-climate-change-related-threats-3374284/,2024-01-24 14:06:16,"According to an official release, AiDash, an enterprise SaaS company, announced that it received $50 million in funding, bringing the total raised to date to $83 million. The Series C round is expected to be oversubscribed, indicative of growing investor interest in proven, scalable, and ...",EIX,0.159569,0.068369,Neutral
"Startup AiDash raises $50 mn in funding for tech that uses AI, satellites",https://www.business-standard.com/companies/start-ups/startup-aidash-raises-50-mn-in-funding-for-tech-that-uses-ai-satellites-124012400506_1.html,2024-01-24 10:16:55,"AiDash, a startup which uses artificial intelligence ( AI ) and satellites to spot weather risks on power lines, said on Wednesday it has raised $50 million in Series C funding led by Lightrock.",EIX,0.072435,0.031163,Neutral
Why Edison International  ( EIX )  is a Top Growth Stock for the Long-Term,https://www.zacks.com/stock/news/2214210/why-edison-international-eix-is-a-top-growth-stock-for-the-long-term,2024-01-23 14:45:07,"Wondering how to pick strong, market-beating stocks for your investment portfolio? Look no further than the Zacks Style Scores.",EIX,0.791081,0.494713,Bullish
Peering Into Edison Intl's Recent Short Interest - Edison Intl  ( NYSE:EIX ) ,https://www.benzinga.com/short-sellers/24/01/36511005/peering-into-edison-intls-recent-short-interest,2024-01-05 15:15:28,"Edison Intl's EIX short percent of float has fallen 39.33% since its last report. The company recently reported that it has 4.31 million shares sold short, which is 1.62% of all regular shares that are available for trading.",EIX,0.426824,0.244394,Somewhat-Bullish
Edison International  ( EIX )  Announces Dividend Hike of 5.8%,https://www.zacks.com/stock/news/2200375/edison-international-eix-announces-dividend-hike-of-58,2023-12-20 11:39:00,Edison (EIX) continues to reward shareholders through dividend hikes. It has been increasing dividends for 20 consecutive years.,EIX,0.495015,0.530811,Bullish
How Is The Market Feeling About Edison Intl? - Edison Intl  ( NYSE:EIX ) ,https://www.benzinga.com/short-sellers/23/12/36304534/how-is-the-market-feeling-about-edison-intl,2023-12-19 14:15:17,"Edison Intl's EIX short percent of float has risen 27.14% since its last report. The company recently reported that it has 7.08 million shares sold short, which is 2.67% of all regular shares that are available for trading.",EIX,0.426824,0.338191,Somewhat-Bullish
AES' Board Rewards Shareholders With 4% Dividend Hike,https://www.zacks.com/stock/news/2196640/aes-board-rewards-shareholders-with-4-dividend-hike,2023-12-12 13:38:00,AES continues to reward shareholders through dividend hikes. It has been paying dividends for 11 consecutive years.,EIX,0.5633,0.43395,Bullish
3 Utility Mutual Funds to Counter Continued Market Volatility,https://www.zacks.com/stock/news/2190617/3-utility-mutual-funds-to-counter-continued-market-volatility,2023-11-29 10:38:00,"Invest in utility mutual funds like FIUIX, FRUAX and PRUAX for steady returns and reduction of risk in a volatile market.",EIX,0.043264,0.085079,Neutral
BP Seeking Partners For Offshore Wind Projects In Japan: Report - BP  ( NYSE:BP ) ,https://www.benzinga.com/markets/equities/23/11/35868409/bp-seeking-partners-for-offshore-wind-projects-in-japan-report,2023-11-20 11:00:57,"BP PLC BP is reportedly seeking partners for offshore wind projects in Japan and may invest in hydrogen technology companies. The company aims to address inflation and equipment bottlenecks that have affected the renewables sector, as per Reuters.",EIX,0.246582,-0.062482,Neutral
"BP, Shell, Edison Request US, EU To Help In Dispute With Venture Global LNG Over Undelivered Cargoes: Report - Edison Intl  ( NYSE:EIX ) , Shell  ( NYSE:SHEL ) , BP  ( NYSE:BP ) ",https://www.benzinga.com/markets/equities/23/11/35742808/bp-shell-edison-request-us-eu-to-help-in-dispute-with-venture-global-lng-over-undelivered-cargoe,2023-11-13 10:52:50,"Oil companies BP PLC BP, Shell PLC SHEL, and Edison International EIX reportedly asked a U.S.-EU energy group to intervene in their ongoing dispute with liquefied natural gas ( LNG ) exporter Venture Global LNG over its failure to supply contracted cargoes.",EIX,0.195814,-0.05048,Neutral
"Fossil fuel interests have large, yet often murky, presence at climate talks, AP analysis finds",https://apnews.com/article/fossil-fuels-influenceconference-of-partieslobbyingclimate-summitclimate-negotiations-d5e677b1c4e515f8944393907ac99457,2023-11-08 14:31:00,"The badges said they were there to participate in negotiations to curb . They stated affiliations like the government of Brazil, Indigenous organizations of the Amazon, the Climate Registry. But in reality, the livelihoods of these participants were more aligned with what's keeping the problem ...",EIX,0.022305,0.037645,Neutral
"Edison International  ( EIX )  Q3 Earnings Miss, Revenues Fall Y/Y",https://www.zacks.com/stock/news/2177416/edison-international-eix-q3-earnings-miss-revenues-fall-yy,2023-11-02 13:49:00,"Edison International's (EIX) third-quarter revenues of $4,702 million miss the Zacks Consensus Estimate by 12.8%. The top line also declines 10.1% from the year-ago quarter's level.",EIX,0.518022,0.036117,Neutral
"Utilities Due to Report Q3 Earnings on Nov 1: NI, ETR & More",https://www.zacks.com/stock/news/2175616/utilities-due-to-report-q3-earnings-on-nov-1-ni-etr-more,2023-10-31 14:37:00,"Let's focus on utilities like NI, ETR, AWK, DTE and EIX, scheduled to release their third-quarter earnings on Nov 1.",EIX,0.281307,0.102324,Neutral
Edison International  ( EIX )  to Post Q3 Earnings: What's in Store?,https://www.zacks.com/stock/news/2173566/edison-international-eix-to-post-q3-earnings-whats-in-store,2023-10-27 11:35:00,Edison International's (EIX) Q3 results are likely to reflect mixed weather pattern impact along with higher interest rate expenses.,EIX,0.574235,0.429641,Bullish
"PG&E Corp.  ( PCG )  Misses Q3 Earnings, Reaffirms 2023 View",https://www.zacks.com/stock/news/2172902/pge-corp-pcg-misses-q3-earnings-reaffirms-2023-view,2023-10-26 14:21:00,PG&E Corp.'s (PCG) third-quarter adjusted EPS lags the Zacks Consensus Estimate by 14.3%.,EIX,0.157483,0.246088,Somewhat-Bullish
Earnings Preview: OGE Energy  ( OGE )  Q3 Earnings Expected to Decline,https://www.zacks.com/stock/news/2172807/earnings-preview-oge-energy-oge-q3-earnings-expected-to-decline,2023-10-26 14:02:22,OGE Energy (OGE) doesn't possess the right combination of the two key ingredients for a likely earnings beat in its upcoming report. Get prepared with the key expectations.,EIX,0.172404,-0.00141,Neutral
Edison International  ( EIX )  Q3 Earnings Preview: What's in the Cards?,https://www.zacks.com/stock/news/2171687/edison-international-eix-q3-earnings-preview-whats-in-the-cards,2023-10-25 14:01:53,Edison International (EIX) doesn't possess the right combination of the two key ingredients for a likely earnings beat in its upcoming report. Get prepared with the key expectations.,EIX,0.256089,0.029282,Neutral
"Walgreens To Rally Around 42%? Here Are 10 Top Analyst Forecasts For Monday - Alcoa  ( NYSE:AA ) , Salesforce  ( NYSE:CRM ) ",https://www.benzinga.com/news/23/10/35370327/walgreens-to-rally-around-42-here-are-10-top-analyst-forecasts-for-monday,2023-10-23 11:47:25,"Top Wall Street analysts changed their outlook on these top names. For a complete view of all analyst rating changes, including upgrades and downgrades, please see our analyst ratings page B of A Securities cut Alcoa Corporation AA price target from $35 to $25.",EIX,0.249531,0.268458,Somewhat-Bullish
Peering Into Edison Intl's Recent Short Interest - Edison Intl  ( NYSE:EIX ) ,https://www.benzinga.com/short-sellers/23/10/35274952/peering-into-edison-intls-recent-short-interest,2023-10-16 19:30:16,"Edison Intl's EIX short percent of float has fallen 8.99% since its last report. The company recently reported that it has 6.71 million shares sold short, which is 2.53% of all regular shares that are available for trading.",EIX,0.426824,0.25252,Somewhat-Bullish
3 Top Vanguard Mutual Funds to Buy Amid Market Uncertainty,https://www.zacks.com/stock/news/2161370/3-top-vanguard-mutual-funds-to-buy-amid-market-uncertainty,2023-10-06 11:35:00,"Invest in Vanguard mutual funds like VASVX, VWNDX and VSTCX to hedge your portfolio amid rising market volatility.",EIX,0.057767,0.052961,Neutral
EONGY vs. EIX: Which Stock Should Value Investors Buy Now?,https://www.zacks.com/stock/news/2160170/eongy-vs-eix-which-stock-should-value-investors-buy-now,2023-10-04 15:40:11,EONGY vs. EIX: Which Stock Is the Better Value Option?,EIX,0.678673,0.583366,Bullish
4 Mutual Funds to Buy Amid Ongoing Market Volatility,https://www.zacks.com/stock/news/2156862/4-mutual-funds-to-buy-amid-ongoing-market-volatility,2023-09-28 09:55:00,"During times of market volatility, selecting stable mutual funds like FSUTX, FRUAX, JNGLX and PRHSX is a prudent decision. These funds offer a combination of stability and growth potential.",EIX,0.052112,0.049686,Neutral
America Going Electric: Dollars And Sense,https://www.forbes.com/sites/greatspeculations/2023/09/26/america-going-electric-dollars-and-sense/,2023-09-26 16:02:07,"We put together a list of beneficiaries of the $370 billion investment needed for California's power grid to meet the state's ""net zero"" goal for CO2 emissions by 2045.",EIX,0.221819,0.135567,Neutral
"Climate Experts Weigh In on Obstacles, Priorities and Hope",https://www.nytimes.com/2023/09/20/climate/experts-qna-obstacles-priorities-hope.html,2023-09-20 18:03:44,This article is part of our special section on the Climate Forward event that will include policy and climate leaders from around the world.,EIX,0.015284,0.0,Neutral
 ( EIX )  - Analyzing Edison Intl's Short Interest - Edison Intl  ( NYSE:EIX ) ,https://www.benzinga.com/short-sellers/23/09/34762506/eix-analyzing-edison-intls-short-interest,2023-09-20 13:30:25,"Edison Intl's EIX short percent of float has risen 4.12% since its last report. The company recently reported that it has 7.37 million shares sold short, which is 2.78% of all regular shares that are available for trading. Based on its trading volume, it would take traders 5.52 days to cover ...",EIX,0.426824,0.338191,Somewhat-Bullish
3 Utility Mutual Funds to Counter Volatility in the Market,https://www.zacks.com/stock/news/2152287/3-utility-mutual-funds-to-counter-volatility-in-the-market,2023-09-19 09:58:00,"Invest in utility mutual funds like FIUIX, FRUAX and FKUTX for steady returns and reduction of risk in a volatile market.",EIX,0.09239,0.090621,Neutral
Is Invesco S&P 500 Equal Weight Utilities ETF  ( RSPU )  a Strong ETF Right Now?,https://www.zacks.com/stock/news/2148720/is-invesco-sp-500-equal-weight-utilities-etf-rspu-a-strong-etf-right-now,2023-09-14 10:20:05,Smart Beta ETF report for ...,EIX,0.121037,0.061185,Neutral
3 Large-Cap Value Mutual Funds to Counter New Inflation Worries,https://www.zacks.com/stock/news/2146516/3-large-cap-value-mutual-funds-to-counter-new-inflation-worries,2023-09-08 12:24:00,"Invest in large-cap value funds like DRGVX, ACSDX and VWNDX to preserve your capital and earn returns amid fresh inflation worries.",EIX,0.052112,0.04869,Neutral
Edison International  ( EIX )  to Gain From Long-term Investments,https://www.zacks.com/stock/news/2145859/edison-international-eix-to-gain-from-long-term-investments,2023-09-07 11:40:00,Edison International's (EIX) strategic investment plans to further improve infrastructure and favorable regulatory outcomes are likely to drive its performance.,EIX,0.367412,0.197114,Somewhat-Bullish
Looking Into Edison Intl's Recent Short Interest - Edison Intl  ( NYSE:EIX ) ,https://www.benzinga.com/short-sellers/23/09/34211800/looking-into-edison-intls-recent-short-interest,2023-09-04 15:45:20,"Edison Intl's EIX short percent of float has risen 7.23% since its last report. The company recently reported that it has 7.08 million shares sold short, which is 2.67% of all regular shares that are available for trading. Based on its trading volume, it would take traders 5.52 days to cover ...",EIX,0.426824,0.338191,Somewhat-Bullish
Should You Invest in the Invesco S&P 500 Equal Weight Utilities ETF  ( RSPU ) ?,https://www.zacks.com/stock/news/2142752/should-you-invest-in-the-invesco-sp-500-equal-weight-utilities-etf-rspu,2023-08-31 10:20:05,Sector ETF report for ...,EIX,0.132368,0.070899,Neutral
'Not just money and math': Young people are willing to sacrifice returns for ESG,https://www.cnbc.com/2023/08/27/not-just-math-and-numbers-young-people-are-willing-to-sacrifice-returns-for-esg.html,2023-08-27 13:33:43,New data shows young people are willing to give up returns to invest in ways that supports causes they care about.,EIX,0.03468,0.24181,Somewhat-Bullish
Edison International Getting Closer To Key Technical Measure,https://www.investors.com/ibd-data-stories/edison-international-getting-closer-to-key-technical-measure/,2023-08-25 07:00:00,"In a welcome move, Edison International ( EIX ) saw its Relative Strength Rating improve from 70 to 73 on Friday. X When looking for the best stocks to buy and watch, keep a close on eye on relative price strength.",EIX,0.888031,0.635195,Bullish
"Analyst Says It As A 'Buy' In The Electrification Era, Upgrades Edison's Stock - Edison Intl  ( NYSE:EIX ) ",https://www.benzinga.com/analyst-ratings/analyst-color/23/08/33989107/analyst-says-it-as-a-buy-in-the-electrification-era-upgrades-edisons-stock,2023-08-22 19:11:10,"Mizuho Securities analyst Anthony Crowdell upgraded Edison International EIX to Buy from Neutral at an increased price target of $75 from $73. The analyst is bullish on the company, given its ability to deliver the EPS CAGR target of 5%-7% and management's extension of the EPS growth rate ...",EIX,0.815635,0.270169,Somewhat-Bullish
3 Best Fidelity Mutual Funds to Buy for Strong Returns,https://www.zacks.com/stock/news/2137259/3-best-fidelity-mutual-funds-to-buy-for-strong-returns,2023-08-17 06:48:00,"Invest in Fidelity mutual funds such as FANAX, FIDSX, and FDVLX for the assurance of substantial returns.",EIX,0.075161,0.177075,Somewhat-Bullish
Utility lobby group taps Trump energy secretary as new president,https://www.reuters.com/business/energy/utility-lobby-group-taps-trump-energy-secretary-new-president-2023-08-16/,2023-08-16 21:20:00,"U.S. Secretary of Energy Dan Brouillette and Portugal's Infrastructure Minister Pedro Nuno Santos ( not pictured ) visit the Terminal XXI at the port of Sines, Portugal February 12, 2020. REUTERS/Rafael Marchante/file photo Acquire Licensing Rights",EIX,0.112008,0.230407,Somewhat-Bullish
Peering Into Edison Intl's Recent Short Interest - Edison Intl  ( NYSE:EIX ) ,https://www.benzinga.com/short-sellers/23/08/33880443/peering-into-edison-intls-recent-short-interest,2023-08-16 18:00:33,"Edison Intl's EIX short percent of float has fallen 4.6% since its last report. The company recently reported that it has 6.61 million shares sold short, which is 2.49% of all regular shares that are available for trading. Based on its trading volume, it would take traders 4.26 days to cover ...",EIX,0.426824,0.25252,Somewhat-Bullish
EEI Board Names Dan Brouillette President and Chief Executive Officer Elect - PR Newswire,https://www.prnewswire.com/news-releases/eei-board-names-dan-brouillette-president-and-chief-executive-officer-elect-301902694.html,2023-08-16 17:15:00,EEI Board Names Dan Brouillette President and Chief Executive Officer Elect PR ...,EIX,0.043818,0.225539,Somewhat-Bullish
Venture Global LNG's customer fight shifts contract discussions,https://www.reuters.com/business/energy/venture-global-lngs-customer-fight-shifts-contract-discussions-2023-08-09/,2023-08-09 17:17:56,"Executive Vice President and Chief Commercial Officer of Cheniere Energy Anatol Feygin poses for a photo near the Cheniere Sabine Pass LNG export unit in Cameron Parish, Louisiana, U.S., April 14, 2022. REUTERS/Marcy de Luna/File Photo HOUSTON, Aug 9 ( Reuters ) - The standoff between U.S.",EIX,0.085936,-0.080089,Neutral
Venture Global LNG blasts complaints over lack of LNG cargoes,https://www.reuters.com/business/energy/venture-global-lng-blasts-complaints-over-lack-lng-cargoes-2023-08-07/,2023-08-07 23:26:00,"HOUSTON, Aug 7 ( Reuters ) - Venture Global LNG on Monday lashed out at some customers signed up to take liquefied natural gas ( LNG ) cargoes from a Louisiana export facility, claiming they ""have chosen to misrepresent confidential long-term contracts.""",EIX,0.113062,-0.006815,Neutral
PG&E  ( PCG )  Gets a Buy from RBC Capital,https://markets.businessinsider.com/news/stocks/pg-e-pcg-gets-a-buy-from-rbc-capital-1032509183,2023-08-03 01:46:57,PG&E (PCG) Gets a Buy from RBC Capital - Markets Insider ...,EIX,0.185306,0.226181,Somewhat-Bullish
4 Vanguard Mutual Funds to Invest in for 2023 and Beyond,https://www.zacks.com/stock/news/2131101/4-vanguard-mutual-funds-to-invest-in-for-2023-and-beyond,2023-08-02 12:47:00,"Invest in Vanguard mutual funds like VEXPX, VASVX, VSTCX and VWNDX that have given impressive returns so far this year and are expected to do the same in 2023 and beyond.",EIX,0.050044,0.050511,Neutral
FirstEnergy's  ( FE )  Q2 Earnings and Revenues Beat Estimates,https://www.zacks.com/stock/news/2130997/firstenergys-fe-q2-earnings-and-revenues-beat-estimates,2023-08-02 11:50:00,First Energy's (FE) second-quarter earnings benefit from utility investment programs and lower operating expenses. FE is now focused on sustainable growth and improving the reliability of operations.,EIX,0.153961,0.104328,Neutral
"Eversource  ( ES )  Q2 Earnings Beat Estimates, Revenues Up Y/Y",https://www.zacks.com/stock/news/2130465/eversource-es-q2-earnings-beat-estimates-revenues-up-yy,2023-08-01 13:12:00,Eversource Energy's (ES) Q2 earnings benefit from the higher level of investments and favorable regulatory decisions.,EIX,0.156461,0.105379,Neutral
"Edison International  ( EIX )  Q2 Earnings Top, Revenues Fall Y/Y",https://www.zacks.com/stock/news/2129446/edison-international-eix-q2-earnings-top-revenues-fall-yy,2023-07-28 12:49:00,"Edison International's (EIX) Q2 revenues total $3,964 million, missing the Zacks Consensus Estimate by 7.2%. Moreover, the top line declines 1.1% year over year.",EIX,0.556946,0.115545,Neutral
Edison International  ( EIX )  Q2 Earnings Surpass Estimates,https://www.zacks.com/stock/news/2129074/edison-international-eix-q2-earnings-surpass-estimates,2023-07-27 21:55:15,"Edison International (EIX) delivered earnings and revenue surprises of 8.60% and 7.17%, respectively, for the quarter ended June 2023. Do the numbers hold clues to what lies ahead for the stock?",EIX,0.396052,0.147109,Neutral
Looking Into Edison Intl's Recent Short Interest - Edison Intl  ( NYSE:EIX ) ,https://www.benzinga.com/short-sellers/23/07/33399837/looking-into-edison-intls-recent-short-interest,2023-07-26 18:00:29,"Edison Intl's EIX short percent of float has fallen 3.33% since its last report. The company recently reported that it has 6.92 million shares sold short, which is 2.61% of all regular shares that are available for trading.",EIX,0.426824,0.25252,Somewhat-Bullish
Will Edison International  ( EIX )  Beat Estimates Again in Its Next Earnings Report?,https://www.zacks.com/stock/news/2128098/will-edison-international-eix-beat-estimates-again-in-its-next-earnings-report,2023-07-26 16:10:12,Edison International (EIX) has an impressive earnings surprise history and currently possesses the right combination of the two key ingredients for a likely beat in its next quarterly report.,EIX,0.400052,0.4081,Bullish
Why Earnings Season Could Be Great for Edison  ( EIX ) ,https://www.zacks.com/stock/news/2127636/why-earnings-season-could-be-great-for-edison-eix,2023-07-26 12:42:00,Edison (EIX) is seeing favorable earnings estimate revision activity and has a positive Zacks Earnings ESP heading into earnings season.,EIX,0.902573,0.600021,Bullish
An Energy Correspondent Hunts for Alternatives,https://www.nytimes.com/2023/07/26/reader-center/energy-sources-alternatives-power-electric.html,2023-07-26 07:00:11,Ivan Penn reports on the new sources we rely on to power our world.,EIX,0.051003,0.0,Neutral
An Energy Correspondent Hunts for Alternatives,https://www.nytimes.com/2023/07/26/pageoneplus/energy-sources-alternatives-power-electric.html,2023-07-26 07:00:10,A Times Energy Reporter Hunts for Power Sources The New York Times ...,EIX,0.051003,0.0,Neutral
What's in the Offing for CMS Energy  ( CMS )  in Q2 Earnings?,https://www.zacks.com/stock/news/2126055/whats-in-the-offing-for-cms-energy-cms-in-q2-earnings,2023-07-24 12:36:00,CMS Energy's (CMS) Q2 results are likely to reflect mixed weather pattern impacts amid wildfire-related higher O&M expenses.,EIX,0.208764,0.08367,Neutral
What's in the Cards for DTE Energy  ( DTE )  in Q2 Earnings?,https://www.zacks.com/stock/news/2126038/whats-in-the-cards-for-dte-energy-dte-in-q2-earnings,2023-07-24 12:26:00,DTE Energy's (DTE) Q2 results are likely to reflect colder-than-normal temperature and higher rate-based cost impact amid higher earnings from its renewable plants.,EIX,0.22421,0.1118,Neutral
PG&E  ( PCG )  to Report Q2 Earnings: Here's What to Expect,https://www.zacks.com/stock/news/2125468/pge-pcg-to-report-q2-earnings-heres-what-to-expect,2023-07-21 14:11:00,PG&E's (PCG) Q2 results are likely to reflect mixed weather pattern impacts along with wildfire self-insurance and incremental vegetation management savings.,EIX,0.209365,0.085536,Neutral
Edison International  ( EIX )  to Post Q2 Earnings: What's in Store?,https://www.zacks.com/stock/news/2125462/edison-international-eix-to-post-q2-earnings-whats-in-store,2023-07-21 14:07:00,Edison International's (EIX) Q2 results are likely to reflect mixed weather pattern impacts. Higher net interest expenses might have hurt its bottom-line performance.,EIX,0.616228,0.452561,Bullish
CenterPoint Energy  ( CNP )  to Post Q2 Earnings: What's in Store?,https://www.zacks.com/stock/news/2125417/centerpoint-energy-cnp-to-post-q2-earnings-whats-in-store,2023-07-21 13:15:00,CenterPoint Energy's (CNP) Q2 results are likely to reflect favorable rate hike and tax benefits amid impacts of wildfire.,EIX,0.191675,0.078351,Neutral
IBD Rating Upgrades: Edison International Shows Improved Relative Price Strength,https://www.investors.com/ibd-data-stories/ibd-rating-upgrades-edison-international-shows-improved-relative-price-strength/,2023-07-21 07:00:00,"Edison International ( EIX ) saw a welcome improvement to its Relative Strength ( RS ) Rating on Friday, with an upgrade from 62 to 73. X As you try to find the best stocks to buy and watch, be sure to pay attention to relative price strength.",EIX,0.573213,0.536704,Bullish
"Florida Economy, Customer Base to Aid NextEra  ( NEE )  Q2 Earnings",https://www.zacks.com/stock/news/2124787/florida-economy-customer-base-to-aid-nextera-nee-q2-earnings,2023-07-20 15:07:00,NextEra Energy's (NEE) second-quarter earnings are likely to have benefited from rising demand from an expanding customer base and a flourishing Florida economy.,EIX,0.31583,0.182018,Somewhat-Bullish
Edison International  ( EIX )  Expected to Beat Earnings Estimates: What to Know Ahead of Q2 Release,https://www.zacks.com/stock/news/2124614/edison-international-eix-expected-to-beat-earnings-estimates-what-to-know-ahead-of-q2-release,2023-07-20 14:02:28,Edison International (EIX) possesses the right combination of the two key ingredients for a likely earnings beat in its upcoming report. Get prepared with the key expectations.,EIX,0.259267,0.167631,Somewhat-Bullish
A New Job for Electric Vehicles: Powering Homes During Blackouts,https://www.nytimes.com/2023/07/16/business/energy-environment/electric-vehicles-backup-power.html,2023-07-16 09:00:31,"In early March, strong winds brought down trees and power lines in the Nashville area, leaving thousands of homes without power. But about 20 miles outside the city an electric pickup truck fed energy to John and Rachelle Reigard's home, keeping their lights on.",EIX,0.032736,0.0,Neutral
"Shell & BP File Lawsuit Against Venture Global, Claim Billions Of Dollars Sales Loss: Report - Shell  ( NYSE:SHEL ) , BP  ( NYSE:BP ) ",https://www.benzinga.com/markets/equities/23/07/33195515/shell-bp-file-lawsuit-against-venture-global-claim-billions-of-dollars-sales-loss-report,2023-07-12 11:52:58,"Shell PLC SHEL and BP PLC BP have reportedly filed arbitration claims separately against the U.S. exporter, Venture Global LNG, for failure to supply contracted cargoes.",EIX,0.382925,0.232741,Somewhat-Bullish
 ( EIX )  - Analyzing Edison Intl's Short Interest - Edison Intl  ( NYSE:EIX ) ,https://www.benzinga.com/short-sellers/23/07/33148197/eix-analyzing-edison-intls-short-interest,2023-07-07 14:16:36,"Edison Intl's EIX short percent of float has fallen 5.21% since its last report. The company recently reported that it has 7.22 million shares sold short, which is 2.73% of all regular shares that are available for trading.",EIX,0.426824,0.25252,Somewhat-Bullish
3 Franklin Templeton Mutual Funds to Buy for Long-Term Gains,https://www.zacks.com/stock/news/2111667/3-franklin-templeton-mutual-funds-to-buy-for-long-term-gains,2023-06-22 11:38:00,"Amid topsy-turvy market conditions, it's prudent for investors to place their bets on low-cost Franklin Templeton mutual funds like FVRMX, FRIAX and FRUAX.",EIX,0.049424,0.146633,Neutral
