title,url,time_published,summary,ticker,relevance_score,ticker_sentiment_score,ticker_sentiment_label
Dominion Energy  ( D )  Beats Q4 Earnings and Revenue Estimates,https://www.zacks.com/stock/news/2051590/dominion-energy-d-beats-q4-earnings-and-revenue-estimates,2023-02-08 14:15:07,"Dominion Energy (D) delivered earnings and revenue surprises of 2.91% and 17.09%, respectively, for the quarter ended December 2022. Do the numbers hold clues to what lies ahead for the stock?",EIX,0.2035,0.0,Neutral
National Fuel Gas  ( NFG )  Q1 Earnings & Revenues Top Estimates,https://www.zacks.com/stock/news/2049361/national-fuel-gas-nfg-q1-earnings-revenues-top-estimates,2023-02-03 11:54:00,"National Fuel Gas' (NFG) fiscal first-quarter 2023 earnings are better than expected. Due to lower natural gas price expectations, the company lowered its fiscal 2023 earnings guidance.",EIX,0.21686,0.22252,Somewhat-Bullish
AMD To Rally Over 26%? Here Are 10 Other Analyst Forecasts For Wednesday,https://www.benzinga.com/news/23/02/30665430/amd-to-rally-over-26-here-are-10-other-analyst-forecasts-for-wednesday,2023-02-01 13:10:47,"Credit Suisse boosted the price target for Mondelez International, Inc. MDLZ from $70 to $76. Credit Suisse analyst Robert Moskow maintained an Outperform rating. Mondelez shares rose 1.8% to $66.61 in pre-market trading. Oppenheimer raised the price target for Amdocs Limited DOX from $94 to $99.",EIX,0.287762,0.013408,Neutral
"Xcel Energy  ( XEL )  Q4 Earnings on Par With Estimates, Sales Beat",https://www.zacks.com/stock/news/2044865/xcel-energy-xel-q4-earnings-on-par-with-estimates-sales-beat,2023-01-26 15:15:00,Xcel Energy's (XEL) fourth-quarter earnings is on par with estimates and the company plans to invest $29.5 billion through 2027 to further strengthen its operations.,EIX,0.239698,0.238574,Somewhat-Bullish
NextEra Energy  ( NEE )  Q4 Earnings & Revenues Beat Estimates,https://www.zacks.com/stock/news/2044160/nextera-energy-nee-q4-earnings-revenues-beat-estimates,2023-01-25 15:26:00,NextEra Energy's (NEE) fourth-quarter earnings are better than expected and the company aims to add more renewable units to its generation portfolio.,EIX,0.162802,0.179876,Somewhat-Bullish
A Bullish Sign Appears On Edison's Chart,https://www.benzinga.com/markets/23/01/30568545/a-bullish-sign-appears-on-edisons-chart,2023-01-25 14:48:08,"If history is any guide, there may be good fortune ahead for shares of Edison EIX. A so-called ""golden cross"" has formed on its chart and, not surprisingly, this could be bullish for the stock. What To Know: Many traders use moving average crossover systems to make their decisions.",EIX,0.567144,0.561872,Bullish
NextEra Energy  ( NEE )  Tops Q4 Earnings and Revenue Estimates,https://www.zacks.com/stock/news/2044014/nextera-energy-nee-tops-q4-earnings-and-revenue-estimates,2023-01-25 14:05:05,"NextEra (NEE) delivered earnings and revenue surprises of 2% and 7.33%, respectively, for the quarter ended December 2022. Do the numbers hold clues to what lies ahead for the stock?",EIX,0.2035,0.0,Neutral
EIX or HE: Which Is the Better Value Stock Right Now?,https://www.zacks.com/stock/news/2039736/eix-or-he-which-is-the-better-value-stock-right-now,2023-01-16 16:40:10,EIX vs. HE: Which Stock Is the Better Value Option?,EIX,0.796338,0.618729,Bullish
PPL's updated business plan drives enhanced value for all stakeholders and delivers top-tier earnings and dividend growth,https://www.prnewswire.com/news-releases/ppls-updated-business-plan-drives-enhanced-value-for-all-stakeholders-and-delivers-top-tier-earnings-and-dividend-growth-301719034.html,2023-01-11 13:00:00,PPL's updated business plan drives enhanced value for all ... PR ...,EIX,0.030878,0.016093,Neutral
Reasons to Add Primo Water  ( PRMW )  to Your Portfolio Now,https://www.zacks.com/stock/news/2035787/reasons-to-add-primo-water-prmw-to-your-portfolio-now,2023-01-05 16:43:00,"Primo Water's (PRMW) rising earnings estimates, customer addition and systematic investments make it a solid investment opportunity for investors.",EIX,0.463792,0.208035,Somewhat-Bullish
California's Carbon Neutrality Is At Risk If Net Metering Gamble Fails To Pay Off,https://www.forbes.com/sites/kensilverstein/2023/01/05/californias-carbon-neutrality-is-at-risk-if-net-metering-gamble-fails-to-pay-off/,2023-01-05 13:45:00,"The California Public Utility Commission has ordered a new net-metering law, which could jeopardize solar deployment and the state's net-zero goals.",EIX,0.044718,0.076507,Neutral
