title,url,time_published,summary,ticker,relevance_score,ticker_sentiment_score,ticker_sentiment_label
"Here is What to Know Beyond Why Etsy, Inc.  ( ETSY )  is a Trending Stock",https://www.zacks.com/stock/news/2126004/here-is-what-to-know-beyond-why-etsy-inc-etsy-is-a-trending-stock,2023-07-24 13:00:06,"Zacks.com users have recently been watching Etsy (ETSY) quite a bit. Thus, it is worth knowing the facts that could determine the stock's prospects.",ETSY,0.527831,0.15718,Somewhat-Bullish
"After Etsy's Latest Move, Is the Stock a Buy -- or a Sell?",https://www.fool.com/investing/2023/07/24/after-etsys-latest-move-is-the-stock-a-buy-or-sell/,2023-07-24 12:49:52,Etsy shares have declined so far this year.,ETSY,0.869158,0.317547,Somewhat-Bullish
Better Buy: Etsy or Shopify Stock?,https://www.fool.com/investing/2023/07/24/better-buy-etsy-or-shopify-stock/,2023-07-24 11:59:00,Marketplace platform stocks can generate excellent returns.,ETSY,0.454945,0.38893,Bullish
2 Dirt-Cheap Stocks That Could Skyrocket When the Market Rallies,https://www.fool.com/investing/2023/07/24/2-dirt-cheap-stocks-that-could-skyrocket-when-the/,2023-07-24 10:20:00,Just because some stocks have gotten expensive doesn't mean they all are.,ETSY,0.678981,0.127811,Neutral
"Host Gift Guide: Fun Ferments, Cozy Quilts and More",https://www.nytimes.com/2023/07/24/t-magazine/host-gift-guide-summer.html,2023-07-24 09:00:12,"When the French interior designer Camille Vergnes throws a dinner party in Paris, she opts for unfussy white table linens and white plates.",ETSY,0.022515,0.077834,Neutral
"How to find the easiest side hustle for you, says 27-year-old who's tried dozens and brought in nearly $700K last year",https://www.cnbc.com/2023/07/22/side-hustle-expert-cody-berman-on-how-to-find-easiest-ones-for-you.html,2023-07-22 14:00:01,"Cody Berman has tried a slew of side hustles, from food delivery to podcast editing. When it comes to the easiest ones, ""look at the skills"" you have, he says.",ETSY,0.069697,0.0,Neutral
2 Top Growth Stocks to Buy Before the Next Bull Market,https://www.fool.com/investing/2023/07/22/2-top-growth-stocks-buy-before-next-bull-market/,2023-07-22 11:40:00,"Many stocks are on the up and up, but investors need to be discerning with their capital.",ETSY,0.237358,0.053397,Neutral
Start an Online Business on the Cheap,https://www.kiplinger.com/personal-finance/start-an-online-business-on-the-cheap,2023-07-21 22:29:06,"Starting an online business can be attractive to budding entrepreneurs, especially as it means lower start-up costs and a broader reach compared to a traditional brick-and-mortar retail operation.",ETSY,0.037098,0.257277,Somewhat-Bullish
How ButcherBox Is Killing It With Free Bacon For Life While Rivals Like Blue Apron Unraveled,https://www.forbes.com/sites/chloesorvino/2023/07/21/how-butcherbox-is-killing-it-with-free-bacon-for-life-while-rivals-like-blue-apron-unraveled/,2023-07-21 10:30:00,"The online meat-seller reached $550 million in sales by outsourcing production, not owning it. Now growth is leveling off as customers get more expensive to enlist.",ETSY,0.021937,-0.180448,Somewhat-Bearish
Planning a 2024 Wedding? 5 Money Moves You'll Want to Make Ahead of Time,https://www.fool.com/retirement/2023/07/21/planning-a-2024-wedding-5-money-moves-youll-want-t/,2023-07-21 09:56:00,Here are some important ways to lay the groundwork for a financially successful union.,ETSY,0.04872,0.081156,Neutral
Moms First Convenes Business Leaders with Biden-Harris Administration Officials to Announce Bold Commitments to Expand Child Care,https://www.prnewswire.com/news-releases/moms-first-convenes-business-leaders-with-biden-harris-administration-officials-to-announce-bold-commitments-to-expand-child-care-301882494.html,2023-07-20 19:30:00,Moms First Convenes Business Leaders with Biden-Harris Administration Officials to Announce Bold Commitments to ... PR ...,ETSY,0.030602,0.140605,Neutral
"It's National Pickleball Day, but has the sport jumped the commercial shark?",https://www.marketwatch.com/story/its-national-pickleball-day-but-has-the-sport-jumped-the-commercial-shark-ba5c1614,2023-08-08 16:58:00,"Pickleball mania encompasses everything from pickleball bobbleheads to pickleball in the sky, and people spent $519 million on pickleball equipment last year ...",ETSY,0.136888,0.305887,Somewhat-Bullish
Taylor Swift friendship bracelet trend has Etsy shop owners cashing in | Business,https://www.cnn.com/2023/08/08/business/taylor-swift-friendship-bracelet-etsy/index.html,2023-08-08 11:33:00,Taylor Swift friendship bracelet trend has Etsy shop owners cashing in ...,ETSY,0.334573,0.111417,Neutral
This Stock Market Indicator Says the S&P 500 Is Headed Higher: 2 Growth Stocks to Buy Now Before the Rally,https://www.fool.com/investing/2023/08/08/the-sp-500-is-headed-higher-2-growth-stocks-to-buy/,2023-08-08 10:15:00,"The Fed's rate hike cycle appears to be winding down, and history says that could drive the stock market much higher in the next year.",ETSY,0.29176,0.380859,Bullish
AI is about to turn the internet into a total nightmare,https://www.businessinsider.com/ai-scam-spam-hacking-ruining-internet-chatgpt-privacy-misinformation-2023-8,2023-08-08 10:00:00,"AI scams, spam, hacking, are ruining the internet - Business Insider ...",ETSY,0.037563,-0.017409,Neutral
3 Top E-Commerce Stocks to Buy in August,https://www.fool.com/investing/2023/08/08/3-top-e-commerce-stocks-to-buy-in-august/,2023-08-08 09:02:00,"The e-commerce market is still in growth mode, and these companies could benefit.",ETSY,0.21803,0.315217,Somewhat-Bullish
What Is Net Debt?,https://www.fool.com/terms/n/net-debt/,2023-08-07 17:44:19,"When analyzing stocks you might want to invest in, one very important area to look at is a company's debts. However, simply looking at a company's total outstanding debt doesn't always give the full picture, especially when a company has a relatively high amount of cash or liquid assets.",ETSY,0.179343,-0.107804,Neutral
2 Top Stocks to Buy in August,https://www.fool.com/investing/2023/08/07/2-top-stocks-to-buy-in-august/,2023-08-07 16:43:00,Think the market's top players have been decided for 2023? Think again. These household names are poised for a profitable comeback.,ETSY,0.276909,0.173497,Somewhat-Bullish
The steep cost of being a Taylor Swift fan,https://www.marketwatch.com/story/the-steep-cost-of-being-a-taylor-swift-fan-445e4abc,2023-08-07 08:59:00,Why are people so willing to spend enormous amounts of money on a concert? Do you really need the limited-edition vinyls and an 'Eras Tour' manicure?,ETSY,0.129052,0.150939,Somewhat-Bullish
What They Paid for Their Weddings,https://www.nytimes.com/2023/08/05/style/couples-wedding-expenses.html,2023-08-05 09:01:25,What Six Married Women Paid for Their Weddings The New York Times ...,ETSY,0.027226,-0.004751,Neutral
Opinion | 'Oppenheimer' and the Shadow of Stalin,https://www.nytimes.com/2023/08/04/opinion/oppenheimer-stalin.html,2023-08-04 18:00:50,"With its depth of historical re-creation, its cast of famous figures given tantalizingly brief appearances, its scientific, political and sociological threads running away in multiple directions, a movie like Christopher Nolan's ""Oppenheimer"" doubles as an encouragement to read more deeply into ...",ETSY,0.023814,0.015827,Neutral
Check Out What Whales Are Doing With ETSY - Etsy  ( NASDAQ:ETSY ) ,https://www.benzinga.com/markets/options/23/08/33579424/check-out-what-whales-are-doing-with-etsy,2023-08-04 17:31:29,"A whale with a lot of money to spend has taken a noticeably bearish stance on Etsy. Looking at options history for Etsy ETSY we detected 15 strange trades. If we consider the specifics of each trade, it is accurate to state that 46% of the investors opened trades with bullish expectations and ...",ETSY,0.841002,-0.020365,Neutral
Why Etsy Stock Dropped This Week,https://www.fool.com/investing/2023/08/04/why-etsy-stock-dropped-this-week/,2023-08-04 12:36:36,The latest earnings update showed mixed results.,ETSY,0.586747,0.45756,Bullish
Buy Etsy Stock on Its Post-Earnings Dip. Here's Why.,https://www.fool.com/investing/2023/08/04/buy-etsy-stock-on-its-post-earnings-dip-heres-why/,2023-08-04 10:52:00,Too many investors were already in a bearish mood immediately before Etsy's Q2 numbers were released.,ETSY,0.560594,0.168096,Somewhat-Bullish
Ecommerce Platform Market worth $13.5 billion by 2028 - Exclusive Report by MarketsandMarkets™,https://www.prnewswire.com/news-releases/ecommerce-platform-market-worth-13-5-billion-by-2028---exclusive-report-by-marketsandmarkets-301893448.html,2023-08-04 10:00:00,"CHICAGO, Aug. 4, 2023 /PRNewswire/ -- With an emphasis on sustainability, adoption of AR/VR, AI-powered personalisation, and mobile commerce, the market for e-commerce platforms appears to have a bright future.",ETSY,0.083107,0.037942,Neutral
1 Growth Stock Down 68% to Buy Right Now,https://www.fool.com/investing/2023/08/04/1-growth-stock-down-68-to-buy-right-now/,2023-08-04 09:20:00,E-commerce niche player Etsy is growing and profitable.,ETSY,0.618606,0.372484,Bullish
Airbnb  ( ABNB )  Q2 2023 Earnings Call Transcript,https://www.fool.com/earnings/call-transcripts/2023/08/04/airbnb-abnb-q2-2023-earnings-call-transcript/,2023-08-04 04:30:23,"ABNB earnings call for the period ending June 30, 2023.",ETSY,0.004797,0.044225,Neutral
Etsy CEO says the company is seeing a new all-time high of active buyers,https://www.cnbc.com/2023/08/03/etsy-ceo-says-the-is-seeing-a-new-all-time-high-of-active-buyers.html,2023-08-03 22:47:19,"Etsy CEO Josh Silverman discussed his company's earnings with CNBC's Jim Cramer on Thursday, explaining how the e-commerce platform is trying to boost revenue.",ETSY,0.837089,0.539906,Bullish
Why Etsy Stock Was Falling Today,https://www.fool.com/investing/2023/08/03/why-etsy-was-falling-today/,2023-08-03 17:42:41,"Etsy topped estimates, but sales on its marketplace remained flat.",ETSY,0.713572,0.440677,Bullish
"ETSY's Q2 Earnings Beat Estimates, Revenues Increase Y/Y",https://www.zacks.com/stock/news/2132196/etsys-q2-earnings-beat-estimates-revenues-increase-yy,2023-08-03 16:33:00,Etsy's (ETSY) second-quarter results reflect growing services and marketplace revenues.,ETSY,0.617765,0.236936,Somewhat-Bullish
"Stocks making the biggest moves midday: Southwest Airlines, Qualcomm, Roku, Clorox and more",https://www.cnbc.com/2023/08/03/stocks-making-the-biggest-moves-midday-luv-qcom-roku-clx.html,2023-08-03 16:30:45,These are the stocks posting the largest moves in midday trading.,ETSY,0.118354,-0.122472,Neutral
"Stocks making the biggest moves premarket: Qualcomm, Moderna, PayPal and more",https://www.cnbc.com/2023/08/03/stocks-making-the-biggest-moves-premarket-qualcomm-moderna-paypal-and-more.html,2023-08-03 12:17:15,These are the stocks posting the largest moves in premarket trading.,ETSY,0.057628,0.081197,Neutral
"US Stock Futures Dip As Apple, Amazon Earnings Loom: Analyst Warns Of 'Perfectly Normal' 5% Pullback This Month - Cars.com  ( NYSE:CARS ) , DraftKings  ( NASDAQ:DKNG ) , PayPal Holdings  ( NASDAQ:PYPL ) , Cheesecake Factory  ( NASDAQ:CAKE ) , Expedia Group  ( NASDAQ:EXPE ) , Hyatt Hotels  ( NYSE:H ) , Kellogg  ( NYSE:K ) , Amgen  ( NASDAQ:AMGN ) , DoorDash  ( NYSE:DASH ) , Invesco QQQ Trust, Series 1  ( NASDAQ:QQQ ) , Occidental Petroleum  ( NYSE:OXY ) , Etsy  ( NASDAQ:ETSY ) , Qualcomm  ( NASDAQ:QCOM ) , Warner Bros. Discovery  ( NASDAQ:WBD ) , EVgo  ( NASDAQ:EVGO ) , Atlassian  ( NASDAQ:TEAM ) , Gilead Sciences  ( NASDAQ:GILD ) , Hasbro  ( NASDAQ:HAS ) , Bausch Health Companies  ( NYSE:BHC ) , Moderna  ( NASDAQ:MRNA ) , Qorvo  ( NASDAQ:QRVO ) , Regeneron Pharmaceuticals  ( NASDAQ:REGN ) , SPDR S&P 500  ( ARCA:SPY ) , Amazon.com  ( NASDAQ:AMZN ) ",https://www.benzinga.com/markets/equities/23/08/33543176/us-stock-futures-dip-as-apple-amazon-earnings-loom-analyst-warns-of-perfectly-normal-5-pullback-,2023-08-03 10:53:08,"As Fitch's U.S. ratings downgrade overhang persists and earnings new flow turns negative, stock futures are pulling back yet again on Thursday. Traders may find caution a virtue as a few profile tech names, including Apple, Inc. AAPL, are scheduled to report their quarterly results.",ETSY,0.106541,0.0,Neutral
"Qualcomm and PayPal shares fall after earnings, and other movers",https://www.marketwatch.com/story/qualcomm-and-paypal-shares-fall-after-earnings-and-other-movers-56260b92,2023-08-03 09:15:00,DoorDash Inc. shares were up 4% after the delivery app reported a slightly bigger second-quarter loss than expected but sales that beat estimates.,ETSY,0.186738,-0.007978,Neutral
Etsy forecasts downbeat third quarter as demand softens,https://www.reuters.com/business/retail-consumer/etsy-forecasts-downbeat-third-quarter-demand-softens-2023-08-02/,2023-08-02 22:32:00,"A sign advertising the online seller Etsy Inc. is seen outside the Nasdaq market site in Times Square following Etsy's initial public offering ( IPO ) on the Nasdaq in New York April 16, 2015. REUTERS/Mike Segar/File Photo",ETSY,0.516656,-0.035839,Neutral
Mediocre Earnings After the Bell; Selloff Continues,https://www.zacks.com/stock/news/2131389/mediocre-earnings-after-the-bell-selloff-continues,2023-08-02 21:58:00,"August looks to be giving back a significant amount of July gains, just in the first two days of the new month's trading.",ETSY,0.171688,0.138582,Neutral
"Stocks making the biggest moves after hours: PayPal, Robinhood, Qualcomm, Clorox, DoorDash and more",https://www.cnbc.com/2023/08/02/stocks-making-the-biggest-moves-after-hours-pypl-hood-qcom-clx.html,2023-08-02 21:26:43,These are the stocks posting the largest moves in extended trading.,ETSY,0.148731,-0.076124,Neutral
Etsy  ( ETSY )  Q2 Earnings and Revenues Surpass Estimates,https://www.zacks.com/stock/news/2131352/etsy-etsy-q2-earnings-and-revenues-surpass-estimates,2023-08-02 21:25:16,"Etsy (ETSY) delivered earnings and revenue surprises of 102.44% and 1.13%, respectively, for the quarter ended June 2023. Do the numbers hold clues to what lies ahead for the stock?",ETSY,0.406745,0.147248,Neutral
$2.95B to $3.10B - Etsy  ( NASDAQ:ETSY ) ,https://www.benzinga.com/news/23/08/33532784/etsy-stock-falls-after-hours-on-q2-earnings-whats-going-on,2023-08-02 20:37:56,"Etsy, Inc. ETSY shares are trading lower in Wednesday's after-hours session following the company's second-quarter earnings. Find out what's going on. What Happened: Etsy reported quarterly earnings of $0.45 per share, which beat the analyst consensus estimate of $0.41, an 11.76% decrease over ...",ETSY,0.862063,0.636857,Bullish
"US Stock Market Could Face 'Pretty Painful' And 'Tricky' August, Warns Analyst - DuPont de Nemours  ( NYSE:DD ) , PayPal Holdings  ( NASDAQ:PYPL ) , CVS Health  ( NYSE:CVS ) , Humana  ( NYSE:HUM ) , Cheesecake Factory  ( NASDAQ:CAKE ) , DoorDash  ( NYSE:DASH ) , Invesco QQQ Trust, Series 1  ( NASDAQ:QQQ ) , Yum Brands  ( NYSE:YUM ) , Occidental Petroleum  ( NYSE:OXY ) , Tesla  ( NASDAQ:TSLA ) , Starbucks  ( NASDAQ:SBUX ) , Etsy  ( NASDAQ:ETSY ) , Louisiana-Pacific  ( NYSE:LPX ) , Qualcomm  ( NASDAQ:QCOM ) , Ferrari  ( NYSE:RACE ) , Advanced Micro Devices  ( NASDAQ:AMD ) , EVgo  ( NASDAQ:EVGO ) , Virgin Galactic Hldgs  ( NYSE:SPCE ) , DISH Network  ( NASDAQ:DISH ) , Zillow Gr  ( NASDAQ:Z ) , Fastly  ( NYSE:FSLY ) , Electronic Arts  ( NASDAQ:EA ) , Qorvo  ( NASDAQ:QRVO ) , SPDR S&P 500  ( ARCA:SPY ) ",https://www.benzinga.com/news/earnings/23/08/33518247/stock-futures-dive-after-fitch-us-downgrade-why-this-analyst-forecasts-pretty-painful-and-tricky-au,2023-08-02 11:43:24,"Market sentiment soured further on Wednesday due to a U.S. sovereign rating downgrade, intensifying concerns about market overbought conditions. Fitch attributed this downgrade to fiscal indiscipline and governance challenges within the country.",ETSY,0.1331,0.0,Neutral
2 Growth Stocks You Can Buy Right Now With Less Than $100,https://www.fool.com/investing/2023/08/02/2-growth-stocks-you-can-buy-right-now-with-less-th/,2023-08-02 09:10:00,Investors with $100 and a long timeline might be interested in these stocks.,ETSY,0.450496,0.108027,Neutral
Union Square Ventures slashed the value of 7 of its funds by 26%. Insiders say this will be the 'start of a cascade' of lower valuations for VC funds.,https://www.businessinsider.com/union-square-ventures-cut-value-of-vc-funds-2023-7,2023-08-02 09:00:00,Union Square Ventures Cut the Value of Its VC Funds by 26% in 2023 - Business Insider ...,ETSY,0.049322,-0.050012,Neutral
Amazon employees leak secret info that marketplace sellers can buy on Telegram,https://www.cnbc.com/2023/08/01/amazon-employees-leak-info-that-marketplace-sellers-buy-on-telegram.html,2023-08-01 17:16:25,Third-party merchants who have been suspended by Amazon can pay for confidential data to potentially help them get their accounts back up and running.,ETSY,0.03014,0.062042,Neutral
DigitalOcean  ( DOCN )  to Post Q2 Earnings: What's in Store?,https://www.zacks.com/stock/news/2130620/digitalocean-docn-to-post-q2-earnings-whats-in-store,2023-08-01 16:21:00,"DigitalOcean's (DOCN) second-quarter 2023 results are likely to reflect benefits from enhanced offerings, strategic acquisitions and strong customer growth.",ETSY,0.21686,-0.035843,Neutral
Should You Buy Etsy  ( ETSY )  Ahead of Earnings?,https://www.zacks.com/stock/news/2130348/should-you-buy-etsy-etsy-ahead-of-earnings,2023-08-01 12:44:00,Etsy (ETSY) is seeing favorable earnings estimate revision activity and has a positive Zacks Earnings ESP heading into earnings season.,ETSY,0.904419,0.60567,Bullish
3 Growth Stocks to Buy Before the Big Bull Rally,https://www.fool.com/investing/2023/08/01/3-growth-stocks-to-buy-before-the-big-bull-rally/,2023-08-01 09:17:00,The improving economy sets the stage for bullishness. These companies -- and their stocks -- will benefit more than most.,ETSY,0.110462,0.170483,Somewhat-Bullish
"Etsy seller whose side hustle brings in $169,000 a year: My No. 1 tip for making money during inflation",https://www.cnbc.com/2023/07/31/etsy-fire-pit-seller-my-best-tip-for-making-money-during-inflation.html,2023-07-31 21:20:01,"In January, Tim Riegel realized his side hustle profit margins were shrinking, due to rising costs of goods. So, he raised his prices and started earning more money.",ETSY,0.130217,0.001214,Neutral
Looking At Etsy's Recent Unusual Options Activity - Etsy  ( NASDAQ:ETSY ) ,https://www.benzinga.com/markets/options/23/07/33478289/looking-at-etsys-recent-unusual-options-activity,2023-07-31 19:46:31,"Someone with a lot of money to spend has taken a bearish stance on Etsy ETSY. We noticed this today when the big position showed up on publicly available options history that we track here at Benzinga. Whether this is an institution or just a wealthy individual, we don't know.",ETSY,0.804025,0.122888,Neutral
Dynatrace  ( DT )  to Report Q1 Earnings: What's in the Cards?,https://www.zacks.com/stock/news/2130072/dynatrace-dt-to-report-q1-earnings-whats-in-the-cards,2023-07-31 17:48:00,"Dynatrace's (DT) fiscal first-quarter 2024 performance is expected to reflect robust adoption of its observability solutions, expansion of clientele and product portfolio.",ETSY,0.188193,-0.032136,Neutral
What's in Store for Weave Communications'  ( WEAV )  Q2 Earnings?,https://www.zacks.com/stock/news/2130059/whats-in-store-for-weave-communications-weav-q2-earnings,2023-07-31 17:05:00,Weave Communications' (WEAV) second-quarter 2023 performance is expected to reflect growing expertise in its communications solutions and strong adoption by the healthcare industry.,ETSY,0.229149,-0.037448,Neutral
Extreme Networks  ( EXTR )  to Report Q4 Earnings: What's in Store?,https://www.zacks.com/stock/news/2130056/extreme-networks-extr-to-report-q4-earnings-whats-in-store,2023-07-31 17:00:00,Extreme Networks' (EXTR) fiscal fourth-quarter 2023 performance is expected to reflect the growing demand for its cloud and network solutions and an expanding clientele.,ETSY,0.217508,-0.035927,Neutral
Fastly  ( FSLY )  to Report Q2 Earnings: What's in the Cards?,https://www.zacks.com/stock/news/2130055/fastly-fsly-to-report-q2-earnings-whats-in-the-cards,2023-07-31 16:58:00,Fastly's (FSLY) second-quarter 2023 performance is likely to reflect benefits from its focus on digital user experiences and an expanding clientele.,ETSY,0.213048,-0.035345,Neutral
Cognizant  ( CTSH )  to Report Q2 Earnings: What's in Store?,https://www.zacks.com/stock/news/2130053/cognizant-ctsh-to-report-q2-earnings-whats-in-store,2023-07-31 16:52:00,"Despite challenging macroeconomic conditions, Cognizant's (CTSH) second-quarter 2023 performance is expected to reflect growing domain expertise in its healthcare business operations.",ETSY,0.187705,-0.032074,Neutral
"Monday's Market Minute: Big Tech Highlights This Week - Apple  ( NASDAQ:AAPL ) , Advanced Micro Devices  ( NASDAQ:AMD ) ",https://www.benzinga.com/markets/23/07/33474032/mondays-market-minute-big-tech-highlights-this-week,2023-07-31 16:03:47,"Let's take a market minute to get ahead of what looks like another busy week for investors and traders. First, the focus will remain on companies announcing quarterly results, with Amazon AMZN and Apple AAPL at the top of the list of names reporting.",ETSY,0.256989,0.141366,Neutral
"For the stock market, bad news is back to being good. Here's why, says a Goldman Sachs economist",https://www.marketwatch.com/story/for-the-stock-market-bad-news-is-back-to-being-good-heres-why-says-a-goldman-sachs-economist-2937b506,2023-07-31 10:49:00,"Even as the market gets excited by the idea of a soft landing, growth surprises aren't well received.",ETSY,0.090134,0.0,Neutral
Better E-Commerce Buy: Amazon vs. Etsy,https://www.fool.com/investing/2023/07/31/better-e-commerce-buy-amazon-vs-etsy/,2023-07-31 10:00:00,Both companies have what it takes to shine over the long term.,ETSY,0.589946,0.36183,Bullish
The death of hobbies,https://www.businessinsider.com/hobbies-death-side-hustles-remote-work-job-market-economic-precarity-2023-7,2023-07-31 09:25:00,Hobbies have been killed by money making side hustles - Business Insider ...,ETSY,0.021738,0.146862,Neutral
C'mon Barbie…,https://www.financialexpress.com/business/brandwagon-cmon-barbie-3193148/,2023-07-31 02:52:58,"Produced by Mattel Films, the Barbie movie has set a benchmark of sorts with over 100-plus brand collaborations earning millions in merchandising revenue. From Crocs to Airbnb, from Aldo to Etsy, brands have put a Barbiecore spin on some of their popular products this summer.",ETSY,0.056407,-0.002,Neutral
What Is the Network Effect?,https://www.fool.com/terms/n/network-effect/,2023-08-17 20:06:15,"There are a number of different ways for businesses to generate competitive advantages, but few are as valuable as the network effect.Network effects apply not just to businesses but also to relationships and social systems.",ETSY,0.143987,0.020626,Neutral
"Got $3,000? These Supercharged Stocks Could Triple Your Money in a Decade.",https://www.fool.com/investing/2023/08/17/got-3000-supercharged-stocks-triple-money-decade/,2023-08-17 16:38:00,"With enough time and patience, these growth stocks can take a small sum of cash a long way.",ETSY,0.36472,0.331351,Somewhat-Bullish
"Carol Duvall, a TV Queen of Crafting, Dies at 97",https://www.nytimes.com/2023/08/17/arts/television/carol-duvall-dead.html,2023-08-17 15:02:18,"Carol Duvall looked at the plastic foam trays that meat or vegetables come packaged in and saw picture frames. To her, ""rock, paper, scissors"" wasn't a children's game; it was a list of what you needed to make a personalized gift for someone to place on the mantel or in the garden.",ETSY,0.039679,0.121463,Neutral
Is Etsy Stock a Buy After Its Post-Earnings Sell-Off?,https://www.fool.com/investing/2023/08/17/is-etsy-stock-a-buy-after-its-post-earnings-sell/,2023-08-17 12:00:00,The stock has declined 35% in the past 12 months.,ETSY,0.368227,-0.127479,Neutral
3 business owners share the one change they made to turn everything round and start making money,https://www.businessinsider.com/how-to-turn-around-a-failing-business,2023-08-17 09:36:00,How to Turn Around a Failing Business to Make Money - Business Insider ...,ETSY,0.372634,0.150995,Somewhat-Bullish
2 Green Flags Investors Are Missing About Etsy Stock,https://www.fool.com/investing/2023/08/15/green-flags-investors-are-missing-about-etsy-stock/,2023-08-15 09:48:00,It wasn't all doom and gloom in the company's latest earnings report.,ETSY,0.542539,0.330419,Somewhat-Bullish
'Lazy-girl jobs' creator hits back at elitism criticisms - says these jobs are 'not a privilege of the middle class.' Others disagree.,https://www.marketwatch.com/story/lazy-girl-jobs-creator-responds-to-criticisms-of-elitism-these-jobs-are-not-a-privilege-of-the-middle-class-10405206,2023-08-14 20:18:00,"Gabrielle Judge, a TikTok influencer, insisted that allegations of privilege about the term she coined are unfounded.",ETSY,0.042953,0.150321,Somewhat-Bullish
Is E-Commerce Still Booming?,https://www.fool.com/investing/2023/08/14/is-e-commerce-still-booming/,2023-08-14 17:58:00,"Shopify pushes merchant services, Etsy tries to find its footing, and MercadoLibre continues to dazzle.",ETSY,0.13001,0.086887,Neutral
"1 Green Flag With Etsy's Q2 Earnings, and 1 Red Flag for Investors",https://www.fool.com/investing/2023/08/12/1-green-flag-with-etsys-q2-earnings-and-1-red-flag/,2023-08-12 12:05:00,There's a lot to unpack with this e-commerce company's latest financial report.,ETSY,0.318074,0.317134,Somewhat-Bullish
