title,url,time_published,summary,ticker,relevance_score,ticker_sentiment_score,ticker_sentiment_label
"I've made almost $10,000 a month from Shopify and YouTube. Here's how I built 2 income streams in college.",https://www.businessinsider.com/shopify-youtube-multiple-second-income-stream-2023-3,2023-03-20 10:17:12,I've Made Almost $10K a Month From Both Shopify and YouTube - Business Insider ...,ETSY,0.332261,0.073913,Neutral
Don't bother writing a 'love letter' to home sellers. They're a waste of time and someone could get screwed.,https://www.businessinsider.com/home-buyer-love-letter-offer-bid-risks-downsides-sellers-agents-2023-3,2023-03-18 09:45:00,Why 'Love Letters' to Home Sellers Are a Waste of Time - Business Insider ...,ETSY,0.057215,0.207999,Somewhat-Bullish
"Amazon, Etsy, eBay, and Shopify sellers feel the squeeze of higher fees. Now they must get creative to stay profitable.",https://www.businessinsider.com/etsy-ebay-amazon-shopify-higher-fees-mean-higher-prices-2023-3,2023-03-17 14:40:51,"Etsy, eBay, Amazon, Shopify Higher Fees Mean Higher Prices - Business Insider ...",ETSY,0.451494,0.12479,Neutral
"I'm a stay-at-home mom who made $23,000 in 3 months on Etsy. Here's how I built a business around my busy schedule.",https://www.businessinsider.com/mom-working-from-home-etsy-prints-income-stream-2023-3,2023-03-17 10:02:51,"I'm a Stay-at-Home Mom Who Made $23,000 in 3 Months on Etsy - Business Insider ...",ETSY,0.442222,0.338973,Somewhat-Bullish
Etsy  ( ETSY )  Stock Sinks As Market Gains: What You Should Know,https://www.zacks.com/stock/news/2067006/etsy-etsy-stock-sinks-as-market-gains-what-you-should-know,2023-03-16 22:00:24,"Etsy (ETSY) closed at $104.43 in the latest trading session, marking a -0.3% move from the prior day.",ETSY,0.688096,0.349039,Somewhat-Bullish
"Silicon Valley Bank Merch Hits Ebay And Etsy: Yeti Mugs, Picnic Set, Ugly Sweaters And More Up For Sale - SVB Finl Gr  ( NASDAQ:SIVB ) ",https://www.benzinga.com/news/23/03/31384875/silicon-valley-bank-merch-hits-ebay-and-etsy-yeti-mugs-picnic-set-ugly-sweaters-and-more-up-for-sale,2023-03-16 17:37:49,"A search on eBay Inc EBAY shows 130 results for ""Silicon Valley Bank,"" the regional bank that was recently shut down and taken over by the FDIC. The bank, a unit of SVB Financial Group SIVB, is now the subject of a rush from collectors for authentic merchandise and newly created swag.",ETSY,0.155451,-0.084135,Neutral
"Etsy, eBay Want IRS 1099-K Relief for Online Sellers",https://www.kiplinger.com/taxes/etsy-ebay-want-irs-1099-k-relief,2023-03-16 14:00:00,"Online shopping sites like Etsy, and eBay, and payment network PayPal, among other companies, want Congress to change the new $600 reporting threshold for IRS Form 1099-K.",ETSY,0.205225,0.176477,Somewhat-Bullish
Kellogg is giving its Pringles and Cheez-It business a new name with classical Latin twist. It's the latest company name to incorporate the 'dead' language.,https://www.businessinsider.com/kellanova-latest-big-company-rebrand-latin-words-2023-3,2023-03-15 19:00:03,'Kellanova' From Kelloggs Is Latest Rebrand to Draw on Latin Words - Business Insider ...,ETSY,0.12013,0.057589,Neutral
Learning Pool becomes Certified B Corporation® Joining a Global Movement of Businesses Committed to Making a Positive Impact on the World,https://www.prnewswire.com/news-releases/learning-pool-becomes-certified-b-corporation-joining-a-global-movement-of-businesses-committed-to-making-a-positive-impact-on-the-world-301773193.html,2023-03-15 16:04:00,Learning Pool becomes Certified B Corporation® Joining a Global ... PR ...,ETSY,0.044634,0.033639,Neutral
There's a Run on Silicon Valley Bank Swag,https://www.wsj.com/articles/svb-merch-swag-ebay-d9747ff8,2023-03-15 14:31:00,"Silicon Valley Bank has collapsed, but branded company gear such as socks, hats and wine tumblers are selling like crazy. Soon after the second-biggest bank failure last week, people who owned SVB swag-and some people who didn't-got to work.",ETSY,0.428632,-0.032793,Neutral
1 Growth Stock Down 62% to Buy Right Now,https://www.fool.com/investing/2023/03/15/1-growth-stock-down-62-to-buy-right-now/,2023-03-15 13:37:00,Etsy still has solid long-term prospects.,ETSY,0.620262,0.334788,Somewhat-Bullish
Exclusive: Union Square Ventures warned startup founders in November to diversify their deposit holdings after alarm over Silicon Valley Bank,https://www.businessinsider.com/vc-firm-usv-warning-to-diversify-deposit-holdings-in-november-2023-3,2023-03-14 21:58:49,VC Firm USV Sent Warning to Diversify Deposit Holdings in November - Business Insider ...,ETSY,0.079921,-0.039571,Neutral
Exclusive: Union Square Ventures warned startup founders in November to diversify their deposit holdings after alarm over Silicon Valley Bank,https://africa.businessinsider.com/news/exclusive-union-square-ventures-warned-startup-founders-in-november-to-diversify/4ex652s,2023-03-14 21:58:49,Exclusive: Union Square Ventures warned startup founders in ... - Business Insider Africa ...,ETSY,0.101582,-0.041488,Neutral
Some Etsy sellers have finally accessed money tied to Silicon Valley Bank and have reopened their shops,https://africa.businessinsider.com/retail/some-etsy-sellers-have-finally-accessed-money-tied-to-silicon-valley-bank-and-have/f6xr9hy,2023-03-14 21:03:01,Some Etsy sellers have finally accessed money tied to Silicon Valley ... - Business Insider Africa ...,ETSY,0.841981,0.004128,Neutral
Looking At Etsy's Recent Unusual Options Activity - Etsy  ( NASDAQ:ETSY ) ,https://www.benzinga.com/markets/options/23/03/31347855/looking-at-etsys-recent-unusual-options-activity,2023-03-14 18:46:13,"A whale with a lot of money to spend has taken a noticeably bearish stance on Etsy. Looking at options history for Etsy ETSY we detected 12 strange trades. If we consider the specifics of each trade, it is accurate to state that 41% of the investors opened trades with bullish expectations and ...",ETSY,0.842959,0.069383,Neutral
"Google got a pandemic boost for its Workspace software but blew it, insiders say. Now it plans to attack Microsoft with a new push in AI.",https://www.businessinsider.com/google-workspace-cloud-microsoft-threats-ai-chatgpt-2023-3,2023-03-14 14:18:22,Inside Google Workspace's Plans to Attack Microsoft With AI - Business Insider ...,ETSY,0.018118,0.0,Neutral
SVB collapse stymies Etsy payments to sellers,https://edition.cnn.com/business/live-news/silicon-valley-bank-collapse-updates-03-13-23/h_6958b7f908358829062cad4fd190fc33,2023-03-14 10:50:58,"March 13, 2023 Latest on the Silicon Valley Bank collapse CNN International ...",ETSY,0.054114,-0.014,Neutral
A Bull Market Is Coming: 5 Top Stocks to Buy Now,https://www.fool.com/investing/2023/03/14/a-bull-market-is-coming-5-top-stocks-to-buy-now/,2023-03-14 09:30:00,These companies all have solid long-term prospects.,ETSY,0.282641,0.196,Somewhat-Bullish
"I designed the hat Beyoncé wore in the Renaissance tour promo. Now I'm working up to 15 hours a day to meet my Etsy waitlist of 6,000.",https://www.businessinsider.com/how-beyonce-wearing-hat-designed-affected-etsy-business-2023-3,2023-03-14 09:00:00,How Beyoncé Wearing a Hat I Designed Affected My Etsy Business - Business Insider ...,ETSY,0.171485,0.167411,Somewhat-Bullish
"Etsy, other e-commerce companies feel squeeze of SVB collapse",https://www.reuters.com/markets/etsy-other-e-commerce-companies-feel-squeeze-svb-collapse-2023-03-13/,2023-03-13 23:05:00,"NEW YORK, March 13 ( Reuters ) - Etsy ( ETSY.O ) on Monday resumed payments to merchants with Silicon Valley Bank accounts after the e-commerce platform paused their payouts over the weekend following the U.S. government shutdown of the bank last week.",ETSY,0.557075,0.060686,Neutral
Some Etsy sellers are still having trouble accessing funds tied to Silicon Valley Bank and they don't know when they'll get them,https://www.businessinsider.com/etsy-sellers-not-getting-paid-after-silicon-valley-bank-collapse-2023-3,2023-03-13 22:27:23,Etsy Sellers Are Not Getting Paid After Silicon Valley Bank Collapse - Business Insider ...,ETSY,0.896158,-0.075537,Neutral
"Stocks making the biggest moves midday: First Republic Bank, Moderna, Newmont, Illumina and more",https://www.cnbc.com/2023/03/13/stocks-moving-big-midday-frc-mrna-nem-prvb.html,2023-03-13 16:56:32,These are the stocks posting the largest moves midday.,ETSY,0.067727,-0.189768,Somewhat-Bearish
Etsy Struggles To Pay Sellers Due To Silicon Valley Bank Ties: 'I'm Confused And Concerned' - Etsy  ( NASDAQ:ETSY ) ,https://www.benzinga.com/news/23/03/31324910/etsy-struggles-to-pay-sellers-due-to-silicon-valley-bank-ties-im-confused-and-concerned,2023-03-13 16:51:02,"E-commerce platform Etsy Inc ETSY is the latest public company to chime in on the impact of the collapse of SVB Financial SIVB. In the case of Etsy, it's not just the company that's impacted, but its sellers as well.",ETSY,0.900896,-0.10565,Neutral
Etsy Unusual Options Activity - Etsy  ( NASDAQ:ETSY ) ,https://www.benzinga.com/markets/options/23/03/31323256/etsy-unusual-options-activity,2023-03-13 15:15:54,"Someone with a lot of money to spend has taken a bearish stance on Etsy ETSY. We noticed this today when the big position showed up on publicly available options history that we track here at Benzinga. Whether this is an institution or just a wealthy individual, we don't know.",ETSY,0.723441,0.166855,Somewhat-Bullish
StarTree Extends Leadership Position in Real-time Analytics with a Year of Strong Growth and Innovation,https://www.benzinga.com/pressreleases/23/03/g31318733/startree-extends-leadership-position-in-real-time-analytics-with-a-year-of-strong-growth-and-innov,2023-03-13 12:30:00,"MOUNTAIN VIEW, Calif., March 13, 2023 ( GLOBE NEWSWIRE ) -- StarTree, Inc. today announced strong business momentum during 2022, fueling 4x growth in sales revenue and 10x growth in the number of customers while doubling headcount to 100 employees across multiple countries.",ETSY,0.094762,0.105252,Neutral
Everything you need to know about a crazy weekend in the wake of Silicon Valley Bank's failure,https://www.businessinsider.com/silicon-valley-bank-failure-weekend-recap-tech-industry-2023-3,2023-03-13 11:55:00,What Happened Over the Weekend Regarding Silicon Valley Bank - Business Insider ...,ETSY,0.03642,-0.014602,Neutral
Some Etsy sellers say they're shutting their stores until the platform clears up any risk of non-payment from Silicon Valley Bank's collapse,https://africa.businessinsider.com/news/some-etsy-sellers-say-theyre-shutting-their-stores-until-the-platform-clears-up-any/33l8fvf,2023-03-13 09:01:45,Some Etsy sellers say they're shutting their stores until the platform ... - Business Insider Africa ...,ETSY,0.892945,-0.165012,Somewhat-Bearish
Some Etsy sellers say they're shutting their stores until the platform clears up any risk of non-payment from Silicon Valley Bank's collapse,https://www.businessinsider.com/silicon-valley-bank-collapse-etsy-sellers-shutting-stores-2023-3,2023-03-13 09:01:45,Etsy Sellers Are Shutting Their Stores Amidst SVB Collapse - Business Insider ...,ETSY,0.88438,-0.224279,Somewhat-Bearish
It's Time for Regulators to Fix the SVB Mess. U.S. Businesses Depend On It.,https://www.barrons.com/articles/svb-bailout-depositors-382dc0d0,2023-03-12 20:44:08,SVB Depositors Need to Be Made Whole. Business Depends on It. ...,ETSY,0.904419,-0.837622,Bearish
Etsy told sellers that payments will be delayed because it was using Silicon Valley Bank,https://www.businessinsider.com/etsy-delays-paying-sellers-because-was-using-silicon-valley-bank-2023-3,2023-03-12 16:45:00,Etsy Delays Paying Sellers Because It Was Using Silicon Valley Bank - Business Insider ...,ETSY,0.774013,-0.155718,Somewhat-Bearish
Etsy told sellers that payments will be delayed because it was using Silicon Valley Bank,https://africa.businessinsider.com/retail/etsy-told-sellers-that-payments-will-be-delayed-because-it-was-using-silicon-valley/k5eqel5,2023-03-12 16:45:00,Etsy told sellers that payments will be delayed because it was using ... - Business Insider Africa ...,ETSY,0.71032,0.031121,Neutral
Futures Loom: FDIC Ready For Monday After SVB Collapse?,https://www.investors.com/market-trend/stock-market-today/dow-jones-futures-fdic-ready-after-svb-financial-collapse-watch-these-bank-stocks/,2023-03-12 16:38:10,Futures: FDIC Ready For Monday After SVB Collapse? Investor's Business Daily ...,ETSY,0.038811,0.077098,Neutral
'I don't know how this ends': Mom with 4 kids in Ohio who owns small startup says SVB mess is not just a '1% problem',https://www.businessinsider.com/mother-small-startup-ceo-fall-svb-not-1-problem-2023-3,2023-03-12 15:53:53,A Mother and Small Startup CEO Says Fall of SVB Is Not a '1 ... - Business Insider ...,ETSY,0.28442,-0.381714,Bearish
'I don't know how this ends': Mom with 4 kids in Ohio who owns small startup says SVB mess is not just a '1% problem',https://africa.businessinsider.com/news/i-dont-know-how-this-ends-mom-with-4-kids-in-ohio-who-owns-small-startup-says-svb/v5vw8e2,2023-03-12 15:53:53,'I don't know how this ends': Mom with 4 kids in Ohio who owns small ... - Business Insider Africa ...,ETSY,0.11983,-0.284506,Somewhat-Bearish
3 Growth Stocks With More Potential Than Any Cryptocurrency,https://www.fool.com/investing/2023/03/12/3-growth-stocks-with-more-potential-than-crypto/,2023-03-12 13:30:00,"These businesses may be dealing with market volatility, but green flags remain for each.",ETSY,0.228073,-0.10832,Neutral
My Etsy store has made $1.9 million in lifetime sales. Here's how I found success selling handmade jewelry.,https://www.businessinsider.com/how-i-opened-etsy-store-handmade-jewelry-2023-3,2023-03-12 12:00:00,My Etsy Store Made $1.9 Million in Lifetime Jewelry Sales - Business Insider ...,ETSY,0.553402,0.234996,Somewhat-Bullish
3 Tech Stocks With More Potential Than Any Cryptocurrency,https://www.fool.com/investing/2023/03/12/3-tech-stocks-with-more-potential-than-any-cryptoc/,2023-03-12 09:15:00,"These companies are on supercharged paths to growth, and patient investors who stay with them can capitalize.",ETSY,0.148273,0.041015,Neutral
Trump's indictment is golden for his presidential campaign fundraising: 'Trump is going to be able to raise a lot of money off this',https://www.marketwatch.com/story/trumps-indictment-is-golden-for-his-presidential-campaign-fundraising-trump-is-going-to-be-able-to-raise-a-lot-of-money-off-this-7809c004,2023-03-31 21:04:00,"Trump is seeing a windfall from t-shirts, while Trump NFTs rallied on Friday. Stormy Daniels also says orders for her merch are 'pouring in.' ...",ETSY,0.039745,0.114267,Neutral
Is Etsy Stock a Buy Now?,https://www.fool.com/investing/2023/03/30/is-etsy-stock-a-buy-now/,2023-03-30 14:07:00,"Buying Etsy stock could be rewarding, but there are risks as well.",ETSY,0.696531,0.17619,Somewhat-Bullish
2 No-Brainer Stocks to Buy Before the Next Bull Market,https://www.fool.com/investing/2023/03/30/2-no-brainer-stocks-to-buy-before-next-bull-market/,2023-03-30 13:53:00,These stocks each have superior businesses that can reward investors over the long haul.,ETSY,0.533678,0.172933,Somewhat-Bullish
"What to know about taxes on third party payment processors like Venmo, CashApp and PayPal",https://www.foxbusiness.com/money/taxes-third-party-payment-processors-venmo-cashapp-paypal,2023-03-30 10:36:29,"There is a lot of information that you need to pull together when filing your taxes. You may need to gather paperwork from any third party payment processors like Venmo, CashApp or PayPal, depending on how much you earned, and what the payments went toward.",ETSY,0.146916,0.033654,Neutral
What Is E-commerce?,https://www.fool.com/terms/e/what-is-e-commerce/,2023-03-29 19:16:04,"In a little more than a generation, e-commerce has become one of the biggest industries in the world, showing the power of the internet and the appeal of convenience, fast delivery, and the ability to shop from the comfort of your home.",ETSY,0.171282,0.111049,Neutral
Better Buy: Etsy vs. Shopify,https://www.fool.com/investing/2023/03/29/better-buy-etsy-vs-shopify/,2023-03-29 12:25:00,"The companies may operate in the same industry, but when you compare the two, there's a clear winner.",ETSY,0.531716,0.309119,Somewhat-Bullish
"This Stock Reminds Me of Airbnb and Etsy, but Almost Nobody Knows About It",https://www.fool.com/investing/2023/03/29/this-stock-reminds-me-of-airbnb-and-etsy-but-almos/,2023-03-29 09:35:00,Can this obscure company revolutionize a $2 trillion industry?,ETSY,0.279015,0.34904,Somewhat-Bullish
Crochet made easy: 'The Woobles' company finds big success in teaching craft to beginners,https://www.foxbusiness.com/lifestyle/crochet-easy-woobles-company-big-success-teaching-craft-beginners,2023-03-28 23:40:29,"Justine Tiu, the founder of The Woobles, a crochet kit business aimed at beginners, said in a recent interview with FOX Business that learning a new skill is a way to build confidence in other areas of life.",ETSY,0.043818,0.12777,Neutral
Etsy  ( ETSY )  Gains As Market Dips: What You Should Know,https://www.zacks.com/stock/news/2071595/etsy-etsy-gains-as-market-dips-what-you-should-know,2023-03-28 22:00:21,"Etsy (ETSY) closed the most recent trading day at $105.06, moving +0.17% from the previous trading session.",ETSY,0.556576,0.20501,Somewhat-Bullish
Where Will Etsy Stock Be in 1 Year?,https://www.fool.com/investing/2023/03/24/where-will-etsy-stock-be-in-1-year/,2023-03-24 21:30:00,The online marketplace for handmade and unusual goods is facing a sales slowdown.,ETSY,0.575055,0.230836,Somewhat-Bullish
Fighting Inflation From Your Home: 10 Side Hustle Ideas To Keep Your Purchasing Power Intact,https://www.benzinga.com/node/30133560,2023-03-24 19:59:58,"With inflation looking like it will last through the year and big companies making job cuts, many Americans are considering additional ways to complement their income in order to avoid making spending cuts or being able to afford some extra luxuries. How to do this?",ETSY,0.068502,0.124898,Neutral
Secondhand resale is getting cutthroat as platforms like Depop and Poshmark boom,https://www.cnbc.com/2023/03/24/depop-poshmark-secondhand-resale-cutthroat.html,2023-03-24 15:40:04,The consumer culture on indie reselling platforms has shifted as more sellers compete to capture demand and more inflation-weary customers hunt for deals.,ETSY,0.038969,0.060611,Neutral
Why Is Etsy  ( ETSY )  Down 16.3% Since Last Earnings Report?,https://www.zacks.com/stock/news/2070230/why-is-etsy-etsy-down-163-since-last-earnings-report,2023-03-24 15:30:47,Etsy (ETSY) reported earnings 30 days ago. What's next for the stock? We take a look at earnings estimates for some clues.,ETSY,0.590628,0.230051,Somewhat-Bullish
Silicon Valley Bank Bust Ripples Through Retail Industry,https://www.forbes.com/sites/gregpetro/2023/03/24/silicon-valley-bank-bust-ripples-through-retail-industry/,2023-03-24 14:23:19,"As a financier of choice for digital innovators, Silicon Valley Bank's (SVB) recent collapse will be felt across many industries, including the consumer-facing companies that depend on technology for ecommerce operations and seamless payment systems.",ETSY,0.087824,-0.052156,Neutral
Here's how the IRS says you should handle 1099-K tax reporting mistakes on your return,https://www.cnbc.com/2023/03/24/how-the-irs-says-to-handle-1099-k-reporting-mistakes-on-tax-returns.html,2023-03-24 13:00:02,The IRS updated guidance on how to handle 1099-K tax reporting errors on your return. Here's what to know about payments from apps like Vemno and PayPal.,ETSY,0.077343,-0.053604,Neutral
Stock Market Sell-Off: Is Etsy a Buy?,https://www.fool.com/investing/2023/03/24/stock-market-sell-off-is-etsy-a-buy/,2023-03-24 10:30:00,Etsy stock is beating rivals in key growth metrics.,ETSY,0.67831,0.225554,Somewhat-Bullish
I run a multimillion-dollar slime business at 19. Here's how I got started in middle school with only $200.,https://www.businessinsider.com/gen-z-teen-made-money-selling-slime-in-high-school-2023-3,2023-03-23 09:41:27,How a Gen-Z Teen Made Money Selling Slime While in High School - Business Insider ...,ETSY,0.074692,0.118219,Neutral
"Will high property prices lead to a generation of renters? Landlords benefit, while millions of Americans find themselves trapped.",https://www.marketwatch.com/story/will-high-property-prices-lead-to-a-generation-of-renters-landlords-benefit-while-millions-of-americans-find-themselves-trapped-749f0dac,2023-03-23 03:38:00,A dearth of homes for sale and high mortgage rates are pushing people to rent for longer.,ETSY,0.035345,-0.057829,Neutral
WTF Is Going On With SVB? - SVB Finl Gr  ( NASDAQ:SIVB ) ,https://www.benzinga.com/news/23/03/31466630/wtf-is-going-on-with-svb,2023-03-22 22:27:13,"It seems like everyone and their mother is talking about Banks nowadays. I'm sure Silicon Valley Bank SIVB rings a bell? The whole situation has caused panic and fear within the banking industry: ""Is there going to be another financial crisis?""",ETSY,0.080458,0.0,Neutral
Etsy  ( ETSY )  Stock Moves -1.55%: What You Should Know,https://www.zacks.com/stock/news/2069318/etsy-etsy-stock-moves--155-what-you-should-know,2023-03-22 22:00:26,"In the latest trading session, Etsy (ETSY) closed at $110.96, marking a -1.55% move from the previous day.",ETSY,0.675573,0.130673,Neutral
Tax Tip - Are you a peer-to-peer seller? Here's what you need to know,https://www.newswire.ca/news-releases/tax-tip-are-you-a-peer-to-peer-seller-here-s-what-you-need-to-know-869700602.html,2023-03-22 18:00:00,"A peer-to-peer ( P2P ) transaction involves the selling of goods from one person or party directly to another. You may be taking part in P2P selling if you are connecting with buyers through digital platforms like websites, online marketplaces or mobile applications ( such as Etsy, eBay or Amazon ...",ETSY,0.082393,0.008316,Neutral
"Becky Fatemi: 'If I don't love it, I can't sell it'",https://www.ft.com/content/c4cbc0eb-3d4b-4ea3-98d3-da9352955626,2023-03-22 16:55:37,"My personal style signifiers are accessories. I wear a lot of vintage Chanel, Bulgari and a Cartier watch that belonged to my mum. When we left Iran in 1979, we left with nothing and all my mum took was a little bag of her jewellery, including the watch and a diamond signet ring.",ETSY,0.026591,0.114235,Neutral
"Sens. Booker, Warnock press big bank CEOs to pause overdraft fees after SVB failure",https://www.cnbc.com/2023/03/22/svb-collapse-booker-warnock-press-banks-on-overdraft-fees.html,2023-03-22 13:43:49,Sens. Booker and Warnock say overdraft and nonsufficient fund fees are causing hardship for Americans who relied on SVB and Signature Bank for payments.,ETSY,0.069697,-0.135647,Neutral
14 Stocks' Amazing Rallies This Year Are Now Completely Gone,https://www.investors.com/etfs-and-funds/sectors/sp500-stocks-amazing-rallies-this-year-are-now-completely-gone/,2023-03-22 12:00:23,Nothing lasts forever. At least that's the lesson for S&P 500 stock investors this year as big gains slip away. Fourteen stocks that had been up big are now shockingly down for the year.,ETSY,0.106305,0.120235,Neutral
"Zacks Industry Outlook Highlights WillScot Mobile Mini Holdings, La-Z-Boy and Flexsteel Industries",https://www.zacks.com/stock/news/2068957/zacks-industry-outlook-highlights-willscot-mobile-mini-holdings-la-z-boy-and-flexsteel-industries,2023-03-22 11:56:00,"WillScot Mobile Mini Holdings, La-Z-Boy and Flexsteel Industries are part of the Zacks Industry Outlook article.",ETSY,0.027476,0.088612,Neutral
Etsy  ( ETSY )  Stock Sinks As Market Gains: What You Should Know,https://www.zacks.com/stock/news/2076584/etsy-etsy-stock-sinks-as-market-gains-what-you-should-know,2023-04-10 22:00:21,"Etsy (ETSY) closed at $103.04 in the latest trading session, marking a -0.98% move from the prior day.",ETSY,0.546745,0.169395,Somewhat-Bullish
Etsy Unusual Options Activity - Etsy  ( NASDAQ:ETSY ) ,https://www.benzinga.com/markets/options/23/04/31733096/etsy-unusual-options-activity,2023-04-10 20:00:54,"A whale with a lot of money to spend has taken a noticeably bearish stance on Etsy. Looking at options history for Etsy ETSY we detected 14 strange trades. If we consider the specifics of each trade, it is accurate to state that 42% of the investors opened trades with bullish expectations and ...",ETSY,0.72844,0.138096,Neutral
TurboTax vs. hiring an accountant: What's the best way to do your taxes?,https://www.marketwatch.com/story/turbotax-vs-hiring-an-accountant-whats-the-best-way-to-do-your-taxes-3a16154d,2023-04-10 13:22:00,'Tax laws are not always black and white. They are gray and they are very much subject to interpretation.' ...,ETSY,0.066691,-0.013154,Neutral
Tax write-offs small-business owners shouldn't forget,https://www.businessinsider.com/tax-write-offs-for-small-businesses-2023-4,2023-04-10 10:00:00,Here Are Tax Write-Offs for Small Businesses You Need to Know - Business Insider ...,ETSY,0.069697,0.038172,Neutral
I began selling stickers on Etsy as a fun hobby and now make 6-figures from my business. Here's how I got started.,https://www.businessinsider.com/stickers-etsy-6-figure-business-hobby-how-i-got-started-2023-4,2023-04-07 15:10:54,I Make Thousands Selling Stickers on Etsy - Here's How I Started - Business Insider ...,ETSY,0.382925,0.146254,Neutral
CedCommerce named the #1 Multichannel Retail Software by G2 with high customer satisfaction score,https://www.prnewswire.com/news-releases/cedcommerce-named-the-1-multichannel-retail-software-by-g2-with-high-customer-satisfaction-score-301792387.html,2023-04-07 11:30:00,CedCommerce named the #1 Multichannel Retail Software by G2 ... PR ...,ETSY,0.06179,0.233233,Somewhat-Bullish
