title,url,time_published,summary,ticker,relevance_score,ticker_sentiment_score,ticker_sentiment_label
Etsy Unusual Options Activity - Etsy  ( NASDAQ:ETSY ) ,https://www.benzinga.com/markets/options/23/11/35924340/etsy-unusual-options-activity,2023-11-22 20:16:32,"Deep-pocketed investors have adopted a bullish approach towards Etsy ETSY, and it's something market players shouldn't ignore. Our tracking of public options records at Benzinga unveiled this significant move today.",ETSY,0.782863,0.199668,Somewhat-Bullish
Personalized Gifts Market to increase by USD 13.01 billion between 2022 to 2027; the growth of the online segment ... - PR Newswire,https://www.prnewswire.com/news-releases/personalized-gifts-market-to-increase-by-usd-13-01-billion-between-2022-to-2027-the-growth-of-the-online-segment-will-be-significant-during-the-forecast-period---technavio-301995047.html,2023-11-22 19:30:00,Personalized Gifts Market to increase by USD 13.01 billion between 2022 to 2027. the growth of the online segment ... PR ...,ETSY,0.051551,0.138989,Neutral
Non-photo Personalized Gifts Market to grow by USD 9.13 billion from 2022 to 2027; market is fragmented due to the ... - PR Newswire,https://www.prnewswire.com/news-releases/non-photo-personalized-gifts-market-to-grow-by-usd-9-13-billion-from-2022-to-2027-market-is-fragmented-due-to-the-presence-of-prominent-companies-like-american-greetings-corp-american-stationery-co-inc-and-bed-bath-and-beyond-301995023.html,2023-11-22 19:00:00,Non-photo Personalized Gifts Market to grow by USD 9.13 billion from 2022 to 2027. market is fragmented due to the ... PR ...,ETSY,0.073098,0.141688,Neutral
Support your favorite small businesses with the best Black Friday 2023 deals,https://www.cnn.com/cnn-underscored/deals/small-business-black-friday-deals-2023-11-22,2023-11-22 18:14:00,"Want more deals? Visit CNN Underscored's Guide to Black Friday for wall-to-wall coverage of the best discounts to be found during the biggest shopping event of the year. For many, Black Friday conjures an image of throngs of shoppers waiting outside major retailers hoping for deals on big ticket ...",ETSY,0.016484,0.095789,Neutral
"41-year-old teacher's 'kitchen table' side hustle brings in $10,400 a month: When I don't work, 'the sales still come in'",https://www.cnbc.com/2023/11/22/oregon-teacher-how-my-worksheet-side-hustle-brings-in-passive-income.html,2023-11-22 18:08:42,Kindergarten teacher Becky Powell sells worksheets on a platform called Teachers Pay Teachers - and brings in six figures while working 10 hours per week.,ETSY,0.061949,-0.008005,Neutral
We found all the best early deals ahead of Black Friday 2023,https://www.cnn.com/cnn-underscored/deals/best-black-friday-deals-2023-11-22,2023-11-22 14:52:00,"Want more deals? Visit CNN Underscored's Guide to Black Friday for wall-to-wall coverage of the best discounts to be found during the biggest shopping event of the year.﻿ Every year, Black Friday savings start earlier and last longer - we're a few days out from the big day, but the online deals ...",ETSY,0.005487,0.087759,Neutral
"A 27-year-old who brings in up to $16,000 a month 3D printing ornaments and other products explains how he built a side hustle selling on Etsy",https://www.businessinsider.com/side-hustle-how-to-sell-make-money-etsy-ecommerce-business-2023-11,2023-11-22 09:00:00,Side Hustles: How to Sell Make Money by Listing Products on Etsy - Business Insider ...,ETSY,0.346554,-0.056414,Neutral
IRS delays tax reporting rule change for business payments on apps such as Venmo and PayPal,https://www.cnbc.com/2023/11/21/irs-delays-rule-change-for-1099-k-on-venmo-paypal-business-payments.html,2023-11-21 21:07:19,"If you received business payments via apps such as PayPal and Venmo, you will not be subject to a lower threshold for 1099-K tax reporting for 2023.",ETSY,0.108466,-0.046691,Neutral
"IRS delays tax-reporting rule on Venmo, PayPal payments over $600",https://www.foxbusiness.com/money/irs-delays-tax-reporting-rule-venmo-paypal-payments-600,2023-11-21 18:58:22,The IRS announced on Tuesday that it is delaying a controversial targeting Americans who made more than $600 online through third-party payment apps like Venmo or PayPal.,ETSY,0.094762,0.114316,Neutral
IRS postpones rule change on digital payment reporting for small businesses and side hustles | Business,https://www.cnn.com/2023/11/21/success/irs-postpones-1099-k-rule-change/index.html,2023-11-21 18:06:00,IRS postpones rule change on digital payment reporting for small businesses and side hustles ...,ETSY,0.0699,0.002015,Neutral
We found all the best early deals ahead of Black Friday 2023,https://www.cnn.com/cnn-underscored/deals/best-black-friday-deals-2023-11-21,2023-11-21 17:44:00,"Want more deals? Visit CNN Underscored's Guide to Black Friday for wall-to-wall coverage of the best discounts to be found during the biggest shopping event of the year.﻿ Every year, Black Friday savings start earlier and last longer - we're a few days out from the big day, but the online deals ...",ETSY,0.006055,0.088201,Neutral
AeroGarden Cultivates Growth for Small Businesses This Holiday Season - PR Newswire,https://www.prnewswire.com/news-releases/aerogarden-cultivates-growth-for-small-businesses-this-holiday-season-301994462.html,2023-11-21 14:15:00,AeroGarden Cultivates Growth for Small Businesses This Holiday Season PR ...,ETSY,0.159043,0.297175,Somewhat-Bullish
"I made $34,400 this year selling digital products on Etsy. I only spend an hour a month on it - here's how.",https://www.businessinsider.com/how-made-money-selling-digital-products-on-etsy-2023-11,2023-11-21 12:24:00,How I Made $34K Selling Digital Products on Etsy - Business Insider ...,ETSY,0.236281,0.145386,Neutral
3 Top Stocks to Buy for the Long Haul,https://www.fool.com/investing/2023/11/21/3-top-stocks-to-buy-for-the-long-haul/,2023-11-21 10:30:00,"Investing will always come with volatility, but investors will want to hold on for the ride with this trio.",ETSY,0.36472,0.320833,Somewhat-Bullish
Side hustles for introverts: which remote online businesses don't require face-to-face interaction and how to start them,https://www.businessinsider.com/best-side-hustles-for-introverts-2023-11,2023-11-21 09:55:00,Side hustles for introverts: making money online from solo remote work - Business Insider ...,ETSY,0.24289,-0.005647,Neutral
We found all the best early deals ahead of Black Friday 2023,https://www.cnn.com/cnn-underscored/deals/best-black-friday-deals-2023-11-20,2023-11-20 18:45:24,"Want more deals? Visit CNN Underscored's Guide to Black Friday for wall-to-wall coverage of the best discounts to be found during the biggest shopping event of the year.﻿ Every year, Black Friday savings start earlier and last longer - we're a few days out from the big day, but the online deals ...",ETSY,0.006398,0.088467,Neutral
Big Players' Recent Trades in ETSY Options - Etsy  ( NASDAQ:ETSY ) ,https://www.benzinga.com/markets/options/23/11/35875600/big-players-recent-trades-in-etsy-options,2023-11-20 15:45:53,"Financial giants have made a conspicuous bullish move on Etsy. Our analysis of options history for Etsy ETSY revealed 11 unusual trades. Delving into the details, we found 63% of traders were bullish, while 36% showed bearish tendencies.",ETSY,0.801457,0.20995,Somewhat-Bullish
"'Dupes' clothing, perfume craze lures holiday shoppers as major brands fret",https://www.reuters.com/business/retail-consumer/lululemon-birkenstock-duplicate-styles-lure-holiday-shoppers-2023-11-20/,2023-11-20 11:13:00,"[1/2] Lauren Maginness rides an exercise bike wearing Dupes, short for duplicate, at her apartment in New York City, U.S., November 10, 2023. REUTERS/Shannon Stapleton Acquire Licensing Rights NEW YORK, Nov 20 ( Reuters ) - Lauren Maginness is a fan of Lululemon ( LULU.O ) .",ETSY,0.03878,0.162922,Somewhat-Bullish
"How my husband and I planned a wedding in one week and stayed under our $3,000 budget",https://africa.businessinsider.com/lifestyle/how-my-husband-and-i-planned-a-wedding-in-one-week-and-stayed-under-our-dollar3000/kcpkwh5.amp,2023-11-19 13:15:01,"We told our immediate family and best friends, but we didn't want to officially announce the engagement - you know, with a social media post - until we could tell our kids in person. My husband had individually asked each of them for their blessing before proposing, so now we wanted to share the ...",ETSY,0.055492,0.036901,Neutral
Wall Street Says the S&P 500 Can Move Higher: 2 No-Brainer Growth Stocks to Buy With $100 Right Now,https://www.fool.com/investing/2023/11/19/sp-500-can-move-higher-2-stocks-to-buy-with-100/,2023-11-19 13:00:00,These growth stocks are brimming with potential not reflected in their share prices.,ETSY,0.344987,0.208504,Somewhat-Bullish
Open Access: The Entrepreneurs Tapping Into An Evolving Maker Economy,https://www.forbes.com/sites/trevorclawson/2023/11/19/open-access-the-entrepreneurs-tapping-into-an-evolving-maker-economy/,2023-11-19 10:13:04,"These days, we don't hear quite so much about the ""maker economy."" At a time when the word startup is indelibly associated with software in general and new hot categories such as deep tech and AI in particular, the work of twenty-century artisans rarely grabs headlines.",ETSY,0.044718,0.156893,Somewhat-Bullish
"'Don't Lose Hope,' Says Analyst About PayPal Stock",https://markets.businessinsider.com/news/stocks/don-t-lose-hope-says-analyst-about-paypal-stock-1032833200,2023-11-19 00:51:58,"On PayPal's ( NASDAQ:PYPL ) recent Q3 earnings call, new CEO Alex Chriss said a priority for the digital payments leader was to enhance the appeal of its Branded Checkout for consumers and at the same time improve the checkout process for merchants.",ETSY,0.08687,0.011597,Neutral
"Is Trending Stock Etsy, Inc.  ( ETSY )  a Buy Now?",https://www.zacks.com/stock/news/2185896/is-trending-stock-etsy-inc-etsy-a-buy-now,2023-11-17 14:00:06,"Etsy (ETSY) has received quite a bit of attention from Zacks.com users lately. Therefore, it is wise to be aware of the facts that can impact the stock's prospects.",ETSY,0.527831,0.122493,Neutral
"Down 57%, the Etsy Vibe Is Sell: But Here's 1 Huge Reason Why It's a Buy Instead",https://www.fool.com/investing/2023/11/17/down-57-the-etsy-vibe-is-sell-but-heres-1-huge-rea/,2023-11-17 10:02:00,No growth has investors moving away. This one reason says it's probably time to be buying.,ETSY,0.913524,0.194552,Somewhat-Bullish
Behind the Scenes of Etsy's Latest Options Trends - Etsy  ( NASDAQ:ETSY ) ,https://www.benzinga.com/markets/options/23/12/36119397/behind-the-scenes-of-etsys-latest-options-trends,2023-12-06 19:00:56,"Financial giants have made a conspicuous bullish move on Etsy. Our analysis of options history for Etsy ETSY revealed 15 unusual trades. Delving into the details, we found 60% of traders were bullish, while 40% showed bearish tendencies.",ETSY,0.712214,0.19282,Somewhat-Bullish
The Market Has Rallied This Year. Should You Pile Into Growth Stocks in December?,https://www.fool.com/investing/2023/12/06/market-has-rallied-should-you-buy-growth-stocks/,2023-12-06 10:30:00,"Before making any decisions, consider your investment style.",ETSY,0.293741,0.30306,Somewhat-Bullish
From Feeling 'Defeated' To Making $10K A Week: The Simple Strategy That Helped This Etsy Seller Supercharge Sales - Etsy  ( NASDAQ:ETSY ) ,https://www.benzinga.com/general/23/12/36098908/from-feeling-defeated-to-making-10k-a-week-the-simple-strategy-that-helped-this-etsy-seller-supercha,2023-12-05 19:37:02,"Austin Ziegler had trouble selling 3D-printed products online when he first started, but a simple strategy helped get his business booming. What To Know: According to a Business Insider report, Ziegler, a 27-year-old engineer, knew almost nothing about the Etsy Inc ETSY marketplace when he ...",ETSY,0.578355,0.081532,Neutral
The Unsinkable Shopper,https://www.fool.com/investing/2023/12/05/the-unsinkable-shopper/,2023-12-05 18:46:00,Black Friday showed consumers are still ready to buy.,ETSY,0.03679,0.074444,Neutral
Why older Americans are ditching retirement to drive for Uber and Lyft,https://www.businessinsider.com/driving-for-uber-lyft-retirement-gig-workers-delivery-driver-rideshare-2023-11,2023-12-05 15:23:00,Driving for Uber and Lyft in retirement to make money part time - Business Insider ...,ETSY,0.028833,-0.012511,Neutral
5 tips for shopping made in the USA products for everyone on your list this Christmas,https://www.foxbusiness.com/lifestyle/shop-american-made-usa-products,2023-12-05 14:12:00,"Holidays are a great time to buy products made in the USA to support American-owned businesses, both big and small. Finding products made in America is actually quite easy, and you can often find unique gifts for everyone on your list, too.",ETSY,0.291471,0.35073,Bullish
Why older Americans are ditching retirement to drive for Uber and Lyft,https://africa.businessinsider.com/careers/why-older-americans-are-ditching-retirement-to-drive-for-uber-and-lyft/v4rj18x.amp,2023-12-05 11:03:01,Older Americans explain how they're spending their retirements working in the gig economy as Uber and Lyft drivers to make ends meet - Business Insider Africa ...,ETSY,0.097457,-0.01423,Neutral
Where Will Etsy Stock Be in 3 Years?,https://www.fool.com/investing/2023/12/05/where-will-etsy-stock-be-in-5-years/,2023-12-05 10:35:00,This e-commerce platform provider isn't growing as quickly as some of its rivals.,ETSY,0.716023,0.544245,Bullish
2 Potentially Explosive Stocks to Buy in December,https://www.fool.com/investing/2023/12/05/2-potentially-explosive-stocks-to-buy-in-december/,2023-12-05 10:30:00,You'll want to pick up these players before they take off.,ETSY,0.497126,0.497071,Bullish
Decoding Etsy's Options Activity: What's the Big Picture? - Etsy  ( NASDAQ:ETSY ) ,https://www.benzinga.com/markets/options/23/12/36071900/decoding-etsys-options-activity-whats-the-big-picture,2023-12-04 15:45:57,"Investors with a lot of money to spend have taken a bullish stance on Etsy ETSY. We noticed this today when the positions showed up on publicly available options history that we track here at Benzinga. Whether these are institutions or just wealthy individuals, we don't know.",ETSY,0.731711,0.211404,Somewhat-Bullish
A Bull Market Is Coming: 1 No-Brainer Growth Stock to Buy Now With $100 and Hold Forever,https://www.fool.com/investing/2023/12/04/bull-market-coming-1-growth-stock-to-buy-with-100/,2023-12-04 11:15:00,This e-commerce growth stock could regain its momentum during the next bull market.,ETSY,0.675683,0.366027,Bullish
Is Etsy's Revised Forecast a Hold Signal for Investors?,https://www.fool.com/investing/2023/12/03/is-etsys-revised-forecast-a-hold-signal-for-invest/,2023-12-03 14:00:00,Unravel Etsy's financial forecast with insights into profitability and growth in the online marketplace.,ETSY,0.56005,0.486942,Bullish
"I'm a financial planner, and I recommend 4 ways to start recession-proofing your money right now",https://africa.businessinsider.com/news/im-a-financial-planner-and-i-recommend-4-ways-to-start-recession-proofing-your-money/5fb7pk5,2023-12-03 13:46:09,"We recently experienced the longest bull market in economic history, with the stock market increasing in value for 11 years straight. Most bull markets last on average five to seven years. This means for my generation's entire adult lives, we've only seen the stock market grow.",ETSY,0.076602,0.064257,Neutral
Is Etsy a Buy Now?,https://www.fool.com/investing/2023/12/03/is-etsy-a-buy-now/,2023-12-03 12:40:00,It's not hard to find compelling reasons to become a shareholder in this e-commerce marketplace.,ETSY,0.665411,0.387672,Bullish
MUNBYN's New Label Printers Offer Bluetooth Or Apple AirPrint,https://www.forbes.com/sites/marksparrow/2023/12/03/munbyns-new-label-printers-offer-bluetooth-or-apple-airprint/,2023-12-03 12:00:00,"Do you have a side hustle making money selling on eBay or Etsy? Or perhaps you run your own business selling spare parts for computers? If so, you may spend a lot of time printing labels for the courier.",ETSY,0.16117,0.057027,Neutral
1 Artificial Intelligence  ( AI )  Stock to Buy Hand Over Fist and 1 to Make Disappear From Your Portfolio,https://www.fool.com/investing/2023/12/02/1-artificial-intelligence-ai-stock-to-buy-hand-ove/,2023-12-02 18:59:00,One is gaining momentum with the help of artificial intelligence. The other continues to fall behind.,ETSY,0.050148,0.159233,Somewhat-Bullish
A Bull Market Could Be Here: 3 Reasons to Buy Etsy Stock,https://www.fool.com/investing/2023/12/02/a-bull-market-could-be-here-3-reasons-to-buy-etsy/,2023-12-02 15:07:00,"The foreseeable future should look much different than the recent past for Etsy, especially if the market perks up.",ETSY,0.495744,0.302002,Somewhat-Bullish
"2 Undervalued Growth Stocks to Buy Before They Soar 68% and 93%, According to These Wall Street Analysts",https://www.fool.com/investing/2023/12/02/2-growth-stocks-to-buy-before-soar-93-wall-street/,2023-12-02 12:25:00,Certain Wall Street analysts believe these growth stocks are trading at a steep discount to their true value.,ETSY,0.415802,0.260171,Somewhat-Bullish
History Says the S&P 500 Will Move Higher in December: 2 Magnificent Growth Stocks to Buy Before 2024 and Hold Long Term,https://www.fool.com/investing/2023/12/01/sp-500-move-higher-2-growth-stocks-to-buy-for-2024/,2023-12-01 22:00:00,"The stock market tends to rise in December, and these growth stocks could benefit from holiday spending.",ETSY,0.043898,0.206549,Somewhat-Bullish
Why Is Etsy  ( ETSY )  Up 23% Since Last Earnings Report?,https://www.zacks.com/stock/news/2192407/why-is-etsy-etsy-up-23-since-last-earnings-report,2023-12-01 16:31:51,Etsy (ETSY) reported earnings 30 days ago. What's next for the stock? We take a look at earnings estimates for some clues.,ETSY,0.545013,0.287753,Somewhat-Bullish
Meta Stock: Why Temu's Challenge To Amazon Is Boosting Meta,https://www.investors.com/news/technology/why-chinese-e-commerce-giant-temu-challenge-to-amazon-is-boosting-meta/,2023-12-01 14:00:00,"Discount shopping app Temu has racked up impressive download numbers and sales in its first 14 months in business, catching attention as a potential challenger to Amazon ( AMZN ) . Wall Street analysts are debating Temu's impact on another member of the Magnificent Seven: Meta stock.",ETSY,0.058903,0.056985,Neutral
"Package theft: How to get a refund if your delivery from Amazon, Walmart or other sellers gets stolen",https://www.marketwatch.com/story/how-to-get-a-refund-if-your-package-is-stolen-f9cace94,2023-11-30 15:26:00,"For peak holiday shipping season, MarketWatch got advice from retailers on how to recover from package theft.",ETSY,0.153226,0.144206,Neutral
3 Top Tech Stocks That Could Help Make You Rich by Retirement,https://www.fool.com/investing/2023/11/30/3-top-tech-stocks-make-you-rich-by-retirement/,2023-11-30 12:20:00,"If you invest in great companies and be patient, your portfolio can swell mightily. Consider these three contenders.",ETSY,0.162073,0.165273,Somewhat-Bullish
What's Going On With Palantir Technologies Stock Wednesday? - Palantir Technologies  ( NYSE:PLTR ) ,https://www.benzinga.com/news/23/11/36002810/whats-going-on-with-palantir-technologies-stock-wednesday,2023-11-29 15:31:42,"Palantir Technologies, Inc. PLTR shares are trading higher Wednesday. The stock has gained more than 34% over the past month.",ETSY,0.382925,0.257479,Somewhat-Bullish
Better Buy: Etsy vs. eBay Stock,https://www.fool.com/investing/2023/11/29/better-buy-etsy-vs-ebay-stock/,2023-11-29 13:15:00,There's value in the middleman selling approach.,ETSY,0.622414,0.55752,Bullish
IRS' Venmo crackdown delayed but not dead this holiday season,https://www.foxbusiness.com/economy/irs-venmo-crackdown-delayed-not-dead-holiday-season,2023-11-29 10:00:00,"The IRS just announced a regulatory rule delay that will provide stay-at-home moms and middle-class Americans a little relief this holiday season. Online transactions totaling $600 or more will not trigger tax reporting on Form 1099-K, for now. This issue is not dead though.",ETSY,0.050465,0.052049,Neutral
"A 27-year-old Etsy seller who went from zero sales in his first 4 months to bringing in $10,000 in a single week explains the low-cost strategy he used to land his first sale",https://www.businessinsider.com/how-to-drive-sales-etsy-amazon-build-successful-ecommerce-business-2023-11,2023-11-29 09:00:00,"How to Drive Sales on Etsy, Build a Successful Ecommerce Business - Business Insider ...",ETSY,0.398499,0.032826,Neutral
"Cyber Monday 2023 is over, but we found the 329 best deals still happening",https://www.cnn.com/cnn-underscored/deals/best-cyber-monday-deals-2023-11-28,2023-11-28 21:39:54,Want more deals? Visit CNN Underscored's Guide to Cyber Monday for wall-to-wall coverage of the best discounts to be found during the biggest shopping event of the year. This month's online deals extravaganza is technically over - Black Friday and Cyber Monday have come and gone - but a bunch of ...,ETSY,0.005248,0.087572,Neutral
"41-year-old's side hustle brings in $125,500 a year, and costs $0 to start: 'The riches are found in niches'",https://www.cnbc.com/2023/11/28/oregon-teacher-with-six-figure-side-hustle-riches-are-found-in-niches.html,2023-11-28 19:57:56,"Becky Powell, a kindergarten teacher in Oregon, brings in six figures a year selling worksheets for other educators online. Here's how she built her side hustle.",ETSY,0.056143,0.025994,Neutral
"Cyber Monday Update: Bargain-Conscious Online Consumers Increase Spend - Chewy  ( NYSE:CHWY ) , Amazon.com  ( NASDAQ:AMZN ) ",https://www.benzinga.com/analyst-ratings/analyst-color/23/11/35985342/cyber-monday-update-bargain-conscious-online-consumers-increase-spend,2023-11-28 17:47:40,"Consumers are becoming more price-conscious and took full advantage of discounted offers on Cyber Monday. Goldman Sachs collected data from Adobe, Salesforce, and Mastercard, among others. Each company reported online sales growth at the start of Cyber Week.",ETSY,0.204936,0.261849,Somewhat-Bullish
"CrowdStrike, Palantir Among Stocks Poised To Double Or Triple Over The Next Year, Says Munster - Apple  ( NASDAQ:AAPL ) , CrowdStrike Holdings  ( NASDAQ:CRWD ) ",https://www.benzinga.com/analyst-ratings/analyst-color/23/11/35983625/crowdstrike-palantir-among-stocks-poised-to-double-or-triple-over-the-next-year-say,2023-11-28 16:57:38,"The so-called magnificent seven should be a part of most portfolios, according to Deepwater Asset Management's Gene Munster. However, the real growth opportunity over the next year is in select sub-$50 billion market cap companies, Munster argued on CNBC's ""Squawk Box.""",ETSY,0.121037,0.243261,Somewhat-Bullish
"Company News for Nov 28, 2023",https://www.zacks.com/stock/news/2190299/company-news-for-nov-28-2023,2023-11-28 14:35:00,Companies in The News Are: ...,ETSY,0.666827,0.529438,Bullish
"Here is What to Know Beyond Why Etsy, Inc.  ( ETSY )  is a Trending Stock",https://www.zacks.com/stock/news/2190245/here-is-what-to-know-beyond-why-etsy-inc-etsy-is-a-trending-stock,2023-11-28 14:00:06,"Etsy (ETSY) has been one of the stocks most watched by Zacks.com users lately. So, it is worth exploring what lies ahead for the stock.",ETSY,0.523044,0.153198,Somewhat-Bullish
"Avalara Survey Finds Proposed Changes to 1099-K Reporting Threshold Would Have Wide-Reaching Impacts on Marketplace Sellers, Online Marketplaces, and Gig Workers",https://www.prnewswire.com/news-releases/avalara-survey-finds-proposed-changes-to-1099-k-reporting-threshold-would-have-wide-reaching-impacts-on-marketplace-sellers-online-marketplaces-and-gig-workers-301998768.html,2023-11-28 14:00:00,Avalara Survey Finds Proposed Changes to 1099-K Reporting Threshold Would Have Wide-Reaching Impacts on ... PR ...,ETSY,0.03878,0.029667,Neutral
"Chuck E. Cheese Unveils New Birthday Platform with New Entertainment Show, Strategic Marketing Partnership and Ticket Promotion",https://www.benzinga.com/pressreleases/23/11/n35976461/chuck-e-cheese-unveils-new-birthday-platform-with-new-entertainment-show-strategic-marketing-partn,2023-11-28 13:00:00,"IRVING, Texas, Nov. 28, 2023 /PRNewswire/ -- Chuck E. Cheese, the No.1 global family entertainment fun Center and worldwide leader in kids' birthdays, announced an exciting array of enhancements to make every birthday celebration extra special. With a focus on inclusivity and guest experience, ...",ETSY,0.032558,0.185834,Somewhat-Bullish
"I made $181,000 in revenue last year from my Etsy store. I discovered what made my items sell and learned from 2 big mistakes.",https://www.businessinsider.com/hospital-worker-etsy-side-hustle-print-on-demand-2023-11,2023-11-28 11:42:00,"How I Made $181K From Etsy Print on Demand: Lessons, Mistakes - Business Insider ...",ETSY,0.649495,0.141862,Neutral
Wall Street ends lower amid Cyber Monday madness,https://www.moneycontrol.com/news/business/markets/wall-street-ends-lower-amid-cyber-monday-madness-11818261.html,2023-11-28 00:45:10,"""Markets are taking a breather to digest these gains we've seen in November,"" said Tom Hainlin, national investment strategist at U.S. Bank Wealth Management in Minneapolis. ""We're at the higher end of a trading range we've been in for some time."" ...",ETSY,0.060236,0.346453,Somewhat-Bullish
E-commerce stocks rally after Black Friday shoppers spend record online,https://www.cnbc.com/2023/11/27/shopify-etsy-wayfair-rally-after-record-black-friday-spend-online.html,2023-11-27 21:22:05,"Shoppers turned out in full force on Thanksgiving and over the Black Friday weekend, largely shunning physical stores for the comfort of clicking buy online from their couches. Black Friday online spending reached a record $9.8 billion in the U.S., up 7.5% from a year earlier, according to Adobe ...",ETSY,0.072655,0.234321,Somewhat-Bullish
