title,url,time_published,summary,ticker,relevance_score,ticker_sentiment_score,ticker_sentiment_label
"Solar Power Market in US to grow by USD 16.41 billion from 2022 to 2027, Abengoa SA, Acciona SA, Avantus LLC, to ... - PR Newswire",https://www.prnewswire.com/news-releases/solar-power-market-in-us-to-grow-by-usd-16-41-billion-from-2022-to-2027--abengoa-sa-acciona-sa-avantus-llc-to-be-key-market-companies--technavio-301928459.html,2023-09-15 02:35:00,"Solar Power Market in US to grow by USD 16.41 billion from 2022 to 2027, Abengoa SA, Acciona SA, Avantus LLC, to ... PR ...",FSLR,0.057352,0.117,Neutral
"Projected Decline In Fossil Fuel Demand 'Nowhere Near Steep Enough' To Limit Global Warming, IEA Chief Warns - 2 Top Green Stocks Are Actively Tackling The Issue - First Solar  ( NASDAQ:FSLR ) , Tesla  ( NASDAQ:TSLA ) ",https://www.benzinga.com/general/23/09/34590442/projected-decline-in-fossil-fuel-demand-nowhere-near-steep-enough-to-limit-global-warming-iea-chief,2023-09-14 17:46:50,"Oil prices are surging again, but according to Fatih Birol, executive director of the International Energy Agency ( IEA ) , the era of continuous fossil fuel growth won't last much longer. In an op-ed published in the Financial Times, Birol projected that demand for oil, gas and coal will ...",FSLR,0.126784,0.075297,Neutral
"The Time To Buy First Solar Is Now: Analyst Sees Attractive Entry Point, Upgrades Stock - First Solar  ( NASDAQ:FSLR ) ",https://www.benzinga.com/analyst-ratings/analyst-color/23/09/34586146/the-time-to-buy-first-solar-is-now-analyst-sees-attractive-entry-point-upgrades-sto,2023-09-14 17:05:47,"BMO Capital Markets analyst Ameet Thakkar upgraded First Solar, Inc FSLR to Outperform with an unchanged price target of $237. The analyst noted that FSLR already had better visibility than most peers due to its current backlog, ASPs, and PTC advantage.",FSLR,0.730954,0.439323,Bullish
"Stocks making the biggest moves premarket: AMC, Etsy, First Solar and more",https://www.cnbc.com/2023/09/14/stocks-making-the-biggest-moves-premarket-amc-etsy-first-solar-and-more.html,2023-09-14 12:52:56,These are the stocks posting the largest moves in premarket trading.,FSLR,0.07913,0.256017,Somewhat-Bullish
This Is What Whales Are Betting On First Solar - First Solar  ( NASDAQ:FSLR ) ,https://www.benzinga.com/markets/options/23/09/34551941/this-is-what-whales-are-betting-on-first-solar,2023-09-13 20:45:53,"Someone with a lot of money to spend has taken a bearish stance on First Solar FSLR. We noticed this today when the big position showed up on publicly available options history that we track here at Benzinga. Whether this is an institution or just a wealthy individual, we don't know.",FSLR,0.825544,0.26741,Somewhat-Bullish
First Solar  ( FSLR )  to Supply Solar Modules to Longroad Energy,https://www.zacks.com/stock/news/2148159/first-solar-fslr-to-supply-solar-modules-to-longroad-energy,2023-09-13 11:37:00,First Solar (FSLR) extends the supply agreement with Longroad Energy for an additional 2 GW of advanced thin-film American solar modules.,FSLR,0.56415,0.4079,Bullish
India's Aeroflex in talks to enter aerospace sector: Executive Asad Daud,https://www.moneycontrol.com/news/business/indias-aeroflex-in-talks-to-enter-aerospace-sector-executive-asad-daud-11360501.html,2023-09-13 08:19:49,"Following the recent success of its lunar mission, India launched its first solar mission, the latest step in its efforts to increase its share of the global satellite launch market by fivefold within the next decade.",FSLR,0.170878,0.326876,Somewhat-Bullish
"Aeroflex Industries in talks to enter aerospace sector, says top official",https://www.business-standard.com/companies/news/aeroflex-industries-in-talks-to-enter-aerospace-sector-says-top-official-123091300370_1.html,2023-09-13 08:06:33,"India's Aeroflex Industries, whose metal hoses are used in utilities, refineries and fire fighting equipment, is in talks to enter the aerospace sector, a top company executive said, aiming to capitalise on the country's burgeoning space program.",FSLR,0.109956,0.262141,Somewhat-Bullish
Array Technologies Joins Elite List Of Stocks With 95-Plus Composite Rating,https://www.investors.com/ibd-data-stories/array-technologies-joins-elite-list-of-stocks-with-95-plus-composite-rating-2/,2023-09-13 07:00:00,Array Technologies Joins Elite List Of Stocks With 95-Plus ... Investor's Business Daily ...,FSLR,0.294093,0.0,Neutral
Statkraft sole owner of its Brazilian subsidiary Statkraft Energias Renováveis  ( SKER ) ,https://www.globenewswire.com/news-release/2023/09/12/2742113/0/en/Statkraft-sole-owner-of-its-Brazilian-subsidiary-Statkraft-Energias-Renov%C3%A1veis-SKER.html,2023-09-12 21:41:00,"( Oslo/Florianópolis, 12 September 2023 ) Statkraft, Europe's largest generator of renewable energy has purchased 18.69% of the shares in its Brazilian subsidiary Statkraft Energias Renováveis ( SKER ) from Fundação dos Economiários Federais ( Funcef ) , the third largest pension fund in Brazil.",FSLR,0.06179,0.082009,Neutral
"Looking to Outperform? Buy these 3 Stocks Exhibiting ""Raw"" Relative Strength",https://www.zacks.com/commentary/2147995/looking-to-outperform-buy-these-3-stocks-exhibiting-raw-relative-strength,2023-09-12 21:37:00,"When markets stumble, pay close attention to which stocks buck the trend. Resilient stocks during market weakness tend to lead when the market regains its footing.",FSLR,0.125789,-0.03829,Neutral
"First Solar And Longroad Energy Supercharge Partnership With 2GW Boost, Totaling 8GW Since 2017 - First Solar  ( NASDAQ:FSLR ) ",https://www.benzinga.com/markets/equities/23/09/34495232/first-solar-and-longroad-energy-supercharge-partnership-with-2gw-boost-totaling-8gw-since-2017,2023-09-12 16:23:17,"First Solar, Inc. FSLR announced that Longroad Energy has agreed to procure an additional 2 gigawatts ( GW ) of advanced thin film American solar modules. The order builds on an existing 3.7 GW framework agreement between the two companies and will be delivered between 2027 and 2029.",FSLR,0.841981,0.53762,Bullish
"First Solar, Longroad Energy extend solar panel supply deal",https://www.reuters.com/markets/deals/first-solar-longroad-energy-extend-solar-panel-supply-deal-2023-09-12/,2023-09-12 13:59:00,"Miniatures of solar panel and electric pole are seen in front of First Solar logo in this illustration taken January 17, 2023. REUTERS/Dado Ruvic/Illustration/File Photo Acquire Licensing Rights",FSLR,0.524949,0.299774,Somewhat-Bullish
First Solar Unusual Options Activity - First Solar  ( NASDAQ:FSLR ) ,https://www.benzinga.com/markets/options/23/09/34452092/first-solar-unusual-options-activity,2023-09-11 17:46:11,"A whale with a lot of money to spend has taken a noticeably bullish stance on First Solar. Looking at options history for First Solar FSLR we detected 10 strange trades. If we consider the specifics of each trade, it is accurate to state that 60% of the investors opened trades with bullish ...",FSLR,0.802374,0.416791,Bullish
One Company Is Expected To Grow Even Faster Than Nvidia,https://www.investors.com/etfs-and-funds/sectors/sp500-one-company-is-expected-to-grow-even-faster-than-nvidia/,2023-09-11 12:00:00,Nvidia stock is a sensation with investors - including top fund managers - for its off-the-hook growth. But there's one S&P 500 stock that's seen growing even faster than the AI wunderkind. Analysts think casino operator Las Vegas Sands ( LVS ) will post 150.7% revenue growth in 2023.,FSLR,0.110717,0.185041,Somewhat-Bullish
Biden reiterates support for India's permanent seat at UN Security Council,https://www.business-standard.com/india-news/biden-reiterates-support-for-india-s-permanent-seat-at-un-security-council-123090900289_1.html,2023-09-09 06:24:58,"The United States President Joe Biden has reiterated US support for India becoming a permanent member of the United Nations Security Council ( UNSC ) , The Economic Times ( ET ) has reported.",FSLR,0.109455,0.126924,Neutral
"Dow Jones Rises; Adobe Gets Upgrade With Earnings Due, FSLR Rises After Analyst Day",https://www.investors.com/market-trend/stock-market-today/dow-jones-rises-adobe-gets-upgrade-with-earnings-due-fslr-rises-after-analyst-day/,2023-09-08 18:03:00,"Dow Jones Rises. Adobe Gets Upgrade With Earnings Due, FSLR ... Investor's Business Daily ...",FSLR,0.148273,0.060291,Neutral
FSLR Stock: Solar Company Boosted By Deutsche Bank Upgrade,https://www.investors.com/news/technology/first-solar-rises-on-upgrade-as-analyst-sees-strong-roadmap/,2023-09-08 16:31:00,"Shares of First Solar ( FSLR ) are on the rise following an upgrade to buy from Deutsche Bank. FSLR stock was up as much as 2.5% in morning trading. At an analyst presentation Thursday, the company projected that its gross margin would grow from about 42% next year to more than 60% in 2026, ...",FSLR,0.828619,0.522189,Bullish
"Stocks making the biggest moves midday: Kroger, DocuSign, Planet Labs, First Solar and more",https://www.cnbc.com/2023/09/08/stocks-making-the-biggest-moves-midday-kroger-docusign-planet-labs-first-solar-and-more.html,2023-09-08 15:58:02,These are the stocks posting the largest moves in midday trading.,FSLR,0.277958,0.535929,Bullish
"Stocks making the biggest moves before the bell: Kroger, DocuSign, Snowflake, Adobe and more",https://www.cnbc.com/2023/09/08/premarket-movers-kroger-docusign-snowflake-adobe-and-more.html,2023-09-08 12:18:34,These are the stocks posting the largest moves in premarket trading.,FSLR,0.07913,0.25502,Somewhat-Bullish
Why Residential Solar Players Like SunPower Stock Are Having A Tough Year,https://www.forbes.com/sites/greatspeculations/2023/09/08/why-residential-solar-players-like-sunpower-stock-are-having-a-tough-year/,2023-09-08 11:00:04,"While solar stocks fared well through the coronavirus pandemic driven by government stimulus and easy monetary policy, surging interest rates appear to have put the br...",FSLR,0.181137,0.171209,Somewhat-Bullish
First Solar  ( FSLR )  Stock Sinks As Market Gains: What You Should Know,https://www.zacks.com/stock/news/2156619/first-solar-fslr-stock-sinks-as-market-gains-what-you-should-know,2023-09-27 22:00:19,"First Solar (FSLR) closed at $158.61 in the latest trading session, marking a -1.72% move from the prior day.",FSLR,0.655281,0.295815,Somewhat-Bullish
Toledo Solar and First Solar settle lawsuit for undisclosed amount,https://www.reuters.com/business/energy/toledo-solar-first-solar-settle-lawsuit-undisclosed-amount-2023-09-27/,2023-09-27 21:45:00,"Solar panels made by First Solar are seen during a tour of the Overland Park Solar Array in Toledo, Ohio, U.S., October 5, 2021. Picture taken October 5, 2021. REUTERS/Dane Rhys/File Photo Acquire Licensing Rights",FSLR,0.82082,-0.072751,Neutral
Beaten down US solar sector may be primed for a rebound: Maguire,https://www.reuters.com/business/energy/beaten-down-us-solar-sector-may-be-primed-rebound-maguire-2023-09-27/,2023-09-27 15:49:00,"LITTLETON, Colorado, Sept 27 ( Reuters ) - Solar stocks have been some of the hardest hit equities in U.S. markets this year, with several major solar firms nursing stock price losses of more than 50% and a major solar-based exchange-traded fund ( ETF ) down roughly 30%.",FSLR,0.127682,0.203726,Somewhat-Bullish
This Reliable 4%-Yielding Dividend Stock Continues to Add More Power to Grow Its Payout,https://www.fool.com/investing/2023/09/27/this-reliable-4-yielding-dividend-stock-continues/,2023-09-27 12:24:00,Southern Company's growing dividend has helped power a large portion of its total returns.,FSLR,0.060388,0.148017,Neutral
"Johnson Controls International To Rally Over 27%? Here Are 10 Other Analyst Forecasts For Wednesday - Costco Wholesale  ( NASDAQ:COST ) , Danaher  ( NYSE:DHR ) ",https://www.benzinga.com/news/23/09/34944454/johnson-controls-international-to-rally-over-27-here-are-10-other-analyst-forecasts-for-wednesday,2023-09-27 11:52:10,Keybanc cut the price target for Danaher Corporation DHR from $325 to $300. Keybanc analyst Paul Knight maintained an Overweight rating. Danaher shares rose 0.6% to $248.75 in pre-market trading. HSBC increased Johnson Controls International plc JCI price target from $58 to $69.,FSLR,0.272788,0.051177,Neutral
JinkoSolar  ( JKS )  Signs MoU for 200MW N-Type Tiger Neo Modules,https://www.zacks.com/stock/news/2156001/jinkosolar-jks-signs-mou-for-200mw-n-type-tiger-neo-modules,2023-09-27 10:55:00,JinkoSolar (JKS) partners with Failte Solar to supply 200 MW of its N-Type Tiger Neo Modules for Irish distribution generation market.,FSLR,0.169676,0.155204,Somewhat-Bullish
Wednesday Briefing: South China Sea Tensions Cross a Line,https://www.nytimes.com/2023/09/26/briefing/philippines-south-china-sea-ukraine-nagorno-karabakh.html,2023-09-26 22:13:23,"A diver's underwater cutting of a section of rope in the South China Sea, as shown in a short video clip this week, may seem too simple an act to qualify as a serious international incident.",FSLR,0.041466,-0.035009,Neutral
This Is What Whales Are Betting On First Solar - First Solar  ( NASDAQ:FSLR ) ,https://www.benzinga.com/markets/options/23/09/34919704/this-is-what-whales-are-betting-on-first-solar,2023-09-26 17:16:08,"A whale with a lot of money to spend has taken a noticeably bearish stance on First Solar. Looking at options history for First Solar FSLR we detected 33 strange trades. If we consider the specifics of each trade, it is accurate to state that 45% of the investors opened trades with bullish ...",FSLR,0.735697,-0.092904,Neutral
Can the U.S. Make Solar Panels? This Company Thinks So.,https://www.nytimes.com/2023/09/26/business/energy-environment/first-solar-panels-biden-ira.html,2023-09-26 05:00:26,First Solar kept producing them in Ohio after most of the industry moved to China. President Biden wants many more domestic manufacturers.,FSLR,0.271274,0.093972,Neutral
"Redefining The New Global Architecture In Solar Energy: The US, LAC, And China",https://www.forbes.com/sites/earlcarr/2023/09/26/redefining-the-new-global-architecture-in-solar-energy-the-us-lac-and-china/,2023-09-26 04:26:41,How nations develop alternative forms of energy- solar being a key example- and create competitive ecosystems are redefining traditional and non-traditional industries and geopolitical alliances. This is the new global architecture in solar energy.,FSLR,0.078099,0.053309,Neutral
Southern Power acquires South Cheyenne Solar Facility,https://www.prnewswire.com/news-releases/southern-power-acquires-south-cheyenne-solar-facility-301936816.html,2023-09-25 18:00:00,"ATLANTA, Sept. 25, 2023 /PRNewswire/ -- Southern Power, a leading U.S. wholesale energy provider and subsidiary of Southern Company, today announced the acquisition of its 30th solar project - the 150-megawatt ( MW ) South Cheyenne Solar Facility - from Qcells USA Corp. ( Qcells USA ) .",FSLR,0.041394,0.119095,Neutral
First Solar  ( FSLR )  Commences Louisiana Facility Construction,https://www.zacks.com/stock/news/2154721/first-solar-fslr-commences-louisiana-facility-construction,2023-09-25 12:46:00,"First Solar (FSLR) begins the construction of its Louisiana manufacturing facility, which comes with a capacity of 3.5 GW.",FSLR,0.328091,0.189885,Somewhat-Bullish
Should Schwab U.S. Mid-Cap ETF  ( SCHM )  Be on Your Investing Radar?,https://www.zacks.com/stock/news/2154629/should-schwab-us-mid-cap-etf-schm-be-on-your-investing-radar,2023-09-25 10:20:05,Style Box ETF report for ...,FSLR,0.12165,0.064739,Neutral
Who Wins & Loses The New Sino-American Green Trade War?,https://www.forbes.com/sites/arielcohen/2023/09/24/who-wins--loses-the-new-sino-american-green-trade-war/,2023-09-24 14:00:00,"As the Sino-American trade war goes green, winners and losers are not whom one would always expect. These new green tariffs are about far more than protecting industry.",FSLR,0.03642,0.038505,Neutral
Enphase  ( ENPH )  Unveils New Products for the UK Solar Market,https://www.zacks.com/stock/news/2154126/enphase-enph-unveils-new-products-for-the-uk-solar-market,2023-09-22 13:08:00,"Enphase (ENPH) recently unveiled a new home energy system for the United Kingdom's solar market, powered by IQ Battery 5P and IQ8 Microinverters.",FSLR,0.221313,0.091928,Neutral
7 Stocks Soar More Than 90% Even As Fed Hikes Rates,https://www.investors.com/etfs-and-funds/sectors/sp500-stocks-jump-more-than-following-the-feds-rate-hikes/,2023-09-22 12:00:00,Who says higher interest rates are bad for S&P 500 stocks? A select group is thriving even as the Federal Reserve hikes rates.,FSLR,0.172919,0.180895,Somewhat-Bullish
First Solar  ( FSLR )  Dips More Than Broader Markets: What You Should Know,https://www.zacks.com/stock/news/2153929/first-solar-fslr-dips-more-than-broader-markets-what-you-should-know,2023-09-21 21:50:19,"First Solar (FSLR) closed the most recent trading day at $166.24, moving -1.77% from the previous trading session.",FSLR,0.548633,0.173564,Somewhat-Bullish
This Is What Whales Are Betting On First Solar - First Solar  ( NASDAQ:FSLR ) ,https://www.benzinga.com/markets/options/23/09/34796561/this-is-what-whales-are-betting-on-first-solar,2023-09-21 15:32:03,"A whale with a lot of money to spend has taken a noticeably bearish stance on First Solar. Looking at options history for First Solar FSLR we detected 10 strange trades. If we consider the specifics of each trade, it is accurate to state that 40% of the investors opened trades with bullish ...",FSLR,0.78028,0.110336,Neutral
"First Solar, Inc.  ( FSLR )  is Attracting Investor Attention: Here is What You Should Know",https://www.zacks.com/stock/news/2152995/first-solar-inc-fslr-is-attracting-investor-attention-here-is-what-you-should-know,2023-09-20 13:00:06,"First Solar (FSLR) has received quite a bit of attention from Zacks.com users lately. Therefore, it is wise to be aware of the facts that can impact the stock's prospects.",FSLR,0.51278,0.145167,Neutral
These 3 Stocks Have Seen Favorable Price Target Upgrades,https://www.zacks.com/stock/news/2152207/these-3-stocks-have-seen-favorable-price-target-upgrades,2023-09-18 23:11:00,"It's critical to note that not all stocks reach analysts' forecasted levels, as unforeseen circumstances can always affect future performance. Still, the positivity surrounding upgrades can be seen as a solid takeaway.",FSLR,0.422661,0.504275,Bullish
Solar Co. Finds Signs of Important Metals at BC Project,https://www.investorideas.com/news/2023/renewable-energy/10061First-Tellurium.asp,2023-10-06 16:56:46,"October 6, 2023 ( Investorideas.com Newswire ) This explorer says it has found bornite at its Deer Horn property in British Columbia, a potential indicator for more valuable metals. First Tellurium Corp. ( FTEL:CSE.",FSLR,0.082677,0.10932,Neutral
Nobel Prize for Quantum Dots Validates the Broad Applicability of UbiQD's Core Technology - PR Newswire,https://www.prnewswire.com/news-releases/nobel-prize-for-quantum-dots-validates-the-broad-applicability-of-ubiqds-core-technology-301949226.html,2023-10-06 13:00:00,Nobel Prize for Quantum Dots Validates the Broad Applicability of UbiQD's Core Technology PR ...,FSLR,0.071357,0.138888,Neutral
"Schneider Electric to expand India operations, exports",https://www.financialexpress.com/business/industry-schneider-electric-to-expand-india-operations-exports-nbsp-3264290/,2023-10-05 21:00:00,"French energy automation company Schneider Electric has lined up plans to bolster its India base, and leverage it for world markets, Deepak Sharma, Zone President-Greater India and MD & CEO, told FE on Thursday. The firm, clocked 20% growth in exports from India in 2023.",FSLR,0.079921,0.073135,Neutral
Here's Why First Solar  ( FSLR )  Gained But Lagged the Market Today,https://www.zacks.com/stock/news/2160373/heres-why-first-solar-fslr-gained-but-lagged-the-market-today,2023-10-04 22:00:18,"First Solar (FSLR) reachead $151.82 at the closing of the latest trading day, reflecting a +0.38% change compared to its last close.",FSLR,0.514619,0.251121,Somewhat-Bullish
First Solar Unusual Options Activity - First Solar  ( NASDAQ:FSLR ) ,https://www.benzinga.com/markets/options/23/10/35065587/first-solar-unusual-options-activity,2023-10-03 14:31:53,"A whale with a lot of money to spend has taken a noticeably bearish stance on First Solar. Looking at options history for First Solar FSLR we detected 10 strange trades. If we consider the specifics of each trade, it is accurate to state that 40% of the investors opened trades with bullish ...",FSLR,0.823417,-0.012192,Neutral
Solar Energy Market worth $552.4 Billion by 2030 - Exclusive Report by The Insight Partners,https://www.benzinga.com/pressreleases/23/10/g35063400/solar-energy-market-worth-552-4-billion-by-2030-exclusive-report-by-the-insight-partners,2023-10-03 13:18:30,"Pune, India, Oct. 03, 2023 ( GLOBE NEWSWIRE ) -- According to The Insight Partners, ""Solar Energy Market Forecast to 2030 - COVID-19 Impact and Global Analysis - by Technology ( Photovoltaic Systems and Concentrated Solar Power Systems ) , Application ( Electricity Generation, Heating, and ...",FSLR,0.048523,0.090076,Neutral
Why Hydrogen Stocks Like FuelCell And Bloom Energy Are Lagging This Year,https://www.forbes.com/sites/greatspeculations/2023/10/03/why-hydrogen-stocks-like-fuelcell-and-bloom-energy-are-lagging-this-year/,2023-10-03 12:00:00,"Our theme of Hydrogen Economy Stocks, which includes the stocks of U.S. listed companies that sell hydrogen fuel cells, related renewable energy equipment, and supply ...",FSLR,0.079656,0.048222,Neutral
"Exclusive: Waaree Group aims to raise Rs 2,000 crore through IPO: CMD Hitesh Doshi",https://www.moneycontrol.com/news/interview/exclusive-waaree-group-aims-to-raise-rs-2000-crore-through-ipo-cmd-hitesh-doshi-11470141.html,2023-10-03 11:12:14,"Waaree Renewable Technologies Ltd, a subsidiary company, will open the group's first solar module manufacturing plant outside India, in Texas, US, the CMD said ...",FSLR,0.04303,0.017713,Neutral
"First Solar, Inc.  ( FSLR )  is Attracting Investor Attention: Here is What You Should Know",https://www.zacks.com/stock/news/2158622/first-solar-inc-fslr-is-attracting-investor-attention-here-is-what-you-should-know,2023-10-02 13:00:05,"First Solar (FSLR) has been one of the stocks most watched by Zacks.com users lately. So, it is worth exploring what lies ahead for the stock.",FSLR,0.513698,0.145341,Neutral
NXT Stock: Solar Firm Nextracker Powers Up Growth After IPO,https://www.investors.com/research/the-new-america/nxt-stock-solar-firm-nextracker-powers-up-growth-after-ipo/,2023-09-29 12:00:00,"Nextracker ( NXT ) has managed to shine despite a gloomy year for many of its fellow solar stocks. NXT stock is up nearly 70% from its initial public offering in February. Fremont-Calif.-based Nextracker is the world's largest manufacturer of solar trackers, the racks that enable solar panels ...",FSLR,0.032513,0.283284,Somewhat-Bullish
"Sandstorm Gold Royalties Renews Credit Facility, Amends Mercedes Stream, Provides Corporate and Development Asset Updates",https://www.newswire.ca/news-releases/sandstorm-gold-royalties-renews-credit-facility-amends-mercedes-stream-provides-corporate-and-development-asset-updates-859978644.html,2023-09-28 20:19:00,"Sandstorm Gold Royalties Renews Credit Facility, Amends Mercedes Stream, Provides Corporate and Development ... Canada ...",FSLR,0.01054,0.0,Neutral
"For Indian solar manufacturers battling Chinese threat, PLI brings hope",https://www.business-standard.com/economy/news/for-indian-solar-manufacturers-battling-chinese-threat-pli-brings-hope-123101500525_1.html,2023-10-15 16:31:31,"In 1989, Hitesh Doshi started a small solar equipment supply company in Mumbai. Back then, solar was restricted to government schemes and the offtake of solar equipment was limited to social welfare programmes. It was not until 2007 that Doshi's company, Waaree Energies, could set up its first ...",FSLR,0.421485,-0.181502,Somewhat-Bearish
"Bargain Hunting for Cheap Stocks: Down 34% to 65%, 3 to Buy on the Dip",https://www.fool.com/investing/2023/10/15/bargain-hunting-for-cheap-stocks-down-34-to-65-3-t/,2023-10-15 09:03:00,One is crazy cheap.,FSLR,0.846873,-0.347396,Somewhat-Bearish
First Solar  ( FSLR )  Dips More Than Broader Market: What You Should Know,https://www.zacks.com/stock/news/2165884/first-solar-fslr-dips-more-than-broader-market-what-you-should-know,2023-10-13 21:50:21,"In the most recent trading session, First Solar (FSLR) closed at $147.92, indicating a -0.98% shift from the previous trading day.",FSLR,0.512933,0.188587,Somewhat-Bullish
France to Double Renewable Output by 2035: Solar Stocks to Gain,https://www.zacks.com/stock/news/2165495/france-to-double-renewable-output-by-2035-solar-stocks-to-gain,2023-10-13 13:19:00,"The French government aims to expand its renewable power capacity by more than 100% by 2035, with solar constituting a major part of this expansion. This is likely to benefit FSLR, ENPH and SEDG.",FSLR,0.299478,0.45281,Bullish
Enphase  ( ENPH )  Ventures Into the Solar Market of South Africa,https://www.zacks.com/stock/news/2165451/enphase-enph-ventures-into-the-solar-market-of-south-africa,2023-10-13 12:41:00,Enphase (ENPH) enters the solar market of South Africa by unveiling its IQ8 Microinverters for residential customers and small commercial applications.,FSLR,0.270523,0.108148,Neutral
JinkoSolar  ( JKS )  Arm Ships More Than 52GW in 1st 3 Quarters,https://www.zacks.com/stock/news/2165488/jinkosolar-jks-arm-ships-more-than-52gw-in-1st-3-quarters,2023-10-13 12:08:00,"JinkoSolar (JKS) continues to maintain its position as a global leader in the modules market. With constant innovations, it strives to create a clean energy ecosystem.",FSLR,0.11983,0.089154,Neutral
