title,url,time_published,summary,ticker,relevance_score,ticker_sentiment_score,ticker_sentiment_label
Here's Why You Should Add Stryker  ( SYK )  Stock to Your Portfolio,https://www.zacks.com/stock/news/2075626/heres-why-you-should-add-stryker-syk-stock-to-your-portfolio,2023-04-06 14:43:00,"Stryker (SYK) continues to benefit from strength in the robotic arm-assisted surgery platform, Mako, and its broad product portfolio. However, pricing pressure weighs on the company.",HSIC,0.149966,0.08485,Neutral
Here's Why You Should Retain Surmodics  ( SRDX )  Stock for Now,https://www.zacks.com/stock/news/2075613/heres-why-you-should-retain-surmodics-srdx-stock-for-now,2023-04-06 14:35:00,Investors continue to feel optimistic about Surmodics (SRDX) owing to its solid prospects in the thrombectomy business.,HSIC,0.147516,0.085286,Neutral
Illumina  ( ILMN )  to Expand Genomics Capacity With New Pact,https://www.zacks.com/stock/news/2075478/illumina-ilmn-to-expand-genomics-capacity-with-new-pact,2023-04-06 13:38:00,Illumina's (ILMN) recent collaboration is built on the shared goal of the organizations to expand sequencing capabilities and capacity for all people in Africa.,HSIC,0.240489,-0.047229,Neutral
Here's Why Investors Should Invest in Zimmer Biomet  ( ZBH )  Now,https://www.zacks.com/stock/news/2075481/heres-why-investors-should-invest-in-zimmer-biomet-zbh-now,2023-04-06 13:37:00,Investors are optimistic about Zimmer Biomet (ZBH) on strong elective procedure recovery and commercial execution.,HSIC,0.195419,-0.046395,Neutral
Best Growth Stocks to Buy for April 6th,https://www.zacks.com/commentary/2075426/best-growth-stocks-to-buy-for-april-6th,2023-04-06 12:17:00,"ASUR, RL and HSIC made it to the Zacks Rank #1 (Strong Buy) growth stocks list on April 6, 2023.",HSIC,0.730954,0.235146,Somewhat-Bullish
Illumina's  ( ILMN )  NovaSeq X Exceeds 200 Order Milestone,https://www.zacks.com/stock/news/2075013/illuminas-ilmn-novaseq-x-exceeds-200-order-milestone,2023-04-05 15:55:00,Illumina's (ILMN) NovaSeq X records the strongest pre-launch demand ever witnessed for any instrument.,HSIC,0.216376,-0.051904,Neutral
3 Reasons to Retain Integer Holdings  ( ITGR )  Stock for Now,https://www.zacks.com/stock/news/2074965/3-reasons-to-retain-integer-holdings-itgr-stock-for-now,2023-04-05 15:13:00,Investors continue to be optimistic about Integer Holdings (ITGR) owing to its improving non-medical sales and a solid foothold in the broader MedTech space.,HSIC,0.206685,-0.050068,Neutral
Here's Why You Should Retain Inari Medical  ( NARI )  Stock Now,https://www.zacks.com/stock/news/2075011/heres-why-you-should-retain-inari-medical-nari-stock-now,2023-04-05 14:52:00,"Inari Medical (NARI) continues to benefit from its commitment to understand the venous system. However, its dependency on the adoption of products is concerning.",HSIC,0.132368,0.080399,Neutral
"CVS Health's  ( CVS )  New Initiatives Aid, Margin Woes Linger",https://www.zacks.com/stock/news/2074912/cvs-healths-cvs-new-initiatives-aid-margin-woes-linger,2023-04-05 14:07:00,CVS Health (CVS) launches functionality that gives patients more choices and convenience in filling prescriptions.,HSIC,0.208017,-0.05032,Neutral
4 Stocks Trading Near 52-Week High That Can Climb Further,https://www.zacks.com/stock/news/2074760/4-stocks-trading-near-52-week-high-that-can-climb-further,2023-04-05 12:48:00,"Investors target stocks that have been on a bullish run lately. Stocks like MYRG, HSIC, KR and COTY, which are seeing price strength, have a high chance of carrying the momentum forward.",HSIC,0.138145,0.178783,Somewhat-Bullish
Here's Why You Should Retain CONMED  ( CNMD )  Stock for Now,https://www.zacks.com/stock/news/2074458/heres-why-you-should-retain-conmed-cnmd-stock-for-now,2023-04-04 16:46:00,"Investors continue to be optimistic about CONMED (CNMD), owing to its broad product spectrum.",HSIC,0.14573,0.045964,Neutral
LabCorp  ( LH )  Expands Colon Cancer Test Access With New Pact,https://www.zacks.com/stock/news/2074448/labcorp-lh-expands-colon-cancer-test-access-with-new-pact,2023-04-04 16:35:00,LabCorp's (LH) at-home collection kit will offer patients an additional and easier option to get screened for colon cancer.,HSIC,0.232996,-0.055066,Neutral
Here's Why You Should Invest in Haemonetics  ( HAE )  Right Now,https://www.zacks.com/stock/news/2074449/heres-why-you-should-invest-in-haemonetics-hae-right-now,2023-04-04 16:34:00,"Investors are upbeat about Haemonetics (HAE) owing to impressive Plasma and Hospital business performance, with continued strength in the Hemostasis Management product line.",HSIC,0.193852,-0.046113,Neutral
3 Reasons to Retain AMN Healthcare  ( AMN )  Stock in Your Portfolio,https://www.zacks.com/stock/news/2074475/3-reasons-to-retain-amn-healthcare-amn-stock-in-your-portfolio,2023-04-04 16:23:00,Investors are optimistic about AMN Healthcare's (AMN) broad array of services.,HSIC,0.210731,-0.050833,Neutral
Masimo's  ( MASI )  New FDA Clearance to Boost Patient Monitoring,https://www.zacks.com/stock/news/2074471/masimos-masi-new-fda-clearance-to-boost-patient-monitoring,2023-04-04 16:10:00,Masimo's (MASI) receipt of the FDA's De Novo grant is expected to combat opioid overdoses by boosting patient monitoring.,HSIC,0.214462,-0.051512,Neutral
Here's What Makes UnitedHealth Group  ( UNH )  a Lucrative Bet Now,https://www.zacks.com/stock/news/2073922/heres-what-makes-unitedhealth-group-unh-a-lucrative-bet-now,2023-04-03 16:28:00,"UnitedHealth Group (UNH) is well-poised for growth on the back of a growing customer base within its government businesses, efficient telehealth services and solid cash-generating abilities.",HSIC,0.140896,0.112589,Neutral
3 Reasons to Retain PacBio  ( PACB )  Stock in Your Portfolio,https://www.zacks.com/stock/news/2073864/3-reasons-to-retain-pacbio-pacb-stock-in-your-portfolio,2023-04-03 16:07:00,PacBio's (PACB) product development activities raise optimism about the stock.,HSIC,0.215894,-0.051812,Neutral
Medtronic  ( MDT )  Launches New Venture to Treat Kidney Failure,https://www.zacks.com/stock/news/2073827/medtronic-mdt-launches-new-venture-to-treat-kidney-failure,2023-04-03 15:34:00,Medtronic's (MDT) new venture is dedicated to reshaping kidney health and driving patient-centered technology solutions.,HSIC,0.245339,-0.061176,Neutral
Here's Why You Should Retain Glaukos  ( GKOS )  in Your Portfolio,https://www.zacks.com/stock/news/2073793/heres-why-you-should-retain-glaukos-gkos-in-your-portfolio,2023-04-03 15:29:00,Glaukos (GKOS) continues to benefit from a robust product portfolio and favorable clinical trial results.,HSIC,0.180685,0.054336,Neutral
"Tandem Diabetes  ( TNDM )  Gains on Pump Sales, Margin Woe Stays",https://www.zacks.com/stock/news/2073790/tandem-diabetes-tndm-gains-on-pump-sales-margin-woe-stays,2023-04-03 15:13:00,Tandem Diabetes (TNDM) is now increasing its renewal numbers both in volume and rates.,HSIC,0.211191,-0.05092,Neutral
Why You Should Add Hologic  ( HOLX )  to Your Portfolio Now,https://www.zacks.com/stock/news/2073785/why-you-should-add-hologic-holx-to-your-portfolio-now,2023-04-03 15:07:00,"Hologic (HOLX) is currently well-positioned to achieve its full-year guidance of low double-digit organic growth ex-COVID in all three franchises, well above the 5-7% long-term growth rate.",HSIC,0.193852,0.003109,Neutral
Abbott's  ( ABT )  Epic Max Tissue Valve Receives FDA Approval,https://www.zacks.com/stock/news/2073266/abbotts-abt-epic-max-tissue-valve-receives-fda-approval,2023-03-31 16:48:00,Abbott's (ABT) Epic Max design optimizes patient blood flow and has a low profile that makes future cardiac interventions simpler.,HSIC,0.223866,-0.053328,Neutral
3 Reasons to Retain DaVita  ( DVA )  Stock in Your Portfolio,https://www.zacks.com/stock/news/2073273/3-reasons-to-retain-davita-dva-stock-in-your-portfolio,2023-03-31 15:58:00,Investors remain optimistic about DaVita (DVA) due to the strength in its DaVita Kidney Care.,HSIC,0.219809,-0.052556,Neutral
HSIC vs. ALGN: Which Stock Is the Better Value Option?,https://www.zacks.com/stock/news/2073084/hsic-vs-algn-which-stock-is-the-better-value-option,2023-03-31 15:40:14,Investors interested in Medical - Dental Supplies stocks are likely familiar with Henry Schein ( HSIC Quick QuoteHSIC - ) and Align Technology ( ALGN Quick QuoteALGN - ) . But which of these two stocks offers value investors a better bang for their buck right now? We'll need to take a closer look.,HSIC,0.701177,0.604964,Bullish
Leidos Partnership Deploys MHS GENESIS to National Capital Region - Leidos Holdings  ( NYSE:LDOS ) ,https://www.benzinga.com/pressreleases/23/03/n31606629/leidos-partnership-deploys-mhs-genesis-to-national-capital-region,2023-03-31 12:00:00,"RESTON, Va., March 31, 2023 /PRNewswire/ -- The Leidos Partnership for Defense Health ( LPDH ) today announced that it successfully delivered the MHS GENESIS electronic health record to an additional 14,000 clinicians and providers as part of its latest double wave deployment ( Waves WALTER ...",HSIC,0.060541,0.215096,Somewhat-Bullish
PacBio  ( PACB )  New Revio Workflows to Boost Agricultural Output,https://www.zacks.com/stock/news/2072613/pacbio-pacb-new-revio-workflows-to-boost-agricultural-output,2023-03-30 17:36:00,"PacBio (PACB), in collaboration with Corteva Agriscience, is likely to enable groundbreaking plant and microbial long-read sequencing workflow on Revio system.",HSIC,0.169279,0.105451,Neutral
"Catalent  ( CTLT )  New Launch to Aid TPD Programs, Clinical Trials",https://www.zacks.com/stock/news/2072593/catalent-ctlt-new-launch-to-aid-tpd-programs-clinical-trials,2023-03-30 16:34:00,Catalent's (CTLT) latest launch will likely aid in advancing the rational selection of orally developable TPD candidates and their progress into clinical trials.,HSIC,0.232996,-0.055066,Neutral
QIAGEN  ( QGEN )  QIAxcel Connect Gets Red Dot Design Award,https://www.zacks.com/stock/news/2072495/qiagen-qgen-qiaxcel-connect-gets-red-dot-design-award,2023-03-30 15:03:00,QIAGEN (QGEN) QIAxcel Connect automates the analysis of the size and quality of isolated DNA and RNA.,HSIC,0.235823,-0.055604,Neutral
Here's Why Investors Should Retain Omnicell  ( OMCL )  Stock Now,https://www.zacks.com/stock/news/2072021/heres-why-investors-should-retain-omnicell-omcl-stock-now,2023-03-29 16:17:00,Investors are optimistic about Omnicell (OMCL) owing to its planned geographic expansion.,HSIC,0.195025,-0.04788,Neutral
Illumina  ( ILMN )  to Enable Tertiary Analysis With New Launch,https://www.zacks.com/stock/news/2072012/illumina-ilmn-to-enable-tertiary-analysis-with-new-launch,2023-03-29 16:08:00,Illumina's (ILMN) Connected Software is an end-to-end software system that standardizes analysis tools and connects data across the genomics workflow.,HSIC,0.191549,-0.047234,Neutral
Reasons to Add The Cooper Companies  ( COO )  to Your Portfolio,https://www.zacks.com/stock/news/2071915/reasons-to-add-the-cooper-companies-coo-to-your-portfolio,2023-03-29 14:03:00,The Cooper Companies (COO) continues to benefit from strength in its business segments. Its acquisitions are likely to drive the top line further.,HSIC,0.137671,0.04695,Neutral
Surmodics  ( SRDX )  Gets FDA's Formal Feedback About SurVeil DCB,https://www.zacks.com/stock/news/2071886/surmodics-srdx-gets-fdas-formal-feedback-about-surveil-dcb,2023-03-29 12:44:00,Surmodics' (SRDX) receipt of the FDA's positive formal feedback regarding its PMA application for the SurVeil DCB looks promising.,HSIC,0.241085,-0.056605,Neutral
Reasons to Retain Quest Diagnostics  ( DGX )  Stock for Now,https://www.zacks.com/stock/news/2071400/reasons-to-retain-quest-diagnostics-dgx-stock-for-now,2023-03-28 15:12:00,Investors are optimistic about Quest Diagnostics (DGX) on solid fourth-quarter 2022 performance and its strategies to accelerate growth.,HSIC,0.188193,-0.046614,Neutral
"Walgreens Boots  ( WBA )  Q2 Earnings Top Estimates, Margins Down",https://www.zacks.com/stock/news/2071398/walgreens-boots-wba-q2-earnings-top-estimates-margins-down,2023-03-28 15:11:00,"The U.S. Healthcare segment of Walgreens Boots (WBA) grows on key contract wins, continued partnership growth and a strong focus on execution during fiscal Q2.",HSIC,0.169975,-0.043322,Neutral
Is Henry Schein  ( HSIC )  Stock Undervalued Right Now?,https://www.zacks.com/stock/news/2071321/is-henry-schein-hsic-stock-undervalued-right-now,2023-03-28 13:40:11,"Here at Zacks, our focus is on the proven Zacks Rank system, which emphasizes earnings estimates and estimate revisions to find great stocks. Nevertheless, we are always paying attention to the latest value, growth, and momentum trends to underscore strong picks.",HSIC,0.568651,0.338306,Somewhat-Bullish
Quest Diagnostics  ( DGX )  Introduces New Post-COVID-19 Panels,https://www.zacks.com/stock/news/2070872/quest-diagnostics-dgx-introduces-new-post-covid-19-panels,2023-03-27 15:28:00,"Quest Diagnostics' (DGX) latest panels provide consumers a deeper look into their health, helping to prepare them for meaningful discussions with their healthcare providers ...",HSIC,0.217834,-0.052181,Neutral
Here's Why You Should Retain Inogen  ( INGN )  Stock for Now,https://www.zacks.com/stock/news/2070832/heres-why-you-should-retain-inogen-ingn-stock-for-now,2023-03-27 14:22:00,Investors continue to be optimistic about Inogen (INGN) on its potential in the POC space and a strong product portfolio.,HSIC,0.226477,-0.053825,Neutral
Here's Why You Should Retain DENTSPLY SIRONA  ( XRAY )  Stock Now,https://www.zacks.com/stock/news/2070675/heres-why-you-should-retain-dentsply-sirona-xray-stock-now,2023-03-27 11:29:00,"DENTSPLY SIRONA (XRAY) continues to gain traction from a robust product portfolio. However, macroeconomic factors like weakened global demand, rising costs and forex woes persist.",HSIC,0.162802,0.049226,Neutral
MedTech Bigwigs in Spotlight as AI Revolutionizes Healthcare,https://www.zacks.com/stock/news/2070332/medtech-bigwigs-in-spotlight-as-ai-revolutionizes-healthcare,2023-03-24 17:02:00,MedTech player like Medtronic (MDT) are integrating artificial intelligence (AI) capabilities to aid therapeutic and diagnostic applications.,HSIC,0.2589,0.027341,Neutral
Dexcom  ( DXCM )  Launches G6 Glucose Monitoring System in Canada,https://www.zacks.com/stock/news/2070276/dexcom-dxcm-launches-g6-glucose-monitoring-system-in-canada,2023-03-24 15:59:00,Dexcom (DXCM) announces the availability of standard of care in diabetes management - G6 CGM system - for type 1 and 2 patients with basal and bolus insulin or using an insulin pump in Canada.,HSIC,0.171688,0.093985,Neutral
Here's Why You Should Retain PerkinElmer  ( PKI )  Stock Now,https://www.zacks.com/stock/news/2070253/heres-why-you-should-retain-perkinelmer-pki-stock-now,2023-03-24 15:47:00,PerkinElmer (PKI) continues to gain from a solid product portfolio despite forex woes.,HSIC,0.142284,0.046573,Neutral
Catalent  ( CTLT )  Inks Deal for Nasal Spray for Opioid Overdoses,https://www.zacks.com/stock/news/2070302/catalent-ctlt-inks-deal-for-nasal-spray-for-opioid-overdoses,2023-03-24 15:16:00,Catalent's (CTLT) latest commercial supply agreement is expected to combat the opioid epidemic by making OTC naloxone more widely and easily accessible.,HSIC,0.231884,-0.054855,Neutral
Medtronic  ( MDT )  to Enhance AI Innovation With New Platform,https://www.zacks.com/stock/news/2069781/medtronic-mdt-to-enhance-ai-innovation-with-new-platform,2023-03-23 16:48:00,"Medtronic's (MDT) GI Genius intelligent endoscopy module is the first FDA-cleared, AI-assisted colonoscopy tool to help physicians detect polyps that can lead to colorectal cancer.",HSIC,0.206245,-0.049985,Neutral
3 Reasons to Retain QuidelOrtho  ( QDEL )  Stock in Your Portfolio,https://www.zacks.com/stock/news/2069757/3-reasons-to-retain-quidelortho-qdel-stock-in-your-portfolio,2023-03-23 16:19:00,Investors continue to be optimistic about QuidelOrtho (QDEL) owing to its strong product portfolio.,HSIC,0.214462,-0.05154,Neutral
Reasons to Retain West Pharmaceutical  ( WST )  in Your Portfolio,https://www.zacks.com/stock/news/2069734/reasons-to-retain-west-pharmaceutical-wst-in-your-portfolio,2023-03-23 15:40:00,"West Pharmaceutical (WST) continues to gain momentum due to its strength in the Proprietary Products business. However, forex concerns persist.",HSIC,0.158868,0.049764,Neutral
Quest Diagnostics  ( DGX )  Advances Transplant Testing Service,https://www.zacks.com/stock/news/2069682/quest-diagnostics-dgx-advances-transplant-testing-service,2023-03-23 15:19:00,"These services by Quest Diagnostics (DGX) are available to recipients and living donors across the United States (excluding Alaska and Hawaii), broadening access for both donor and patient.",HSIC,0.230782,-0.054645,Neutral
Here's Why You Should Retain Patterson Companies  ( PDCO )  Stock,https://www.zacks.com/stock/news/2069662/heres-why-you-should-retain-patterson-companies-pdco-stock,2023-03-23 14:24:00,Investors are optimistic about Patterson Companies' (PDCO) strong product line.,HSIC,0.134841,0.045247,Neutral
Here's Why You Should Retain Abbott  ( ABT )  Stock for Now,https://www.zacks.com/stock/news/2069241/heres-why-you-should-retain-abbott-abt-stock-for-now,2023-03-22 17:07:00,Investors are optimistic about Abbott (ABT) on continued growth in the core Diagnostics arm.,HSIC,0.193852,-0.047662,Neutral
Neogen  ( NEOG )  Receives New Label Claims for Viroxide Super,https://www.zacks.com/stock/news/2069237/neogen-neog-receives-new-label-claims-for-viroxide-super,2023-03-22 16:53:00,"Neogen's (NEOG) Viroxide Super active constituents are potassium peroxymonosulfate and sodium chloride, which have been verified effective against multiple industry-relevant bacteria and viruses.",HSIC,0.20537,-0.04982,Neutral
Three Reasons to Add Masimo  ( MASI )  Stock to Your Portfolio,https://www.zacks.com/stock/news/2069183/three-reasons-to-add-masimo-masi-stock-to-your-portfolio,2023-03-22 15:58:00,Investors continue to be optimistic about Masimo (MASI) due to its focus on patient monitoring.,HSIC,0.214937,-0.051602,Neutral
"Chemed  ( CHE )  Up on Roto-Rooter Sales Growth, Strong Admissions",https://www.zacks.com/stock/news/2069207/chemed-che-up-on-roto-rooter-sales-growth-strong-admissions,2023-03-22 15:13:00,"Chemed (CHE) records increases in drain cleaning, plumbing, excavation and water restoration revenues within the Roto-Rooter branch commercial business.",HSIC,0.25168,-0.056711,Neutral
Henry Schein  ( HSIC )  Bolsters Dental Practices With AI Tools,https://www.zacks.com/stock/news/2068881/henry-schein-hsic-bolsters-dental-practices-with-ai-tools,2023-03-22 11:40:00,"Henry Schein (HSIC) integrates AI-enabled solutions, Dentrix Ascend Detect AI and Dentrix Ascend Voice, into its cloud-based dental software.",HSIC,0.503559,0.611527,Bullish
Syneos Health's  ( SYNH )  New Microsoft Deal to Expand AI Usage,https://www.zacks.com/stock/news/2068548/syneos-healths-synh-new-microsoft-deal-to-expand-ai-usage,2023-03-21 13:04:00,"With the multi-year deal, Syneos Health (SYNH) aims to deliver technology and data solutions with Microsoft.",HSIC,0.24847,-0.058005,Neutral
Merit Medical's  ( MMSI )  New Launch to Boost its Product Suite,https://www.zacks.com/stock/news/2068530/merit-medicals-mmsi-new-launch-to-boost-its-product-suite,2023-03-21 12:45:00,Merit Medical's (MMSI) latest addition to its Vascular portfolio is expected to significantly enhance patient outcomes.,HSIC,0.22861,-0.054231,Neutral
NuVasive's  ( NUVA )  Precice System Cleared for Pediatric Patients,https://www.zacks.com/stock/news/2068400/nuvasives-nuva-precice-system-cleared-for-pediatric-patients,2023-03-21 11:40:00,NuVasive (NUVA) receives FDA 510(k) clearance for using the Precice limb lengthening system for treating pediatric patients.,HSIC,0.24847,0.039692,Neutral
Universal Health  ( UHS )  Up 26% in 6 Months: More Room to Run?,https://www.zacks.com/stock/news/2068141/universal-health-uhs-up-26-in-6-months-more-room-to-run,2023-03-20 18:45:00,"Universal Health (UHS) is well-poised for growth on the back of improved patient volumes, acquisitions and robust cash-generating abilities.",HSIC,0.220809,0.131841,Neutral
Catalent  ( CTLT )  Inks Deal for New & Effective Drug Delivery,https://www.zacks.com/stock/news/2068098/catalent-ctlt-inks-deal-for-new-effective-drug-delivery,2023-03-20 15:13:00,"Catalent (CTLT) will use Bhami Research Laboratory's technology to evaluate and develop drug-delivery system for high-concentration therapies, thereby increasing effectiveness.",HSIC,0.188683,0.100551,Neutral
Here's Why You Should Retain Accuray  ( ARAY )  Stock for Now,https://www.zacks.com/stock/news/2067941/heres-why-you-should-retain-accuray-aray-stock-for-now,2023-03-20 12:35:00,Investors continue to be optimistic about Accuray (ARAY) owing to strong demand for its products.,HSIC,0.213988,-0.05145,Neutral
BD's  ( BDX )  New FDA Approval to Improve Vaginitis Testing,https://www.zacks.com/stock/news/2067345/bds-bdx-new-fda-approval-to-improve-vaginitis-testing,2023-03-17 14:40:00,BD's (BDX) receipt of the latest FDA approval is likely to improve the detection and prevention of vaginitis.,HSIC,0.168785,-0.043089,Neutral
Catalent's  ( CTLT )  Tie-Up to Accelerate Clinical Trial Timelines,https://www.zacks.com/stock/news/2066808/catalents-ctlt-tie-up-to-accelerate-clinical-trial-timelines,2023-03-16 15:19:00,Catalent's (CTLT) latest collaboration is expected to leverage multiple services that reduce drug development timelines.,HSIC,0.230235,-0.054541,Neutral
Reasons to Retain Cardinal Health  ( CAH )  in Your Portfolio,https://www.zacks.com/stock/news/2066740/reasons-to-retain-cardinal-health-cah-in-your-portfolio,2023-03-16 12:48:00,"Cardinal Health (CAH) continues to gain traction from solid pharmaceutical segment and a diversified product portfolio. However, the rising cost of products is a concern.",HSIC,0.137148,0.081884,Neutral
Shockwave Medical  ( SWAV )  Launches New IVL Catheter in U.S.,https://www.zacks.com/stock/news/2066548/shockwave-medical-swav-launches-new-ivl-catheter-in-us,2023-03-16 10:30:00,Shockwave Medical's (SWAV) latest U.S. launch is expected to serve a wider patient pool.,HSIC,0.212115,-0.051095,Neutral
Here's Why You Should Retain Merit Medical  ( MMSI )  Stock for Now,https://www.zacks.com/stock/news/2066291/heres-why-you-should-retain-merit-medical-mmsi-stock-for-now,2023-03-15 16:18:00,Investors continue to be optimistic about Merit Medical (MMSI) owing to its strong product portfolio.,HSIC,0.208464,-0.050404,Neutral
PacBio's  ( PACB )  Latest Offering to Enhance Genome Analysis,https://www.zacks.com/stock/news/2066232/pacbios-pacb-latest-offering-to-enhance-genome-analysis,2023-03-15 14:57:00,"PacBio's (PACB) new informatics analysis method, Paraphase, will enable researchers to genotype gene paralogs and pseudogenes with high accuracy.",HSIC,0.200134,0.106656,Neutral
Reasons to Retain AmerisourceBergen  ( ABC )  in Your Portfolio,https://www.zacks.com/stock/news/2066229/reasons-to-retain-amerisourcebergen-abc-in-your-portfolio,2023-03-15 14:54:00,"AmerisourceBergen (ABC) continues to gain traction from the robust U.S. Healthcare Solutions segment. However, stiff competition is a concern.",HSIC,0.135094,0.081239,Neutral
"The Zacks Analyst Blog Highlights Ameriprise Financial, Everest Re Group, Microchip Technology, Henry Schein and HSBC Holdings",https://www.zacks.com/stock/news/2066124/the-zacks-analyst-blog-highlights-ameriprise-financial-everest-re-group-microchip-technology-henry-schein-and-hsbc-holdings,2023-03-15 13:04:00,"Ameriprise Financial, Everest Re Group, Microchip Technology, Henry Schein and HSBC Holdings are part of the Zacks top Analyst Blog.",HSIC,0.177584,0.284002,Somewhat-Bullish
Henry Schein  ( HSIC )  Aids Growth of Ambulatory Surgery Centers,https://www.zacks.com/stock/news/2065623/henry-schein-hsic-aids-growth-of-ambulatory-surgery-centers,2023-03-14 16:29:00,Henry Schein (HSIC) joined ASCA as part of its commitment to augment the value of ambulatory surgery centers.,HSIC,0.366061,0.335868,Somewhat-Bullish
OPKO Health  ( OPK )  to Develop EBV Vaccine With Latest Tie-Up,https://www.zacks.com/stock/news/2065588/opko-health-opk-to-develop-ebv-vaccine-with-latest-tie-up,2023-03-14 16:08:00,OPKO Health's (OPK) entry into a worldwide license and collaboration agreement with Merck is expected to aid in developing a vaccine against EBV.,HSIC,0.243498,-0.057063,Neutral
Here's Why You Should Retain NextGen  ( NXGN )  Stock for Now,https://www.zacks.com/stock/news/2065575/heres-why-you-should-retain-nextgen-nxgn-stock-for-now,2023-03-14 15:55:00,NextGen's (NXGN) strong product portfolio and continued demand for its solutions raise optimism about the stock.,HSIC,0.216376,-0.051904,Neutral
"Henry Schein  ( HSIC )  International Growth Solid, Dental Rebounds",https://www.zacks.com/stock/news/2065456/henry-schein-hsic-international-growth-solid-dental-rebounds,2023-03-14 14:28:00,Henry Schein's (HSIC) distribution business boasts a wide global footprint with 61 distribution centers.,HSIC,0.301933,0.460556,Bullish
5 Discounted Value Picks Based on PEG Ratio,https://www.zacks.com/stock/news/2065296/5-discounted-value-picks-based-on-peg-ratio,2023-03-14 13:11:00,"Here are five stocks that pass our screening criteria. These are HSIC, KR, BIDU, TOL and ACGL.",HSIC,0.222546,0.182707,Somewhat-Bullish
Fed May Stick to 25 bps Rate Hike After SVB Fiasco: 5 Picks,https://www.zacks.com/stock/news/2065395/fed-may-stick-to-25-bps-rate-hike-after-svb-fiasco-5-picks,2023-03-14 12:40:00,"We have narrowed the search to select five companies that have strong potential for 2023. These are: AMP, RE, MCHP, HSIC and HSBC.",HSIC,0.154852,0.378656,Bullish
