title,url,time_published,summary,ticker,relevance_score,ticker_sentiment_score,ticker_sentiment_label
CVS Health  ( CVS )  to Report Q1 Earnings: What's in the Cards?,https://www.zacks.com/stock/news/2085230/cvs-health-cvs-to-report-q1-earnings-whats-in-the-cards,2023-04-26 14:57:00,CVS Health's (CVS) digital capabilities are expected to have driven consumer engagement across all CVS Health businesses in Q1.,HSIC,0.08687,0.0,Neutral
"Boston Scientific  ( BSX )  Q1 Earnings Beat, 2023 View Raised",https://www.zacks.com/stock/news/2085157/boston-scientific-bsx-q1-earnings-beat-2023-view-raised,2023-04-26 14:50:00,Reported and organic revenues at each of Boston Scientific's (BSX) core business segments and geographies increase in the reported quarter.,HSIC,0.227859,0.094096,Neutral
"Thermo Fisher  ( TMO )  Q1 Earnings Beat Estimates, Margins Down",https://www.zacks.com/stock/news/2085228/thermo-fisher-tmo-q1-earnings-beat-estimates-margins-down,2023-04-26 14:49:00,The year-over-year growth in the Analytical Instruments and the Laboratory Products and Biopharma Services segments drove Thermo Fisher's (TMO) Q1 revenues.,HSIC,0.263373,0.105818,Neutral
AmerisourceBergen  ( ABC )  to Post Q2 Earnings: What's in Store?,https://www.zacks.com/stock/news/2085156/amerisourcebergen-abc-to-post-q2-earnings-whats-in-store,2023-04-26 14:41:00,AmerisourceBergen's (ABC) fiscal 2023 second-quarter results are likely to reflect solid performance in the U.S. Healthcare Solutions segment.,HSIC,0.179788,0.104243,Neutral
3 Dental Supplies Stocks to Buy as Industry Prospects Recover,https://www.zacks.com/commentary/2084877/3-dental-supplies-stocks-to-buy-as-industry-prospects-recover,2023-04-26 14:33:00,"Here, we discuss three stocks from the Dental Supplies industry that are likely to create wealth for investors. These include WST, COO and HSIC.",HSIC,0.158519,0.20125,Somewhat-Bullish
"Illumina  ( ILMN )  Q1 Earnings Beat Estimates, Margins Contract",https://www.zacks.com/stock/news/2084868/illumina-ilmn-q1-earnings-beat-estimates-margins-contract,2023-04-26 13:26:00,"Illumina's (ILMN) Q1 revenues decline year over year, reflecting the impact of Covid-19 monitoring headwinds and the transition of its high-throughput customers to NovaSeq X.",HSIC,0.123844,0.046875,Neutral
3 MedTech Stocks Likely to Beat Estimates in Q1 Earnings,https://www.zacks.com/stock/news/2084748/3-medtech-stocks-likely-to-beat-estimates-in-q1-earnings,2023-04-26 12:14:00,"MedTech companies' results are likely to reflect base business recovery on a year-over-year basis. Let's see how BIO, HSIC and PODD are poised ahead of their earnings releases.",HSIC,0.228533,0.116633,Neutral
Ecolab  ( ECL )  to Report Q1 Earnings: What's in the Offing?,https://www.zacks.com/stock/news/2084509/ecolab-ecl-to-report-q1-earnings-whats-in-the-offing,2023-04-25 17:38:00,Ecolab's (ECL) first-quarter results are likely to reflect continued strength in its Global Industrial segment.,HSIC,0.11166,0.100131,Neutral
"LabCorp  ( LH )  Q1 Earnings Miss Estimates, Margins Decline",https://www.zacks.com/stock/news/2084471/labcorp-lh-q1-earnings-miss-estimates-margins-decline,2023-04-25 16:10:00,"The decline in COVID-19 PCR and antibody testing sales, the severe foreign exchange headwind and inflationary pressure hurt LabCorp's (LH) business performance in Q1.",HSIC,0.215702,0.088432,Neutral
Henry Schein  ( HSIC )  Expected to Beat Earnings Estimates: What to Know Ahead of Q1 Release,https://www.zacks.com/stock/news/2084231/henry-schein-hsic-expected-to-beat-earnings-estimates-what-to-know-ahead-of-q1-release,2023-04-25 14:01:19,Henry Schein (HSIC) possesses the right combination of the two key ingredients for a likely earnings beat in its upcoming report. Get prepared with the key expectations.,HSIC,0.260189,0.098262,Neutral
STERIS  ( STE )  Set to Post Q4 Earnings: What's in the Cards?,https://www.zacks.com/stock/news/2083979/steris-ste-set-to-post-q4-earnings-whats-in-the-cards,2023-04-25 12:51:00,"STERIS' (STE) fourth-quarter fiscal 2023 results are likely to reflect an impressive performance across the Healthcare and AST segments, with a gradual improvement in the supply chain.",HSIC,0.167612,0.133441,Neutral
Stryker  ( SYK )  to Report Q1 Earnings: What's in the Cards?,https://www.zacks.com/stock/news/2083952/stryker-syk-to-report-q1-earnings-whats-in-the-cards,2023-04-25 11:30:00,"Stryker's (SYK) first-quarter results are expected to reflect strong segmental performances. However, rising costs are likely to have continued hurting margins.",HSIC,0.186738,0.10273,Neutral
3 Reasons to Retain HealthEquity  ( HQY )  Stock in Your Portfolio,https://www.zacks.com/stock/news/2083471/3-reasons-to-retain-healthequity-hqy-stock-in-your-portfolio,2023-04-24 14:24:00,Investors continue to be optimistic about HealthEquity's (HQY) strength in HSA.,HSIC,0.211652,0.006553,Neutral
GYN Surgical Sales to Aid Hologic  ( HOLX )  in Q2 Earnings,https://www.zacks.com/stock/news/2083512/gyn-surgical-sales-to-aid-hologic-holx-in-q2-earnings,2023-04-24 14:20:00,Strong performance led by MyoSure and NovaSure is expected to have driven Hologic' s (HOLX) Q2 performance.,HSIC,0.104911,0.0,Neutral
BioRad Laboratories  ( BIO )  to Post Q1 Earnings: What's in Store?,https://www.zacks.com/stock/news/2083202/biorad-laboratories-bio-to-post-q1-earnings-whats-in-store,2023-04-24 10:59:00,"Bio-Rad Laboratories' (BIO) first-quarter 2023 results are likely to reflect an impressive performance across its Life Science segment, with a gradual reduction in backlogs and an improvement in the supply chain.",HSIC,0.199859,0.151384,Somewhat-Bullish
DexCom  ( DXCM )  to Report Q1 Earnings: What's in the Cards?,https://www.zacks.com/stock/news/2083218/dexcom-dxcm-to-report-q1-earnings-whats-in-the-cards,2023-04-24 10:35:00,DexCom's (DXCM) first-quarter results likely to reflect rising volumes across all channels.,HSIC,0.157483,0.091382,Neutral
Neogen  ( NEOG )  New Buyouts Aid Growth Amid Rise in Expenses,https://www.zacks.com/stock/news/2082894/neogen-neog-new-buyouts-aid-growth-amid-rise-in-expenses,2023-04-21 15:35:00,"Neogen's (NEOG) performance of the Food Safety business is strong, driven by several long-term secular tailwinds.",HSIC,0.180798,-0.04379,Neutral
AmerisourceBergen's  ( ABC )  New JV to Boost Oncology Care,https://www.zacks.com/stock/news/2082868/amerisourcebergens-abc-new-jv-to-boost-oncology-care,2023-04-21 15:28:00,AmerisourceBergen's (ABC) new JV is expected to provide the independent community oncology network with additional resources and expertise to grow the platform and improve patient outcomes.,HSIC,0.236972,0.007183,Neutral
Here's Why You Should Retain NextGen  ( NXGN )  Stock for Now,https://www.zacks.com/stock/news/2082858/heres-why-you-should-retain-nextgen-nxgn-stock-for-now,2023-04-21 15:17:00,NextGen's (NXGN) strong product portfolio and continued demand for its solutions raise optimism about the stock.,HSIC,0.159569,0.089508,Neutral
What's in Store for West Pharmaceutical  ( WST )  in Q1 Earnings?,https://www.zacks.com/stock/news/2082836/whats-in-store-for-west-pharmaceutical-wst-in-q1-earnings,2023-04-21 14:57:00,"West Pharmaceutical's (WST) first-quarter 2023 results are likely to reflect strength in the Proprietary Products business. However, unfavorable currency movements might have hurt the top and bottom lines.",HSIC,0.190167,0.108595,Neutral
Hologic  ( HOLX )  to Report Q2 Earnings: What's in the Cards?,https://www.zacks.com/stock/news/2082845/hologic-holx-to-report-q2-earnings-whats-in-the-cards,2023-04-21 14:01:00,Robust performance from MyoSure and NovaSure along with increasing contributions from the company's laparoscopic portfolio are expected to have contributed to the Hologic's (HOLX) Q2 reveneus.,HSIC,0.104002,0.0,Neutral
IDEXX Laboratories  ( IDXX )  to Post Q1 Earnings: What's in Store?,https://www.zacks.com/stock/news/2082610/idexx-laboratories-idxx-to-post-q1-earnings-whats-in-store,2023-04-21 12:21:00,IDEXX Laboratories' (IDXX) first-quarter 2023 results are expected to reflect an impressive performance in the CAG segment despite inflationary impacts.,HSIC,0.167904,0.133597,Neutral
Henry Schein  ( HSIC )  Gains As Market Dips: What You Should Know,https://www.zacks.com/stock/news/2082478/henry-schein-hsic-gains-as-market-dips-what-you-should-know,2023-04-20 22:00:20,"In the latest trading session, Henry Schein (HSIC) closed at $83.01, marking a +0.07% move from the previous day.",HSIC,0.666827,0.17636,Somewhat-Bullish
Zimmer Biomet  ( ZBH )  Hits 52-Week High: What's Driving It?,https://www.zacks.com/stock/news/2082240/zimmer-biomet-zbh-hits-52-week-high-whats-driving-it,2023-04-20 14:41:00,Investors are optimistic about Zimmer Biomet's (ZBH) continued business recovery.,HSIC,0.208914,-0.050462,Neutral
Masimo's  ( MASI )  New FDA Approval to Improve Patient Monitoring,https://www.zacks.com/stock/news/2082238/masimos-masi-new-fda-approval-to-improve-patient-monitoring,2023-04-20 14:37:00,Masimo's (MASI) receipt of the FDA's clearance for the Rad-G with Temperature is expected to support clinicians in almost any care scenario.,HSIC,0.243498,-0.057033,Neutral
Henry Schein  ( HSIC )  to Report Q1 Earnings: What's in Store?,https://www.zacks.com/stock/news/2082024/henry-schein-hsic-to-report-q1-earnings-whats-in-store,2023-04-20 13:51:00,"Henry Schein's (HSIC) medical business is expected to have gained from improved U.S. patient traffic to physician offices, ultimate care sites and ambulatory surgical centers.",HSIC,0.291842,0.369868,Bullish
What's in Store for Edwards Lifesciences  ( EW )  in Q1 Earnings?,https://www.zacks.com/stock/news/2081900/whats-in-store-for-edwards-lifesciences-ew-in-q1-earnings,2023-04-20 12:07:00,Continued demand for the HemoSphere monitoring platform and Smart Recovery is likely to have contributed to the Edwards Lifesciences' (EW) Q1 growth.,HSIC,0.1331,0.0,Neutral
Baxter  ( BAX )  to Post Q1 Earnings: What's in the Offing?,https://www.zacks.com/stock/news/2081798/baxter-bax-to-post-q1-earnings-whats-in-the-offing,2023-04-20 11:12:00,"Baxter's (BAX) first-quarter results are likely to reflect growth in elective surgical procedures, offset by currency movement. Hillrom's products might have boosted sales.",HSIC,0.128135,0.084983,Neutral
Quest Diagnostics  ( DGX )  to Post Q1 Earnings: What's in Store?,https://www.zacks.com/stock/news/2081749/quest-diagnostics-dgx-to-post-q1-earnings-whats-in-store,2023-04-20 10:57:00,Quest Diagnostics' (DGX) first-quarter 2023 results are likely to reflect an impressive performance in its non-COVID-19 base business amid inflationary pressure and labor challenges.,HSIC,0.156715,0.12774,Neutral
Zimmer Biomet  ( ZBH )  to Report Q1 Earnings: What's in Store?,https://www.zacks.com/stock/news/2081461/zimmer-biomet-zbh-to-report-q1-earnings-whats-in-store,2023-04-19 15:49:00,"Zimmer Biomet (ZBH) might have faced an upheaval in business, thanks to the global inflationary situation in terms of mounting labor and raw material costs, severe staffing shortages and supply issues.",HSIC,0.102013,0.0,Neutral
Reasons to Retain AmerisourceBergen  ( ABC )  in Your Portfolio,https://www.zacks.com/stock/news/2081413/reasons-to-retain-amerisourcebergen-abc-in-your-portfolio,2023-04-19 15:12:00,"AmerisourceBergen (ABC) continues to gain traction from the robust U.S. Healthcare Solutions segment. However, stiff competition is a woe.",HSIC,0.134841,0.08116,Neutral
"Abbott's  ( ABT )  Q1 Earnings Beat Estimates, Margins Down",https://www.zacks.com/stock/news/2081409/abbotts-abt-q1-earnings-beat-estimates-margins-down,2023-04-19 14:03:00,"Double-digit organic growth in Diabetes Care, Structural Heart, Heart Failure and Neuromodulation contributed to Abbott's (ABT) Q1 revenues.",HSIC,0.206862,0.083987,Neutral
Are Investors Undervaluing Henry Schein  ( HSIC )  Right Now?,https://www.zacks.com/stock/news/2081004/are-investors-undervaluing-henry-schein-hsic-right-now,2023-04-19 13:40:12,"Here at Zacks, our focus is on the proven Zacks Rank system, which emphasizes earnings estimates and estimate revisions to find great stocks. Nevertheless, we are always paying attention to the latest value, growth, and momentum trends to underscore strong picks.",HSIC,0.634884,0.324647,Somewhat-Bullish
Catalent  ( CTLT )  Declines on Profit Warnings and CFO Exit,https://www.zacks.com/stock/news/2080674/catalent-ctlt-declines-on-profit-warnings-and-cfo-exit,2023-04-18 17:55:00,Catalent (CTLT) issues a profit warning for third-quarter fiscal 2023 amid supply chain disruptions and operational challenges. It also announces the departure of its CFO.,HSIC,0.31482,0.168429,Somewhat-Bullish
What's in Store for Boston Scientific  ( BSX )  in Q1 Earnings?,https://www.zacks.com/stock/news/2080593/whats-in-store-for-boston-scientific-bsx-in-q1-earnings,2023-04-18 16:26:00,"Boston Scientific (BSX) is expected to have registered strong growth in EMEA within structural heart, including TAVR, WATCHMAN, and other interventional cardiology therapies in the first quarter.",HSIC,0.068797,0.0,Neutral
What's in Store for Thermo Fisher  ( TMO )  in Q1 Earnings?,https://www.zacks.com/stock/news/2080645/whats-in-store-for-thermo-fisher-tmo-in-q1-earnings,2023-04-18 16:02:00,"Thermo Fisher (TMO) is likely to have generated growth in the first quarter, driven by a favorable business mix and new launches.",HSIC,0.081414,0.0,Neutral
3 Reasons to Retain Merit Medical  ( MMSI )  Stock in Your Portfolio,https://www.zacks.com/stock/news/2080520/3-reasons-to-retain-merit-medical-mmsi-stock-in-your-portfolio,2023-04-18 15:32:00,Investors continue to be optimistic about Merit Medical (MMSI) owing to its strong product portfolio.,HSIC,0.203215,-0.049414,Neutral
Align Technology  ( ALGN )  to Post Q1 Earnings: What's in Store?,https://www.zacks.com/stock/news/2080230/align-technology-algn-to-post-q1-earnings-whats-in-store,2023-04-18 13:23:00,Align Technology's (ALGN) first-quarter 2023 results are likely to witness impressive performance across its operating segments amid macroeconomic pressure.,HSIC,0.183895,0.142347,Neutral
HSIC or MMSI: Which Is the Better Value Stock Right Now?,https://www.zacks.com/stock/news/2079790/hsic-or-mmsi-which-is-the-better-value-stock-right-now,2023-04-17 15:40:13,HSIC vs. MMSI: Which Stock Is the Better Value Option?,HSIC,0.773597,0.663321,Bullish
QuidelOrtho  ( QDEL )  Reports Solid Preliminary Q1 Revenues,https://www.zacks.com/stock/news/2079737/quidelortho-qdel-reports-solid-preliminary-q1-revenues,2023-04-17 14:28:00,QuidelOrtho's (QDEL) revenue growth in the first quarter is likely to have been boosted by continued strength in its non-respiratory product sales.,HSIC,0.256989,0.111265,Neutral
3 Reasons to Retain Veeva Systems  ( VEEV )  Stock in Your Portfolio,https://www.zacks.com/stock/news/2079728/3-reasons-to-retain-veeva-systems-veev-stock-in-your-portfolio,2023-04-17 14:19:00,Veeva Systems' (VEEV) strong product portfolio raises optimism about the stock.,HSIC,0.200273,-0.048861,Neutral
Here's Why You Should Invest in Henry Schein  ( HSIC )  Now,https://www.zacks.com/stock/news/2079716/heres-why-you-should-invest-in-henry-schein-hsic-now,2023-04-17 14:00:00,"Investors are optimistic about Henry Schein (HSIC), led by the strong potential in the company's dental technology joint venture, Henry Schein One.",HSIC,0.515466,0.58462,Bullish
LabCorp  ( LH )  to Report Q1 Earnings: What's in the Cards?,https://www.zacks.com/stock/news/2079663/labcorp-lh-to-report-q1-earnings-whats-in-the-cards,2023-04-17 13:52:00,Ongoing sales rebound in the base business for both Diagnostics and Drug Development segments is likely to have benefited LabCorp (LH) in Q1.,HSIC,0.154125,0.0,Neutral
Reasons to Retain Cardinal Health  ( CAH )  in Your Portfolio,https://www.zacks.com/stock/news/2079591/reasons-to-retain-cardinal-health-cah-in-your-portfolio,2023-04-17 12:24:00,"Cardinal Health (CAH) continues to gain traction from solid pharmaceutical segment and a diversified product portfolio. However, the rising cost of products is a concern.",HSIC,0.137409,0.081966,Neutral
Best Growth Stocks to Buy for April 17th,https://www.zacks.com/commentary/2079453/best-growth-stocks-to-buy-for-april-17th,2023-04-17 11:26:00,"CROX, HSIC and IPAR made it to the Zacks Rank #1 (Strong Buy) growth stocks list on April 17, 2023.",HSIC,0.775204,0.160969,Somewhat-Bullish
Henry Schein  ( HSIC )  Stock Moves -0.17%: What You Should Know,https://www.zacks.com/stock/news/2079285/henry-schein-hsic-stock-moves--017-what-you-should-know,2023-04-14 22:00:24,"In the latest trading session, Henry Schein (HSIC) closed at $82.43, marking a -0.17% move from the previous day.",HSIC,0.610329,0.245799,Somewhat-Bullish
Bio-Rad  ( BIO )  Rises 6.5% Since Q4 Earnings: What's Driving It?,https://www.zacks.com/stock/news/2078976/bio-rad-bio-rises-65-since-q4-earnings-whats-driving-it,2023-04-14 15:16:00,Investors are optimistic about Bio-Rad's (BIO) strong global presence and stable solvency position.,HSIC,0.238133,-0.054224,Neutral
Merit Medical  ( MMSI )  Hits 52-Week High: What's Driving the Stock?,https://www.zacks.com/stock/news/2078970/merit-medical-mmsi-hits-52-week-high-whats-driving-the-stock,2023-04-14 15:10:00,Investors are optimistic about Merit Medical's (MMSI) strong product portfolio.,HSIC,0.209365,0.001657,Neutral
"Globus'  ( GMED )  NUVA Buyout Seems Strategic, Cost Woe Stays",https://www.zacks.com/stock/news/2078942/globus-gmed-nuva-buyout-seems-strategic-cost-woe-stays,2023-04-14 14:31:00,Globus Medical (GMED) and NuVasive (NUVA) are currently planning to combine in an all-stock transaction to create a global musculoskeletal company.,HSIC,0.250386,0.005713,Neutral
"Amedisys  ( AMED )  New Buyouts Aid Growth, CMS Ruling Unfavorable",https://www.zacks.com/stock/news/2078935/amedisys-amed-new-buyouts-aid-growth-cms-ruling-unfavorable,2023-04-14 14:26:00,"For Amedisys (AMED), dealing with the continuous shortage of clinical labo, in nursing in particular, has been challenging.",HSIC,0.209819,0.004959,Neutral
eAssist Dental Solutions to Present at THRIVELIVE 2023,https://www.prnewswire.com/news-releases/eassist-dental-solutions-to-present-at-thrivelive-2023-301797609.html,2023-04-14 12:16:00,"SALT LAKE CITY, April 14, 2023 /PRNewswire/ -- eAssist Dental Solutions ( ) , the nation's leading platform for and for dental offices, will have a notable presence at this year's THRIVELIVE™ conference, hosted by Henry Schein.",HSIC,0.123209,0.159015,Somewhat-Bullish
Myriad Genetics'  ( MYGN )  New Pact to Boost Precision Medicine,https://www.zacks.com/stock/news/2078461/myriad-genetics-mygn-new-pact-to-boost-precision-medicine,2023-04-13 16:20:00,Myriad Genetics' (MYGN) latest program will increase access to affordable genetic testing. It will also aid in identifying and elevating high-risk patient care.,HSIC,0.193852,0.004666,Neutral
Masimo  ( MASI )  Hits 52-Week High: What's Aiding the Stock?,https://www.zacks.com/stock/news/2078424/masimo-masi-hits-52-week-high-whats-aiding-the-stock,2023-04-13 16:05:00,Investors are optimistic about Masimo's (MASI) slew of product launches.,HSIC,0.213517,0.001682,Neutral
Is 89BIO  ( ETNB )  Outperforming Other Medical Stocks This Year?,https://www.zacks.com/stock/news/2078152/is-89bio-etnb-outperforming-other-medical-stocks-this-year,2023-04-13 13:40:11,Here is how 89BIO (ETNB) and Henry Schein (HSIC) have performed compared to their sector so far this year.,HSIC,0.411176,0.290713,Somewhat-Bullish
3 Reasons to Hold DexCom  ( DXCM )  Stock in Your Portfolio,https://www.zacks.com/stock/news/2078042/3-reasons-to-hold-dexcom-dxcm-stock-in-your-portfolio,2023-04-13 11:25:00,Investors continue to be optimistic about DexCom (DXCM) owing to its strong product portfolio.,HSIC,0.139804,0.046123,Neutral
Best Growth Stocks to Buy for April 13th,https://www.zacks.com/commentary/2077989/best-growth-stocks-to-buy-for-april-13th,2023-04-13 11:07:00,"CROX, HSIC and and GPK made it to the Zacks Rank #1 (Strong Buy) growth stocks list on April 13, 2023.",HSIC,0.756655,0.159418,Somewhat-Bullish
BD's  ( BDX )  New Launch to Result in Optimal IV Placement,https://www.zacks.com/stock/news/2077681/bds-bdx-new-launch-to-result-in-optimal-iv-placement,2023-04-12 15:57:00,BD's (BDX) latest launch is expected to advance its vision of a One-Stick Hospital Stay by improving the first-stick success in IV placements.,HSIC,0.198221,-0.04845,Neutral
Here's Why You Should Retain Catalent  ( CTLT )  Stock for Now,https://www.zacks.com/stock/news/2077367/heres-why-you-should-retain-catalent-ctlt-stock-for-now,2023-04-12 11:27:00,"Catalent's (CTLT) product and service launches, and a slew of strategic deals raise optimism about the stock.",HSIC,0.147516,0.085286,Neutral
Here's Why Investors Should Buy Bio-Rad  ( BIO )  Stock Now,https://www.zacks.com/stock/news/2077120/heres-why-investors-should-buy-bio-rad-bio-stock-now,2023-04-11 16:45:00,Investors are optimistic about Bio-Rad (BIO) on robust growth in Life Science and Clinical Diagnostics arms.,HSIC,0.218325,-0.050576,Neutral
Thermo Fisher  ( TMO )  Expands to Boost Commercial Manufacturing,https://www.zacks.com/stock/news/2077119/thermo-fisher-tmo-expands-to-boost-commercial-manufacturing,2023-04-11 16:43:00,Thermo Fisher's expansion in Bourgoin is built on the company's investments in small molecule solutions.,HSIC,0.218817,-0.050667,Neutral
Encompass Health  ( EHC )  Up 32% in 6 Months: More Room to Run?,https://www.zacks.com/stock/news/2077115/encompass-health-ehc-up-32-in-6-months-more-room-to-run,2023-04-11 16:40:00,Encompass Health (EHC) is well-poised for growth on the back of growing facility count within its Inpatient Rehabilitation segment and sound liquidity position.,HSIC,0.216376,0.131394,Neutral
3 Reasons to Retain Ecolab  ( ECL )  Stock in Your Portfolio,https://www.zacks.com/stock/news/2077017/3-reasons-to-retain-ecolab-ecl-stock-in-your-portfolio,2023-04-11 15:20:00,Investors continue to be optimistic about Ecolab (ECL) owing to its strong business.,HSIC,0.203215,-0.049414,Neutral
PacBio's  ( PACB )  New Offering to Enable High-Throughput Workflows,https://www.zacks.com/stock/news/2077016/pacbios-pacb-new-offering-to-enable-high-throughput-workflows,2023-04-11 15:14:00,PacBio's (PACB) latest launch is expected to combine the power of HiFi sequencing and Nanobind technology to optimize sample preparation workflows for its high-volume customers.,HSIC,0.217834,-0.052152,Neutral
Best Growth Stocks to Buy for April 11th,https://www.zacks.com/commentary/2076725/best-growth-stocks-to-buy-for-april-11th,2023-04-11 11:35:00,"CROX, HSIC and PANW made it to the Zacks Rank #1 (Strong Buy) growth stocks list on April 11, 2023.",HSIC,0.772528,0.16075,Somewhat-Bullish
Henry Schein  ( HSIC )  Acquires Majority Stake in Biotech Dental,https://www.zacks.com/stock/news/2076729/henry-schein-hsic-acquires-majority-stake-in-biotech-dental,2023-04-11 11:33:00,Henry Schein (HSIC) announces that the completion of the Biotech Dental partnership brings forth the company's several important solutions to customers.,HSIC,0.361501,0.554567,Bullish
Henry Schein  ( HSIC )  Stock Sinks As Market Gains: What You Should Know,https://www.zacks.com/stock/news/2076595/henry-schein-hsic-stock-sinks-as-market-gains-what-you-should-know,2023-04-10 22:15:24,"In the latest trading session, Henry Schein (HSIC) closed at $83.89, marking a -0.99% move from the previous day.",HSIC,0.613743,0.310173,Somewhat-Bullish
Baxter's  ( BAX )  New Premix Drug Now Available in the U.S.,https://www.zacks.com/stock/news/2076367/baxters-bax-new-premix-drug-now-available-in-the-us,2023-04-10 15:13:00,"Baxter's (BAX) latest frozen premix formulation is expected to support patient safety, simplify medication preparation and boost operational efficiencies.",HSIC,0.249744,-0.058247,Neutral
Here's Why You Should Invest in IDEXX  ( IDXX )  Stock Right Now,https://www.zacks.com/stock/news/2076359/heres-why-you-should-invest-in-idexx-idxx-stock-right-now,2023-04-10 15:00:00,Investors are optimistic about IDEXX's (IDXX) strength in the Companion Animal Group business.,HSIC,0.1871,-0.044904,Neutral
CVS Health  ( CVS )  Team Up to Treat Digestive Disorder Virtually,https://www.zacks.com/stock/news/2076356/cvs-health-cvs-team-up-to-treat-digestive-disorder-virtually,2023-04-10 14:56:00,CVS Health's (CVS) recent partnership with Oshi makes it possible for its members to receive coordinated virtual digestive treatment.,HSIC,0.191549,-0.047234,Neutral
Here's Why You Should Retain Intuitive Surgical  ( ISRG )  Stock Now,https://www.zacks.com/stock/news/2076345/heres-why-you-should-retain-intuitive-surgical-isrg-stock-now,2023-04-10 14:42:00,Investors continue to be optimistic about Intuitive Surgical (ISRG) owing to its strength in robotics.,HSIC,0.212115,-0.051095,Neutral
Henry Schein  ( NASDAQ:HSIC )  Rating Increased to Buy at StockNews.com,https://www.defenseworld.net/2023/04/08/henry-schein-nasdaqhsic-rating-increased-to-buy-at-stocknews-com.html,2023-04-08 08:16:41,Henry Schein ( NASDAQ:HSIC ) Rating Increased to Buy at ... Defense World ...,HSIC,0.848503,0.450642,Bullish
"QIAGEN's  ( QGEN )  Expanded Test Menu Aids, FX Woe Lingers",https://www.zacks.com/stock/news/2075684/qiagens-qgen-expanded-test-menu-aids-fx-woe-lingers,2023-04-06 16:15:00,"In terms of QIAstat-Dx, QIAGEN (QGEN) continues to witness increased demand for system placements and growing consumables usage around the world.",HSIC,0.222838,-0.053132,Neutral
National Vision  ( EYE )  Rides on Comps Growth Amid Macro Issues,https://www.zacks.com/stock/news/2075700/national-vision-eye-rides-on-comps-growth-amid-macro-issues,2023-04-06 16:08:00,"National Vision (EYE) continues to roll out its remote care capabilities, which provide doctors with additional levels of flexibility and expand exam capacity in many areas.",HSIC,0.235823,-0.055604,Neutral
