title,url,time_published,summary,ticker,relevance_score,ticker_sentiment_score,ticker_sentiment_label
Dental Surgical Equipment Market size to Grow by USD 2.10 billion from 2022 to 2027; Surging demand for cutting ... - PR Newswire,https://www.prnewswire.com/news-releases/dental-surgical-equipment-market-size-to-grow-by-usd-2-10-billion-from-2022-to-2027-surging-demand-for-cutting-edge-tools-in-dental-procedures-to-drive-growth---technavio-302039764.html,2024-01-22 09:20:00,Dental Surgical Equipment Market size to Grow by USD 2.10 billion from 2022 to 2027. Surging demand for cutting ... PR ...,HSIC,0.062434,0.131062,Neutral
The hottest hotel for elites at the World Economic Forum costs around $120 a night in the states,https://www.businessinsider.com/world-economic-forum-davos-switzerland-hilton-garden-inn-hot-hotel-2024-1,2024-01-21 04:11:00,Elites at the World Economic Forum stay at the Hilton Garden Inn: WSJ - Business Insider ...,HSIC,0.068502,-0.018198,Neutral
"What Vitamins Did For Healthy Living, Stemtech Corporation  ( OTCQB: STEK )  Says It Is Doing For Anti-Aging With Stem Cell Nutrition - Herbalife  ( NYSE:HLF ) , Amphastar Pharma  ( NASDAQ:AMPH ) ",https://www.benzinga.com/general/biotech/24/01/36694007/what-vitamins-did-for-healthy-living-stemtech-corporation-otcqb-stek-says-it-is-doing-for-anti-ag,2024-01-19 13:14:38,"Vitamins may not be a miracle cure, but combined with exercise and a healthy diet, they have the potential to greatly improve health and wellness. It's no wonder vitamin supplements are a multi-billion dollar business, projected to hit a market size of $98 billion in less than a decade.",HSIC,0.084871,0.0,Neutral
Dental Implants and Prosthetics Market Worth $16.0 Billion | MarketsandMarkets™,https://www.prnewswire.com/news-releases/dental-implants-and-prosthetics-market-worth-16-0-billion--marketsandmarkets-302033431.html,2024-01-12 15:30:00,"CHICAGO, Jan. 12, 2024 /PRNewswire/ -- Dental Implants and Prosthetics Market in terms of revenue was estimated to be worth $10.4 billion in 2023 and is poised to reach $16.0 billion by 2029, growing at a CAGR of 7.5% from 2023 to 2029 according to a new report by MarketsandMarkets™.",HSIC,0.02677,0.049838,Neutral
3 Medical Info Systems Stocks to Buy as Industry Rebounds,https://www.zacks.com/commentary/2204867/3-medical-info-systems-stocks-to-buy-as-industry-rebounds,2024-01-03 15:22:00,"Zacks Medical Info Systems industry stocks like Clover Health Investments (CLOV), Talkspace (TALK) and P3 Health Partners (PIII) are expected to gain from the new normal trends.",HSIC,0.03014,0.057652,Neutral
"Henry Schein  ( HSIC )  Sales Hurt by Cyber Attack, Macro Woes",https://www.zacks.com/stock/news/2202660/henry-schein-hsic-sales-hurt-by-cyber-attack-macro-woes,2023-12-27 15:09:00,Henry Schein's (HSIC) financial operations are being affected by the current macroeconomic environment.,HSIC,0.523336,0.205851,Somewhat-Bullish
Henry Schein  ( HSIC )  Enters Orthopedic Market With New Buyout,https://www.zacks.com/stock/news/2201157/henry-schein-hsic-enters-orthopedic-market-with-new-buyout,2023-12-21 16:39:00,"Henry Schein's (HSIC) recent deals will position it as a prominent producer and supplier in the orthopedic market's Foot and Ankle, Hand and Wrist extremity sectors.",HSIC,0.49407,0.44276,Bullish
Henry Schein  ( HSIC )  Up 4.9% Since Last Earnings Report: Can It Continue?,https://www.zacks.com/stock/news/2197464/henry-schein-hsic-up-49-since-last-earnings-report-can-it-continue,2023-12-13 16:30:06,Henry Schein (HSIC) reported earnings 30 days ago. What's next for the stock? We take a look at earnings estimates for some clues.,HSIC,0.440827,0.173446,Somewhat-Bullish
"Veterinary Equipment and Disposables Market Size to Exceed USD 4.4 billion By 2031, with a Robust CAGR of 7.9 %| States Transparency Market Research, Inc.",https://www.benzinga.com/pressreleases/23/12/g36190825/veterinary-equipment-and-disposables-market-size-to-exceed-usd-4-4-billion-by-2031-with-a-robust-c,2023-12-12 09:00:00,"Wilmington, Delaware, United States, Dec. 12, 2023 ( GLOBE NEWSWIRE ) -- Transparency Market Research Inc. - The global market for veterinary equipment and disposables is projected to soar significantly at a CAGR of 7.9% between 2023 and 2031.",HSIC,0.067064,0.242501,Somewhat-Bullish
eAssist Partners with Henry Schein and Other Dental Industry Experts to Launch 2024 Give Yourself a Raise Tour - PR Newswire,https://www.prnewswire.com/news-releases/eassist-partners-with-henry-schein-and-other-dental-industry-experts-to-launch-2024-give-yourself-a-raise-tour-302010158.html,2023-12-11 13:31:00,eAssist Partners with Henry Schein and Other Dental Industry Experts to Launch 2024 Give Yourself a Raise Tour PR ...,HSIC,0.320974,0.403909,Bullish
"WebMD Ignite Introduces HealthAdvisor, its New Health Risk Assessment Solution",https://markets.businessinsider.com/news/stocks/webmd-ignite-introduces-healthadvisor-its-new-health-risk-assessment-solution-1032882742,2023-12-07 15:33:00,HealthAdvisor promotes more preventive care for patients while also driving patient engagement and acquisition for providers,HSIC,0.043186,0.106782,Neutral
Henry Schein's  ( HSIC )  Zahn Dental and Myerson Enter New Deal,https://www.zacks.com/stock/news/2193401/henry-scheins-hsic-zahn-dental-and-myerson-enter-new-deal,2023-12-05 12:37:00,"Henry Schein's (HSIC) dental laboratory business, Zahn Dental, is set to exclusively distribute Myerson's New Trusana 3D Premium Denture System.",HSIC,0.287762,0.301113,Somewhat-Bullish
"Henry Schein  ( NASDAQ:HSIC )  Downgraded to ""Hold"" at StockNews.com",https://www.defenseworld.net/2023/12/05/henry-schein-nasdaqhsic-downgraded-to-hold-at-stocknews-com.html,2023-12-05 08:26:42,"Henry Schein ( NASDAQ:HSIC ) Downgraded to ""Hold"" at StockNews ... Defense World ...",HSIC,0.847902,0.531289,Bullish
"Henry Schein  ( NASDAQ:HSIC )  Lifted to ""Buy"" at StockNews.com",https://www.defenseworld.net/2023/11/21/henry-schein-nasdaqhsic-lifted-to-buy-at-stocknews-com.html,2023-11-21 08:20:44,"Henry Schein ( NASDAQ:HSIC - Get Free Report ) was upgraded by stock analysts at StockNews.com from a ""hold"" rating to a ""buy"" rating in a research note issued to investors on Tuesday.",HSIC,0.890401,0.454334,Bullish
HSIC: Henry Schein  ( HSIC )  Q3 Earnings Analysis: A Medical Stock to Watch?,https://stocknews.com/news/hsic-ocpny-mdxg-fonr-henry-schein-hsic-q3-earnings-analysis-a-medical-stock-to/,2023-11-17 12:33:31,HSIC: Henry Schein ( HSIC ) Q3 Earnings Analysis: A Medical Stock ... ...,HSIC,0.596651,0.443475,Bullish
Novavax Makes Changes to Executive Leadership Team to Enhance Focus on Delivery of Strategic Priorities,https://www.prnewswire.com/news-releases/novavax-makes-changes-to-executive-leadership-team-to-enhance-focus-on-delivery-of-strategic-priorities-301991645.html,2023-11-17 12:15:00,• New organizational structure for executive leadership team designed to facilitate a leaner and more focused approach to annual execution of business plans • to join as Chief Legal Officer and Corporate Secretary,HSIC,0.03468,-0.056161,Neutral
Leidos Partnership Continues MHS GENESIS Overseas Deployment in Second Planned International Wave - Leidos Holdings  ( NYSE:LDOS ) ,https://www.benzinga.com/pressreleases/23/11/n35838187/leidos-partnership-continues-mhs-genesis-overseas-deployment-in-second-planned-international-wave,2023-11-16 21:15:00,"RESTON, Va., Nov. 16, 2023 /PRNewswire/ -- The Leidos Partnership for Defense Health ( LPDH ) today announced it successfully delivered the MHS GENESIS electronic health record ( EHR ) to an additional 7,000 Department of Defense ( DOD ) clinicians and providers as part of a second Outside of ...",HSIC,0.053992,0.205842,Somewhat-Bullish
Henry Schein  ( NASDAQ:HSIC )  Stock Rating Lowered by StockNews.com,https://www.defenseworld.net/2023/11/15/henry-schein-nasdaqhsic-stock-rating-lowered-by-stocknews-com.html,2023-11-15 08:34:45,Henry Schein ( NASDAQ:HSIC ) Stock Rating Lowered by StockNews ... Defense World ...,HSIC,0.862681,0.472532,Bullish
These Analysts Slash Their Forecasts On Henry Schein After Q3 Results - Henry Schein  ( NASDAQ:HSIC ) ,https://www.benzinga.com/news/earnings/23/11/35787216/these-analysts-slash-their-forecasts-on-henry-schein-after-q3-results,2023-11-14 19:16:34,"Henry Schein Inc HSIC posted downbeat sales results for its third quarter on Monday. Henry Schein reported quarterly sales of $3.16 billion, slightly missing the consensus of $3.21 billion. Adjusted EPS of $1.32, up 2.3% Y/Y, in line with the estimate.",HSIC,0.974346,0.03452,Neutral
"Henry Schein  ( HSIC )  Q3 Revenues Miss, 2023 Guidance Cut",https://www.zacks.com/stock/news/2183765/henry-schein-hsic-q3-revenues-miss-2023-guidance-cut,2023-11-14 12:20:00,Henry Schein's (HSIC) third-quarter 2023 performance demonstrates remarkable sales growth in the Technology and Value-Added Service businesses.,HSIC,0.447528,0.132782,Neutral
"Fear Continues To Grip Markets Ahead Of Inflation Data - Aramark  ( NYSE:ARMK ) , Home Depot  ( NYSE:HD ) ",https://www.benzinga.com/news/earnings/23/11/35769195/fear-continues-to-grip-markets-ahead-of-inflation-data,2023-11-14 07:18:11,"The CNN Money Fear and Greed index showed some easing in the overall fear level, with the index remaining in the ""Fear"" zone on Monday. U.S. stocks closed mixed on Monday, ahead of the release of key inflation data. Treasury yields were mostly flat during Monday's session. Tyson Foods, Inc.",HSIC,0.277433,0.585596,Bullish
Why Is Dental Supplier Henry Schein  ( HSIC )  Stock Trading Higher Today? - Henry Schein  ( NASDAQ:HSIC ) ,https://www.benzinga.com/analyst-ratings/analyst-color/23/11/35753923/why-is-dental-supplier-henry-schein-stock-trading-higher-today,2023-11-13 17:18:22,"Henry Schein Inc HSIC reported Q3 FY23 sales of $3.16 billion, slightly missing the consensus of $3.21 billion, up 3.1% Y/Y, including a 1.2% decrease in local currencies excluding acquisitions, reflecting some market softening in the second half of the quarter as well as lower sales of PPE ...",HSIC,0.47672,0.170807,Somewhat-Bullish
"Monday.Com Reports Q3 Beat, Joins Fortrea Holdings, Henry Schein And Other Big Stocks Moving Higher On Monday - Consensus Cloud Solutions  ( NASDAQ:CCSI ) , Boeing  ( NYSE:BA ) ",https://www.benzinga.com/news/23/11/35753005/monday-com-reports-q3-beat-joins-fortrea-holdings-henry-schein-and-other-big-stocks-moving-higher-on,2023-11-13 16:30:49,"U.S. stocks traded lower, with the Dow Jones falling around 40 points on Monday. Shares of monday.com Ltd. MNDY gained on Monday following upbeat earnings. Monday.com posted adjusted earnings of 64 cents per share, beating market estimates of 20 cents per share.",HSIC,0.202366,0.0,Neutral
"US Stocks On Track To Start Week Lower As Moody's Rating Outlook Cut, Inflation Data Dampen Risk Appetite - Invesco QQQ Trust, Series 1  ( NASDAQ:QQQ ) , SPDR S&P 500  ( ARCA:SPY ) ",https://www.benzinga.com/news/earnings/23/11/35745289/us-stocks-on-track-to-start-week-lower-as-moodys-rating-outlook-cut-inflation-data-dampen-risk-appe,2023-11-13 12:15:10,"Stock futures point to a modestly lower open on Monday as the indices struggle to find a clear direction following the setback in late July. The rate uncertainty has remained an overhang on the market. Therefore, inflation data and speeches by Federal Reserve officials scheduled for the week ...",HSIC,0.088964,0.0,Neutral
Henry Schein  ( HSIC )  Matches Q3 Earnings Estimates,https://www.zacks.com/stock/news/2183101/henry-schein-hsic-matches-q3-earnings-estimates,2023-11-13 12:15:04,"Henry Schein (HSIC) delivered earnings and revenue surprises of 0% and 0.93%, respectively, for the quarter ended September 2023. Do the numbers hold clues to what lies ahead for the stock?",HSIC,0.407844,0.133743,Neutral
"Henry Schein, Verve Therapeutics And Other Big Stocks Moving Lower In Monday's Pre-Market Session - AudioCodes  ( NASDAQ:AUDC ) , Maplebear  ( NASDAQ:CART ) ",https://www.benzinga.com/news/23/11/35743676/henry-schein-verve-therapeutics-and-other-big-stocks-moving-lower-in-mondays-pre-market-session,2023-11-13 11:12:15,"U.S. stock futures traded mostly lower this morning on Monday, with the Nasdaq futures falling around 50 points this morning. Shares of Verve Therapeutics, Inc. VERV fell in pre-market trading after the company announced first human proof-of-concept data for in vivo base editing from the ongoing ...",HSIC,0.25168,-0.362761,Bearish
"Tyson Foods, Henry Schein And 3 Stocks To Watch Heading Into Monday - Henry Schein  ( NASDAQ:HSIC ) , AECOM  ( NYSE:ACM ) ",https://www.benzinga.com/news/earnings/23/11/35742071/tyson-foods-henry-schein-and-3-stocks-to-watch-heading-into-monday,2023-11-13 08:52:58,"With U.S. stock futures trading lower this morning on Monday, some of the stocks that may grab investor focus today are as follows: Wall Street expects AECOM ACM to report quarterly earnings at 97 cents per share on revenue of $3.69 billion after the closing bell.",HSIC,0.532043,0.588305,Bullish
"Fear Among US Investors Is Easing, Here's Why - Henry Schein  ( NASDAQ:HSIC ) , Tyson Foods  ( NYSE:TSN ) ",https://www.benzinga.com/news/earnings/23/11/35742089/fear-among-us-investors-is-easing-heres-why,2023-11-13 07:52:09,"The CNN Money Fear and Greed index showed some easing in the overall fear level, but the index remained in the ""Fear"" zone on Friday. U.S. stocks closed higher on Friday, following a surge in tech stocks. The tech-heavy Nasdaq Composite notched its biggest single-day percentage surge since May 26.",HSIC,0.240489,0.0,Neutral
Henry Schein Gears Up For Q3 Print; Here's A Look At Recent Price Target Changes By The Most Accurate Analysts - Henry Schein  ( NASDAQ:HSIC ) ,https://www.benzinga.com/news/earnings/23/11/35742043/henry-schein-gears-up-for-q3-print-heres-a-look-at-recent-price-target-changes-by-the-most-accurate,2023-11-13 06:07:49,"Henry Schein, Inc. HSIC is projected to release financial results for its third quarter, before the opening bell on Nov. 13, 2023. Analysts expect the company to post quarterly earnings at $1.32 per share, up from year-ago earnings of $1.29 per share.",HSIC,0.579393,0.578107,Bullish
Henry Schein's Transition From Distributor To Manufacturer Spurs Upgrade - This Analyst Sees Easing Headwinds - Henry Schein  ( NASDAQ:HSIC ) ,https://www.benzinga.com/analyst-ratings/analyst-color/23/11/35729361/henry-scheins-transition-from-distributor-to-manufacturer-spurs-upgrade-this-analys,2023-11-10 19:39:28,"Stifel analyst Jonathan D. Block upgraded health care products distributor Henry Schein Inc HSIC to Buy from Hold and maintained a price target of $70. The analyst is bullish as the impact of several multi-year headwinds, including the pace of practice consolidation and loss of market share to ...",HSIC,0.546745,0.380806,Bullish
Insights Into Henry Schein  ( HSIC )  Q3: Wall Street Projections for Key Metrics,https://www.zacks.com/stock/news/2182466/insights-into-henry-schein-hsic-q3-wall-street-projections-for-key-metrics,2023-11-10 16:50:00,"Looking beyond Wall Street's top -and-bottom-line estimate forecasts for Henry Schein (HSIC), delve into some of its key metrics to gain a deeper insight into the company's potential performance for the quarter ended September 2023.",HSIC,0.342803,0.205419,Somewhat-Bullish
"eAssist Dental Solutions Mourns the Passing of Dr. Charles Blair, DDS, a Distinguished Figure in the Dental Community - PR Newswire",https://www.prnewswire.com/news-releases/eassist-dental-solutions-mourns-the-passing-of-dr-charles-blair-dds-a-distinguished-figure-in-the-dental-community-301984814.html,2023-11-10 14:28:00,"eAssist Dental Solutions Mourns the Passing of Dr. Charles Blair, DDS, a Distinguished Figure in the Dental Community PR ...",HSIC,0.059636,0.209422,Somewhat-Bullish
eAssist Dental Solutions Named One of Utah's 100 Fastest Growing Companies for the 7th Year in a Row by ... - PR Newswire,https://www.prnewswire.com/news-releases/eassist-dental-solutions-named-one-of-utahs-100-fastest-growing-companies-for-the-7th-year-in-a-row-by-mountainwest-capital-network-301977926.html,2023-11-06 13:32:00,eAssist Dental Solutions Named One of Utah's 100 Fastest Growing Companies for the 7th Year in a Row by ... PR ...,HSIC,0.080458,0.224878,Somewhat-Bullish
Cardinal Health  ( CAH )  Surpasses Q1 Earnings and Revenue Estimates,https://www.zacks.com/stock/news/2177922/cardinal-health-cah-surpasses-q1-earnings-and-revenue-estimates,2023-11-03 12:45:20,"Cardinal (CAH) delivered earnings and revenue surprises of 23.57% and 0.43%, respectively, for the quarter ended September 2023. Do the numbers hold clues to what lies ahead for the stock?",HSIC,0.138863,0.0,Neutral
Becton Dickinson  ( BDX )  Reports Next Week: Wall Street Expects Earnings Growth,https://www.zacks.com/stock/news/2177363/becton-dickinson-bdx-reports-next-week-wall-street-expects-earnings-growth,2023-11-02 14:00:39,Becton Dickinson (BDX) doesn't possess the right combination of the two key ingredients for a likely earnings beat in its upcoming report. Get prepared with the key expectations.,HSIC,0.17179,-0.025363,Neutral
Henry Schein  ( HSIC )  Earnings Expected to Grow: Should You Buy?,https://www.zacks.com/stock/news/2175520/henry-schein-hsic-earnings-expected-to-grow-should-you-buy,2023-10-31 14:01:35,Henry Schein (HSIC) doesn't possess the right combination of the two key ingredients for a likely earnings beat in its upcoming report. Get prepared with the key expectations.,HSIC,0.259267,0.053283,Neutral
Henry Schein  ( HSIC )  Set to Post Q3 Earnings: What Awaits?,https://www.zacks.com/stock/news/2174298/henry-schein-hsic-set-to-post-q3-earnings-what-awaits,2023-10-30 12:41:00,Henry Schein's (HSIC) third-quarter 2023 results are likely to reflect the strong fundamentals of the Dental business.,HSIC,0.417198,0.410321,Bullish
"Test Strip Market Growth Worth $12.5 Billion, Globally, by 2030 - Exclusive Report by The Insight Partners",https://www.benzinga.com/pressreleases/23/10/g35410612/test-strip-market-growth-worth-12-5-billion-globally-by-2030-exclusive-report-by-the-insight-partn,2023-10-25 09:40:48,"Pune, India, Oct. 25, 2023 ( GLOBE NEWSWIRE ) -- A test strip is crucial for the medical diagnostics industry, especially for blood sugar testing and urinalysis. Test strips consist of multiple layers, including hydrophilic inner, adhesive, and electrode layers and an outer layer that provides ...",HSIC,0.041039,0.118123,Neutral
3 Dental Supply Stocks You Can Sink Your Teeth Into,https://www.fool.com/investing/2023/10/25/3-dental-supply-stocks-you-can-sink-your-teeth-int/,2023-10-25 09:20:00,Long-term trends and margin improvements are driving growth for dental supply companies.,HSIC,0.144563,0.162625,Somewhat-Bullish
Henry Schein  ( HSIC )  Acquires Majority Stake in Shield Healthcare,https://www.zacks.com/stock/news/2170706/henry-schein-hsic-acquires-majority-stake-in-shield-healthcare,2023-10-24 13:05:00,"Henry Schein (HSIC) completes the majority investment in Shield Healthcare, Inc.",HSIC,0.264515,0.11868,Neutral
TMR Report Predicts Dental Syringe Market to Reach USD 577.8 Million by 2031 with 5.1% CAGR,https://www.benzinga.com/pressreleases/23/10/g35387162/tmr-report-predicts-dental-syringe-market-to-reach-usd-577-8-million-by-2031-with-5-1-cagr,2023-10-24 05:30:00,"Wilmington, Delaware, United States, Oct. 24, 2023 ( GLOBE NEWSWIRE ) -- Transparency Market Research Inc. - The global dental syringe market was estimated to have acquired US$ 343.4 million in 2021. It is anticipated to register a 5.1% CAGR from 2022 to 2031 and by 2031, the market is likely to ...",HSIC,0.083396,0.210445,Somewhat-Bullish
Restorative Dentistry Market is Expected to Reach $22.2 billion | MarketsandMarkets.,https://www.benzinga.com/pressreleases/23/10/g35347871/restorative-dentistry-market-is-expected-to-reach-22-2-billion-marketsandmarkets,2023-10-20 12:00:00,"Chicago, Oct. 20, 2023 ( GLOBE NEWSWIRE ) -- The restorative dentistry industry is poised for significant growth in the near future as advancements in materials and technologies continue to revolutionize the field.",HSIC,0.03463,-0.014053,Neutral
Should Value Investors Buy Henry Schein  ( HSIC )  Stock?,https://www.zacks.com/stock/news/2167933/should-value-investors-buy-henry-schein-hsic-stock,2023-10-18 13:40:11,"Here at Zacks, our focus is on the proven Zacks Rank system, which emphasizes earnings estimates and estimate revisions to find great stocks. Nevertheless, we are always paying attention to the latest value, growth, and momentum trends to underscore strong picks.",HSIC,0.585687,0.340341,Somewhat-Bullish
Are You a Value Investor? This 1 Stock Could Be the Perfect Pick,https://www.zacks.com/stock/news/2167132/are-you-a-value-investor-this-1-stock-could-be-the-perfect-pick,2023-10-17 13:40:07,The Zacks Style Scores offers investors a way to easily find top-rated stocks based on their investing style. Here's why you should take advantage.,HSIC,0.340915,0.371105,Bullish
Here's Why Henry Schein  ( HSIC )  is a Strong Growth Stock,https://www.zacks.com/stock/news/2166441/heres-why-henry-schein-hsic-is-a-strong-growth-stock,2023-10-16 13:45:07,The Zacks Style Scores offers investors a way to easily find top-rated stocks based on their investing style. Here's why you should take advantage.,HSIC,0.472338,0.512017,Bullish
24 Leading Companies Join New U.S. Initiative to Help Hispanic Refugees Advance Their Careers,https://www.prnewswire.com/news-releases/24-leading-companies-join-new-us-initiative-to-help-hispanic-refugees-advance-their-careers-301952947.html,2023-10-11 11:00:00,"Businesses including Bank of America, Diageo North America, Google, Hilton, Marriott International, and TelevisaUnivision join the Tent Partnership for Refugees' new Hispanic Refugee Mentorship Program",HSIC,0.041901,0.1004,Neutral
HSIC vs. MMSI: Which Stock Is the Better Value Option?,https://www.zacks.com/stock/news/2163618/hsic-vs-mmsi-which-stock-is-the-better-value-option,2023-10-10 15:40:10,Investors interested in Medical - Dental Supplies stocks are likely familiar with Henry Schein ( HSIC Quick QuoteHSIC - ) and Merit Medical ( MMSI Quick QuoteMMSI - ) . But which of these two stocks offers value investors a better bang for their buck right now? We'll need to take a closer look.,HSIC,0.773597,0.63077,Bullish
4 Stocks to Buy From the Prospering Dental Supplies Industry,https://www.zacks.com/commentary/2163221/4-stocks-to-buy-from-the-prospering-dental-supplies-industry,2023-10-10 13:50:00,"Here we discuss four stocks from the Dental Supplies industry that are likely to earn wealth for investors. These include MCK, WST, ALGN and HSIC.",HSIC,0.157337,0.172927,Somewhat-Bullish
Here's Why You Should Retain Henry Schein  ( HSIC )  Stock for Now,https://www.zacks.com/stock/news/2159880/heres-why-you-should-retain-henry-schein-hsic-stock-for-now,2023-10-04 12:41:00,"Investors are optimistic about Henry Schein (HSIC), backed by the strength of the dental business and acquisitions.",HSIC,0.481177,0.34281,Somewhat-Bullish
Why Henry Schein  ( HSIC )  is a Top Growth Stock for the Long-Term,https://www.zacks.com/stock/news/2156202/why-henry-schein-hsic-is-a-top-growth-stock-for-the-long-term,2023-09-27 13:45:07,"Whether you're a value, growth, or momentum investor, finding strong stocks becomes easier with the Zacks Style Scores, a top feature of the Zacks Premium research service.",HSIC,0.462395,0.504008,Bullish
Henry Schein  ( HSIC )  Gains From Strong Global Network Amid FX Woes,https://www.zacks.com/stock/news/2155547/henry-schein-hsic-gains-from-strong-global-network-amid-fx-woes,2023-09-26 15:10:00,Henry Schein's (HSIC) dental software business is progressing well despite a challenging business environment.,HSIC,0.458708,0.313002,Somewhat-Bullish
"Global Practice Management System  ( Integrated, Standalone )  Market Report 2023: A $25.5 Billion Market by 2030 - Cloud-Based Practice Management Systems Lead the Way with Faster Processing",https://www.prnewswire.com/news-releases/global-practice-management-system-integrated-standalone-market-report-2023-a-25-5-billion-market-by-2030---cloud-based-practice-management-systems-lead-the-way-with-faster-processing-301937294.html,2023-09-25 10:15:00,"Global Practice Management System ( Integrated, Standalone ) Market Report 2023: A $25.5 Billion Market by 2030 ... PR ...",HSIC,0.058759,0.203058,Somewhat-Bullish
"Medical Terminology Software Market to grow by USD 1,705.83 million from 2022 to 2027, Market driven increasing ... - PR Newswire",https://www.prnewswire.com/news-releases/medical-terminology-software-market-to-grow-by-usd-1-705-83-million-from-2022-to-2027--market-driven-increasing-demand-for-medical-terminology-software---technavio-301935787.html,2023-09-24 06:35:00,"Medical Terminology Software Market to grow by USD 1,705.83 million from 2022 to 2027, Market driven increasing ... PR ...",HSIC,0.052226,0.088583,Neutral
Here's Why Henry Schein  ( HSIC )  is a Strong Value Stock,https://www.zacks.com/stock/news/2153080/heres-why-henry-schein-hsic-is-a-strong-value-stock,2023-09-20 13:40:08,"Whether you're a value, growth, or momentum investor, finding strong stocks becomes easier with the Zacks Style Scores, a top feature of the Zacks Premium research service.",HSIC,0.567746,0.497214,Bullish
"Dental Practice Management Software Market Share to Hit $4 Billion, Globally, by 2027 - Exclusive Report by The Insight Partners",https://www.benzinga.com/pressreleases/23/09/g34762525/dental-practice-management-software-market-share-to-hit-4-billion-globally-by-2027-exclusive-repor,2023-09-20 13:31:12,"Pune, India, Sept. 20, 2023 ( GLOBE NEWSWIRE ) -- According to The Insight Partners, ""Dental Practice Management Software Market Forecast to 2027 - COVID-19 Impact and Global Analysis By Delivery Mode ( On-Premise Delivery Mode, Web-Based Delivery Mode and Cloud-Based Delivery Mode ) , Component ...",HSIC,0.069394,0.101633,Neutral
