title,url,time_published,summary,ticker,relevance_score,ticker_sentiment_score,ticker_sentiment_label
Looking Into L3Harris Technologies's Recent Short Interest - L3Harris Technologies  ( NYSE:LHX ) ,https://www.benzinga.com/short-sellers/23/09/35006449/looking-into-l3harris-technologiess-recent-short-interest,2023-09-29 16:00:24,"L3Harris Technologies's LHX short percent of float has risen 29.69% since its last report. The company recently reported that it has 1.56 million shares sold short, which is 0.83% of all regular shares that are available for trading.",LHX,0.221819,0.155473,Somewhat-Bullish
General Dynamics  ( GD )  Wins Deal to Aid Abrams Battle Tank,https://www.zacks.com/stock/news/2157050/general-dynamics-gd-wins-deal-to-aid-abrams-battle-tank,2023-09-28 12:31:00,General Dynamics' (GD) unit is set to provide technical support for its Abrams battle tank systems.,LHX,0.055364,-0.08415,Neutral
Global Push To Talk Market Is Expected To Surge To $39.5 Billion In 2027 With Rising Adoption Of IoT And Innovative Technologies - By The Business Research Company,https://www.prnewswire.com/news-releases/global-push-to-talk-market-is-expected-to-surge-to-39-5-billion-in-2027-with-rising-adoption-of-iot-and-innovative-technologies--by-the-business-research-company-301939037.html,2023-09-26 15:40:00,Global Push To Talk Market Is Expected To Surge To $39.5 Billion In 2027 With Rising Adoption Of IoT And Innovative ... PR ...,LHX,0.057767,0.106973,Neutral
Wearable Robots Market expected to hit USD 9205.5 Mn by 2029 at a CAGR of 41.6 percent - says Maximize Market Research,https://www.benzinga.com/pressreleases/23/09/g34898853/wearable-robots-market-expected-to-hit-usd-9205-5-mn-by-2029-at-a-cagr-of-41-6-percent-says-maximi,2023-09-26 10:39:39,"Dublin, Sept. 26, 2023 ( GLOBE NEWSWIRE ) -- A global Automation & Process Control research and business consulting firm, Maximize Market Research, has published a market intelligence report on the ""Wearable Robots Market"".",LHX,0.023372,0.0,Neutral
The Tactical Communication Market Is Set To Grow At A CAGR Of More Than 8% Through 2023-2027 - By The Business Research Company,https://www.prnewswire.com/news-releases/the-tactical-communication-market-is-set-to-grow-at-a-cagr-of-more-than-8-through-2023-2027--by-the-business-research-company-301936127.html,2023-09-22 15:45:00,The Tactical Communication Market Is Set To Grow At A CAGR Of More Than 8% Through 2023-2027 - By The ... PR ...,LHX,0.062597,0.110599,Neutral
General Dynamics  ( GD )  Wins Contract to Aid Abrams Battle Tank,https://www.zacks.com/stock/news/2153135/general-dynamics-gd-wins-contract-to-aid-abrams-battle-tank,2023-09-20 12:59:00,General Dynamics (GD) is set to provide technical support for Abrams battle tank system.,LHX,0.053629,-0.084079,Neutral
"This Analyst With Over 80% Accuracy Rate Sees Around 9% Upside In Smucker - Here Are 5 Stock Picks For Last Week From Wall Street's Most Accurate Analysts - Ashland  ( NYSE:ASH ) , ABM Indus  ( NYSE:ABM ) ",https://www.benzinga.com/trading-ideas/long-ideas/23/09/34697773/this-analyst-with-over-80-accuracy-rate-sees-around-9-upside-in-smucker-here-are-5-stock,2023-09-18 16:20:48,"U.S. stocks closed lower on Friday, ahead of the Federal Reserve's policy meeting this week. The Dow, meanwhile, settled slightly higher last week, while the S&P 500 and Nasdaq both recorded losses for the second straight week. Wall Street analysts make new stock picks on a daily basis.",LHX,0.235823,0.184406,Somewhat-Bullish
US Joint All Domain Command and Control  ( JADC2 )  Companies - Lockheed Martin Corporation  ( US )  and Northrop Grumman Corporation  ( US )  are the Key Players,https://www.benzinga.com/pressreleases/23/09/g34690529/us-joint-all-domain-command-and-control-jadc2-companies-lockheed-martin-corporation-us-and-northro,2023-09-18 13:30:00,"Chicago, Sept. 18, 2023 ( GLOBE NEWSWIRE ) -- The US Joint All Domain Command and Control ( JADC2 ) Market by Platform ( Land, Naval, Airborne, Cyber, Space ) , Application ( JADC2 Specific, Command & Control ( C2 ) , Communication, SATCOM, Computers, and AI, Networks ) , Solution - Forecast to ...",LHX,0.040899,0.268449,Somewhat-Bullish
"Micron Technology To Rally Around 22%? Here Are 10 Other Analyst Forecasts For Monday - Albany Intl  ( NYSE:AIN ) , DoorDash  ( NYSE:DASH ) ",https://www.benzinga.com/news/23/09/34685754/micron-technology-to-rally-around-22-here-are-10-other-analyst-forecasts-for-monday,2023-09-18 12:00:38,Piper Sandler cut the price target for IBEX Limited IBEX from $24 to $17. Piper Sandler analyst Arvind Ramnani maintained an Overweight rating. IBEX shares rose 0.3% to close at $13.59 on Friday. Raymond James slashed The Charles Schwab Corporation SCHW price target from $77 to $72.,LHX,0.271777,0.292938,Somewhat-Bullish
Here's How Much $100 Invested In L3Harris Technologies 10 Years Ago Would Be Worth Today - L3Harris Technologies  ( NYSE:LHX ) ,https://www.benzinga.com/news/earnings/23/09/34594771/heres-how-much-100-invested-in-l3harris-technologies-10-years-ago-would-be-worth-today,2023-09-14 21:00:26,"L3Harris Technologies LHX has outperformed the market over the past 10 years by 1.34% on an annualized basis producing an average annual return of 11.38%. Currently, L3Harris Technologies has a market capitalization of $32.45 billion.",LHX,0.980595,0.386944,Bullish
BAE Systems  ( BAESY )  Wins $64.8M Deal for Military Radios,https://www.zacks.com/stock/news/2147852/bae-systems-baesy-wins-648m-deal-for-military-radios,2023-09-12 14:52:00,BAE Systems' (BAESY) business unit secures a contract worth $64.8 million for radios.,LHX,0.213048,0.176763,Somewhat-Bullish
Looking Into L3Harris Technologies's Recent Short Interest - L3Harris Technologies  ( NYSE:LHX ) ,https://www.benzinga.com/short-sellers/23/09/34486805/looking-into-l3harris-technologiess-recent-short-interest,2023-09-12 13:01:05,"L3Harris Technologies's LHX short percent of float has fallen 20.59% since its last report. The company recently reported that it has 1.54 million shares sold short, which is 0.81% of all regular shares that are available for trading.",LHX,0.221819,0.083071,Neutral
"SAIC Bags $574M Contract To Modernize US Space Force Missions - L3Harris Technologies  ( NYSE:LHX ) , Science Applications Intl  ( NYSE:SAIC ) ",https://www.benzinga.com/markets/equities/23/09/34444650/saic-bags-574m-contract-to-modernize-us-space-force-missions,2023-09-11 15:52:37,Science Applications International Corp SAIC has secured a $574 million contract from the United States Space Force ( USSF ) to support its Ground Based Radar Maintenance and Sustainment Services ( GMASS ) .,LHX,0.327366,0.16005,Somewhat-Bullish
RTX Secures Contract to Support Maintenance of AESA Radar,https://www.zacks.com/stock/news/2146537/rtx-secures-contract-to-support-maintenance-of-aesa-radar,2023-09-08 12:33:00,"RTX is set to provide engineering and technical services for the installation, operation, and maintenance of the F/A-18 and EA-18G aircraft's AESA.",LHX,0.125134,0.145546,Neutral
Satellite Navigation System Market Report 2023-2028: Exploring New Business Models and Revenue Streams Through Value-Added Services and Customized Solution,https://www.prnewswire.com/news-releases/satellite-navigation-system-market-report-2023-2028-exploring-new-business-models-and-revenue-streams-through-value-added-services-and-customized-solution-301921779.html,2023-09-08 10:45:00,Satellite Navigation System Market Report 2023-2028: Exploring New Business Models and Revenue Streams ... PR ...,LHX,0.052801,0.0,Neutral
Lockheed Martin  ( LMT )  Deploys 10 Satellites for SDA's Mission,https://www.zacks.com/stock/news/2146386/lockheed-martin-lmt-deploys-10-satellites-for-sdas-mission,2023-09-08 09:30:00,"Lockheed Martin (LMT) continues to deliver advanced military capabilities in space, with the latest launch of 10 transport layer satellites.",LHX,0.184834,0.217091,Somewhat-Bullish
"Top 5 Industrials Stocks That Could Lead To Your Biggest Gains In September - Alaska Air Gr  ( NYSE:ALK ) , American Airlines Group  ( NASDAQ:AAL ) ",https://www.benzinga.com/trading-ideas/long-ideas/23/09/34313090/top-5-industrials-stocks-that-could-lead-to-your-biggest-gains-in-september,2023-09-07 11:26:37,"The most oversold stocks in the industrials sector presents an opportunity to buy into undervalued companies. The RSI is a momentum indicator, which compares a stock's strength on days when prices go up to its strength on days when prices go down.",LHX,0.313484,0.152609,Somewhat-Bullish
L3Harris  ( LHX )  Secures Modification Contract to Aid Submarines,https://www.zacks.com/stock/news/2144748/l3harris-lhx-secures-modification-contract-to-aid-submarines,2023-09-05 13:04:00,L3Harris (LHX) wins a $35.7M modification contract for the procurement of production hardware for in-service class submarines.,LHX,0.226301,0.370514,Bullish
Military Wearable Sensors Market size is set to grow by USD 160.7 million from 2022 to 2027 | Increased spending on ... - PR Newswire,https://www.prnewswire.com/news-releases/military-wearable-sensors-market-size-is-set-to-grow-by-usd-160-7-million-from-2022-to-2027--increased-spending-on-military-modernization-programs-drives-the-market---technavio-301916259.html,2023-09-05 01:30:00,Military Wearable Sensors Market size is set to grow by USD 160.7 million from 2022 to 2027 | Increased spending on ... PR ...,LHX,0.053271,0.0,Neutral
General Dynamics  ( GD )  Wins Deal to Aid Abrams Tank,https://www.zacks.com/stock/news/2144169/general-dynamics-gd-wins-deal-to-aid-abrams-tank,2023-09-04 11:37:00,General Dynamics (GD) is set to provide technical support for Abrams battle tank.,LHX,0.057767,-0.084285,Neutral
Cryocooler Market to grow by USD 816.44 million from 2022 to 2027 | Increasing adoption of cryopreservation ... - PR Newswire,https://www.prnewswire.com/news-releases/cryocooler-market-to-grow-by-usd-816-44-million-from-2022-to-2027--increasing-adoption-of-cryopreservation-procedures-drives-the-market---technavio-301915430.html,2023-09-01 23:00:00,Cryocooler Market to grow by USD 816.44 million from 2022 to 2027 | Increasing adoption of cryopreservation ... PR ...,LHX,0.047559,0.041363,Neutral
Aviation cyber security market to grow by USD 38.08 billion from 2022 to 2027 | The network security segment will be ... - PR Newswire,https://www.prnewswire.com/news-releases/aviation-cyber-security-market-to-grow-by-usd-38-08-billion-from-2022-to-2027--the-network-security-segment-will-be-significant-during-the-forecast-period---technavio-301915121.html,2023-09-01 06:30:00,Aviation cyber security market to grow by USD 38.08 billion from 2022 to 2027 | The network security segment will be ... PR ...,LHX,0.048621,0.219997,Somewhat-Bullish
Here's How Much $100 Invested In L3Harris Technologies 10 Years Ago Would Be Worth Today - L3Harris Technologies  ( NYSE:LHX ) ,https://www.benzinga.com/news/earnings/23/08/34125295/heres-how-much-100-invested-in-l3harris-technologies-10-years-ago-would-be-worth-today,2023-08-30 20:30:22,"L3Harris Technologies LHX has outperformed the market over the past 10 years by 1.32% on an annualized basis producing an average annual return of 11.94%. Currently, L3Harris Technologies has a market capitalization of $33.63 billion.",LHX,0.980595,0.386944,Bullish
Why BigBear.ai Stock Popped Today - BigBear.ai Hldgs  ( NYSE:BBAI ) ,https://www.benzinga.com/news/23/08/34100150/why-bigbear-ai-stock-popped-today,2023-08-29 19:21:04,"BigBear.ai, Inc. BBAI shares are trading higher Tuesday. HC Wainwright initiated coverage on the stock with a Buy rating and a $4 price target.",LHX,0.19117,0.329,Somewhat-Bullish
Want to Get Rich? 3 Game-Changing Space Stocks to Buy Right Now,https://markets.businessinsider.com/news/stocks/want-to-get-rich-3-game-changing-space-stocks-to-buy-right-now-1032584303,2023-08-27 18:08:57,"We are all aware of the many companies doing amazing work in different sectors of our economies ecosystems. However, a little extra admiration has to be shown for the impressive companies engaging in advancing technology to help explore and navigate the next frontier.",LHX,0.053509,0.114,Neutral
L3Harris  ( LHX )  Down 6.3% Since Last Earnings Report: Can It Rebound?,https://www.zacks.com/stock/news/2140859/l3harris-lhx-down-63-since-last-earnings-report-can-it-rebound,2023-08-25 15:31:24,L3Harris (LHX) reported earnings 30 days ago. What's next for the stock? We take a look at earnings estimates for some clues.,LHX,0.132004,0.050673,Neutral
Unmanned Aerial Vehicle (UAV) Ground Control Station (GCS) Market to grow by USD 271.02 million from 2022 to ... - PR Newswire,https://www.prnewswire.com/news-releases/unmanned-aerial-vehicle-uav-ground-control-station-gcs-market-to-grow-by-usd-271-02-million-from-2022-to-2027--the-increasing-defense-spending-on-unmanned-technologies-to-boost-market-growth---technavio-301909371.html,2023-08-25 08:45:00,Unmanned Aerial Vehicle ( UAV ) Ground Control Station ( GCS ) Market to grow by USD 271.02 million from 2022 to ... PR ...,LHX,0.057352,0.042952,Neutral
Looking Into L3Harris Technologies's Recent Short Interest - L3Harris Technologies  ( NYSE:LHX ) ,https://www.benzinga.com/short-sellers/23/08/34031272/looking-into-l3harris-technologiess-recent-short-interest,2023-08-24 19:00:23,"L3Harris Technologies's LHX short percent of float has risen 12.09% since its last report. The company recently reported that it has 1.93 million shares sold short, which is 1.02% of all regular shares that are available for trading.",LHX,0.221819,0.155473,Somewhat-Bullish
Here's How Much You Would Have Made Owning L3Harris Technologies Stock In The Last 20 Years - L3Harris Technologies  ( NYSE:LHX ) ,https://www.benzinga.com/news/earnings/23/08/33991629/heres-how-much-you-would-have-made-owning-l3harris-technologies-stock-in-the-last-20-years,2023-08-22 18:30:47,"L3Harris Technologies LHX has outperformed the market over the past 20 years by 5.07% on an annualized basis producing an average annual return of 12.66%. Currently, L3Harris Technologies has a market capitalization of $34.03 billion.",LHX,0.980595,0.386944,Bullish
L3Harris  ( LHX )  Secures Modification Contract to Aid Submarines,https://www.zacks.com/stock/news/2139158/l3harris-lhx-secures-modification-contract-to-aid-submarines,2023-08-22 15:41:00,L3Harris (LHX) wins a $39.3M modification contract for the procurement of production hardware for in-service class submarines.,LHX,0.2306,0.388212,Bullish
"MAG Aerospace, L3Harris Team to Expand US Army's Aerial ISR Capabilities - L3Harris Technologies  ( NYSE:LHX ) ",https://www.benzinga.com/pressreleases/23/08/n33983464/mag-aerospace-l3harris-team-to-expand-us-armys-aerial-isr-capabilities,2023-08-22 13:00:00,"Provides two aircraft for Army's next-generation aerial Intelligence, Surveillance and Reconnaissance ( ISR ) radar program. Continues modernization efforts for Army's long-range precision fires. Will provide greater survivability and endurance with leading-edge sensor technology.",LHX,0.162437,0.250857,Somewhat-Bullish
3 Dividend Stocks That Should Pay You the Rest of Your Life,https://www.fool.com/investing/2023/08/20/dividend-stocks-should-pay-you-the-rest-of-life/,2023-08-20 11:20:00,These three companies each have decades of dividend growth under their belts.,LHX,0.172919,0.129324,Neutral
Robotics Market to grow by USD 22.2697 billion from 2022 to 2027; Stringent health and safety regulations to drive ... - PR Newswire,https://www.prnewswire.com/news-releases/robotics-market-to-grow-by-usd-22-2697-billion-from-2022-to-2027-stringent-health-and-safety-regulations-to-drive-market-growth---technavio-301903874.html,2023-08-18 14:01:00,Robotics Market to grow by USD 22.2697 billion from 2022 to 2027. Stringent health and safety regulations to drive ... PR ...,LHX,0.050894,0.018953,Neutral
Northrop  ( NOC )  Wins Contract to Aid SEWIP Block 3 Systems,https://www.zacks.com/stock/news/2138100/northrop-noc-wins-contract-to-aid-sewip-block-3-systems,2023-08-18 13:55:00,Northrop (NOC) is set to provide design agent engineering of SEWIP Block 3 systems.,LHX,0.127795,0.245642,Somewhat-Bullish
RTX's Unit Secures Contract for Satellite Communications Pod,https://www.zacks.com/stock/news/2136444/rtxs-unit-secures-contract-for-satellite-communications-pod,2023-08-15 13:15:00,RTX Corporation's (RTX) unit Collins Aerospace will provide a secure and reliable wireless data network to warfighters through its Beyond-Line-Of-Sight satellite communications pod.,LHX,0.190167,0.175629,Somewhat-Bullish
L3Harris  ( LHX )  Secures Contract to Aid AN/ALQ-214 System,https://www.zacks.com/stock/news/2136218/l3harris-lhx-secures-contract-to-aid-analq-214-system,2023-08-14 14:21:00,L3Harris (LHX) wins a $29.5M contract for the AN/ALQ-214 countermeasure system's production and associated services.,LHX,0.173333,0.386023,Bullish
"Deep Sea Robot Market to grow by USD 1,746.53 million from 2022 to 2027; Market driven by the growing demand for ... - PR Newswire",https://www.prnewswire.com/news-releases/deep-sea-robot-market-to-grow-by-usd-1-746-53-million-from-2022-to-2027-market-driven-by-the-growing-demand-for-oceanography-research---technavio-301895952.html,2023-08-09 21:00:00,"Deep Sea Robot Market to grow by USD 1,746.53 million from 2022 to 2027. Market driven by the growing demand for ... PR ...",LHX,0.029184,-0.06173,Neutral
CTTAY: Investor Interest Soars in the Top 3 Auto Stocks,https://stocknews.com/news/cttay-alsn-gtx-investor-interest-soars-in-the-top-3-auto-stocks/,2023-08-09 15:54:21,"Despite macroeconomic concerns, auto sales in the US are expected to remain robust due to increased demand. So, quality auto stocks Continental Aktiengesellschaft ( CTTAY ) , Allison Transmission Holdings, Inc. ( ALSN ) , and Garrett Motion Inc. ( GTX ) could be wise additions to your portfolio.",LHX,0.036091,0.050308,Neutral
"Situational Awareness Market Size, Share & Industry Growth Analysis Report",https://www.benzinga.com/pressreleases/23/08/g33660695/situational-awareness-market-size-share-industry-growth-analysis-report,2023-08-09 11:30:00,"Chicago, Aug. 09, 2023 ( GLOBE NEWSWIRE ) -- The Situational Awareness Market by Component ( Sensors, GPS, Gyroscopes ) , Products ( Fire & Flood Alarm Systems, HMI, RFID Solutions ) , Applications ( Robots, Smart Infrastructure Management, CBRN Systems ) , Industry, and Geography, Increasing ...",LHX,0.093653,0.0,Neutral
"The Small Satellite Market to grow by USD 3,734.88 million from 2022 to 2027 | The low-cost solution deployment ... - PR Newswire",https://www.prnewswire.com/news-releases/the-small-satellite-market-to-grow-by-usd-3-734-88-million-from-2022-to-2027--the-low-cost-solution-deployment-through-micro-and-nanosatellites-to-boost-market-growth---technavio-301892614.html,2023-08-04 08:00:00,"The Small Satellite Market to grow by USD 3,734.88 million from 2022 to 2027 | The low-cost solution deployment ... PR ...",LHX,0.047559,0.040732,Neutral
"Aerospace Stocks Are Set To Fly High On Multi-Year Tailwinds, Says Mario Gabelli - L3Harris Technologies  ( NYSE:LHX ) ",https://www.benzinga.com/trading-ideas/long-ideas/23/08/33524671/aerospace-stocks-are-set-to-fly-high-on-multi-year-tailwinds-says-mario-gabelli,2023-08-02 16:47:28,"Mario Gabelli says aerospace stocks are poised to take off. What Happened: Gabelli named several aerospace stocks he's interested in right now, Wednesday morning on CNBC's ""Squawk Box."" ""The aerospace industry, defense, commercial aviation is extraordinarily exciting,"" the GAMCO Investors ...",LHX,0.550532,0.261806,Somewhat-Bullish
Space Propulsion Market worth $18.1 billion by 2028 - Exclusive Report by MarketsandMarkets,https://www.prnewswire.com/news-releases/space-propulsion-market-worth-18-1-billion-by-2028---exclusive-report-by-marketsandmarkets-301889048.html,2023-07-31 10:00:00,"CHICAGO, July 31, 2023 /PRNewswire/ -- The space propulsion market is estimated to be USD 10.6 billion in 2023 and is projected to reach USD 18.1 billion by 2028, at a CAGR of 11.3% during the forecast period according to a new report by MarketsandMarkets.",LHX,0.043264,0.076213,Neutral
The Geospatial Analytics Market to grow by USD 102.97 billion between 2022 to 2027|Alphabet Inc. and Alteryx Inc ... - PR Newswire,https://www.prnewswire.com/news-releases/the-geospatial-analytics-market-to-grow-by-usd-102-97-billion-between-2022-to-2027alphabet-inc-and-alteryx-inc-are-major-vendors---technavio-301887575.html,2023-07-28 16:00:00,The Geospatial Analytics Market to grow by USD 102.97 billion between 2022 to 2027|Alphabet Inc. and Alteryx Inc ... PR ...,LHX,0.032871,0.102575,Neutral
"Stocks making the biggest moves midday: Meta Platforms, Chipotle, Royal Caribbean and more",https://www.cnbc.com/2023/07/27/stocks-making-the-biggest-moves-midday-meta-platforms-chipotle-royal-caribbean-and-more.html,2023-07-27 17:01:05,"Here are the stocks making headlines on Wall Street on Thursday, July 27.",LHX,0.037155,0.160827,Somewhat-Bullish
"L3Harris  ( LHX )  Q2 Earnings Beat Estimates, Sales Up Y/Y",https://www.zacks.com/stock/news/2128570/l3harris-lhx-q2-earnings-beat-estimates-sales-up-yy,2023-07-27 11:27:00,L3Harris' (LHX) second-quarter 2023 adjusted earnings beat the Zacks Consensus Estimate of $2.94 by 1%. Revenues increase 13.5% from the year-ago quarter's sales ...,LHX,0.297301,0.074307,Neutral
L3Harris says deal for Aerojet gets go-ahead from U.S. regulator,https://www.reuters.com/markets/deals/l3harris-says-deal-aerojet-gets-go-ahead-us-regulator-2023-07-26/,2023-07-26 22:13:00,July 26 ( Reuters ) - Aerospace and defense company L3Harris Technologies ( LHX.N ) on Wednesday said it was informed that the U.S. Federal Trade Commission would not block its $4.7 billion deal for Aerojet Rocketdyne ( AJRD.N ) .,LHX,0.138464,0.148135,Neutral
"Stocks making the biggest moves after hours: Meta Platforms, Chipotle Mexican Grill, ServiceNow and more",https://www.cnbc.com/2023/07/26/stocks-making-the-biggest-moves-after-hours-meta-cmg-now-and-more.html,2023-07-26 21:26:17,See which stocks are posting big moves after the bell.,LHX,0.062434,0.092221,Neutral
How Is The Market Feeling About L3Harris Technologies? - L3Harris Technologies  ( NYSE:LHX ) ,https://www.benzinga.com/short-sellers/23/07/33398992/how-is-the-market-feeling-about-l3harris-technologies,2023-07-26 17:15:17,"L3Harris Technologies's LHX short percent of float has risen 4.6% since its last report. The company recently reported that it has 1.73 million shares sold short, which is 0.91% of all regular shares that are available for trading.",LHX,0.221819,0.155473,Somewhat-Bullish
L3Harris Likely To Report Decline In Q2 Earnings; Here's A Look At Recent Price Target Changes By The Most Accurate Analysts - L3Harris Technologies  ( NYSE:LHX ) ,https://www.benzinga.com/news/earnings/23/07/33392236/l3harris-likely-to-report-decline-in-q2-earnings-heres-a-look-at-recent-price-target-changes-by-the,2023-07-26 13:08:44,"L3Harris Technologies, Inc. LHX is expected to report its second-quarter financial results, after the closing bell on July 26, 2023. Analysts expect the company to post quarterly earnings at $2.94 per share, down from year-ago earnings of $3.23 per share. The company's revenue might come in at ...",LHX,0.436009,0.420671,Bullish
What's in the Cards for Virgin Galactic  ( SPCE )  in Q2 Earnings?,https://www.zacks.com/stock/news/2127583/whats-in-the-cards-for-virgin-galactic-spce-in-q2-earnings,2023-07-26 12:06:00,"Virgin Galactic's (SPCE) Q2 results are likely to reflect the positive impact of an increased focus on commercial space travel. However, earnings may have been dampened by the rise in certain costs.",LHX,0.232069,-0.094572,Neutral
Will Higher Component Price Hurt Leidos  ( LDOS )  in Q2 Earnings?,https://www.zacks.com/stock/news/2127553/will-higher-component-price-hurt-leidos-ldos-in-q2-earnings,2023-07-26 10:44:00,"Leidos' (LDOS) Q2 2023 results are likely to reflect solid sales growth across all its segments. Yet, supply chain disruption-induced higher component price might have hurt its bottom-line performance.",LHX,0.185781,0.0,Neutral
Will Lower Defense Deliveries Hit Boeing  ( BA )  in Q2 Earnings?,https://www.zacks.com/stock/news/2126811/will-lower-defense-deliveries-hit-boeing-ba-in-q2-earnings,2023-07-25 12:18:00,Boeing's (BA) Q2 results are likely to reflect the impact of lower defense deliveries as well as supply-chain constraints.,LHX,0.18967,0.0,Neutral
"Aerospace & Defense Stock Q2 Earnings on Jul 26: BA, GD & More",https://www.zacks.com/stock/news/2126805/aerospace-defense-stock-q2-earnings-on-jul-26-ba-gd-more,2023-07-25 12:15:00,"Earnings of the aerospace sector, which houses the aerospace and defense stocks, are expected to decline 9% from the prior-year quarter's reported figure. Let's see how BA, GD, TDY & LHX reports.",LHX,0.184739,0.151574,Somewhat-Bullish
Will 777X Related Costs Hurt Boeing  ( BA )  in Q2 Earnings?,https://www.zacks.com/stock/news/2126118/will-777x-related-costs-hurt-boeing-ba-in-q2-earnings,2023-07-24 12:51:00,Boeing's (BA) Q2 results for its commercial airplane business are likely to reflect solid 787 delivery benefits amid abnormal cost impacts related to 787 and 777X programs.,LHX,0.1789,0.0,Neutral
Satellite Navigation System Market worth $75.5 billion by 2028 - Exclusive Report by MarketsandMarkets,https://www.prnewswire.com/news-releases/satellite-navigation-system-market-worth-75-5-billion-by-2028---exclusive-report-by-marketsandmarkets-301883757.html,2023-07-24 10:30:00,"CHICAGO, July 24, 2023 /PRNewswire/ -- The Satellite Navigation System Market is estimated at USD 61.1 billion in 2023 and is projected to reach USD 75.5 billion by 2028, at a CAGR of 4.4 % from 2023 to 2028 according to a new report by MarketsandMarkets.",LHX,0.050044,0.0,Neutral
