title,url,time_published,summary,ticker,relevance_score,ticker_sentiment_score,ticker_sentiment_label
Military simulation and virtual training market size to grow by USD 6.11 billion from 2021 to 2026: Cost-effective virtual training will drive growth -Technavio,https://www.prnewswire.com/news-releases/military-simulation-and-virtual-training-market-size-to-grow-by-usd-6-11-billion-from-2021-to-2026-cost-effective-virtual-training-will-drive-growth--technavio-301775138.html,2023-03-20 20:45:00,Military simulation and virtual training market size to grow by USD ... PR ...,LHX,0.03319,0.085547,Neutral
 ( LHX )  - Analyzing L3Harris Technologies's Short Interest - L3Harris Technologies  ( NYSE:LHX ) ,https://www.benzinga.com/short-sellers/23/03/31423544/lhx-analyzing-l3harris-technologiess-short-interest,2023-03-20 15:45:48,"L3Harris Technologies's LHX short percent of float has fallen 6.82% since its last report. The company recently reported that it has 1.56 million shares sold short, which is 0.82% of all regular shares that are available for trading.",LHX,0.221819,0.083071,Neutral
Will Segmental Sales Boost AAR Corp.  ( AIR )  Q3 Earnings?,https://www.zacks.com/stock/news/2067928/will-segmental-sales-boost-aar-corp-air-q3-earnings,2023-03-20 13:37:00,AAR Corp. (AIR) Q3 results are likely to reflect a strong sales performance across its segments.,LHX,0.121037,-0.019717,Neutral
"Aerojet Rocketdyne Stockholders Approve Proposed Acquisition by L3Harris - Aerojet Rocketdyne Hldgs  ( NYSE:AJRD ) , L3Harris Technologies  ( NYSE:LHX ) ",https://www.benzinga.com/pressreleases/23/03/g31388643/aerojet-rocketdyne-stockholders-approve-proposed-acquisition-by-l3harris,2023-03-16 20:21:54,"EL SEGUNDO, Calif., March 16, 2023 ( GLOBE NEWSWIRE ) -- Aerojet Rocketdyne Holdings, Inc. AJRD ( or the ""Company"" ) announced that at a special meeting held today, its stockholders voted to approve the Company's proposed acquisition by L3Harris Technologies LHX. 99.7% of votes cast were in favor ...",LHX,0.127456,0.1679,Somewhat-Bullish
Aerojet Rocketdyne Stockholders Approve Proposed Acquisition by L3Harris,https://www.globenewswire.com/news-release/2023/03/16/2629202/19445/en/Aerojet-Rocketdyne-Stockholders-Approve-Proposed-Acquisition-by-L3Harris.html,2023-03-16 20:21:00,"EL SEGUNDO, Calif., March 16, 2023 ( GLOBE NEWSWIRE ) -- Aerojet Rocketdyne Holdings, Inc. ( NYSE: AJRD ) ( or the ""Company"" ) announced that at a special meeting held today, its stockholders voted to approve the Company's proposed acquisition by L3Harris Technologies ( NYSE: LHX ) . 99.7% of ...",LHX,0.115787,0.174632,Somewhat-Bullish
L3Harris Technologies  ( NYSE:LHX )  Now Covered by StockNews.com,https://www.defenseworld.net/2023/03/16/l3harris-technologies-nyselhx-now-covered-by-stocknews-com.html,2023-03-16 10:24:43,"Equities researchers at StockNews.com started coverage on shares of L3Harris Technologies ( NYSE:LHX - Get Rating ) in a note issued to investors on Thursday. The brokerage set a ""buy"" rating on the stock.",LHX,0.911376,0.440499,Bullish
CesiumAstro Scanned the Airline Wi-Fi Market and Spied Opportunity,https://www.forbes.com/sites/erictegler/2023/03/15/cesiumastro-scanned-the-airline-wi-fi-market-and-spied-opportunity/,2023-03-15 13:00:00,"Texas-based satellite antenna-maker, CesiumAstro, is offering its flat-panel phased array antenna and software-defined radio combo to air transport manufacturers, betting that in-cabin broadband will be a must-have for airlines.",LHX,0.016773,0.024371,Neutral
"Electro-Optics in Naval Market Size Worth USD 11.13 Bn, Globally, by 2028 at 4.3% CAGR - Exclusive Report by The Insight Partners",https://www.benzinga.com/pressreleases/23/03/g31318803/electro-optics-in-naval-market-size-worth-usd-11-13-bn-globally-by-2028-at-4-3-cagr-exclusive-repo,2023-03-13 12:31:31,"New York, March 13, 2023 ( GLOBE NEWSWIRE ) -- According to The Insight Partners, ""Electro-Optics in Naval Market Forecast to 2028 - COVID-19 Impact and Global Analysis - by Technology ( Camera, Sensor, and Laser Range Finder ) , Application ( Target Detection, Identification, and Tracking.",LHX,0.081645,0.061355,Neutral
"Airborne ISR Market Analysis, Size, Share, Growth Drivers, and Trends by 2030",https://www.benzinga.com/pressreleases/23/03/g31281426/airborne-isr-market-analysis-size-share-growth-drivers-and-trends-by-2030,2023-03-09 17:02:22,"Pune India, March 09, 2023 ( GLOBE NEWSWIRE ) -- The global airborne ISR market size is expected to surge exponentially due to the rising benefits of the ISR system among military personnel. Further, the rising adoption of small unmanned systems in surveillance is expected to bolster industry ...",LHX,0.036587,0.0,Neutral
General Dynamics  ( GD )  Announces a Hike of 4.8% in Dividend,https://www.zacks.com/stock/news/2063529/general-dynamics-gd-announces-a-hike-of-48-in-dividend,2023-03-09 14:22:00,"General Dynamics (GD) raises the quarterly dividend to $1.32 per share, reflecting a rise of 4.8% from the previous payout.",LHX,0.127456,0.272282,Somewhat-Bullish
Small Satellite Market to Hit USD 12.02 Billion by 2029 | At a CAGR of 11.53%,https://www.benzinga.com/pressreleases/23/03/g31231047/small-satellite-market-to-hit-usd-12-02-billion-by-2029-at-a-cagr-of-11-53,2023-03-07 06:30:44,"Pune, India, March 07, 2023 ( GLOBE NEWSWIRE ) -- The global small satellite market size was valued at USD 4.90 billion in 2021 and reached USD 5.60 billion in 2022. The market is expected to be valued at USD 12.02 billion by 2029, exhibiting a CAGR of 11.53% during the forecast period.",LHX,0.029728,0.0,Neutral
Avionics Market to Hit USD 75.81 Billion by 2027 | At a CAGR of 9.25%,https://www.benzinga.com/pressreleases/23/03/g31165608/avionics-market-to-hit-usd-75-81-billion-by-2027-at-a-cagr-of-9-25,2023-03-02 12:57:53,"Pune, India, March 02, 2023 ( GLOBE NEWSWIRE ) -- The global avionics market size is projected to reach USD 75.81 billion by the end of 2027. The increasing product applications will provide a platform for growth for the companies operating in the market.",LHX,0.04406,0.0,Neutral
"Global Signals Intelligence  ( SIGINT )  Market Anticipated to Garner $20,013.20 Million, Growing with 4.5% CAGR in the 2022-2030 Timeframe [240-Pages] | Declared by Research Dive",https://www.benzinga.com/pressreleases/23/02/g31091189/global-signals-intelligence-sigint-market-anticipated-to-garner-20-013-20-million-growing-with-4-5,2023-02-28 14:02:00,"New York, USA, Feb. 28, 2023 ( GLOBE NEWSWIRE ) -- Research Dive has published a new report on the global signals intelligence ( SIGINT ) market. According to the report, the global market is projected to surpass $20,013.20 million and grow with a CAGR of 4.5% in the estimated period, 2022-2030.",LHX,0.055751,0.0,Neutral
"Janet Yellen Makes Surprise Ukraine Visit In Wake Of Russian Drone Strikes: What You Need To Know - CrowdStrike Holdings  ( NASDAQ:CRWD ) , Northrop Grumman  ( NYSE:NOC ) , Chevron  ( NYSE:CVX ) , BP  ( NYSE:BP ) , SentinelOne  ( NYSE:S ) , Check Point Software  ( NASDAQ:CHKP ) , Fortinet  ( NASDAQ:FTNT ) , Raytheon Technologies  ( NYSE:RTX ) , Exxon Mobil  ( NYSE:XOM ) , Zscaler  ( NASDAQ:ZS ) , General Dynamics  ( NYSE:GD ) , L3Harris Technologies  ( NYSE:LHX ) , Palo Alto Networks  ( NASDAQ:PANW ) ",https://www.benzinga.com/news/23/02/31075003/janet-yellen-makes-surprise-ukraine-visit-in-wake-of-russian-drone-strikes-what-you-need-to-know,2023-02-27 19:01:06,U.S. Treasury Secretary Janet Yellen is on a surprise visit to Ukraine on Monday. The appearance is one week after President Joe Biden visited Kyiv to meet with his Ukrainian counterpart and express support for the Eastern European nation.,LHX,0.143843,0.0,Neutral
"Unmanned Sea Systems Market size to grow at a CAGR of 9.78% by 2027, Emergence of 3D printing and composite materials to be a leading trend - Technavio",https://www.prnewswire.com/news-releases/unmanned-sea-systems-market-size-to-grow-at-a-cagr-of-9-78-by-2027---emergence-of-3d-printing-and-composite-materials-to-be-a-leading-trend---technavio-301755239.html,2023-02-25 02:30:00,Unmanned Sea Systems Market size to grow at a CAGR of 9.78% by ... PR ...,LHX,0.030838,0.058848,Neutral
"Image Intensifier Market to Reach $3.2 Billion, Globally, by 2031 at 7.5% CAGR: Allied Market Research",https://www.prnewswire.com/news-releases/image-intensifier-market-to-reach-3-2-billion-globally-by-2031-at-7-5-cagr-allied-market-research-301755570.html,2023-02-24 16:41:00,"Image Intensifier Market to Reach $3.2 Billion, Globally, by 2031 at ... PR ...",LHX,0.027288,0.0,Neutral
L3Harris Boosts Quarterly Dividend By About 2% - L3Harris Technologies  ( NYSE:LHX ) ,https://www.benzinga.com/news/23/02/31046645/l3harris-boosts-quarterly-dividend-by-about-2,2023-02-24 13:50:15,"L3Harris Technologies, Inc. LHX said its Board of Directors approved an increase in the company's per share quarterly cash dividend rate from $1.12 to $1.14. The hike will commence with the dividend for the first quarter of 2023, payable on March 24, 2023, to shareholders of record on the close ...",LHX,0.827318,0.587729,Bullish
Aviation Analytics Market to Hit USD 4.36 Billion by 2028 | At a CAGR of 11.58%,https://www.benzinga.com/pressreleases/23/02/g31002160/aviation-analytics-market-to-hit-usd-4-36-billion-by-2028-at-a-cagr-of-11-58,2023-02-22 10:02:22,"Pune, India, Feb. 22, 2023 ( GLOBE NEWSWIRE ) -- The aviation analytics market size is anticipated to hit USD 4.36 billion by 2028 and exhibit a CAGR of 11.58% during the forecast period. Airlines' growing adoption of aviation analytics for cost saving is anticipated to bolster market growth.",LHX,0.040212,0.0,Neutral
RTX: 3 Defensive Stocks to Buy Before the End of February,https://stocknews.com/news/rtx-lmt-lhx-3-defensive-stocks-to-buy-before-the-end-of-february/,2023-02-21 16:39:25,"Over the past year, defense stocks have benefited from increased outlays on weapons by the United States and its allies due to the Ukraine war. Still, companies have struggled with supply snags, higher costs, and labor shortages.",LHX,0.216618,0.222808,Somewhat-Bullish
Autonomous Underwater Vehicles Market Size to Hit USD 4.17 Billion by 2028 | Exhibiting a CAGR of 17.80%,https://www.benzinga.com/pressreleases/23/02/g30976530/autonomous-underwater-vehicles-market-size-to-hit-usd-4-17-billion-by-2028-exhibiting-a-cagr-of-17,2023-02-20 13:41:00,"Pune, India, Feb. 20, 2023 ( GLOBE NEWSWIRE ) -- The global autonomous underwater vehicles market size was valued at USD 1.16 billion in 2020. The market is forecast to rise from USD 1.33 billion in 2021 to USD 4.17 billion by 2028 at 17.80% CAGR during the 2021-2028 period.",LHX,0.080055,0.112919,Neutral
"SHAREHOLDER INVESTIGATION: Halper Sadeh LLC Investigates TIG, SESN, CINC, AJRD - CinCor Pharma  ( NASDAQ:CINC ) , Aerojet Rocketdyne Hldgs  ( NYSE:AJRD ) ",https://www.benzinga.com/pressreleases/23/02/g30942252/shareholder-investigation-halper-sadeh-llc-investigates-tig-sesn-cinc-ajrd,2023-02-16 13:54:48,"NEW YORK, Feb. 16, 2023 ( GLOBE NEWSWIRE ) -- Halper Sadeh LLC, an investor rights law firm, is investigating the following companies for potential violations of the federal securities laws and/or breaches of fiduciary duties to shareholders relating to: Trean Insurance Group, Inc.",LHX,0.126784,0.097376,Neutral
"Aerojet Rocketdyne Holdings, Inc. Reports 2022 Fourth Quarter and Annual Results",https://www.globenewswire.com/news-release/2023/02/15/2609219/19445/en/Aerojet-Rocketdyne-Holdings-Inc-Reports-2022-Fourth-Quarter-and-Annual-Results.html,2023-02-15 21:15:00,"Record fourth quarter and annual sales of $648 million and $2,238 million, respectively Record fourth quarter and annual sales of $648 million and $2,238 million, respectively ...",LHX,0.014332,0.08422,Neutral
"Image Intensifier Tube Market Revenue to Cross $1.38 Billion, Globally, by 2028 - Growth Report by The Insight Partners",https://www.benzinga.com/pressreleases/23/02/g30925349/image-intensifier-tube-market-revenue-to-cross-1-38-billion-globally-by-2028-growth-report-by-the-,2023-02-15 14:49:50,"New York, Feb. 15, 2023 ( GLOBE NEWSWIRE ) -- According to The Insight Partners, ""Image Intensifier Tube Market Size, Share, Growth, Trends and Global Forecast to 2028 - COVID-19 Impact and Global Analysis By Generation ( Generation 1, Generation 2, and Generation 3 ) and End User ( Military, ...",LHX,0.063258,0.026004,Neutral
CAE reports third quarter fiscal 2023 results,https://www.newswire.ca/news-releases/cae-reports-third-quarter-fiscal-2023-results-893435693.html,2023-02-14 13:09:00, Revenue of vs. in prior year  Earnings per share ( EPS ) of vs. in prior year  Adjusted EPS ( 1 ) of vs. in prior year  Operating income of vs. in prior year  Adjusted segment operating income ( 1 ) of vs. in prior year  Adjusted order intake ( 1 ) of for a record adjusted backlog ( 1 ) ...,LHX,0.005787,0.08674,Neutral
CAE reports third quarter fiscal 2023 results,https://www.prnewswire.com/news-releases/cae-reports-third-quarter-fiscal-2023-results-301746336.html,2023-02-14 13:09:00,"Revenue of $1,020.3 million vs. $848.7 million in prior year Earnings per share ( EPS ) of $0.25 vs. $0.08 in prior year Adjusted EPS ( 1 ) of $0.28 vs. $0.19 in prior year Operating income of $145.9 million vs. $65.5 million in prior year",LHX,0.005444,0.083868,Neutral
"Huntington Ingalls  ( HII )  Q4 Earnings Miss, Revenues Rise Y/Y",https://www.zacks.com/stock/news/2052271/huntington-ingalls-hii-q4-earnings-miss-revenues-rise-yy,2023-02-09 14:23:00,"Huntington Ingalls' (HII) Q4 revenues of $2,812 million beat the Zacks Consensus Estimate by 4.5%. The top line also improves 5% year over year.",LHX,0.113866,-0.019206,Neutral
Satellite Bus Market Size to Worth USD 54.33 Billion by 2028 | At a CAGR of 8.81%,https://www.benzinga.com/pressreleases/23/02/g30828619/satellite-bus-market-size-to-worth-usd-54-33-billion-by-2028-at-a-cagr-of-8-81,2023-02-09 10:05:48,"Pune, India, Feb. 09, 2023 ( GLOBE NEWSWIRE ) -- The global satellite bus market size was USD 27.67 billion in 2020. The market is projected to grow from USD 30.08 billion in 2021 to USD 54.33 billion in 2028 at a CAGR of 8.81% in the 2021-2028 period.",LHX,0.042346,0.0,Neutral
Aircraft Antenna Market to Worth USD 631.1 Million by 2029 | At a CAGR of 6.71%,https://www.benzinga.com/pressreleases/23/02/g30828555/aircraft-antenna-market-to-worth-usd-631-1-million-by-2029-at-a-cagr-of-6-71,2023-02-09 09:57:10,"Pune, India, Feb. 09, 2023 ( GLOBE NEWSWIRE ) -- The global aircraft antenna market size was pegged at USD 389.5 million in 2021. The market is anticipated to surge from USD 400.7 million in 2022 to USD 631.1 million by 2029 at 6.71% CAGR during the forecast period.",LHX,0.038223,-0.085696,Neutral
"Spirit AeroSystems  ( SPR )  Reports Q4 Loss, Revenues Rise Y/Y",https://www.zacks.com/stock/news/2051404/spirit-aerosystems-spr-reports-q4-loss-revenues-rise-yy,2023-02-08 11:40:00,"Spirit AeroSystems' (SPR) total fourth-quarter revenues of $1,320 million miss the Zacks Consensus Estimate by 4.2% but rise 23% on a year-over-year basis.",LHX,0.109705,-0.018928,Neutral
"Unmanned Sea Systems Market to Grow by 9.34% between 2022 and 2023; Insights on Top Countries such as Germany, among others - Technavio",https://www.prnewswire.com/news-releases/unmanned-sea-systems-market--to-grow-by-9-34-between-2022-and-2023-insights-on-top-countries-such-as-germany-among-others--technavio-301738298.html,2023-02-06 12:30:00,Unmanned Sea Systems Market to Grow by 9.34% between 2022 ... PR ...,LHX,0.043342,0.084111,Neutral
Northrop  ( NOC )  to Repurchase $500M Shares Under ASR Agreement,https://www.zacks.com/stock/news/2049474/northrop-noc-to-repurchase-500m-shares-under-asr-agreement,2023-02-03 13:48:00,Northrop (NOC) announces to buy back $500 million of the common stock under the ASR program.,LHX,0.180236,0.330031,Somewhat-Bullish
"SHAREHOLDER INVESTIGATION: Halper Sadeh LLC Investigates ALBO, AJRD, CBIO, STAR - Aerojet Rocketdyne Hldgs  ( NYSE:AJRD ) , Albireo Pharma  ( NASDAQ:ALBO ) ",https://www.benzinga.com/pressreleases/23/02/g30704835/shareholder-investigation-halper-sadeh-llc-investigates-albo-ajrd-cbio-star,2023-02-03 12:27:03,"NEW YORK, Feb. 03, 2023 ( GLOBE NEWSWIRE ) -- Halper Sadeh LLC, an investor rights law firm, is investigating the following companies for potential violations of the federal securities laws and/or breaches of fiduciary duties to shareholders relating to: Albireo Pharma, Inc. ALBO's sale to ...",LHX,0.123526,0.096228,Neutral
"At 9.7% CAGR, Aircraft Communication System Market Share Worth $13.06 Bn, Globally, by 2028 - Exclusive Report by The Insight Partners",https://www.benzinga.com/pressreleases/23/02/g30663913/at-9-7-cagr-aircraft-communication-system-market-share-worth-13-06-bn-globally-by-2028-exclusive-r,2023-02-01 12:17:59,"New York, Feb. 01, 2023 ( GLOBE NEWSWIRE ) -- According to The Insight Partners, Aircraft Communication System Market Forecast to 2028 - COVID-19 Impact and Global Analysis by Type ( VHF/UHF/HF Radios, Data Links, and SATCOM ) , Components ( Antennas, Transponders, Transceivers, and Displays & ...",LHX,0.029436,0.078743,Neutral
"At 7.8% CAGR, Unmanned Underwater Vehicle Market Share Worth $4.44 Bn, Globally, by 2028 - Exclusive Report by The Insight Partners",https://www.benzinga.com/pressreleases/23/01/g30644850/at-7-8-cagr-unmanned-underwater-vehicle-market-share-worth-4-44-bn-globally-by-2028-exclusive-repo,2023-01-31 15:03:07,"New York, Jan. 31, 2023 ( GLOBE NEWSWIRE ) -- According to The Insight Partners, Unmanned Underwater Vehicle Market Forecast to 2028 - COVID-19 Impact and Global Analysis by Type ( Remotely Operated Vehicle and Autonomous ) , Accessories ( Camera, Sensor, Sonar, Navigation System, Communication ...",LHX,0.026357,-0.05247,Neutral
$100 Invested In L3Harris Technologies 20 Years Ago Would Be Worth This Much Today,https://www.benzinga.com/news/earnings/23/01/30626054/100-invested-in-l3harris-technologies-20-years-ago-would-be-worth-this-much-today,2023-01-30 17:03:18,"L3Harris Technologies LHX has outperformed the market over the past 20 years by 6.01% on an annualized basis producing an average annual return of 14.14%. Currently, L3Harris Technologies has a market capitalization of $40.36 billion.",LHX,0.980595,0.386944,Bullish
Northrop Grumman Elects Stephen O'Bryan Corporate Vice President and Global Business Development Officer; David Perry to Retire,https://www.benzinga.com/pressreleases/23/01/g30622725/northrop-grumman-elects-stephen-obryan-corporate-vice-president-and-global-business-development-of,2023-01-30 14:25:41,"FALLS CHURCH, Va., Jan. 30, 2023 ( GLOBE NEWSWIRE ) -- Northrop Grumman Corporation NOC announces that its board of directors has elected Stephen O'Bryan corporate vice president and Global Business Development Officer, effective February 6.",LHX,0.104228,0.005528,Neutral
Northrop Grumman Elects Stephen O'Bryan Corporate Vice President and Global Business Development Officer; David Perry to Retire,https://www.globenewswire.com/news-release/2023/01/30/2597673/189/en/Northrop-Grumman-Elects-Stephen-O-Bryan-Corporate-Vice-President-and-Global-Business-Development-Officer-David-Perry-to-Retire.html,2023-01-30 14:25:00,"FALLS CHURCH, Va., Jan. 30, 2023 ( GLOBE NEWSWIRE ) -- Northrop Grumman Corporation ( NYSE: NOC ) announces that its board of directors has elected Stephen O'Bryan corporate vice president and Global Business Development Officer, effective February 6.",LHX,0.107978,0.0056,Neutral
"'I Say, Move On': Cramer Prefers Nvidia Over This Cloud-Base Content Management Company Up 22%",https://www.benzinga.com/trading-ideas/long-ideas/23/01/30617441/i-say-move-on-cramer-prefers-nvidia-over-this-cloud-base-content-management-company-up-2,2023-01-30 13:36:42,"On CNBC's ""Mad Money Lightning Round,"" Jim Cramer said L3Harris Technologies Inc LHX is still a buy. ""There's so many people betting against it, and they're wrong,"" he added. Analysts have a consensus Neutral rating on LHX, according to Benzinga analyst ratings data.",LHX,0.448842,-0.38582,Bearish
Cramer's lightning round: L3Harris Technologies is still a buy,https://www.cnbc.com/2023/01/27/cramers-lightning-round-l3harris-technologies-is-still-a-buy.html,2023-01-28 00:14:05,"""Mad Money"" host Jim Cramer rings the lightning round bell, which means he's giving his answers to callers' stock questions at rapid speed.",LHX,0.170878,0.0,Neutral
"Visa, L3Harris rise; Intel, Eastman Chemical fall",https://apnews.com/article/business-financial-markets-hasbro-inc-intel-corp-eastman-chemical-co-bc6098f6666736306ec51b17fcbee1cc,2023-01-27 21:13:35,"Visa, L3Harris rise. Intel, Eastman Chemical fall The Associated Press - en ...",LHX,0.306963,0.0,Neutral
U.S. Senator Warren urges FTC to stop L3Harris deal to buy Aerojet,https://www.reuters.com/markets/deals/us-senator-warren-urges-ftc-stop-l3harris-deal-buy-aerojet-2023-01-27/,2023-01-27 18:58:00,U.S. Senator Warren urges FTC to stop L3Harris deal to buy ...,LHX,0.213048,-0.091272,Neutral
"L3Harris  ( LHX )  Q4 Earnings Beat Estimates, Sales Up Y/Y",https://www.zacks.com/stock/news/2045264/l3harris-lhx-q4-earnings-beat-estimates-sales-up-yy,2023-01-27 11:24:00,"L3Harris' (LHX) Q4 revenues of $4,578 million beat the Zacks Consensus Estimate by 5.7%. Revenues increase 5.2% from the year-ago quarter's $4,350 million.",LHX,0.34648,0.08034,Neutral
"L3Harris Revenue Beats Expectations, Helped by Defense Spending. The Stock Is Rising.",https://www.barrons.com/articles/l3harris-stock-earnings-revenue-defense-spending-51674817484,2023-01-27 11:17:00,L3Harris Stock Rises After Revenue Tops Expectations on Strong Defense Spending ...,LHX,0.876064,0.423339,Bullish
Will Segmental Revenues Aid L3Harris  ( LHX )  Q4 Earnings?,https://www.zacks.com/stock/news/2042563/will-segmental-revenues-aid-l3harris-lhx-q4-earnings,2023-01-23 13:42:00,"L3Harris' (LHX) fourth-quarter results are likely to benefit from growth across all its segments, partially weighed down by the impacts of supply-chain challenges.",LHX,0.426567,0.273173,Somewhat-Bullish
"Tesla, Microsoft, Boeing earnings, along with GDP top week ahead",https://www.foxbusiness.com/markets/tesla-microsoft-boeing-earnings-gdp-top-week-ahead,2023-01-22 22:22:33,"This week will be a busy one for investors with earnings from defense, credit cards and airline companies all reporting quarterly results. The stock market is coming off a mixed week with the Dow Jones Industrial Average falling over 2%, while the S&P slipped marginally as the Nasdaq Composite ...",LHX,0.05654,0.0,Neutral
Infrared Sensors Major Players for 2023 to 2027 in Germany and Globally researched by Technavio,https://www.prnewswire.com/news-releases/infrared-sensors-major-players-for-2023-to-2027-in-germany-and-globally-researched-by-technavio-301724765.html,2023-01-19 16:30:00,Infrared Sensors Major Players for 2023 to 2027 in Germany and ... PR ...,LHX,0.02922,0.033849,Neutral
3 Dividend Stocks Trading Near Their 52-Week Lows,https://www.fool.com/investing/2023/01/19/3-dividend-stocks-trading-near-their-52-week-lows/,2023-01-19 10:55:00,Income investors looking to buy on a pullback might be interested in these stocks.,LHX,0.111488,-0.108471,Neutral
"Global Homeland Security Market Expected to Accumulate a Revenue of $8,03,967.3 Million by 2028, Growing at a CAGR of 6.1% [328-Pages] | Proclaimed by Research Dive",https://www.benzinga.com/pressreleases/23/01/g30461830/global-homeland-security-market-expected-to-accumulate-a-revenue-of-8-03-967-3-million-by-2028-gro,2023-01-18 14:03:00,"New York, USA, Jan. 18, 2023 ( GLOBE NEWSWIRE ) -- According to the latest report published by Research Dive, the global homeland security market is anticipated to rise at a stable CAGR of 6.1%, thereby garnering a revenue of $8,03,967.3 million by 2028.",LHX,0.056943,0.0,Neutral
Top 5 Industrials Stocks That May Jump,https://www.benzinga.com/trading-ideas/long-ideas/23/01/30439378/top-5-industrials-stocks-that-may-jump,2023-01-17 13:35:19,"The most oversold stocks in the industrials sector presents an opportunity to buy into undervalued companies. The RSI is a momentum indicator, which compares a stock's strength on days when prices go up to its strength on days when prices go down.",LHX,0.366061,-0.186395,Somewhat-Bearish
"Global Satellite Data Services Market Anticipated to Generate $22,431.6 Million by 2028 and Grow at a CAGR of 12.7% in the 2021-2028 Timeframe [218-Pages] | Exclusive by Research Dive",https://www.benzinga.com/pressreleases/23/01/g30428208/global-satellite-data-services-market-anticipated-to-generate-22-431-6-million-by-2028-and-grow-at,2023-01-16 14:03:00,"New York, USA, Jan. 16, 2023 ( GLOBE NEWSWIRE ) -- As per Research Dive's latest report, the global satellite data services market is expected to garner a revenue of $22,431.6 million by 2028 and grow with a stunning CAGR of 12.7% in the 2021-2028 timeframe.",LHX,0.052685,0.0,Neutral
Northrop  ( NOC )  Builds Advanced Radar for the F-35 Lightning II,https://www.zacks.com/stock/news/2039452/northrop-noc-builds-advanced-radar-for-the-f-35-lightning-ii,2023-01-16 11:52:00,Northrop (NOC) develops an advanced active electronically scanned array radar for the F-35 Lightning II.,LHX,0.114956,0.24503,Somewhat-Bullish
"Communication Intelligence Market to Observe Significant Growth Owing to Product Launches and Company Collaborations by Market Players, such as Raytheon Company, TCI International and Others",https://www.benzinga.com/pressreleases/23/01/g30307923/communication-intelligence-market-to-observe-significant-growth-owing-to-product-launches-and-comp,2023-01-06 11:43:46,"Pune, Jan. 06, 2023 ( GLOBE NEWSWIRE ) -- According to the ""Global Communication Intelligence Market"" report published by Maximize market Research, the market is expected to reach USD 12.15 Billion by 2029, exhibiting a CAGR of 6.70 % during the forecast period ( 2022-2029 ) .",LHX,0.03545,0.0,Neutral
