title,url,time_published,summary,ticker,relevance_score,ticker_sentiment_score,ticker_sentiment_label
"Delta Earnings Set To Soar As Consumers Seek Travel, Experiences",https://www.investors.com/news/delta-air-lines-earnings-q4-dal-stock/,2023-01-10 22:50:00,"Delta Air Lines ( DAL ) prepares to report fourth-quarter earnings early Friday, after raising its Q4 guidance and giving bullish 2023 outlook in mid December, on the back of robust travel demand. DAL stock rose for a fifth straight day Tuesday.",LUV,0.136888,-0.031282,Neutral
Southwest Airlines promotes executives following operational meltdown,https://www.foxbusiness.com/markets/southwest-airlines-promotes-executives-following-operational-meltdown,2023-01-10 21:55:21,"Southwest Airlines promoted five executives as the budget air carrier continues to reel from an operational meltdown that resulted in nearly 17,000 canceled flights over the chaotic holiday travel season.",LUV,0.179788,-0.247571,Somewhat-Bearish
Southwest Airlines Makes Moves Customers May Question,https://www.thestreet.com/travel/southwest-airlines-promotions,2023-01-10 19:07:00,The airline is still not out of the woods after a holiday weekend that left thousands of travelers stranded.,LUV,0.13347,0.09103,Neutral
4 Important Leadership Lessons From Southwest Airlines' Holiday Meltdown,https://www.forbes.com/sites/jonpicoult/2023/01/10/4-important-leadership-lessons-from-southwest-airlines-holiday-meltdown/,2023-01-10 18:35:01,"Last month, Southwest had a terrible, horrible, no good, very bad week - and every business can learn something from it.",LUV,0.02351,-0.069746,Neutral
"Vail Resorts' Holiday Metrics Affected By Storm-Related Disruptions, Says Analyst - Vail Resorts  ( NYSE:MTN ) ",https://www.benzinga.com/analyst-ratings/analyst-color/23/01/30357284/vail-resorts-holiday-metrics-affected-by-storm-related-disruptions-says-analyst,2023-01-10 17:46:11,"Stifel analyst Jeffrey A. Stantial reiterated a Hold rating on the shares of Vail Resorts Inc MTN with a price target of $261.00. The analyst said conditions have been favorable to start the 2022/23 ski season, as a series of large storms has driven snowfall in most major U.S. ski regions well ...",LUV,0.244109,0.354728,Bullish
Southwest launches one-way fares starting $49 for some routes,https://www.reuters.com/business/aerospace-defense/southwest-launches-one-way-fares-starting-49-some-routes-2023-01-10/,2023-01-10 17:05:00,"Jan 10 ( Reuters ) - Southwest Airlines Co ( LUV.N ) on Tuesday launched a limited fare sale for select one-way routes, days after the carrier's massive flight disruptions in December. The airline said it will offer the fares starting at $49 for certain one-way routes, with travelers required ...",LUV,0.24289,-0.188225,Somewhat-Bearish
"If You Invested $100 In This Stock 10 Years Ago, You Would Have $300 Today - Southwest Airlines  ( NYSE:LUV ) ",https://www.benzinga.com/news/earnings/23/01/30357887/if-you-invested-100-in-this-stock-10-years-ago-you-would-have-300-today,2023-01-10 17:02:49,"Southwest Airlines LUV has outperformed the market over the past 10 years by 2.26% on an annualized basis producing an average annual return of 12.44%. Currently, Southwest Airlines has a market capitalization of $21.25 billion.",LUV,0.980595,0.386944,Bullish
U.S. forwarding Southwest complaints to airline as part of probe,https://www.reuters.com/business/aerospace-defense/us-forwarding-southwest-complaints-airline-part-probe-2023-01-10/,2023-01-10 15:55:35,"WASHINGTON, Jan 10 ( Reuters ) - The U.S. Transportation Department ( USDOT ) said Tuesday it is forwarding thousands of consumer complaints stemming from Southwest Airlines ( LUV.N ) massive December flight disruptions to the airline as part of its ongoing investigation.",LUV,0.377142,-0.333498,Somewhat-Bearish
Southwest Airlines Shuffles Leadership Roles. Flight-Chaos Fallout Continues.,https://www.barrons.com/articles/southwest-airlines-stock-flight-chaos-51673360944,2023-01-10 15:29:00,"Southwest Airlines has reshuffled a number of senior leadership roles as the fallout of the carrier's holiday flight chaos continues. Southwest ( ticker: LUV ) , which canceled more than 16,700 flights from Dec.22 through Dec.31, issued last week a ""heartfelt apology"" to those affected, and said ...",LUV,0.876064,0.394804,Bullish
"AT&T To Rally Over 15%? Here Are 10 Other Analyst Forecasts For Tuesday - Ally Financial  ( NYSE:ALLY ) , argenx  ( NASDAQ:ARGX ) ",https://www.benzinga.com/news/23/01/30352263/at-t-to-rally-over-15-here-are-10-other-analyst-forecasts-for-tuesday,2023-01-10 13:48:11,"Keybanc boosted Five Below, Inc. FIVE price target from $188 to $200. Keybanc analyst Bradley Thomas maintained an Overweight rating on the stock. Five Below shares fell 1.6% to $183.92 in pre-market trading. Wells Fargo raised AT&T Inc. T price target from $17 to $22.",LUV,0.181819,-0.118667,Neutral
"Top Stories Tuesday, Jan. 10 - Bitcoin  ( BTC/USD ) , Ethereum  ( ETH/USD ) ",https://www.benzinga.com/general/biotech/23/01/30351188/coinbase-discloses-restructuring-plan-amid-macro-headwinds-pfizer-rebuts-generic-version-of-covid,2023-01-10 13:17:16,"Coinbase Global, Inc COIN disclosed a restructuring plan letting go of 950 employees, helping it reduce its operating expenses by 25% amid the crypto meltdown.",LUV,0.077593,0.086993,Neutral
"Southwest Airlines Faces Shareholder Activism, Reshuffles Leadership To Strengthen Ops - Southwest Airlines  ( NYSE:LUV ) ",https://www.benzinga.com/news/large-cap/23/01/30349077/southwest-airlines-faces-shareholder-activism-reshuffles-leadership-to-strengthen-ops,2023-01-10 12:53:31,"After the holiday meltdown with over 16,000 flight cancellations, Southwest Airlines Co LUV announced five department leadership changes to strengthen operations. The company promoted vice president of network planning, Adam Decaire, to SVP of network planning & network operations control ( NOC ) ...",LUV,0.423843,0.346404,Somewhat-Bullish
"Promotions, not job cuts, follow Southwest's holiday chaos",https://apnews.com/article/business-dallas-82d2308fa62d7a584d0c1ae0186576aa,2023-01-10 00:34:41,"DALLAS ( AP ) - Southwest Airlines announced a number of executive promotions on Monday, days after announcing that last month's service meltdown will cost the company up to $825 million, but none of the changes involved the highest ranking officers.",LUV,0.144275,-0.027649,Neutral
Southwest Airlines  ( LUV )  Gains As Market Dips: What You Should Know,https://www.zacks.com/stock/news/2037006/southwest-airlines-luv-gains-as-market-dips-what-you-should-know,2023-01-09 22:50:19,"Southwest Airlines (LUV) closed at $35.61 in the latest trading session, marking a +1.51% move from the prior day.",LUV,0.699089,0.204524,Somewhat-Bullish
"ROSEN, A LEADING LAW FIRM, Encourages Southwest Airlines Co. Investors with Losses to Inquire About Class Action Investigation - LUV - Southwest Airlines  ( NYSE:LUV ) ",https://www.benzinga.com/pressreleases/23/01/g30343084/rosen-a-leading-law-firm-encourages-southwest-airlines-co-investors-with-losses-to-inquire-about-c,2023-01-09 22:49:35,"NEW YORK, Jan. 09, 2023 ( GLOBE NEWSWIRE ) -- WHY: Rosen Law Firm, a global investor rights law firm, continues to investigate potential securities claims on behalf of shareholders of Southwest Airlines Co. LUV resulting from allegations that Southwest Airlines may have issued materially ...",LUV,0.468029,0.033888,Neutral
Southwest Airlines reshuffles senior management roles,https://www.reuters.com/business/aerospace-defense/southwest-airlines-reshuffles-senior-management-roles-2023-01-09/,2023-01-09 22:20:38,"[1/2] Southwest customers visit the help desk after U.S. airlines, led by Southwest, canceled thousands of flights due to a massive winter storm which swept over much of the country before and during the Christmas holiday weekend, at Dallas Love Field Airport in Dallas, Texas, U.S., December 28, ...",LUV,0.136888,-0.168572,Somewhat-Bearish
"After Southwest meltdown, experts issue tips on avoiding future airport issues",https://www.foxbusiness.com/lifestyle/southwest-meltdown-experts-issue-tips-avoiding-future-airport-issues,2023-01-09 21:21:47,"Travelers impacted by Southwest's operational meltdown last month may have skipped some important steps when trying to recoup their losses, including keeping their receipts, according to online travel insurance agency InsureMyTrip.com.",LUV,0.131284,-0.298869,Somewhat-Bearish
SOUTHWEST AIRLINES ANNOUNCES LEADERSHIP PROMOTIONS,https://www.prnewswire.com/news-releases/southwest-airlines-announces-leadership-promotions-301716973.html,2023-01-09 21:00:00,"DALLAS, Jan. 9, 2023 /PRNewswire/ -- Southwest Airlines Co. ( NYSE: LUV ) today announced five Leadership promotions across several Departments. These changes, which are effective immediately, represent phase two of the organizational structure work that began in September 2022.",LUV,0.330433,0.376456,Bullish
New York state comptroller asks Southwest Air about plans to avoid future meltdowns,https://www.reuters.com/business/aerospace-defense/new-york-state-comptroller-asks-southwest-air-about-plans-avoid-future-meltdowns-2023-01-09/,2023-01-09 20:11:00,New York state comptroller asks Southwest Air about plans to avoid ... ...,LUV,0.12546,-0.058396,Neutral
News Exclusive | Southwest Airlines Meltdown Prompts Questions From Big Investor,https://www.wsj.com/articles/southwest-airlines-meltdown-prompts-investor-questions-11673288398,2023-01-09 18:55:00,"New York State Comptroller Thomas DiNapoli, who manages the state's pension system, requests information about carrier's operational problems over the holidays.",LUV,0.798255,0.045622,Neutral
Southwest's credit impact due to flight cancellations manageable - Moody's,https://www.reuters.com/business/aerospace-defense/southwests-credit-impact-due-flight-cancellations-manageable-moodys-2023-01-09/,2023-01-09 16:28:58,Southwest's credit impact due to flight cancellations manageable ... ...,LUV,0.145145,0.247046,Somewhat-Bullish
Analysts Pick 9 'Cheap' Favorites As Value Stocks Still Dominate,https://www.investors.com/etfs-and-funds/sectors/sp500-analysts-pick-9-cheap-favorites-as-value-stocks-still-dominate/,2023-01-09 13:00:00,Value stocks are ruling the S&P 500 again following their standout run last year. And analysts are picking their favorites for the year.,LUV,0.157141,0.192341,Somewhat-Bullish
Southwest  ( LUV )  May Incur Q4 Loss Post Flight Cancellations,https://www.zacks.com/stock/news/2036558/southwest-luv-may-incur-q4-loss-post-flight-cancellations,2023-01-09 11:12:00,Southwest (LUV) expects capacity in fourth-quarter 2022 to decline 6% versus fourth-quarter 2019 actuals.,LUV,0.523202,-0.231206,Somewhat-Bearish
"Bragar Eagel & Squire, P.C. Is Investigating Southwest, Credit Acceptance, and UP Fintech and Encourages Investors to Contact the Firm - Credit Acceptance  ( NASDAQ:CACC ) , Southwest Airlines  ( NYSE:LUV ) ",https://www.benzinga.com/pressreleases/23/01/g30324856/bragar-eagel-squire-p-c-is-investigating-southwest-credit-acceptance-and-up-fintech-and-encourages,2023-01-09 02:01:00,"NEW YORK, Jan. 08, 2023 ( GLOBE NEWSWIRE ) -- Bragar Eagel & Squire, P.C., a nationally recognized shareholder rights law firm, is investigating potential claims against Southwest Airlines Co. LUV, Credit Acceptance Credit Acceptance Corporation CACC, and UP Fintech Holding Limited TIGR. Our ...",LUV,0.319933,-0.081686,Neutral
"American Airlines drops 3 cities from service, blaming pilot shortage, 'soft demand'",https://www.foxbusiness.com/lifestyle/american-airlines-drops-3-cities-service-blaming-pilot-shortage-soft-demand,2023-01-07 17:26:52,American Airlines is closing three more flight routes this spring due to low demand and an ongoing pilot shortage. The airline told FOX Business about the decision in a statement sent Saturday. SOUTHWEST AIRLINES SAYS HOLIDAY CANCELLATIONS COULD AMOUNT TO $825M LOSS,LUV,0.148731,0.043943,Neutral
Investing Action Plan: Earnings Season And A Black Box Rally,https://www.investors.com/research/investing-action-plan/stock-market-investing-action-plan-earnings-season-and-a-black-box-rally/,2023-01-06 23:37:00,Stock Market Investing Action Plan: Earnings Season And A Black ... Investor's Business Daily ...,LUV,0.05749,0.092074,Neutral
LUV: 1 Airline Stock to Buy in 2023 and 2 to Sell Short,https://stocknews.com/news/luv-save-astr-1-airline-stock-to-buy-in-2023-and-2-to/,2023-01-06 19:49:12,"According to the International Air Transport Association ( IATA ) , the airline industry could turn profitable this year, driven by pent-up demand for travel despite growing economic uncertainties. Passenger demand is predicted to reach 85.5% of 2019 levels this year, generating $522 billion in ...",LUV,0.218817,0.296324,Somewhat-Bullish
"Airlines expected to offer flight deals, but they'll be short-lived",https://www.foxbusiness.com/lifestyle/airlines-expected-offer-flight-deals-short-lived,2023-01-06 16:52:29,"It's the off-season for the travel industry, which typically means airlines will start rolling out flight deals in order to garner up demand. Alaska Airlines and JetBlue have already offered up deals just days after the holiday travel surge settled.",LUV,0.089797,-0.105402,Neutral
SOUTHWEST AIRLINES: Kaplan Fox Investigates Southwest Airlines Co. - Southwest Airlines  ( NYSE:LUV ) ,https://www.benzinga.com/pressreleases/23/01/g30312955/southwest-airlines-kaplan-fox-investigates-southwest-airlines-co,2023-01-06 16:15:24,"NEW YORK, Jan. 06, 2023 ( GLOBE NEWSWIRE ) -- Kaplan Fox & Kilsheimer LLP ( www.kaplanfox.com ) is investigating claims on behalf of investors of Southwest Airlines Co. ( ""Southwest"" or ""Company"" ) LUV. Click here to join investigation.",LUV,0.229149,0.101406,Neutral
Essay | What Airline Chaos Looks Like From the Inside,https://www.wsj.com/articles/what-airline-chaos-looks-like-from-the-inside-11673020765,2023-01-06 15:59:00,"For a former executive at Spirit Airlines, last week's meltdown of Southwest felt familiar ...",LUV,0.227007,0.14372,Neutral
"More Jobs, Slower Wages Growth: December Employment Data Keeps Focus on Fed Toolbox",https://www.benzinga.com/markets/23/01/30312494/more-jobs-slower-wages-growth-december-employment-data-keeps-focus-on-fed-toolbox,2023-01-06 15:49:02,"The U.S. economy added 223,000 jobs last month, well above the expected 200,000 target, but the unemployment rate fell slightly to 3.5%. November's job growth was a revised 256,000.",LUV,0.072435,-0.224872,Somewhat-Bearish
Stock Market Has Hope After Jobs Numbers; Tesla Sees More Pain,https://www.investors.com/market-trend/stock-market-today/stock-market-has-hope-after-jobs-numbers-tesla-sees-more-pain/,2023-01-06 15:48:00,Stock Market Has Hope After Jobs Numbers. Tesla Sees More Pain Investor's Business Daily ...,LUV,0.098862,-0.221524,Somewhat-Bearish
Southwest Airlines says holiday cancellations could amount to $825M loss,https://www.foxbusiness.com/lifestyle/southwest-airlines-disruption-cost-airline-825m,2023-01-06 15:09:15,"Southwest Airlines expects to lose as much as $825 million from the operational meltdown that led to nearly 17,000 canceled flights over the chaotic holiday season.",LUV,0.091509,-0.137855,Neutral
Strong Jobs Number Again,https://www.forbes.com/sites/jjkinahan/2023/01/06/strong-jobs-number-again/,2023-01-06 14:00:00,December's employment report was a bit of a mixed bag.,LUV,0.148731,-0.029041,Neutral
Futures Higher After Strong December Jobs Report,https://www.investors.com/market-trend/stock-market-today/dow-jones-futures-rise-ahead-of-december-jobs-report-tesla-stock-dives-on-china-price-cuts/,2023-01-06 13:52:00,Dow Jones Futures Rally On December Jobs Report. Tesla Stock ... Investor's Business Daily ...,LUV,0.061631,-0.165075,Somewhat-Bearish
Is a Beat in the Cards for Delta Air  ( DAL )  in Q4 Earnings?,https://www.zacks.com/stock/news/2036149/is-a-beat-in-the-cards-for-delta-air-dal-in-q4-earnings,2023-01-06 13:48:00,"Passenger revenues are likely to have been high in Q4, in turn boosting Delta Air's (DAL) top line.",LUV,0.211191,0.0,Neutral
Why Southwest Airlines  ( LUV )  Shares Are Trading Lower Today - Southwest Airlines  ( NYSE:LUV ) ,https://www.benzinga.com/news/23/01/30308337/southwests-holiday-crisis-could-cost-it-up-to-first-nine-months-of-fy22-earnings-analysts-say,2023-01-06 13:31:38,"The crisis that cost Southwest Airlines Co LUV over 15,000-holiday flights could cost the carrier up to earnings for nine months of 2022 in lost revenue and customer reimbursements, industry analysts say.",LUV,0.340915,-0.278947,Somewhat-Bearish
Southwest Reveals Impact of Flight Chaos on Earnings. The Stock Is Falling.,https://www.barrons.com/articles/southwest-flight-chaos-earnings-stock-51673007065,2023-01-06 12:41:00,"Southwest Airlines said Friday it expects to post a net loss in the fourth quarter, driven by mass cancellations over the holiday season. The carrier estimated a hit of $725 million to $825 million from the disruption, which saw it cancel more than 16,000 flights between Dec. 21 and Jan. 2.",LUV,0.495015,0.051513,Neutral
Southwest's strong 2022 rebound soured by holiday debacle,https://apnews.com/article/southwest-airlines-co-business-dallas-8d822c36934c0ed4fb17bd6447750050,2023-01-06 12:33:19,"Southwest, after strong 2022 rebound, expects losses in Q4 The Associated Press - en ...",LUV,0.258351,-0.03493,Neutral
Southwest sees flight cancellations costing up to $825 million,https://www.marketwatch.com/story/southwest-sees-flight-cancellations-costing-up-to-825-million-11673007500,2023-01-06 12:18:00,"Southwest Airlines warned of a surprise fourth-quarter net loss, due to costs resulting from the more than 16,700 flights canceled ...",LUV,0.308891,0.06176,Neutral
Southwest's December Meltdown to Cause Quarterly Loss,https://www.wsj.com/articles/southwests-december-meltdown-to-cause-quarterly-loss-11673007141,2023-01-06 12:12:00,"The airline said it lost up to $425 million in revenue after it canceled more than 16,700 flights in the final 10 days of the year as a winter storm wreaked havoc on operation.",LUV,0.443626,-0.563529,Bearish
Southwest Airlines expects to post loss after mass cancellations,https://www.reuters.com/business/aerospace-defense/southwest-airlines-expects-report-net-loss-q4-after-mass-cancellations-2023-01-06/,2023-01-06 11:39:00,Southwest Airlines expects to report net loss in Q4 after mass ... ...,LUV,0.391923,0.025433,Neutral
Southwest's meltdown could end up being good for travelers,https://www.axios.com/2023/01/06/southwest-travelers-rights-refunds-delays,2023-01-06 11:31:17,A combination of regulatory threats and competitive pressure in the wake of Southwest Airlines' disastrous holiday meltdown could make it easier for travelers to assert their rights when travel plans go wrong.,LUV,0.068306,-0.179935,Somewhat-Bearish
Southwest's Meltdown Could Cost It Up to $800 Million,https://www.nytimes.com/2023/01/06/business/southwest-airlines-meltdown-costs-reimbursement.html,2023-01-06 10:00:27,The airline has not said how much it might have to spend to reimburse customers and upgrade its technology systems.,LUV,0.060085,0.005038,Neutral
Southwest to review meltdown after union criticizes lack of plan,https://www.foxbusiness.com/markets/southwest-review-meltdown-after-union-criticizes-lack-plan,2023-01-06 05:24:02,Southwest Airlines is vowing to take steps to prevent a repeat of the holiday meltdown that stranded thousands of passengers. The company promised on Thursday to conduct a thorough review of an operational collapse at the end of the year.,LUV,0.327366,-0.224342,Somewhat-Bearish
Southwest to carry out thorough review of disruption -CEO,https://www.reuters.com/business/aerospace-defense/southwest-carry-out-thorough-review-disruption-ceo-2023-01-06/,2023-01-06 00:11:00,Southwest to carry out thorough review of disruption ...,LUV,0.495015,-0.522164,Bearish
"Business Highlights: Startups at CES, Southwest's reputation",https://apnews.com/article/business-highlights-99e492a65dceb0c95bb5350b46cd4151,2023-01-05 22:36:18,"LAS VEGAS ( AP ) - More than a thousand startups are showcasing their products at the annual CES tech show in Las Vegas, hoping to create some buzz around their gadgets and capture the eyes of investors who can help their businesses grow.",LUV,0.041181,-0.076542,Neutral
Delta plans to offer free Wi-Fi starting Feb. 1,https://www.cnbc.com/2023/01/05/delta-plans-to-offer-free-wi-fi-starting-feb-1.html,2023-01-05 19:08:51,Delta has been studying how to make Wi-Fi free of charge for years.,LUV,0.173333,0.061416,Neutral
"20 Ways To Avert Your Company's Own ""Southwest Meltdown""",https://www.forbes.com/sites/douglaslaney/2023/01/05/20-ways-to-avert-your-companys-own-southwest-meltdown/,2023-01-05 18:45:43,"Rather than simply indicting the airline, business and technologi leaders should consider how their business might mitigate the risk of a similar meltdown.",LUV,0.032056,-0.075551,Neutral
U.S. FAA names experts to review Boeing safety culture after fatal crashes,https://www.reuters.com/business/aerospace-defense/us-faa-names-experts-review-boeing-safety-culture-after-fatal-crashes-2023-01-05/,2023-01-05 18:44:15,U.S. FAA names experts to review Boeing safety culture after fatal ... ...,LUV,0.094762,-0.049227,Neutral
Flight Bookings Surge As China Relaxes Travel Restrictions,https://www.forbes.com/sites/greatspeculations/2023/01/05/flight-bookings-surge-as-china-relaxes-travel-restrictions/,2023-01-05 17:53:48,"It's been a long three years, and travel demand has built up to epic proportions. According to Trip.com, China's biggest online travel agency, bookings for outbound flights jumped an incredible 254% the day after the announcement was made that quarantine requirements would be lifted.",LUV,0.046999,-0.089812,Neutral
Expert sounds alarm on Southwest as many passengers still await lost bags: 'Real cocktail for total confusion',https://www.foxbusiness.com/lifestyle/expert-sounds-alarm-southwest-passenger-await-lost-bags-real-cocktail-total-confusion,2023-01-05 17:40:41,"Although Southwest Airlines has promised to return all lost luggage to its original owners by the end of this week after the holiday ""flightmare,"" one expert is warning some travelers may never see those personal belongings again.",LUV,0.150592,-0.019544,Neutral
This Week In Credit Card News: Interest Rates Expected To Keep Rising; Credit Card Trends In 2023,https://www.forbes.com/sites/billhardekopf/2023/01/05/this-week-in-credit-card-news-interest-rates-expected-to-keep-rising-credit-card-trends-in-2023/,2023-01-05 17:34:09,What took place this week in the credit card and payment industries ...,LUV,0.028355,0.352297,Bullish
Southwest starts on reputation repair after cancellations,https://apnews.com/article/business-texas-arizona-california-da3b72f2350b0f77498f7f67316facb5,2023-01-05 16:58:39,"DALLAS ( AP ) - With its flights running on a roughly normal schedule, Southwest Airlines is now turning its attention to repairing its damaged reputation after it canceled 15,000 flights around Christmas and left holiday travelers stranded.",LUV,0.038101,0.045288,Neutral
Southwest starts on reputation repair after cancellations,https://apnews.com/article/business-texas-arizona-california-da3b72f2350b0f77498f7f67316facb5,2023-01-05 16:58:39,"DALLAS ( AP ) - With its flights running on a roughly normal schedule, Southwest Airlines is now turning its attention to repairing its damaged reputation after it canceled 15,000 flights around Christmas and left holiday travelers stranded.",LUV,0.032294,0.04453,Neutral
Southwest Airlines Stock Continues To Drop In The Wake Of Canceled Flights,https://www.forbes.com/sites/qai/2023/01/05/southwest-airlines-stock-continues-to-drop-in-the-wake-of-canceled-flights/,2023-01-05 15:45:56,Southwest Airlines suffered significant disruptions to its flights over the holidays. Here is what happened and how the stock has fared through the debacle.,LUV,0.360752,-0.02092,Neutral
"Southwest has no solutions for recent debacle, faces up to $1 bln revenue hit - union official",https://www.reuters.com/business/aerospace-defense/southwest-has-no-solutions-recent-debacle-faces-up-1-bln-revenue-hit-union-2023-01-05/,2023-01-05 15:16:00,"Southwest has no solutions for recent debacle, faces up to $1 bln ... ...",LUV,0.120431,-0.055504,Neutral
How to avoid flight chaos,https://www.economist.com/business/2023/01/05/how-to-avoid-flight-chaos,2023-01-05 14:20:04,"Lessons from Southwest and Volaris, two highly successful airlines that ruined the holidays ...",LUV,0.0378,-0.035497,Neutral
Getting Results-and Money-When Airlines Cancel Flights,https://www.wsj.com/articles/canceled-flights-refunds-reimbursements-luggage-hotels-11672878789,2023-01-05 10:30:00,A guide for passengers on what they can ask for from airlines after cancellations that can lead to unexpected hotel stays and lost luggage.,LUV,0.535653,-0.600861,Bearish
Does The Southwest Snafu Suggest The Need For A Technology And Innovation Committee Of Directors On Boards?,https://www.forbes.com/sites/shivaramrajgopal/2023/01/05/does-the-southwest-snafu-suggest-the-need-for-a-technology-and-innovation-committee-of-directors-on-boards/,2023-01-05 06:33:15,"Companies need three core assets to succeed and compete: financial assets, human capital assets, software and technology assets. Southwest and other companies potentially need a board level committee to manage and create such technology assets.",LUV,0.026241,-0.086732,Neutral
U.S. Senate Commerce chair plans hearings after Southwest Airlines meltdown,https://www.reuters.com/business/aerospace-defense/us-senate-commerce-chair-plans-hearings-after-southwest-airlines-meltdown-2023-01-04/,2023-01-04 23:56:00,U.S. Senate Commerce chair plans hearings after Southwest ... ...,LUV,0.340915,-0.058433,Neutral
