title,url,time_published,summary,ticker,relevance_score,ticker_sentiment_score,ticker_sentiment_label
"DEADLINE ALERT for LUV, GWH, BVS, and YMAB: The Law Offices of Frank R. Cruz Reminds Investors of Class Actions on Behalf of Shareholders - ESS Tech  ( NYSE:GWH ) , Bioventus  ( NASDAQ:BVS ) ",https://www.benzinga.com/pressreleases/23/02/g30693089/deadline-alert-for-luv-gwh-bvs-and-ymab-the-law-offices-of-frank-r-cruz-reminds-investors-of-class,2023-02-02 17:11:00,"LOS ANGELES, Feb. 02, 2023 ( GLOBE NEWSWIRE ) -- The Law Offices of Frank R. Cruz reminds investors that class action lawsuits have been filed on behalf of shareholders of the following publicly-traded companies. Investors have until the deadlines listed below to file a lead plaintiff motion.",LUV,0.199037,-0.263638,Somewhat-Bearish
Flight canceled or disrupted? Know your rights,https://www.foxbusiness.com/economy/flight-canceled-disrupted-know-your-rights,2023-02-02 15:17:06,"Winter weather has resulted in thousands of flight cancellations at airports in the South and more may be on the way as a looming polar vortex is expected to arrive in the Northeast this weekend, so travelers should be aware of their rights when airlines cancel or delay flights.",LUV,0.047844,-0.247665,Somewhat-Bearish
Boeing's New Customer Driven Supply Chain,https://www.forbes.com/sites/kevinomarah/2023/02/02/boeings-new-customer-driven-supply-chain/,2023-02-02 14:18:19,"Although hired as an aerodynamics engineer in 1997, most of Mounir's Boeing career has been in sales and marketing.",LUV,0.054607,0.069399,Neutral
Investors Heavily Search Southwest Airlines Co.  ( LUV ) : Here is What You Need to Know,https://www.zacks.com/stock/news/2048299/investors-heavily-search-southwest-airlines-co-luv-here-is-what-you-need-to-know,2023-02-02 14:00:12,"Recently, Zacks.com users have been paying close attention to Southwest (LUV). This makes it worthwhile to examine what the stock has in store.",LUV,0.105604,0.036578,Neutral
Southwest Airlines Promotes Lauren Woods To Chief Information Officer,https://www.benzinga.com/news/23/02/30683097/southwest-airlines-promotes-lauren-woods-to-chief-information-officer,2023-02-02 10:24:58,"Southwest Airlines Co LUV has promoted its Vice President of Technology, Lauren Woods, to Senior Vice President and Chief Information Officer. Woods will report to the Chief Administration & Communications Officer Linda Rutherford.",LUV,0.578355,-0.283022,Somewhat-Bearish
How the US fell out of love with flying,https://www.ft.com/content/4341f119-09e4-4644-ab6f-fac585040358,2023-02-02 05:00:51,"Cancelled flights, missing bags and disappearing routes are infuriating passengers - and galvanising a push for tighter regulation ...",LUV,0.01583,-0.091465,Neutral
"The Biden administration gave Southwest a deadline to issue refunds for the flight chaos over Christmas. A month later, some passengers were still waiting to be paid.",https://www.businessinsider.com/southwest-missed-biden-admin-deadline-to-refund-canceled-flights-2023-2,2023-02-02 02:57:12,Southwest Missed Biden Admin Deadline to Refund Canceled Flights - Business Insider ...,LUV,0.121037,-0.088171,Neutral
U.S. airline group blasts White House competition efforts,https://www.reuters.com/business/aerospace-defense/us-airline-group-blasts-white-house-competition-efforts-2023-02-01/,2023-02-01 21:58:00,"[1/2] The White House seen from outside the north lawn fence in Washington September 22, 2014. REUTERS/Kevin Lamarque WASHINGTON, Feb 1 ( Reuters ) - A group representing major U.S. airlines blasted White House proposals on competition in the industry as ""short-sighted"" and said they would ...",LUV,0.235823,0.0,Neutral
"Delta Airlines Stock, IBD Stock Of The Day, Set To Take Off On Air Travel Recovery",https://www.investors.com/research/ibd-stock-of-the-day/delta-stock-ibd-stock-of-the-day-set-to-take-off-on-air-travel-recovery/,2023-02-01 19:19:00,"Delta Airlines Stock, IBD Stock Of The Day, Set To Take Off On Air ... Investor's Business Daily ...",LUV,0.200688,0.073519,Neutral
"These United, Delta, American Fees Could Be Eliminated Soon",https://www.thestreet.com/travel/these-united-delta-and-american-airlines-fees-could-be-eliminated-soon,2023-02-01 16:39:00,Senate Democrats introduced a couple of bills that could drastically change how much it costs to take a flight in the U.S.,LUV,0.157483,0.256552,Somewhat-Bullish
"GWH, LUV & IBM Class Action Reminders: Bronstein, Gewirtz & Grossman, LLC, A Successful Firm, Reminds Investors of Deadlines and to Actively Participate",https://www.benzinga.com/pressreleases/23/02/g30668777/gwh-luv-ibm-class-action-reminders-bronstein-gewirtz-grossman-llc-a-successful-firm-reminds-invest,2023-02-01 15:00:00,"NEW YORK, Feb. 01, 2023 ( GLOBE NEWSWIRE ) -- Attorney Advertising -- Bronstein, Gewirtz & Grossman, LLC reminds investors that a class action lawsuit has been filed against the following publicly-traded companies.",LUV,0.208166,-0.330594,Somewhat-Bearish
Lawmakers look to increase penalties for airline disruptions,https://www.foxbusiness.com/politics/lawmakers-look-increase-penalties-airline-disruptions,2023-02-01 03:41:16,"Lawmakers want to impose stricter penalties on U.S. airlines that delay or strand passengers. This time, Senators think it can finally become law. The latest move comes following outrage over debacles like the one at Southwest Airlines in December.",LUV,0.186738,-0.109607,Neutral
"Earnings Roundup: Tesla, Intel, Chevron, and More",https://www.fool.com/investing/2023/01/31/earnings-roundup-tesla-intel-chevron-and-more/,2023-02-01 01:26:00,"Plus, Corrado Russo, head of global securities at Hazelview Investments, shares some insight for real estate investors.",LUV,0.017813,-0.088147,Neutral
"Business Highlights: AI detection tool, methane reduction",https://apnews.com/article/business-highlights-233da8297f33b0928deb35a01985cf78,2023-01-31 22:44:47,SAN FRANCISCO ( AP ) - The maker of ChatGPT is trying to curb its reputation as a freewheeling cheating machine with a new tool that can help teachers detect if a student or artificial intelligence wrote that homework.,LUV,0.037098,-0.016873,Neutral
Lawmakers aim to raise penalties for US airline disruptions,https://apnews.com/article/edward-markey-richard-blumenthal-connecticut-business-lawsuits-2f92c1f75391d15c59727675c69bc0d0,2023-01-31 21:45:33,Senators who want to impose tougher penalties when U.S. airlines strand or delay passengers say they finally might be able to turn their ideas into law because of outrage over debacles like the one at Southwest Airlines in December.,LUV,0.064104,-0.110864,Neutral
Senators push for airline passenger protections after holiday travel meltdown,https://www.cnbc.com/2023/01/31/senators-push-airline-passengers-bill-of-rights.html,2023-01-31 20:55:54,Sens. Ed Markey and Richard Blumenthal reintroduced legislation that would strengthen airline passengers' rights.,LUV,0.137671,-0.155105,Somewhat-Bearish
Should You Look Past Mixed Earnings & Play Airlines ETF?,https://www.zacks.com/stock/news/2047229/should-you-look-past-mixed-earnings-play-airlines-etf,2023-01-31 19:00:00,The pure-play airlines ETF U.S. Global Jets ETF (JETS) has gained about 23% past month despite mixed earnings.,LUV,0.165031,0.048617,Neutral
Warren Buffett: Someone's Sitting in the Shade Today Because Someone Planted a Tree a Long Time Ago,https://www.benzinga.com/news/23/01/30650082/warren-buffett-someones-sitting-in-the-shade-today-because-someone-planted-a-tree-a-long-time-ago,2023-01-31 18:59:56,"Business magnate Warren Buffett was once the richest person in the world and is widely considered one of the greatest investors out there. Buffett, who is often vocal about his strategies and investing philosophy, is the king of long-term investing.",LUV,0.078354,-0.067085,Neutral
Southwest Airlines Hires Former Congressman Ahead Of Potential DOT Investigation: What Investors Should Know,https://www.benzinga.com/government/23/01/30648802/southwest-airlines-hires-former-congressman-ahead-of-potential-dot-investigation-what-investors-shou,2023-01-31 18:52:47,Southwest Airlines Co LUV made headlines for all the wrong reasons during the 2022 holiday season. Keeping thousands of people from holiday gatherings and seeing family members generated tons of negative press for the airline and could be the subject of an investigation.,LUV,0.302243,-0.002271,Neutral
"Layoffs 'Kill People' And Big Tech Firms Are 'Copycats' In Making Decision, Business Professor Says",https://www.benzinga.com/general/entertainment/23/01/30554738/layoffs-kill-people-and-big-tech-job-cuts-are-a-social-contagion-business-professor-says-1,2023-01-31 16:36:00,"As the tech industry continues to shed jobs by the thousands, a business professor is sounding the alarm on the dangerous consequences of following the herd.",LUV,0.157483,-0.014114,Neutral
Winter weather disrupts hundreds of flights across Texas,https://www.cnbc.com/2023/01/31/texas-winter-weather-airlines-cancel-flights.html,2023-01-31 16:07:00,Airlines have canceled hundreds of flights in Texas due to bad winter weather.,LUV,0.299478,0.318413,Somewhat-Bullish
"Myrtle Beach, South Carolina Announces What's New in 2023",https://www.benzinga.com/pressreleases/23/01/n30645087/myrtle-beach-south-carolina-announces-whats-new-in-2023,2023-01-31 15:15:00,"Coastal destination reveals exciting new ways for travelers to experience The Beach this year and beyond MYRTLE BEACH, S.C., Jan. 31, 2023 /PRNewswire/ -- With 60 miles of breathtaking beaches and 14 unique coastal communities, there's always something new and exciting to explore in Myrtle Beach, ...",LUV,0.044885,0.0,Neutral
Dangerous ice storm underway from Texas to Tennessee as Arctic air surges south,https://www.axios.com/2023/01/30/winter-weather-storm-ice-texas-kentucky-flight-delays,2023-01-31 08:14:24,"Winter storm warnings, ice storms hit Texas, Kentucky ...",LUV,0.113062,0.088001,Neutral
SOUTHWEST AIRLINES CO.  ( NYSE: LUV )  SHAREHOLDER CLASS ACTION ALERT: Bernstein Liebhard LLP Reminds Investors of the Deadline to File a Lead Plaintiff Motion in a Securities Class Action Lawsuit Against Southwest Airlines Co.  ( NYSE: LUV ) ,https://www.benzinga.com/pressreleases/23/01/g30635514/southwest-airlines-co-nyse-luv-shareholder-class-action-alert-bernstein-liebhard-llp-reminds-inves,2023-01-31 06:45:00,"Did you lose money on investments in Southwest Airlines? If so, please visit Southwest Airlines Co. Shareholder Class Action Lawsuit or contact Peter Allocco at ( 212 ) 951-2030 or pallocco@bernlieb.com to discuss your rights.",LUV,0.761699,-0.115774,Neutral
A GOP senator says Republican lawmakers are frustrated with Transportation Secretary Pete Buttigieg because he wants 'everything to be climate and politically correct',https://www.businessinsider.com/buttigieg-capito-republican-frustration-transportation-train-derailment-capitol-hill-2023-2,2023-02-19 19:01:59,Sen. Capito Says GOP Pols Frustrated With Buttigieg: He's 'Not ... - Business Insider ...,LUV,0.060085,-0.223083,Somewhat-Bearish
Near Misses Raise Fresh Questions For US Air Regulator,https://www.barrons.com/news/near-misses-raise-fresh-questions-for-us-air-regulator-bb2bdf52,2023-02-19 02:10:47,"US air safety regulators are facing fresh questions following recent near crashes at American airports, further challenging an aviation industry ramp-up in response to rising travel demand.",LUV,0.051774,0.0,Neutral
Can Southwest Airlines fix its tech problems? We asked aviation experts. The answer wasn't encouraging,https://www.cnbc.com/2023/02/18/can-southwest-fix-its-tech-problems-aviation-experts-arent-confident.html,2023-02-18 16:57:53,Southwest Airlines is spending over $1 billion to fix the technology issues which took down its nationwide system. Aviation experts say it may not be enough.,LUV,0.075279,-0.029722,Neutral
Southwest Airlines raises Wi-Fi fees for passengers with connecting flights,https://www.foxbusiness.com/lifestyle/southwest-airlines-raises-wi-fi-fees-passengers-connecting-flights,2023-02-18 16:02:04,"Southwest Airlines has announced a new pricing model for its onboard internet, raising Wi-Fi fees for passengers with connecting flights. Beginning on Feb. 21, onboard internet will be purchased per-leg and from ""Takeoff to Landing,"" replacing the airline's current DayPass.",LUV,0.329551,-0.068248,Neutral
Flight disruptions at JFK to stretch to a third day,https://www.foxbusiness.com/lifestyle/flight-disruptions-jfk-stretch-third-day,2023-02-18 08:50:43,"Flight disruptions involving international flights at JFK Airport in New York are expected to stretch into Saturday, although some service is expected to return. The power outage forced a closure of the airport's Terminal 1 as a result of a fire and has disrupted inbound and outbound flights at ...",LUV,0.163909,-0.098043,Neutral
"Small jet slides off Houston runway, causing delays",https://apnews.com/article/houston-business-f374cfda826610502bb126f324cd3404,2023-02-17 20:44:01,"HOUSTON ( AP ) - A small jet slid off a runway at a Houston airport on Friday, halting flights, officials said. The jet landed at Hobby Airport, a Southwest Airlines hub, just before noon and slid off the runaway and onto a grassy area located between two runway safety areas.",LUV,0.282234,0.055144,Neutral
Electrical outage at JFK Airport leaves passengers stranded,https://www.foxbusiness.com/lifestyle/electrical-outage-jfk-airport-leaves-passengers-stranded,2023-02-17 06:56:43,"A power outage at New York's Kennedy Airport has caused chaos for travelers counting on international flights. Travel disruptions are expected to continue on Friday as Terminal 1 will remain closed, according to a tweet issued by the airport.",LUV,0.165031,-0.098501,Neutral
Senator Cantwell demands more answers from Southwest Airlines on holiday cancelation chaos,https://www.foxbusiness.com/politics/senator-cantwell-demands-more-answers-southwest-airlines-holiday-cancelation-chaos,2023-02-17 02:28:00,"Sen. Maria Cantwell, D-Wash., the chair of the Senate Commerce Committee on Commerce, sent a letter to Southwest Airlines on Thursday, seeking a ""full accounting"" of how the airline is refunding customers after mass cancellations over the holidays.",LUV,0.666827,-0.350358,Bearish
"Southwest Airlines Co.: Please contact the Portnoy Law Firm to recover your losses; March 13, 2023 deadline - Southwest Airlines  ( NYSE:LUV ) ",https://www.benzinga.com/pressreleases/23/02/g30954641/southwest-airlines-co-please-contact-the-portnoy-law-firm-to-recover-your-losses-march-13-2023-dea,2023-02-17 01:12:03,Investors can contact the law firm at no cost to learn more about recovering their losses,LUV,0.499789,-0.325867,Somewhat-Bearish
Shares of aircraft lessors take off in tight market for planes,https://www.foxbusiness.com/markets/shares-aircraft-lessors-take-off-tight-market-planes,2023-02-16 22:42:26,"It has been a good year to own airliners-or stocks and bonds from companies that do. Travelers around the world are dusting off their passports and buying tickets again, nudging global passenger counts closer to pre-Covid levels.",LUV,0.042196,0.163784,Somewhat-Bullish
U.S. senator seeks 'full accounting' of Southwest Airlines meltdown refunds,https://www.reuters.com/business/aerospace-defense/us-senator-seeks-full-accounting-southwest-airlines-meltdown-refunds-2023-02-16/,2023-02-16 19:47:00,U.S. senator seeks 'full accounting' of Southwest Airlines meltdown ... ...,LUV,0.733479,-0.292489,Somewhat-Bearish
U.S. safety board probes United runway incursion at Honolulu airport,https://www.reuters.com/business/aerospace-defense/us-safety-board-probes-united-runway-incursion-honolulu-airport-2023-02-15/,2023-02-15 21:30:37,"WASHINGTON, Feb 15 ( Reuters ) - The National Transportation Safety Board ( NTSB ) said on Wednesday that it will open an investigation into a Jan. 23 runway incursion at Honolulu Airport that occurred when a United ( UAL.O ) Boeing 777 crossed a runway and conflicted with a Cessna 208B landing ...",LUV,0.206685,-0.041714,Neutral
"Cruz grills FAA leader, plays video animation of Austin airport close call: 'How can this happen?'",https://www.foxbusiness.com/politics/cruz-grills-faa-leader-plays-video-animation-austin-airport-close-call-how-can-this-happen,2023-02-15 19:04:12,"Senator Ted Cruz, R-Texas, on Wednesday pressed the acting head of the Federal Aviation Administration ( FAA ) for answers after two planes nearly collided at an airport in Austin, Texas, earlier this month.",LUV,0.110462,0.062341,Neutral
FAA to form safety review team following close calls,https://www.foxbusiness.com/lifestyle/faa-to-form-safety-review-team-following-close-calls,2023-02-15 18:00:31,Acting Federal Aviation Administration ( FAA ) administrator Billy Nolen announced that he is forming a safety review team to look into the aviation system following a handful of close calls.,LUV,0.076358,-0.104934,Neutral
The FAA is taking action after multiple serious safety incidents among US airlines: 'Now is the time',https://www.businessinsider.com/faa-launching-safety-review-committee-after-recent-near-crashes-2023-2,2023-02-15 17:57:13,FAA Launching Safety Review Committee After Recent Near-Crashes - Business Insider ...,LUV,0.072655,0.1118,Neutral
FAA head defends safety of US air travel after close calls,https://apnews.com/article/federal-aviation-administration-ted-cruz-austin-business-4e39db3c15e63ce32510ea6841162999,2023-02-15 16:10:08,The head of the Federal Aviation Administration said Wednesday he has taken steps to avoid a repeat of the technology failure last month that briefly halted all flights nationwide from taking off.,LUV,0.086245,-0.08582,Neutral
U.S. travel insurance to take off as year-end cancellations spook flyers,https://www.reuters.com/business/us-travel-insurance-take-off-year-end-cancellations-spook-flyers-2023-02-15/,2023-02-15 15:56:00,"Feb 15 ( Reuters ) - Demand for travel insurance in the United States is set to jump this year, as more Americans turn cautious after a spike in flight cancellations and lost luggage in the last two months upended holiday plans of tens of thousands across the country.",LUV,0.078611,0.096377,Neutral
FAA chief tells Senate that new procedures will avoid repeat of outage that halted U.S. flights,https://www.cnbc.com/2023/02/15/faa-senate-hearing-notam-outage.html,2023-02-15 15:02:40,The FAA is conducting a safety review after a series of near-misses of large commercial aircraft.,LUV,0.124809,-0.176804,Somewhat-Bearish
SHAREHOLDER ALERT: Pomerantz Law Firm Investigates Claims On Behalf of Investors of Southwest Airlines Co. - LUV - Southwest Airlines  ( NYSE:LUV ) ,https://www.benzinga.com/pressreleases/23/02/g30915969/shareholder-alert-pomerantz-law-firm-investigates-claims-on-behalf-of-investors-of-southwest-airli,2023-02-14 23:54:08,"NEW YORK, Feb. 14, 2023 ( GLOBE NEWSWIRE ) -- Pomerantz LLP is investigating claims on behalf of investors of Southwest Airlines Co. ( ""Southwest"" or the ""Company"" ) LUV. Such investors are advised to contact Robert S. Willoughby at newaction@pomlaw.com or 888-476-6529, ext. 7980.",LUV,0.395012,-0.005405,Neutral
United flight that dove within 800 feet of sea one of recent flight close calls,https://www.foxbusiness.com/lifestyle/travel-airline-industry-incidents-remember,2023-02-14 16:45:24,"The airline industry has had a busy few months during and after the winter holidays. Not all of it has been smooth soaring, with airlines having to answer for multiple incidents and deal with unruly passengers.",LUV,0.063425,0.0,Neutral
"4 tips to save money with brands like Nike and Starbucks from a TikToker who paid off $200,000 in student debt in 2 years",https://www.businessinsider.com/tips-save-money-nike-starbucks-amazon-apple-medical-bills-2023-2,2023-02-14 10:00:00,"4 Ways to Save Money With Apple, Amazon, Starbucks, Nike ... - Business Insider ...",LUV,0.052112,-0.12102,Neutral
SOUTHWEST AIRLINES CO.  ( NYSE: LUV )  SHAREHOLDER CLASS ACTION ALERT: Bernstein Liebhard LLP Reminds Investors of the Deadline to File a Lead Plaintiff Motion in a Securities Class Action Lawsuit Against Southwest Airlines Co.  ( NYSE: LUV )  - Southwest Airlines  ( NYSE:LUV ) ,https://www.benzinga.com/pressreleases/23/02/g30892554/southwest-airlines-co-nyse-luv-shareholder-class-action-alert-bernstein-liebhard-llp-reminds-inves,2023-02-14 06:45:00,"Did you lose money on investments in Southwest Airlines? If so, please visit Southwest Airlines Co. Shareholder Class Action Lawsuit or contact Peter Allocco at ( 212 ) 951-2030 or pallocco@bernlieb.com to discuss your rights.",LUV,0.761699,-0.115774,Neutral
"Bragar Eagel & Squire, P.C. Reminds Investors That Class Action Lawsuits Have Been Filed Against Avaya, BioLineRx, Enovix, and Southwest Airlines and Encourages Investors to Contact the Firm - Avaya Hldgs  ( NYSE:AVYA ) , Avaya Holdings Corp Warrants  ( 15/12/2022 )   ( OTC:AVYAW ) ",https://www.benzinga.com/pressreleases/23/02/g30891885/bragar-eagel-squire-p-c-reminds-investors-that-class-action-lawsuits-have-been-filed-against-avaya,2023-02-14 02:00:00,"NEW YORK, Feb. 13, 2023 ( GLOBE NEWSWIRE ) -- Bragar Eagel & Squire, P.C., a nationally recognized shareholder rights law firm, reminds investors that class actions have been commenced on behalf of stockholders of Avaya Holdings Corp. AVYAAVYAW, BioLineRx Ltd.",LUV,0.308476,-0.079844,Neutral
"ROSEN, A GLOBAL AND LEADING LAW FIRM, Encourages Southwest Airlines Co. Investors to Secure Counsel Before Important Deadline in Securities Class Action First Filed by the Firm - LUV - Southwest Airlines  ( NYSE:LUV ) ",https://www.benzinga.com/pressreleases/23/02/g30891440/rosen-a-global-and-leading-law-firm-encourages-southwest-airlines-co-investors-to-secure-counsel-b,2023-02-14 00:28:00,"NEW YORK, Feb. 13, 2023 ( GLOBE NEWSWIRE ) -- WHY: Rosen Law Firm, a global investor rights law firm, reminds purchasers of the securities of Southwest Airlines Co. LUV between June 13, 2020 and December 31, 2022, both dates inclusive ( the ""Class Period"" ) , of the important March 13, 2023 ...",LUV,0.31019,-0.111722,Neutral
Ryanair Is A Good Operating Model For Southwest To Emulate,https://www.forbes.com/sites/benbaldanza/2023/02/13/ryanair-is-a-good-operating-model-for-southwest-to-emulate/,2023-02-13 20:42:55,"As Southwest reacts from their Christmas meltdown, they should consider the base structure used by Ryanair to improve reliability and lower costs. Years ago, Ryanair copied airport turn procedures from Southwest.",LUV,0.03704,0.062478,Neutral
A4A Super Bowl Sunday Ad Highlights Airlines' Industry-wide Hiring Spree,https://www.benzinga.com/pressreleases/23/02/n30884705/a4a-super-bowl-sunday-ad-highlights-airlines-industry-wide-hiring-spree,2023-02-13 19:48:00,"WASHINGTON, Feb. 13, 2023 /PRNewswire/ -- Airlines for America ( A4A ) released an advertisement on Super Bowl Sunday, highlighting the aggressive and effective hiring campaigns across the U.S. airline industry - including mechanics, gate agents, pilots, flight attendants and many other jobs.",LUV,0.093289,0.0,Neutral
"Southwest working on a series of updates, upgrades to technology -CIO",https://www.reuters.com/business/aerospace-defense/southwest-working-series-updates-upgrades-technology-cio-2023-02-13/,2023-02-13 18:17:00,"Southwest working on a series of updates, upgrades to technology ... ...",LUV,0.165031,-0.131375,Neutral
"GWH, LUV & IBM Class Action Reminders: Bronstein, Gewirtz & Grossman, LLC, A Successful Firm, Reminds Investors of Deadlines and to Actively Participate - IBM  ( NYSE:IBM ) , ESS Tech  ( NYSE:GWH ) ",https://www.benzinga.com/pressreleases/23/02/g30878360/gwh-luv-ibm-class-action-reminders-bronstein-gewirtz-grossman-llc-a-successful-firm-reminds-invest,2023-02-13 15:00:00,"NEW YORK, Feb. 13, 2023 ( GLOBE NEWSWIRE ) -- Attorney Advertising -- Bronstein, Gewirtz & Grossman, LLC reminds investors that a class action lawsuit has been filed against the following publicly-traded companies.",LUV,0.208166,-0.330594,Somewhat-Bearish
SHAREHOLDER ALERT: Pomerantz Law Firm Investigates Claims On Behalf of Investors of Southwest Airlines Co. - LUV,https://www.prnewswire.com/news-releases/shareholder-alert-pomerantz-law-firm-investigates-claims-on-behalf-of-investors-of-southwest-airlines-co---luv-301744779.html,2023-02-13 13:25:00,SHAREHOLDER ALERT: Pomerantz Law Firm Investigates Claims ... PR ...,LUV,0.407844,0.066439,Neutral
Safety investigators subpoena pilots over close call at JFK,https://apnews.com/article/new-york-city-business-subpoenas-4554a1e1ea4443bf5a96d0b2a6c3e4a8,2023-02-11 02:41:23,Federal investigators said Friday they issued subpoenas to force the pilots of an American Airlines jet to sit for recorded interviews about a close call with a Delta plane on a runway at New York's Kennedy Airport last month.,LUV,0.063425,-0.059093,Neutral
Southwest Airlines to fix scheduling software,https://www.axios.com/local/dallas/2023/02/10/southwest-promises-changes,2023-02-10 12:20:13,"Andrew Watterson, chief operating officer at Southwest Airlines, testifies before a Senate committee yesterday. Photo: Tom Williams/CQ-Roll Call, Inc via Getty Images Southwest Airlines' scheduling system should be fixed by Friday, one of the company's top executives said in testimony before a ...",LUV,0.310843,-0.079865,Neutral
The Airline Experiment to Make Boarding Less Awful,https://www.wsj.com/articles/southwest-airlines-boarding-seating-turn-ee12d3f2,2023-03-01 10:30:00,Southwest Airlines is studying ways to squeeze more flights per plane-a big focus is on passenger boarding bottlenecks.,LUV,0.459624,0.254759,Somewhat-Bullish
