title,url,time_published,summary,ticker,relevance_score,ticker_sentiment_score,ticker_sentiment_label
"Analyzing Corporate Travel Trends: Key Insights From Morgan Stanley's Global Survey - Alaska Air Gr  ( NYSE:ALK ) , United Airlines Holdings  ( NASDAQ:UAL ) , American Airlines Group  ( NASDAQ:AAL ) , Delta Air Lines  ( NYSE:DAL ) ",https://www.benzinga.com/analyst-ratings/analyst-color/23/06/32821817/analyzing-corporate-travel-trends-key-insights-from-morgan-stanleys-global-survey,2023-06-12 18:43:47,"Morgan Stanley conducted an online survey of 90 global corporate travel managers in mid -late May who are involved in hotel and/or airline carrier negotiations in the U.S., Europe and Asia.",LUV,0.34729,0.407526,Bullish
Carnival leads gains in cruise stocks as analysts eye strong travel demand,https://www.reuters.com/business/autos-transportation/carnival-leads-gains-cruise-stocks-analysts-eye-strong-travel-demand-2023-06-12/,2023-06-12 16:33:00,"NEW YORK, June 12 ( Reuters ) - Shares of Carnival Corp ( CCL.N ) and Norwegian Cruise Line Holdings Ltd ( NCLH.N ) jumped on Monday, and were among the top S&P 500 ( .SPX ) performers, as analysts anticipate continuing growth in travel demand from customers.",LUV,0.130926,0.068444,Neutral
'We're paying twice for the same experience': Plus-size travelers hit out at 'discriminatory' airline seat policies,https://www.cnn.com/travel/article/plus-size-travelers-slam-airline-seat-policies/index.html,2023-06-12 13:36:00,"While the average width of an airplane seat has been shrinking for decades, bodies are getting larger around the world, with experts predicting that over half of the global population will be overweight or obese by 2035.",LUV,0.039878,0.046239,Neutral
Deadline for airline 5G retrofits could add to travel woes this July 4 holiday | Business,https://www.cnn.com/2023/06/29/business/airline-5g-retrofits-travel-delays/index.html,2023-06-29 18:56:00,Deadline for airline 5G retrofits could add to travel woes this July 4 holiday ...,LUV,0.06697,0.112265,Neutral
Southwest pilots' union lays groundwork for potential strike with labor talks at an impasse,https://www.cnbc.com/2023/06/29/southwest-pilots-union-lays-groundwork-for-potential-strike.html,2023-06-29 17:00:09,"Southwest's pilots' union is seeking to be released from federal mediation, a step toward a potential strike.",LUV,0.282234,-0.058407,Neutral
"Airline Stock Roundup: DAL's Upbeat View, LUV's Labor Deal & More",https://www.zacks.com/stock/news/2114800/airline-stock-roundup-dals-upbeat-view-luvs-labor-deal-more,2023-06-29 12:52:00,"Delta (DAL) forwards a rosy outlook, owing to upbeat air-travel demand. Southwest (LUV) inks tentative deal with the union for mechanics.",LUV,0.256989,0.266017,Somewhat-Bullish
"1 ETF Shows The Economy Is Stronger Than We Think, Bulldog Holmes Tells - U.S. Global Jets ETF  ( ARCA:JETS ) ",https://www.benzinga.com/news/23/06/33046873/1-etf-shows-the-economy-is-stronger-than-we-think-bulldog-holmes-tells-benzinga,2023-06-28 19:11:47,"Renowned businessman and U.S. Global Investors CEO Frank 'Bulldog' Holmes appeared on Benzinga's PreMarket Prep show Wednesday morning to discuss a variety of topics, including how the U.S. Global Jets ETF JETS is up 15.4% in the last month. JETS counts the ""Big 4"" airlines - Delta Air Lines, Inc.",LUV,0.175859,0.166103,Somewhat-Bullish
"Southwest flyer's photo shows line of passengers sitting in wheelchairs, claims 'pre-boarding scam'",https://www.foxbusiness.com/lifestyle/southwest-flyers-photo-shows-line-passengers-sitting-wheelchairs-claims-pre-boarding-scam,2023-06-28 18:38:16,A Southwest Airlines passenger claims several flyers may have found a way to take advantage of the carrier's wheelchair policy in order to be first in line to board a plane.,LUV,0.203215,0.073435,Neutral
"The Zacks Analyst Blog Highlights Delta Air Lines, Alaska Air, Southwest Airlines and SkyWest",https://www.zacks.com/stock/news/2113966/the-zacks-analyst-blog-highlights-delta-air-lines-alaska-air-southwest-airlines-and-skywest,2023-06-28 09:39:00,"Delta Air Lines, Alaska Air, Southwest Airlines and SkyWest are included in this Analyst Blog.",LUV,0.270973,0.135437,Neutral
Southwest Airlines Unusual Options Activity For June 27 - Southwest Airlines  ( NYSE:LUV ) ,https://www.benzinga.com/markets/options/23/06/33033175/southwest-airlines-unusual-options-activity-for-june-27,2023-06-27 20:01:50,"Benzinga's options scanner just detected over 11 options trades for Southwest Airlines LUV summing a total amount of $419,473. At the same time, our algo caught 4 for a total amount of 239,008.",LUV,0.805471,0.159254,Somewhat-Bullish
Credit Cards That Cover Rental Car Insurance,https://www.kiplinger.com/personal-finance/credit-cards/credit-cards-that-cover-rental-car-insurance,2023-06-27 19:21:09,"Should you tick the box for rental car insurance at the Avis, Budget or other rental car counter? Or does your personal auto insurance or credit card already offer this benefit? Given that supplemental insurance for rental cars can cost around $15 to $30 per day or more, it's worth asking these ...",LUV,0.036812,0.313398,Somewhat-Bullish
Here's Why Southwest Airlines  ( LUV )  Stock Is Moving - Southwest Airlines  ( NYSE:LUV ) ,https://www.benzinga.com/news/23/06/33030817/heres-why-southwest-airlines-luv-stock-is-moving,2023-06-27 17:48:03,"Southwest Airlines Co LUV shares are trading higher by 3.82% to $35.30 during Tuesday's session. The stock is potentially trading higher in sympathy with Delta Air Lines, Inc. after the company raised its second-quarter and 2023 guidance at its Investor Day presentation.",LUV,0.558244,0.347873,Somewhat-Bullish
Are Airline Stocks Becoming More Shareholder Friendly?,https://www.zacks.com/stock/news/2113643/are-airline-stocks-becoming-more-shareholder-friendly,2023-06-27 14:06:00,"Delta Air Lines (DAL), Alaska Air (ALK), Southwest (LUV) and SkyWest (SKYW) reward shareholders by renewing their dividend payouts or share buybacks, after lifting of COVID-19 restrictions.",LUV,0.242285,0.151386,Somewhat-Bullish
Extreme weather is hitting parts of the US. That's bad news for the economy | Business,https://www.cnn.com/2023/06/27/investing/premarket-stocks-trading/index.html,2023-06-27 11:49:00,Extreme weather is hitting parts of the US. That's bad news for the economy ...,LUV,0.068698,-0.065503,Neutral
"Hackers steal personal information from 8K pilot applicants for American, Southwest",https://www.foxbusiness.com/technology/hackers-steal-personal-information-8k-pilot-applicants-american-southwest,2023-06-27 10:58:07,"Hackers obtained personal information for more than 8,000 pilot applicants at American Airlines and Southwest Airlines after a database maintained by a recruiting company was broken into. The breach took place at Pilot Credentials, which is based in Austin, Texas, on April 30.",LUV,0.151539,-0.145659,Neutral
Hackers steal personal information on thousands of pilot applicants at American and Southwest,https://apnews.com/article/pilots-hackers-personal-information-security-cce1def1b3de34781a6759daf8f20fea,2023-06-26 21:29:28,"Hackers steal personal information on thousands of pilot applicants at American and Southwest DALLAS ( AP ) - Personal information for more than 8,000 applicants to become pilots at American Airlines and Southwest Airlines was stolen when hackers broke into a data base maintained by a recruiting ...",LUV,0.156461,-0.222998,Somewhat-Bearish
How I beat expensive summer travel by booking an all-inclusive trip to Mexico with travel points,https://www.cnn.com/cnn-underscored/travel/all-inclusive-resort-mexico-points-miles,2023-06-26 20:51:00,"CNN Underscored reviews financial products based on their overall value. We may receive a commission through our affiliate partners if you apply and are approved for a product, but our reporting is always independent and objective. Terms apply to American Express benefits and offers.",LUV,0.025113,0.02898,Neutral
How I beat expensive summer travel by booking an all-inclusive trip to Mexico with travel points,https://edition.cnn.com/cnn-underscored/travel/all-inclusive-resort-mexico-points-miles,2023-06-26 20:51:00,"CNN Underscored reviews financial products based on their overall value. We may receive a commission through our affiliate partners if you apply and are approved for a product, but our reporting is always independent and objective. Terms apply to American Express benefits and offers.",LUV,0.025113,0.02898,Neutral
Southwest  ( LUV )  & AMFA Ink Tentative Agreement for Mechanics,https://www.zacks.com/stock/news/2112979/southwest-luv-amfa-ink-tentative-agreement-for-mechanics,2023-06-26 13:16:00,The implementation of the provisional deal inked by Southwest (LUV) and mechanics' labor union is subject to a favorable voting outcome.,LUV,0.521961,0.522188,Bullish
Letting the bull loose,https://theweek.com/economy/1024486/letting-the-bull-loose,2023-06-25 09:58:25,"The smartest insight and analysis, from all perspectives, rounded up from around the web: The bull market is back, said Nicole Goodkind at CNN. As of early this week, the S&P 500 had rebounded more than 20% since its most recent low, reached in October 2022.",LUV,0.072217,0.023337,Neutral
Buttigieg warns airlines to finish retrofitting planes to avoid interference from 5G signals,https://apnews.com/article/buttigieg-airlines-5g-wireless-service-d24dbc4a1295538d51ee7da345cb6303,2023-06-23 23:27:02,Transportation Secretary Pete Buttigieg warned the nation's airlines Friday that flights could be disrupted starting next week because some planes lack updated equipment to prevent interference from transmissions by wireless companies.,LUV,0.076358,0.106215,Neutral
Southwest Airlines  ( LUV )  Dips More Than Broader Markets: What You Should Know,https://www.zacks.com/stock/news/2112669/southwest-airlines-luv-dips-more-than-broader-markets-what-you-should-know,2023-06-23 22:15:24,"Southwest Airlines (LUV) closed the most recent trading day at $33.93, moving -1.02% from the previous trading session.",LUV,0.495015,0.178765,Somewhat-Bullish
Southwest has a labor deal with mechanics just days after flight attendants rejected theirs,https://apnews.com/article/southwest-airlines-labor-mechanics-flight-attendants-pilots-177f11d21ccbfdd9855af496ceaebddf,2023-06-23 17:27:05,Southwest has a labor deal with mechanics just days after flight attendants rejected theirs DALLAS ( AP ) - Southwest Airlines has reached agreement on a new labor contract with its mechanics just days after the flight attendants' union rejected a company proposal.,LUV,0.156461,0.058601,Neutral
Southwest Airlines reaches tentative agreement with mechanics' union,https://www.cnbc.com/2023/06/23/southwest-airlines-reaches-tentative-agreement-with-mechanics-union.html,2023-06-23 17:19:12,"Southwest Airlines said it has reached a tentative agreement with a union representing the airline's over 2,800 mechanics and related employees.",LUV,0.089462,0.104195,Neutral
Amazon  ( AMZN )  AWS Strengthens Relationship With Old Mutual,https://www.zacks.com/stock/news/2112573/amazon-amzn-aws-strengthens-relationship-with-old-mutual,2023-06-23 16:51:00,"Amazon (AMZN) AWS' client, Old Mutual, completes the migration of its entire information technology infrastructure.",LUV,0.119532,0.177389,Somewhat-Bullish
Southwest Airlines reaches tentative agreement with mechanics union,https://www.reuters.com/business/aerospace-defense/southwest-airlines-reaches-tentative-agreement-with-mechanics-union-2023-06-23/,2023-06-23 13:56:00,June 23 ( Reuters ) - Southwest Airlines ( LUV.N ) said on Friday it had reached a tentative agreement with the union representing the company's mechanics and related employees.,LUV,0.303175,0.212773,Somewhat-Bullish
TENTATIVE AGREEMENT REACHED FOR SOUTHWEST AIRLINES' MECHANICS & RELATED EMPLOYEES - Southwest Airlines  ( NYSE:LUV ) ,https://www.benzinga.com/pressreleases/23/06/n32983302/tentative-agreement-reached-for-southwest-airlines-mechanics-related-employees,2023-06-23 13:00:00,"DALLAS, June 23, 2023 /PRNewswire/ -- Southwest Airlines Co. LUV and the Aircraft Mechanics Fraternal Association ( AMFA ) have reached a Tentative Agreement ( TA ) for the airline's Mechanics & Related Employees.",LUV,0.404563,0.54866,Bullish
Elon Musk and Mark Zuckerberg challenge each other to a cage fight,https://www.marketwatch.com/story/elon-musk-and-mark-zuckerberg-challenge-each-other-to-cage-fight-acf7889f,2023-06-22 12:47:00,A war of words between tech billionaires Elon Musk and Mark Zuckerberg has led to the two men challenging each other to a cage fight.,LUV,0.100729,-0.134001,Neutral
Amazon's  ( AMZN )  Client Base Expands as BBVA Selects AWS,https://www.zacks.com/stock/news/2111423/amazons-amzn-client-base-expands-as-bbva-selects-aws,2023-06-21 17:35:00,BBVA selects Amazon's (AMZN) AWS to accelerate its data-driven transformation.,LUV,0.142284,0.160981,Somewhat-Bullish
I'm a financial planner who's been to 16 countries - I have 5 techniques anyone can use to save money on travel,https://www.businessinsider.com/personal-finance/techniques-from-financial-planner-save-money-on-travel-2023-7,2023-07-09 11:30:00,5 techniques from a financial planner to save money on travel - Business Insider ...,LUV,0.046452,0.113547,Neutral
Southwest Airlines  ( LUV )  Gains As Market Dips: What You Should Know,https://www.zacks.com/stock/news/2118368/southwest-airlines-luv-gains-as-market-dips-what-you-should-know,2023-07-07 22:15:23,"In the latest trading session, Southwest Airlines (LUV) closed at $37.59, marking a +1.32% move from the previous day.",LUV,0.624172,0.232642,Somewhat-Bullish
"Wall Street Is Cautious On These 2 First Half Winners - American Airlines Group  ( NASDAQ:AAL ) , DaVita  ( NYSE:DVA ) ",https://www.benzinga.com/analyst-ratings/analyst-color/23/07/33145548/wall-street-is-cautious-on-these-2-first-half-winners,2023-07-07 13:36:54,"Lately, it seems like the only thing that can stop the U.S. equity markets is a holiday early close. Heading into the 4th of July celebration, major stock indices are enjoying a festive 2023 thanks to 1 ) waning expectations of a long anticipated recession and 2 ) retreating inflation.",LUV,0.099476,-0.156385,Somewhat-Bearish
Investors Scramble To Buy Stocks Again - Especially These 10,https://www.investors.com/etfs-and-funds/sectors/sp500-investors-scramble-to-buy-stocks-again-especially-these-10/,2023-07-07 12:00:00,Buying S&P 500 stocks is a thing again. And investors are rushing to buy their new favorites.,LUV,0.133841,0.201966,Somewhat-Bullish
Analysis: Will abandoning American help JetBlue's Spirit merger? Not by much,https://www.reuters.com/markets/deals/will-abandoning-american-help-jetblues-spirit-merger-not-by-much-2023-07-06/,2023-07-06 21:30:00,"CHICAGO/WASHINGTON, July 6 ( Reuters ) - JetBlue Airways' ( JBLU.O ) decision to abandon its alliance with American Airlines ( AAL.O ) has improved its chances in the trial over a $3.8 billion deal to buy Spirit Airlines ( SAVE.N ) , but may not be enough to hand it a victory, antitrust experts ...",LUV,0.078099,0.169661,Somewhat-Bullish
Commercial 50 And Fewer Seat Aircraft Are Economically Dead,https://www.forbes.com/sites/benbaldanza/2023/07/06/commercial-50-and-fewer-seat-aircraft-are-economically-dead/,2023-07-06 17:40:58,"Jets with 50 seats no longer are economically viable in the U.S. due to pilot wages, and the fast growth of low-cost carriers. The 70-seat jets aren't far behind.",LUV,0.030254,0.089786,Neutral
"A Las Vegas flight to Hawaii was diverted after a passenger AirDropped a photo suggesting there was a bomb on the plane to other passengers, police say",https://markets.businessinsider.com/news/stocks/southwest-flight-las-vegas-hawaii-diverted-airdrop-bomb-threat-police-2023-7,2023-07-06 13:51:37," A Southwest Airlines flight was diverted after someone on board share a sinister message, police said.  Police said the passenger shared a photo that appeared to suggest there was a bomb on the plane.  No explosives were found, and the incident is now being investigated by the FBI, according ...",LUV,0.283323,-0.019166,Neutral
"A Las Vegas flight to Hawaii was diverted after a passenger AirDropped a photo suggesting there was a bomb on the plane to other passengers, police say",https://www.businessinsider.com/southwest-flight-las-vegas-hawaii-diverted-airdrop-bomb-threat-police-2023-7,2023-07-06 13:51:00,Southwest flight to Hawaii diverted after AirDrop bomb threat: police - Business Insider ...,LUV,0.262052,-0.075685,Neutral
"Goldman Adds Southwest Airlines To ""Conviction"" List, Value Play? - United Airlines Holdings  ( NASDAQ:UAL ) , American Airlines Group  ( NASDAQ:AAL ) , Goldman Sachs Gr  ( NYSE:GS ) , Southwest Airlines  ( NYSE:LUV ) , Delta Air Lines  ( NYSE:DAL ) ",https://www.benzinga.com/analyst-ratings/analyst-color/23/07/33131542/goldman-adds-southwest-airlines-to-conviction-list-value-play,2023-07-06 13:48:52,"When it comes to the world of airlines, most - if not all - of underlying earnings and operating profits are too volatile for the typical investor's stomach. Financials throughout companies like American Airlines AAL, Delta Airlines DAL, and even United Airlines UAL will show a widened range of ...",LUV,0.162437,0.07821,Neutral
Will Southwest Airlines Stock Recover To Its Pre-Inflation-Shock Level?,https://www.forbes.com/sites/greatspeculations/2023/07/06/will-southwest-airlines-stock-recover-to-its-pre-inflation-shock-level/,2023-07-06 12:00:36,Returning to the pre-inflation shock level means that LUV stock will have to gain more than 70% from here.,LUV,0.758753,-0.197885,Somewhat-Bearish
Carriage Services Announces Election of Somer Webb to Board of Directors - Carriage Servs  ( NYSE:CSV ) ,https://www.benzinga.com/pressreleases/23/07/g33123526/carriage-services-announces-election-of-somer-webb-to-board-of-directors,2023-07-05 20:28:55,"HOUSTON, July 05, 2023 ( GLOBE NEWSWIRE ) -- Carriage Services, Inc. CSV ( ""Carriage"" or the ""Company"" ) announced today that its Board of Directors ( the ""Board"" ) has elected Somer Webb as an independent director, effective immediately.",LUV,0.061949,0.09902,Neutral
Carriage Services Announces Election of Somer Webb to Board of Directors,https://www.globenewswire.com/news-release/2023/07/05/2699946/0/en/Carriage-Services-Announces-Election-of-Somer-Webb-to-Board-of-Directors.html,2023-07-05 20:28:00,"HOUSTON, July 05, 2023 ( GLOBE NEWSWIRE ) -- Carriage Services, Inc. ( NYSE: CSV ) ( ""Carriage"" or the ""Company"" ) announced today that its Board of Directors ( the ""Board"" ) has elected Somer Webb as an independent director, effective immediately.",LUV,0.063258,0.099051,Neutral
Southwest Airlines Unusual Options Activity - Southwest Airlines  ( NYSE:LUV ) ,https://www.benzinga.com/markets/options/23/07/33122333/southwest-airlines-unusual-options-activity,2023-07-05 20:01:55,"A whale with a lot of money to spend has taken a noticeably bearish stance on Southwest Airlines. Looking at options history for Southwest Airlines LUV we detected 15 strange trades. If we consider the specifics of each trade, it is accurate to state that 20% of the investors opened trades with ...",LUV,0.814341,0.036548,Neutral
Explainer: Why U.S. labor unions are gaining leverage in contract talks with big employers,https://www.reuters.com/markets/us/why-us-labor-unions-are-gaining-leverage-contract-talks-with-big-employers-2023-07-05/,2023-07-05 19:31:00,July 5 ( Reuters ) - U.S. union workers are finding more solid footing during contract negotiations with employers as a tight labor market allows employees to flex more bargaining power.,LUV,0.165598,0.242668,Somewhat-Bullish
Airlines struggled ahead of July Fourth weekend. Their stocks didn't,https://www.cnbc.com/2023/07/04/why-airline-stocks-are-up-even-as-disruptions-mount.html,2023-07-04 16:10:41,"Airline disruptions piled up over the last week, but their stocks are soaring as travelers return.",LUV,0.063091,-0.275564,Somewhat-Bearish
This Is What Whales Are Betting On Southwest Airlines - Southwest Airlines  ( NYSE:LUV ) ,https://www.benzinga.com/markets/options/23/07/33101333/this-is-what-whales-are-betting-on-southwest-airlines,2023-07-03 19:34:19,"Someone with a lot of money to spend has taken a bearish stance on Southwest Airlines LUV. We noticed this today when the big position showed up on publicly available options history that we track here at Benzinga. Whether this is an institution or just a wealthy individual, we don't know.",LUV,0.796338,0.115678,Neutral
Airlines' Bullish Q2 Outlook Implies More Upside Potential,https://www.zacks.com/stock/news/2116006/airlines-bullish-q2-outlook-implies-more-upside-potential,2023-07-03 14:20:00,"Backed by buoyant air-travel demand, Delta Air Lines (DAL), American Airlines (AAL) and Southwest Airlines (LUV) have recently updated their second-quarter 2023 guidance.",LUV,0.20537,0.22818,Somewhat-Bullish
The Fourth of July in 2023: A Celebration of Economic Resilience,https://www.zacks.com/stock/news/2115996/the-fourth-of-july-in-2023-a-celebration-of-economic-resilience,2023-07-03 13:06:00,"As Americans prepare to celebrate Independence Day on Jul 4, 2023, upbeat economic indicators, including easing inflation, ebbing recessionary fears and resilient consumers, are likely to add to their merriment.",LUV,0.144708,0.129998,Neutral
United Airlines Meltdown: 1 More Reason to Avoid the Stock,https://www.fool.com/investing/2023/07/02/united-airlines-meltdown-1-more-reason-to-avoid-th/,2023-07-02 13:17:00,"The airline giant canceled thousands of flights last week, despite management's previous claims that it had made major investments to avoid operational meltdowns.",LUV,0.052918,-0.237014,Somewhat-Bearish
"United CEO apologizes for flying private jet while the airline delayed, canceled thousands of flights",https://www.foxbusiness.com/economy/united-ceo-apologizes-flying-private-jet-while-airline-delayed-canceled-thousands-flights,2023-07-01 00:29:17,United Airlines CEO Scott Kirby apologized Friday for flying a private jet this week while passengers were left stranded by thousands of delays and cancelations this week.,LUV,0.083251,-0.204536,Somewhat-Bearish
Southwest Airlines  ( LUV )  Gains But Lags Market: What You Should Know,https://www.zacks.com/stock/news/2115636/southwest-airlines-luv-gains-but-lags-market-what-you-should-know,2023-06-30 22:15:23,"In the latest trading session, Southwest Airlines (LUV) closed at $36.21, marking a +0.72% move from the previous day.",LUV,0.48724,0.25851,Somewhat-Bullish
United Airlines Struggles to Resolve Flight Disruptions,https://www.nytimes.com/2023/06/30/business/united-airlines-delayed-canceled-flights.html,2023-06-30 15:01:14,"United Airlines was struggling on Friday to recover from a week of flight delays and cancellations, testing the resilience of its operation as people head to airports ahead of the busy July 4 holiday. The airline's troubles began last weekend in the New York area.",LUV,0.056674,-0.160965,Somewhat-Bearish
LUV: Is There Momentum in Southwest Airlines Company  ( LUV ) ?,https://stocknews.com/news/luv-singy-qabsy-aflyy-is-there-momentum-in-southwest-airlines-company-luv/,2023-06-30 14:12:57,"In its fiscal first quarter, Southwest Airlines Co. ( LUV ) incurred a pre-tax net loss of approximately $380 million ( $294 million after-tax ) due to the December 2022 operational disruption. Travel cancellations and reduced bookings in January and February caused a $325 million revenue decline ...",LUV,0.633981,0.27738,Somewhat-Bullish
"Top Stories Friday, June 30: Amazon Hires Dozens of Former FTC Officials, Volkswagen Discusses With Tesla to Adopt North American Charging Standard, FDA Approves First Hemophilia A BioMarin Gene Therapy - Amazon.com  ( NASDAQ:AMZN ) , Boeing  ( NYSE:BA ) ",https://www.benzinga.com/news/23/06/33078145/amazon-hires-dozens-of-former-ftc-officials-volkswagen-discusses-with-tesla-to-adopt-north-american,2023-06-30 13:48:00,Amazon.Com Inc AMZN is poaching several staffers from the Federal Trade Commission as it gears up for an antitrust battle with the regulator. The firm battling charges of strong-arming third-party sellers into using its logistics network - has already hired around a dozen former FTC officials.,LUV,0.073209,-0.111868,Neutral
Southwest Pilots On The Verge Of Strike As They Seek To Be Released From Mediation - Southwest Airlines  ( NYSE:LUV ) ,https://www.benzinga.com/markets/equities/23/06/33076234/southwest-pilots-on-the-verge-of-strike-as-they-seek-to-be-released-from-mediation,2023-06-30 12:34:32,Southwest Airlines Co.'s LUV pilots' union is reportedly moving closer to a possible strike. LUV's pilot union filed a request with the National Mediation Board ( NMB ) to be officially released from mediation.,LUV,0.601928,0.047015,Neutral
Southwest Airlines  ( LUV )  Outpaces Stock Market Gains: What You Should Know,https://www.zacks.com/stock/news/2124130/southwest-airlines-luv-outpaces-stock-market-gains-what-you-should-know,2023-07-19 22:00:18,"In the latest trading session, Southwest Airlines (LUV) closed at $37.35, marking a +1.66% move from the previous day.",LUV,0.666827,0.367288,Bullish
Kearney Announces Acquisition of Silicon Foundry to Expand Strategic Transformation and Innovation Capabilities,https://www.prnewswire.com/news-releases/kearney-announces-acquisition-of-silicon-foundry-to-expand-strategic-transformation-and-innovation-capabilities-301880218.html,2023-07-19 13:06:00,Global consulting firm adds seasoned venture capital and innovation professionals to continue to help global clients transform and establish itself as a hub of corporate innovation.,LUV,0.053509,0.174748,Somewhat-Bullish
