title,url,time_published,summary,ticker,relevance_score,ticker_sentiment_score,ticker_sentiment_label
SOUTHWEST AIRLINES RANKED BY FORTUNE AS ONE OF AMERICA'S MOST INNOVATIVE COMPANIES,https://www.prnewswire.com/news-releases/southwest-airlines-ranked-by-fortune-as-one-of-americas-most-innovative-companies-301936612.html,2023-09-22 20:40:00,"Carrier recognized for continued innovation efforts that enhance the Customer Experience DALLAS, Sept. 22, 2023 /PRNewswire/ -- Southwest Airlines Co. ( NYSE: LUV ) celebrates earning 2023 recognition by Fortune as one of America's Most Innovative Companies.",LUV,0.161982,0.352562,Bullish
"From UPS to Detroit Three automakers, US labor unions flex muscle",https://www.reuters.com/markets/us/ups-detroit-three-automakers-us-labor-unions-flex-muscle-2023-09-22/,2023-09-22 16:06:00,"Teamster member Sergio Martinez yells out during a rally outside a UPS facility in downtown in Los Angeles, California, U.S. July 19, 2023. REUTERS/Mike Blake Acquire Licensing Rights",LUV,0.053992,-0.122749,Neutral
American Airlines becomes latest to find unapproved replacement parts: report,https://www.marketwatch.com/story/american-airlines-becomes-latest-to-find-unapproved-replacement-parts-report-bd072f1d,2023-09-22 08:44:00,The airline industry has been on a worldwide hunt to find spare parts for jet engines that were sold using unapproved documents.,LUV,0.186738,-0.236145,Somewhat-Bearish
Southwest Airlines  ( LUV )  Stock Moves -0.84%: What You Should Know,https://www.zacks.com/stock/news/2153954/southwest-airlines-luv-stock-moves--084-what-you-should-know,2023-09-21 22:00:18,"Southwest Airlines (LUV) closed the most recent trading day at $28.28, moving -0.84% from the previous trading session.",LUV,0.670305,0.122651,Neutral
"The week's good news: Sept. 21, 2023",https://theweek.com/digest/round-up/the-weeks-good-news-sept-21-2023,2023-09-21 19:14:54,"Snow leopards make a comeback, a music studio for everyone, and more The Week ...",LUV,0.035502,0.084821,Neutral
Southwest Airlines  ( LUV )  Dips More Than Broader Markets: What You Should Know,https://www.zacks.com/stock/news/2153399/southwest-airlines-luv-dips-more-than-broader-markets-what-you-should-know,2023-09-20 22:15:18,"Southwest Airlines (LUV) closed at $28.52 in the latest trading session, marking a -1.35% move from the prior day.",LUV,0.651499,0.218046,Somewhat-Bullish
Futu Holdings and Southwest Airlines have been highlighted as Zacks Bull and Bear of the Day,https://www.zacks.com/stock/news/2152939/futu-holdings-and-southwest-airlines-have-been-highlighted-as-zacks-bull-and-bear-of-the-day,2023-09-20 11:29:00,Futu Holdings and Southwest Airlines are part of the Zacks Bull and Bear of the Day article.,LUV,0.1789,-0.02855,Neutral
Bear of the Day: Southwest Airlines  ( LUV ) ,https://www.zacks.com/commentary/2152760/bear-of-the-day-southwest-airlines-luv,2023-09-20 08:00:00,"Prospective airline investors should avoid low-cost carriers such as Southwest airlines. LUV has slower growth, shrinking margins, and notable reputational damage to contend with.",LUV,0.405215,-0.067889,Neutral
United Airlines becomes third major carrier to disclose it's been affected by suspicious engine parts,https://www.businessinsider.com/united-airlines-is-third-carrier-affected-by-suspect-engine-parts-2023-9,2023-09-19 15:30:00,United Airlines is third carrier affected by suspect engine parts - Business Insider ...,LUV,0.107016,0.060514,Neutral
Southwest Airlines  ( LUV )  Stock Dips While Market Gains: Key Facts,https://www.zacks.com/stock/news/2161892/southwest-airlines-luv-stock-dips-while-market-gains-key-facts,2023-10-06 22:00:20,"The latest trading day saw Southwest Airlines (LUV) settling at $27.08, representing a -0.88% change from its previous close.",LUV,0.598621,0.318947,Somewhat-Bullish
SOUTHWEST AIRLINES MATERIAL SPECIALISTS APPROVE NEW CONTRACT - Southwest Airlines  ( NYSE:LUV ) ,https://www.benzinga.com/pressreleases/23/10/n35133310/southwest-airlines-material-specialists-approve-new-contract,2023-10-06 21:15:00,"DALLAS, Oct. 6, 2023 /PRNewswire/ -- Southwest Airlines Co. LUV announced today that its Material Specialists, represented by the International Brotherhood of Teamsters, ratified a new collective bargaining agreement.",LUV,0.407844,0.581443,Bullish
SOUTHWEST AIRLINES MATERIAL SPECIALISTS APPROVE NEW CONTRACT,https://www.prnewswire.com/news-releases/southwest-airlines-material-specialists-approve-new-contract-301949969.html,2023-10-06 21:15:00,"DALLAS, Oct. 6, 2023 /PRNewswire/ -- Southwest Airlines Co. ( NYSE: LUV ) announced today that its Material Specialists, represented by the International Brotherhood of Teamsters, ratified a new collective bargaining agreement.",LUV,0.401331,0.574593,Bullish
"SOUTHWEST AIRLINES UNVEILS SPECIAL TROLLS-THEMED AIRCRAFT TO CELEBRATE DREAMWORKS ANIMATION'S NEW MOVIE ""TROLLS BAND TOGETHER"" - Southwest Airlines  ( NYSE:LUV ) ",https://www.benzinga.com/pressreleases/23/10/n35122628/southwest-airlines-unveils-special-trolls-themed-aircraft-to-celebrate-dreamworks-animations-new-m,2023-10-06 10:00:00,"Airline to launch Customer sweepstakes, custom inflight entertainment content, and surprise and delight moments",LUV,0.190954,0.288551,Somewhat-Bullish
 ( LUV )  Advances While Market Declines: Some Information for Investors,https://www.zacks.com/stock/news/2161156/luv-advances-while-market-declines-some-information-for-investors,2023-10-05 22:15:20,"Southwest Airlines (LUV) reachead $27.32 at the closing of the latest trading day, reflecting a +0.44% change compared to its last close.",LUV,0.463792,0.075695,Neutral
Major US airlines find unapproved jet engine parts in some aircraft as alleged supplier faces lawsuit,https://www.foxbusiness.com/lifestyle/major-us-airlines-find-unapproved-jet-engine-parts-some-aircraft-alleged-supplier-faces-lawsuit,2023-10-05 18:27:00,"Major U.S. airlines have found that some jet engines installed in aircraft were built with parts that had forged safety certificates, leading to a lawsuit against a London-based parts supplier.",LUV,0.216215,-0.029182,Neutral
Southwest Airlines' Pilots Have Had Enough. Should Shareholders Take Another Look?,https://www.forbes.com/sites/joemoglia/2023/10/05/southwest-airlines-pilots-have-had-enough-should-shareholders-take-another-look/,2023-10-05 10:15:00,Southwest Airlines' (NYSE: LUV) pilots' union claims the company's scheduling failures have brought it to a breaking point.,LUV,0.163909,-0.028576,Neutral
"From Detroit Three automakers to healthcare, US labor unions flex muscle",https://www.reuters.com/markets/us/detroit-three-automakers-healthcare-us-labor-unions-flex-muscle-2023-10-04/,2023-10-04 14:54:00,"Teamster member Sergio Martinez yells out during a rally outside a UPS facility in downtown in Los Angeles, California, U.S. July 19, 2023. REUTERS/Mike Blake Acquire Licensing Rights",LUV,0.042196,-0.12034,Neutral
Why Southwest Airlines Stock Flew South in September,https://www.fool.com/investing/2023/10/03/why-southwest-airlines-stock-flew-south-in-septemb/,2023-10-03 16:57:26,A combination of slowing demand and higher fuel costs is weighing on the airlines.,LUV,0.288893,-0.156225,Somewhat-Bearish
Delta says some aircraft engines found to contain unapproved parts during overhaul,https://www.foxbusiness.com/lifestyle/delta-some-aircraft-engines-found-contain-unapproved-parts-overhaul,2023-10-03 16:40:30,Delta says some aircraft engines found to contain unapproved parts ... Fox Business ...,LUV,0.120431,-0.096313,Neutral
"Delta Uncovers Unauthorized Components In Jets In Growing Industry Scandal - United Airlines Holdings  ( NASDAQ:UAL ) , American Airlines Group  ( NASDAQ:AAL ) , Southwest Airlines  ( NYSE:LUV ) , Delta Air Lines  ( NYSE:DAL ) ",https://www.benzinga.com/news/23/10/35052883/delta-uncovers-unauthorized-components-in-jets-in-growing-industry-scandal,2023-10-03 13:32:16,"Delta Air Lines Inc DAL recently unearthed the presence of unauthorized components within some of its jet engines, joining the ranks of major U.S. airlines that have found fake parts in their machinery.",LUV,0.185306,0.0,Neutral
Airlines want you to lose weight. Ozempic could save them millions.,https://www.businessinsider.com/ozempic-wegovy-weight-loss-drugs-airlines-fuel-costs-savings-2023-10,2023-10-02 19:46:00,Airlines Want You to Lose Weight. Ozempic May Save Them Millions - Business Insider ...,LUV,0.064276,0.037016,Neutral
Check Out What Whales Are Doing With LUV - Southwest Airlines  ( NYSE:LUV ) ,https://www.benzinga.com/markets/options/23/10/35038267/check-out-what-whales-are-doing-with-luv,2023-10-02 18:01:38,"A whale with a lot of money to spend has taken a noticeably bearish stance on Southwest Airlines. Looking at options history for Southwest Airlines LUV we detected 11 strange trades. If we consider the specifics of each trade, it is accurate to state that 36% of the investors opened trades with ...",LUV,0.805127,0.229283,Somewhat-Bullish
"From UPS to Detroit Three automakers, US labor unions flex muscle",https://www.reuters.com/markets/us/ups-detroit-three-automakers-us-labor-unions-flex-muscle-2023-10-02/,2023-10-02 13:53:00,"Oct 2 ( Reuters ) - A tight U.S. labor market, the expiry of union contracts and high living costs have led to tough negotiations for pay hikes and benefits from workers and triggered strikes and protests across industries.",LUV,0.049526,-0.12214,Neutral
Southwest Airlines  ( LUV )  Dips More Than Broader Markets: What You Should Know,https://www.zacks.com/stock/news/2158198/southwest-airlines-luv-dips-more-than-broader-markets-what-you-should-know,2023-09-29 22:00:18,"Southwest Airlines (LUV) closed the most recent trading day at $27.07, moving -0.55% from the previous trading session.",LUV,0.601928,0.127011,Neutral
United Pilots Win 40% Raise As Union Ratifies New Contract,https://www.forbes.com/sites/anafaguy/2023/09/29/united-pilots-win-40-raise-as-union-ratifies-new-contract/,2023-09-29 19:10:00,The agreement marks the latest major pay raise for unionized workers in the United States.,LUV,0.110462,0.0,Neutral
"Ground Control To Congress, Commencing Countdown, Engines Off: How Government Shutdown Could Impact Air Travel - U.S. Global Jets ETF  ( ARCA:JETS ) , American Airlines Group  ( NASDAQ:AAL ) ",https://www.benzinga.com/news/23/09/35009244/ground-control-to-congress-commencing-countdown-engines-off-how-government-shutdown-could-impact-air,2023-09-29 18:54:58,"The travel industry has experienced a surge since coming out of the COVID-19 pandemic, fostering optimism for airline stocks. But now a potential government shutdown could temper some of this optimism, with air travel and its patrons poised to experience the repercussions firsthand.",LUV,0.127456,-0.203108,Somewhat-Bearish
United Airlines pilots ratified a new contract that their union says is worth more than $10 billion,https://apnews.com/article/united-airlines-pilots-ratify-contract-afab5d9875b2b207b84fdd4b1eabe6c6,2023-09-29 16:29:00,CHICAGO ( AP ) - Pilots for United Airlines have ratified a new four-year contract that their union says is worth more than $10 billion. The union previously said the deal would raise pay by up to 40% over four years.,LUV,0.214937,0.011624,Neutral
"New to The Street Leadership Program Interviews Two Inspirational Leaders, Jon Gordon and Tom Mendoza",https://www.benzinga.com/pressreleases/23/09/g35002339/new-to-the-street-leadership-program-interviews-two-inspirational-leaders-jon-gordon-and-tom-mendo,2023-09-29 13:30:00,"NEW YORK, Sept. 29, 2023 ( GLOBE NEWSWIRE ) -- FMW Media Works' ""New to The Street Leadership"" show, powered by Sector SPDR ETFs, airs on Bloomberg TV as sponsored programming on Saturday, September 30, 2023, at 6:30 PM ET.",LUV,0.020903,0.1642,Somewhat-Bullish
"21 Great Ways To Use $1,000",https://www.kiplinger.com/personal-finance/great-ways-to-use-1000-dollars,2023-10-17 11:25:54,21 Great Ways To Use $1000 Kiplinger's Personal Finance ...,LUV,0.009806,0.066336,Neutral
Fuel Costs Likely to Hurt American Airlines'  ( AAL )  Q3 Earnings,https://www.zacks.com/stock/news/2166933/fuel-costs-likely-to-hurt-american-airlines-aal-q3-earnings,2023-10-17 10:38:00,American Airlines (AAL) expects third-quarter 2023 fuel cost per gallon (including taxes) in the $2.90-$3.00 band.,LUV,0.381755,-0.02098,Neutral
"5 things to know for Oct. 16: Israel, hate crimes, House speaker, earthquake, bedbugs",https://edition.cnn.com/2023/10/16/us/5-things-to-know-for-oct-16-israel-hate-crimes-house-speaker-earthquake-bedbugs/index.html,2023-10-16 10:43:00,"India, the world's largest democracy and most populous country, does not recognize same-sex marriage, effectively barring millions of LGBTQ couples from certain legal benefits and insurance.",LUV,0.036037,0.227708,Somewhat-Bullish
"5 things to know for Oct. 16: Israel, hate crimes, House speaker, earthquake, bedbugs",https://www.cnn.com/2023/10/16/us/5-things-to-know-for-oct-16-israel-hate-crimes-house-speaker-earthquake-bedbugs/index.html,2023-10-16 10:43:00,"India, the world's largest democracy and most populous country, does not recognize same-sex marriage, effectively barring millions of LGBTQ couples from certain legal benefits and insurance.",LUV,0.036037,0.227708,Somewhat-Bullish
These are the 10 best mega airports in the U.S.-LAX didn't make the cut,https://www.cnbc.com/2023/10/15/best-mega-airports-us-jd-power-2023-study.html,2023-10-15 13:15:01,J.D. Power's 2023 North America Airport Satisfaction Study measured overall traveler satisfaction by examining six factors in order of importance.,LUV,0.08687,0.0,Neutral
She grew up idolizing her flight attendant grandmother. Now they fly together,https://edition.cnn.com/travel/article/southwest-flight-attendants-grandmother-granddaughter/index.html,2023-10-15 07:00:00,Grandmother and granddaughter flight attendant duo hit the skies CNN International ...,LUV,0.053153,0.025,Neutral
She grew up idolizing her flight attendant grandmother. Now they fly together,https://www.cnn.com/travel/article/southwest-flight-attendants-grandmother-granddaughter/index.html,2023-10-15 07:00:00,Grandmother and granddaughter flight attendant duo hit the skies ...,LUV,0.053153,0.025,Neutral
'Unusual odor' in cabin midflight sends Southwest plane back to Las Vegas for emergency landing,https://www.foxbusiness.com/industrials/unusual-odor-cabin-midflight-sends-southwest-plane-back-las-vegas-emergency-landing,2023-10-15 01:48:27,"A Southwest Airlines flight made an emergency landing Thursday night after crew members reported an ""unusual odor"" and possibly smoke in the cabin, an FAA spokesperson said.",LUV,0.373378,-0.225503,Somewhat-Bearish
SOUTHWEST AIRLINES ANNOUNCES FLIGHT PATH PLANS FOR 2024 TOTAL ECLIPSE,https://www.prnewswire.com/news-releases/southwest-airlines-announces-flight-path-plans-for-2024-total-eclipse-301956709.html,2023-10-14 14:00:00,"DALLAS, Oct. 14, 2023 /PRNewswire/ -- Southwest Airlines Co. ( NYSE: LUV ) celebrates today's annular solar eclipse with a countdown to the next total solar eclipse on April 8, 2024, by announcing flights scheduled to operate in the direct and partial paths of the celestial event.",LUV,0.378285,0.479615,Bullish
"Global Low Cost Airlines Market Soars to $189.1 Billion in 2022, Awaits 8.7% CAGR to Reach $315.4 Billion by 2028",https://www.prnewswire.com/news-releases/global-low-cost-airlines-market-soars-to-189-1-billion-in-2022--awaits-8-7-cagr-to-reach-315-4-billion-by-2028--301956277.html,2023-10-13 23:00:00,"DUBLIN, Oct. 13, 2023 /PRNewswire/ -- The ""Low Cost Airlines Market: Global Industry Trends, Share, Size, Growth, Opportunity and Forecast 2023-2028"" report has been added to ResearchAndMarkets.com's offering.",LUV,0.065327,0.016111,Neutral
Southwest Airlines  ( LUV )  Stock Moves -0.31%: What You Should Know,https://www.zacks.com/stock/news/2165917/southwest-airlines-luv-stock-moves--031-what-you-should-know,2023-10-13 22:00:20,"In the most recent trading session, Southwest Airlines (LUV) closed at $25.37, indicating a -0.31% shift from the previous trading day.",LUV,0.521961,0.142546,Neutral
Southwest Airlines Unusual Options Activity - Southwest Airlines  ( NYSE:LUV ) ,https://www.benzinga.com/markets/options/23/10/35249082/southwest-airlines-unusual-options-activity,2023-10-13 20:46:41,"Someone with a lot of money to spend has taken a bullish stance on Southwest Airlines LUV. We noticed this today when the big position showed up on publicly available options history that we track here at Benzinga. Whether this is an institution or just a wealthy individual, we don't know.",LUV,0.708701,0.347106,Somewhat-Bullish
MATERIAL SPECIALISTS AT SOUTHWEST AIRLINES RATIFY TEAMSTER CONTRACT,https://www.prnewswire.com/news-releases/material-specialists-at-southwest-airlines-ratify-teamster-contract-301956605.html,2023-10-13 20:35:00,"Collective Bargaining Agreement Fifth to be Ratified by Aviation Teamsters This Year WASHINGTON, Oct. 13, 2023 /PRNewswire/ -- Material Specialists at Southwest Airlines have ratified their most recent collective bargaining agreement with the Teamsters.",LUV,0.468029,0.58301,Bullish
MATERIAL SPECIALISTS AT SOUTHWEST AIRLINES RATIFY TEAMSTER CONTRACT,https://www.benzinga.com/pressreleases/23/10/n35248911/material-specialists-at-southwest-airlines-ratify-teamster-contract,2023-10-13 20:35:00,"WASHINGTON, Oct. 13, 2023 /PRNewswire/ -- Material Specialists at Southwest Airlines have ratified their most recent collective bargaining agreement with the Teamsters. The agreement covers more than 500 workers who provide supplies and other support services to the fleet maintenance team.",LUV,0.463792,0.574267,Bullish
SOUTHWEST AIRLINES SCORES BIG WITH THE DENVER NUGGETS AND COLORADO AVALANCHE JOINING THE AIRLINE'S ROSTER - Southwest Airlines  ( NYSE:LUV ) ,https://www.benzinga.com/pressreleases/23/10/n35242323/southwest-airlines-scores-big-with-the-denver-nuggets-and-colorado-avalanche-joining-the-airlines-,2023-10-13 14:40:00,Airline celebrates new partnerships at an Employee event in the Heart of Downtown Denver as Southwest becomes The Official Airline for the Nuggets and Avalanche,LUV,0.343279,0.444925,Bullish
"From Detroit Three to healthcare, US labor unions flex muscle",https://www.reuters.com/markets/us/detroit-three-healthcare-us-labor-unions-flex-muscle-2023-10-13/,2023-10-13 11:45:00,"Teamster member Sergio Martinez yells out during a rally outside a UPS facility in downtown in Los Angeles, California, U.S. July 19, 2023. REUTERS/Mike Blake Acquire Licensing Rights",LUV,0.041538,-0.12013,Neutral
Cleantech Podcast - Dow Inc.  ( NYSE: DOW )  Ranked 4th in Top 100 Water Polluters,https://www.investorideas.com/news/2023/cleantech-podcasts/10111Dow-Water-Polluter.asp,2023-10-11 16:10:28,Cleantech Podcast - Dow Inc. ( NYSE: DOW ) Ranked 4th in Top 100 ... ...,LUV,0.085476,0.0,Neutral
"Airline Stock Roundup: GOL, CPA & Azul's Impressive Traffic Reports, LUV's Labor Deal",https://www.zacks.com/stock/news/2164381/airline-stock-roundup-gol-cpa-azuls-impressive-traffic-reports-luvs-labor-deal,2023-10-11 14:58:00,Southwest Airlines (LUV) receives encouraging tidings on the labor front. Revenue passenger miles increase 14.1% year over year in September at Copa Holdings (CPA).,LUV,0.218817,-0.006979,Neutral
"From Detroit Three to healthcare, US labor unions flex muscle",https://www.reuters.com/markets/us/detroit-three-healthcare-us-labor-unions-flex-muscle-2023-10-10/,2023-10-10 10:52:00,"Teamster member Sergio Martinez yells out during a rally outside a UPS facility in downtown in Los Angeles, California, U.S. July 19, 2023. REUTERS/Mike Blake Acquire Licensing Rights",LUV,0.041901,-0.120247,Neutral
Your complete guide to the Chase Ultimate Rewards travel portal,https://www.cnn.com/cnn-underscored/travel/chase-ultimate-rewards-travel-portal-guide,2023-10-09 20:11:32,How to book travel and save money with the Chase Ultimate Rewards travel portal CNN Underscored ...,LUV,0.019193,0.0,Neutral
Southwest Airlines  ( LUV )  & IBT Approve New Collective Deal,https://www.zacks.com/stock/news/2162875/southwest-airlines-luv-ibt-approve-new-collective-deal,2023-10-09 15:51:00,The deal covers more than 480 Southwest Airlines (LUV) employees and becomes amendable in April 2026.,LUV,0.488007,0.517909,Bullish
"Fly Play hf.: 85% Load Factor, 164,000 passengers & PLAY Cabin Crew wins USA Today Readers Choice Award",https://www.globenewswire.com/news-release/2023/10/09/2756499/0/en/Fly-Play-hf-85-Load-Factor-164-000-passengers-PLAY-Cabin-Crew-wins-USA-Today-Readers-Choice-Award.html,2023-10-09 09:00:00,"85% Load Factor, 164,000 passengers & PLAY Cabin Crew wins USA Today Readers Choice Award PLAY carried 163,784 passengers in September, which is a 77% increase from September 2022 when PLAY carried 92,181 passengers. The load factor in September 2023 was 85%, compared to 81.5% load factor in ...",LUV,0.07423,0.31533,Somewhat-Bullish
"JPMorgan earnings, inflation data and UAW strike top week ahead",https://www.foxbusiness.com/markets/jpmorgan-earnings-inflation-data-uaw-strike-week-ahead,2023-10-08 15:00:16,Investors will gear up for the start of earnings season with the big banks kicking off results and the United Auto Workers strike against Detroit's Big Three entering its fourth week. Stocks rose Friday and for the week after a stronger-than-expected September jobs report.,LUV,0.072435,-0.043832,Neutral
Start a wave of generosity Nov. 1 by giving early for Colorado Gives Day - PR Newswire,https://www.prnewswire.com/news-releases/start-a-wave-of-generosity-nov-1-by-giving-early-for-colorado-gives-day-301970478.html,2023-10-27 19:12:00,Start a wave of generosity Nov. 1 by giving early for Colorado Gives Day PR ...,LUV,0.040622,0.025311,Neutral
SOUTHWEST AIRLINES AWARDED A TOP SCORE ON THE 2023 DISABILITY EQUALITY INDEX,https://www.prnewswire.com/news-releases/southwest-airlines-awarded-a-top-score-on-the-2023-disability-equality-index-301970387.html,2023-10-27 17:31:00,"Carrier recognized by the Disability Equality Index for the fourth consecutive year DALLAS, Oct. 27, 2023 /PRNewswire/ -- Southwest Airlines Co. ( NYSE: LUV ) is proud to score a 100 on The Disability Equality Index ( DEI ) for the fourth consecutive year.",LUV,0.443626,0.580406,Bullish
"Airline Stock Roundup: Q3 Earnings Reports of LUV, ALK, SAVE & Others",https://www.zacks.com/stock/news/2173818/airline-stock-roundup-q3-earnings-reports-of-luv-alk-save-others,2023-10-27 14:22:00,Hawaiian Holdings' (HA) third-quarter 2023 loss widens due to downbeat revenues. Southwest Airlines (LUV) reports in-line earnings in the third quarter.,LUV,0.210731,0.137577,Neutral
Analysis: America's economy is booming but tougher times lie ahead | Business,https://www.cnn.com/premarket-stocks-economy/index.html,2023-10-27 11:41:00,America's economy is booming but tougher times lie ahead ...,LUV,0.033846,-0.361842,Bearish
"Southwest Credit Cards Launch $1,125 Bonus Offer",https://www.kiplinger.com/personal-finance/credit-cards/southwest-credit-cards-bonus-offer,2023-10-27 10:00:00,Southwest Credit Cards Launch $1125 Bonus Offer Kiplinger's Personal Finance ...,LUV,0.04912,0.182767,Somewhat-Bullish
Southwest Airlines  ( LUV )  Q3 2023 Earnings Call Transcript,https://www.fool.com/earnings/call-transcripts/2023/10/26/southwest-airlines-luv-q3-2023-earnings-call-trans/,2023-10-26 22:30:21,"LUV earnings call for the period ending September 30, 2023.",LUV,0.041682,0.172767,Somewhat-Bullish
"A new Southwest card bonus can get you halfway to Companion Pass status, which lets you fly a friend for free",https://www.businessinsider.com/personal-finance/southwest-rapid-rewards-personal-credit-cards-limited-time-offer-2023-10,2023-10-26 18:44:00,"Southwest Priority, Premier and Plus Cards Now Offer Generous Bonuses - Business Insider ...",LUV,0.039745,0.139249,Neutral
Texas' abortion travel bans face a constitutional challenge,https://theweek.com/politics/texas-abortion-travel-bans-face-a-constitutional-challenge,2023-10-26 18:17:54,Abortion travel banned in Texas The Week ...,LUV,0.033656,0.098115,Neutral
"Study in Contrasts: Robust Economic Data, Including GDP, Can't Stop Slide on Wall Street - General Motors  ( NYSE:GM ) , Amazon.com  ( NASDAQ:AMZN ) ",https://www.benzinga.com/markets/23/10/35447849/study-in-contrasts-robust-economic-data-including-gdp-cant-stop-slide-on-wall-street,2023-10-26 18:07:55,"( Thursday market open ) Economic vigor contrasts early Thursday with a retreating stock market. The first government estimate for third-quarter Gross Domestic Product ( GDP ) outpaced most estimates and orders for durable goods remained robust, but Wall Street lost more ground in premarket ...",LUV,0.041755,0.061738,Neutral
Southwest Airlines orders 108 additional Boeing 737 MAX jets,https://markets.businessinsider.com/news/stocks/southwest-airlines-orders-108-additional-boeing-737-max-jets-1032745259,2023-10-26 18:00:00,"SEATTLE, Oct. 26, 2023 /PRNewswire/ -- Boeing [NYSE: BA] and Southwest Airlines announced today the carrier is increasing its commitment to the fuel-efficient 737 MAX family with an order for 108 737-7s. The new deal supports Southwest's modernization strategy and provides flexibility to expand ...",LUV,0.219809,0.209103,Somewhat-Bullish
"Southwest Airlines  ( LUV )  Q3 Earnings in Line, Revenues Miss",https://www.zacks.com/stock/news/2173102/southwest-airlines-luv-q3-earnings-in-line-revenues-miss,2023-10-26 17:29:00,Southwest Airlines' (LUV) third-quarter 2023 revenues benefit from solid leisure demand.,LUV,0.542075,0.296986,Somewhat-Bullish
Southwest Airlines  ( LUV )  Meets Q3 Earnings Estimates,https://www.zacks.com/stock/news/2172431/southwest-airlines-luv-meets-q3-earnings-estimates,2023-10-26 12:05:16,"Southwest (LUV) delivered earnings and revenue surprises of 0% and 0.69%, respectively, for the quarter ended September 2023. Do the numbers hold clues to what lies ahead for the stock?",LUV,0.141726,0.127775,Neutral
