title,url,time_published,summary,ticker,relevance_score,ticker_sentiment_score,ticker_sentiment_label
MAIA Biotechnology Touts Positive Data From Healthy Volunteer Study Of Potential Lung Cancer Candidate - MAIA Biotechnology  ( AMEX:MAIA ) ,https://www.benzinga.com/general/biotech/23/04/31749899/maia-biotechnology-touts-positive-data-from-healthy-volunteer-study-of-potential-lung-cancer-cand,2023-04-11 16:43:56,MAIA Biotechnology Inc MAIA released topline data from the completed Part A safety lead-in of its THIO-101 Phase 2 go-to-market trial in advanced Non-Small Cell Lung Cancer ( NSCLC ) and has commenced recruitment in Part B randomized efficacy/dose selection.,REGN,0.345674,0.0,Neutral
"Sports Medicine Devices Market to Witness 5.6% CAGR during 2021 - 2028, Reaching USD 13.85 Bn: TMR Study",https://www.benzinga.com/pressreleases/23/04/g32092403/sports-medicine-devices-market-to-witness-5-6-cagr-during-2021-2028-reaching-usd-13-85-bn-tmr-stud,2023-04-28 19:30:00,"Wilmington, Delaware, United States, April 29, 2023 ( GLOBE NEWSWIRE ) -- Increase in preference for minimally invasive surgeries and surge in adoption of arthroscopic surgery for the treatment of common sports injuries are propelling market growth.",REGN,0.038592,0.071758,Neutral
"Stock Charts Strategy May 1-5: Fed Policy, April Payrolls, Apple Earnings",https://www.investors.com/all-categories/stock-charts-action-plan-may-1-5-fed-policy-april-payrolls-apple-earnings/,2023-04-28 17:12:00,"Stock Charts Strategy May 1-5: Fed Policy, April Payrolls, Apple ... Investor's Business Daily ...",REGN,0.047371,0.066605,Neutral
Government Drug Price Curbs Could Sound A Death Knell For Industry,https://www.investors.com/news/technology/biotech-stocks-brace-for-the-worst-as-government-drug-price-negotiations-loom/,2023-04-28 12:00:00,Biotech Stocks Brace For The Worst As Government Drug Price ... Investor's Business Daily ...,REGN,0.027118,0.0,Neutral
AMGEN REPORTS FIRST QUARTER FINANCIAL RESULTS,https://investingnews.com/amgen-reports-first-quarter-financial-results/,2023-04-27 20:43:13,Amgen ( NASDAQ:AMGN ) today announced financial results for the first quarter of 2023.,REGN,0.015675,0.0,Neutral
AMGEN REPORTS FIRST QUARTER FINANCIAL RESULTS,https://investingnews.com/amgen-reports-first-quarter-financial-results-2659922399/,2023-04-27 20:43:13,Amgen ( NASDAQ:AMGN ) today announced financial results for the first quarter of 2023.,REGN,0.015675,0.0,Neutral
AMGEN REPORTS FIRST QUARTER FINANCIAL RESULTS,https://www.prnewswire.com/news-releases/amgen-reports-first-quarter-financial-results-301810090.html,2023-04-27 20:01:00,"THOUSAND OAKS, Calif., April 27, 2023 /PRNewswire/ -- Amgen ( NASDAQ:AMGN ) today announced financial results for the first quarter of 2023.",REGN,0.006681,0.0,Neutral
REGN: A Prescription for Success: Check Out This Strong Pharmaceutical Stock This Week,https://stocknews.com/news/regn-biib-gild-vnda-a-prescription-for-success-check-out-this-strong-pharmaceutical-stock/,2023-04-27 15:54:46,REGN: A Prescription for Success: Check Out This Strong ... ...,REGN,0.552443,0.362894,Bullish
"Alnylam - Regeneron Partnered Alzheimer's Candidate's Initial Data Sounds Promising, Analyst Says - Alnylam Pharmaceuticals  ( NASDAQ:ALNY ) , Regeneron Pharmaceuticals  ( NASDAQ:REGN ) ",https://www.benzinga.com/general/biotech/23/04/32048648/alnylam-regeneron-partnered-alzheimers-candidates-initial-data-sounds-promising-analyst-says,2023-04-27 15:52:05,Alnylam Pharmaceuticals Inc ALNY and its partner Regeneron Pharmaceuticals Inc REGN announced preliminary data from their Phase I study of their experimental drug dubbed ALN-APP.,REGN,0.38489,0.248511,Somewhat-Bullish
EXCLUSIVE: SAB Biotherapeutics Releases Topline Data From Discontinued COVID Antibody Trial - SAB Biotherapeutics  ( NASDAQ:SABS ) ,https://www.benzinga.com/general/biotech/23/04/32004894/exclusive-sab-biotherapeutics-releases-topline-data-from-discontinued-covid-antibody-trial,2023-04-26 12:00:13,SAB Biotherapeutics Inc SABS has revealed topline results from the Phase 3 National Institutes of Health's ( NIH ) ACTIV-2 trial that assessed SAB-185 in non-hospitalized COVID-19 patients at high risk for severe outcomes.,REGN,0.211191,0.045143,Neutral
Regeneron Pharmaceuticals Unusual Options Activity For April 25 - Regeneron Pharmaceuticals  ( NASDAQ:REGN ) ,https://www.benzinga.com/markets/options/23/04/31992883/regeneron-pharmaceuticals-unusual-options-activity-for-april-25,2023-04-25 15:45:51,A whale with a lot of money to spend has taken a noticeably bearish stance on Regeneron Pharmaceuticals. Looking at options history for Regeneron Pharmaceuticals REGN we detected 11 strange trades.,REGN,0.71032,0.057325,Neutral
"4 Pharma, Biotech Stocks Poised to Beat Q1 Earnings Estimates",https://www.zacks.com/stock/news/2083259/4-pharma-biotech-stocks-poised-to-beat-q1-earnings-estimates,2023-04-24 12:38:00,"We look at a few pharma/biotech companies, SNY, AMGN, REGN, ACAD, which are poised to beat on earnings in the first quarter.",REGN,0.306963,0.190761,Somewhat-Bullish
"Regeneron Pharmaceuticals  ( NASDAQ:REGN )  Upgraded to ""Strong-Buy"" by StockNews.com",https://www.defenseworld.net/2023/05/09/regeneron-pharmaceuticals-nasdaqregn-upgraded-to-strong-buy-by-stocknews-com.html,2023-05-09 09:30:55,"Regeneron Pharmaceuticals ( NASDAQ:REGN ) Upgraded to ""Strong ... Defense World ...",REGN,0.763362,0.444403,Bullish
Looking At Regeneron Pharmaceuticals's Recent Unusual Options Activity - Regeneron Pharmaceuticals  ( NASDAQ:REGN ) ,https://www.benzinga.com/markets/options/23/05/32274966/looking-at-regeneron-pharmaceuticalss-recent-unusual-options-activity,2023-05-08 20:46:16,"Someone with a lot of money to spend has taken a bullish stance on Regeneron Pharmaceuticals REGN. We noticed this today when the big position showed up on publicly available options history that we track here at Benzinga. Whether this is an institution or just a wealthy individual, we don't ...",REGN,0.846873,0.303176,Somewhat-Bullish
"If You Invested $100 In This Stock 10 Years Ago, You Would Have $300 Today - Regeneron Pharmaceuticals  ( NASDAQ:REGN ) ",https://www.benzinga.com/news/earnings/23/05/32240272/if-you-invested-100-in-this-stock-10-years-ago-you-would-have-300-today,2023-05-05 14:30:22,"Regeneron Pharmaceuticals REGN has outperformed the market over the past 10 years by 1.49% on an annualized basis producing an average annual return of 11.18%. Currently, Regeneron Pharmaceuticals has a market capitalization of $82.95 billion.",REGN,0.980595,0.386944,Bullish
"Intellia  ( NTLA )  Beats on Q1 Earnings, Gives Pipeline Update",https://www.zacks.com/stock/news/2090934/intellia-ntla-beats-on-q1-earnings-gives-pipeline-update,2023-05-05 13:15:00,Intellia's (NTLA) first-quarter earnings beat estimates. The company provides updates on its gene-editing pipeline.,REGN,0.261818,0.272985,Somewhat-Bullish
Ultragenyx  ( RARE )  Q1 Earnings and Revenues Miss Estimates,https://www.zacks.com/stock/news/2090844/ultragenyx-rare-q1-earnings-and-revenues-miss-estimates,2023-05-05 12:27:00,Ultragenyx Pharmaceutical's (RARE) first-quarter 2023 earnings and revenues miss estimates. The company maintains its 2023 guidance.,REGN,0.09239,0.137782,Neutral
Stock Market Off Heading Back To Day's Lows. Medical Diagnostics Stock Jumps 15% After Earnings.,https://www.investors.com/market-trend/stock-market-today/stock-market-off-lows-prostate-cancer-stock-jumps/,2023-05-04 19:27:00,Stock Market Off Lows Ahead Of Apple And Jobs. Prostate Cancer ... Investor's Business Daily ...,REGN,0.08197,-0.039639,Neutral
Why Regeneron Pharmaceuticals  ( REGN )  Shares Are Trading Lower Today? - Regeneron Pharmaceuticals  ( NASDAQ:REGN ) ,https://www.benzinga.com/general/biotech/23/05/32216673/why-regeneron-pharmaceuticals-shares-are-trading-lower-today,2023-05-04 17:50:24,"Regeneron Pharmaceuticals Inc REGN earned adjusted EPS of $10.09, down 12% Y/Y, beating the $9.60 Street estimate. Revenues decreased 6% Y/Y to $3.16 billion, down from $3.41 billion in Q4 FY22, beating the consensus of $3.00 billion.",REGN,0.479683,-0.078038,Neutral
Why Regeneron Pharmaceuticals Stock Is Tanking Today,https://www.fool.com/investing/2023/05/04/why-regeneron-pharmaceuticals-stock-is-tanking-tod/,2023-05-04 17:23:55,Investors are worried about Eylea's falling sales.,REGN,0.28387,-0.145033,Neutral
"Regeneron  ( REGN )  Q1 Earnings & Sales Top, Eylea Sales Decline",https://www.zacks.com/stock/news/2090283/regeneron-regn-q1-earnings-sales-top-eylea-sales-decline,2023-05-04 16:03:00,"Regeneron (REGN) beats earnings and sales estimates in first-quarter 2023 fueled by Dupixent. However, sales of the lead drug Eylea declined yet again.",REGN,0.187463,0.191405,Somewhat-Bullish
Regeneron Dives As Competition Undercuts Its Biggest Moneymaker,https://www.investors.com/news/technology/regn-stock-regeneron-earnings-q1-2023/,2023-05-04 12:50:00,REGN Stock Dives As Competition Hammers Away At Eylea Investor's Business Daily ...,REGN,0.779232,0.091344,Neutral
Intellia Therapeutics Announces First Quarter 2023 Financial Results and Highlights Recent Company Progress,https://www.globenewswire.com/news-release/2023/05/04/2661383/0/en/Intellia-Therapeutics-Announces-First-Quarter-2023-Financial-Results-and-Highlights-Recent-Company-Progress.html,2023-05-04 11:30:00,"CAMBRIDGE, Mass., May 04, 2023 ( GLOBE NEWSWIRE ) -- Intellia Therapeutics, Inc. ( NASDAQ:NTLA ) , a leading clinical-stage genome editing company focused on developing potentially curative therapies leveraging CRISPR-based technologies, today reported operational highlights and financial ...",REGN,0.044496,0.070367,Neutral
Regeneron beats quarterly profit estimates,https://www.reuters.com/business/healthcare-pharmaceuticals/regeneron-beats-quarterly-profit-estimates-eylea-strength-2023-05-04/,2023-05-04 10:39:00,"May 4 ( Reuters ) - Regeneron Pharmaceuticals Inc ( REGN.O ) beat Wall Street estimates for first-quarter profit on Thursday, driven by strong demand for eczema treatment Dupixent. Excluding items, the company reported a profit of $10.09 per share for the quarter, above analysts' estimates of ...",REGN,0.495015,0.51181,Bullish
Regeneron Pharmaceuticals Unusual Options Activity - Regeneron Pharmaceuticals  ( NASDAQ:REGN ) ,https://www.benzinga.com/markets/options/23/05/32196053/regeneron-pharmaceuticals-unusual-options-activity,2023-05-03 19:16:27,"Someone with a lot of money to spend has taken a bullish stance on Regeneron Pharmaceuticals REGN. We noticed this today when the big position showed up on publicly available options history that we track here at Benzinga. Whether this is an institution or just a wealthy individual, we don't ...",REGN,0.753462,0.375938,Bullish
"Drug, Biotech Stocks' Q1 Earnings on May 4: REGN, ZTS & More",https://www.zacks.com/stock/news/2089198/drug-biotech-stocks-q1-earnings-on-may-4-regn-zts-more,2023-05-03 15:46:00,"Let us look at four big drug and biotech companies, REGN, ZTS, MRNA and NVO, which are gearing up for their earnings release.",REGN,0.18967,0.0,Neutral
Why Earnings Season Could Be Great for Regeneron  ( REGN ) ,https://www.zacks.com/stock/news/2088882/why-earnings-season-could-be-great-for-regeneron-regn,2023-05-03 12:36:00,Regeneron (REGN) is seeing favorable earnings estimate revision activity and has a positive Zacks Earnings ESP heading into earnings season.,REGN,0.812724,0.693705,Bullish
Cerevel Therapeutics Appoints Ron Renaud as President and Chief Executive Officer and Reports First Quarter 2023 Financial Results,https://www.globenewswire.com/news-release/2023/05/03/2660120/0/en/Cerevel-Therapeutics-Appoints-Ron-Renaud-as-President-and-Chief-Executive-Officer-and-Reports-First-Quarter-2023-Financial-Results.html,2023-05-03 10:30:00,"Ron Renaud to succeed Tony Coles, M.D. as CEO, effective June 12, 2023. Dr. Coles will continue as chairperson of the board ...",REGN,0.014541,0.053412,Neutral
Should You Invest in the Invesco Dynamic Biotechnology & Genome ETF  ( PBE ) ?,https://www.zacks.com/stock/news/2088704/should-you-invest-in-the-invesco-dynamic-biotechnology-genome-etf-pbe,2023-05-03 10:20:07,Sector ETF report for ...,REGN,0.130571,0.07042,Neutral
Kiniksa Pharmaceuticals Reports First Quarter 2023 Financial Results and Recent Portfolio Execution,https://www.globenewswire.com/news-release/2023/05/02/2659011/0/en/Kiniksa-Pharmaceuticals-Reports-First-Quarter-2023-Financial-Results-and-Recent-Portfolio-Execution.html,2023-05-02 11:30:00,"- ARCALYST® ( rilonacept ) Q1 2023 net product revenue of $42.7 million -- ARCALYST full-year 2023 net product revenue guidance increased to $200 - $215 million, representing ~69% year-over-year growth at the midpoint -- Final cohort of KPL-404 Phase 2 rheumatoid arthritis trial now enrolling ...",REGN,0.020615,-0.169486,Somewhat-Bearish
Regeneron to Highlight New and Updated Clinical Data at ASCO Showcasing Breadth of Cancer Research - Regeneron Pharmaceuticals  ( NASDAQ:REGN ) ,https://www.benzinga.com/pressreleases/23/05/g32152354/regeneron-to-highlight-new-and-updated-clinical-data-at-asco-showcasing-breadth-of-cancer-research,2023-05-02 11:00:45,Oral presentations include interim results from pivotal trial of linvoseltamab ( BCMAxCD3 ) in relapsed/refractory multiple myeloma and three cohorts of fianlimab ( LAG-3 inhibitor ) combined with Libtayo® ( cemiplimab-rwlc ) in advanced melanoma,REGN,0.055837,-0.098997,Neutral
Regeneron to Highlight New and Updated Clinical Data at ASCO Showcasing Breadth of Cancer Research,https://www.globenewswire.com/news-release/2023/05/02/2658982/0/en/Regeneron-to-Highlight-New-and-Updated-Clinical-Data-at-ASCO-Showcasing-Breadth-of-Cancer-Research.html,2023-05-02 11:00:00,Oral presentations include interim results from pivotal trial of linvoseltamab ( BCMAxCD3 ) in relapsed/refractory multiple myeloma and three cohorts of fianlimab ( LAG-3 inhibitor ) combined with Libtayo® ( cemiplimab-rwlc ) in advanced melanoma ...,REGN,0.049706,0.029966,Neutral
Is a Beat on the Cards for Regeneron's  ( REGN )  Q1 Earnings?,https://www.zacks.com/stock/news/2087388/is-a-beat-on-the-cards-for-regenerons-regn-q1-earnings,2023-05-01 12:02:00,Regeneron's (REGN) first-quarter earnings are likely to have gotten a boost from the solid performance of Dupixent.,REGN,0.238913,0.228333,Somewhat-Bullish
"Autoimmune Drugs Market size to grow by USD 29,314.5 million between 2022 and 2027; AbbVie Inc., and AdvaCare Pharma among others, identified as key vendors - Technavio",https://www.prnewswire.com/news-releases/autoimmune-drugs-market-size-to-grow-by-usd-29-314-5-million-between-2022-and-2027-abbvie-inc-and-advacare-pharma-among-others-identified-as-key-vendors--technavio-301828870.html,2023-05-19 23:15:00,"Autoimmune Drugs Market size to grow by USD 29,314.5 million ... PR ...",REGN,0.075161,0.137715,Neutral
Regeneron  ( REGN )  Faces Challenges as Eylea Sales Decline,https://www.zacks.com/stock/news/2097627/regeneron-regn-faces-challenges-as-eylea-sales-decline,2023-05-19 17:42:00,"Regeneron (REGN) loses some of its gains as sales of its lead drug, Eylea, decline. Nevertheless, Dupixent sales boost the top line.",REGN,0.142144,-0.306968,Somewhat-Bearish
This Is What Whales Are Betting On Regeneron Pharmaceuticals - Regeneron Pharmaceuticals  ( NASDAQ:REGN ) ,https://www.benzinga.com/markets/options/23/05/32486814/this-is-what-whales-are-betting-on-regeneron-pharmaceuticals,2023-05-19 14:46:17,"Someone with a lot of money to spend has taken a bullish stance on Regeneron Pharmaceuticals REGN. We noticed this today when the big position showed up on publicly available options history that we track here at Benzinga. Whether this is an institution or just a wealthy individual, we don't ...",REGN,0.766141,0.344161,Somewhat-Bullish
Is First Trust NYSE Arca Biotechnology ETF  ( FBT )  a Strong ETF Right Now?,https://www.zacks.com/stock/news/2097186/is-first-trust-nyse-arca-biotechnology-etf-fbt-a-strong-etf-right-now,2023-05-19 10:20:08,Smart Beta ETF report for ...,REGN,0.116348,0.06132,Neutral
Alvotech Reports Financial Results for First three Months of 2023 and Provides Business Update,https://www.globenewswire.com/news-release/2023/05/19/2672401/0/en/Alvotech-Reports-Financial-Results-for-First-three-Months-of-2023-and-Provides-Business-Update.html,2023-05-19 09:00:00,"• Revenue for the first three months of 2023 increased to $15.9 million, compared to $0.8 million for the same period in 2022 • Confirmatory patient study for AVT05, a proposed biosimilar for Simponi® and Simponi Aria® ( golimumab ) initiated, marking the fifth internally developed portfolio ...",REGN,0.012545,0.0,Neutral
Alvotech Reports Financial Results for First three Months of 2023 and Provides Business Update,https://www.globenewswire.com/news-release/2023/05/19/2672402/0/en/Alvotech-Reports-Financial-Results-for-First-three-Months-of-2023-and-Provides-Business-Update.html,2023-05-19 09:00:00,"REYKJAVIK, Iceland, May 19, 2023 ( GLOBE NEWSWIRE ) -- Alvotech ( NASDAQ: ALVO, or the ""Company"" ) , a global biotech company specializing in the development and manufacture of biosimilar medicines for patients worldwide, today reported unaudited financial results for the first three months of ...",REGN,0.012512,0.0,Neutral
Regeneron Applauds Supreme Court's Unanimous Opinion Striking Down Amgen's PCSK9 Patent Claims and Supporting Scientific Innovation,https://www.globenewswire.com/news-release/2023/05/18/2672107/0/en/Regeneron-Applauds-Supreme-Court-s-Unanimous-Opinion-Striking-Down-Amgen-s-PCSK9-Patent-Claims-and-Supporting-Scientific-Innovation.html,2023-05-18 15:45:00,Decision ends nearly decade-long patent dispute related to ...,REGN,0.116631,0.056512,Neutral
Regeneron Applauds Supreme Court's Unanimous Opinion Striking Down Amgen's PCSK9 Patent Claims and Supporting Scientific Innovation - Regeneron Pharmaceuticals  ( NASDAQ:REGN ) ,https://www.benzinga.com/pressreleases/23/05/g32470164/regeneron-applauds-supreme-courts-unanimous-opinion-striking-down-amgens-pcsk9-patent-claims-and-s,2023-05-18 15:45:00,"Decision ends nearly decade-long patent dispute related to Regeneron-invented Praluent® ( alirocumab ) TARRYTOWN, N.Y., May 18, 2023 ( GLOBE NEWSWIRE ) -- Regeneron Pharmaceuticals, Inc.",REGN,0.113731,0.053555,Neutral
"Top CEOs Earned Less In 2022 Compared To 2021: Discover Their Earnings And The Highest-Paid Leaders - Apple  ( NASDAQ:AAPL ) , Amazon.com  ( NASDAQ:AMZN ) ",https://www.benzinga.com/news/23/05/32404282/top-ceos-earned-less-in-2022-compared-to-2021-discover-their-earnings-and-the-highest-paid-leaders,2023-05-15 20:57:22,"The issue of executive compensation remains a highly debated subject among shareholders of publicly traded corporations. This discussion is fueled by instances where job and cost reductions are implemented, while some executives continue to receive substantial rewards.",REGN,0.063594,0.297777,Somewhat-Bullish
How Is The Market Feeling About Regeneron Pharmaceuticals? - Regeneron Pharmaceuticals  ( NASDAQ:REGN ) ,https://www.benzinga.com/short-sellers/23/05/32400918/how-is-the-market-feeling-about-regeneron-pharmaceuticals,2023-05-15 17:15:45,"Regeneron Pharmaceuticals's REGN short percent of float has risen 11.97% since its last report. The company recently reported that it has 1.21 million shares sold short, which is 1.31% of all regular shares that are available for trading.",REGN,0.221819,0.155473,Somewhat-Bullish
Decibel Therapeutics Reports First Quarter 2023 Financial Results and Corporate Update,https://www.globenewswire.com/news-release/2023/05/15/2668677/0/en/Decibel-Therapeutics-Reports-First-Quarter-2023-Financial-Results-and-Corporate-Update.html,2023-05-15 11:45:00,"- Initiated CHORD™, a global Phase 1/2 dose escalation clinical trial of lead gene therapy product candidate, ...",REGN,0.045012,0.029736,Neutral
Should You Invest in the iShares Biotechnology ETF  ( IBB ) ?,https://www.zacks.com/stock/news/2095065/should-you-invest-in-the-ishares-biotechnology-etf-ibb,2023-05-15 10:20:09,Sector ETF report for ...,REGN,0.137671,0.072354,Neutral
"AI-Run ETF Dumps Apple In Favor Of This Chip Stock And Hints At New Opportunity Brewing In Market - Meta Platforms  ( NASDAQ:META ) , NVIDIA  ( NASDAQ:NVDA ) , Apple  ( NASDAQ:AAPL ) , TJX Companies  ( NYSE:TJX ) , Monster Beverage  ( NASDAQ:MNST ) , Vertex Pharmaceuticals  ( NASDAQ:VRTX ) , QRAFT AI-Enhanced U.S. Large Cap Momentum ETF  ( ARCA:AMOM ) , Starbucks  ( NASDAQ:SBUX ) , Lowe's Companies  ( NYSE:LOW ) , O'Reilly Automotive  ( NASDAQ:ORLY ) , AutoZone  ( NYSE:AZO ) , Eli Lilly  ( NYSE:LLY ) , Home Depot  ( NYSE:HD ) , Regeneron Pharmaceuticals  ( NASDAQ:REGN ) , Walmart  ( NYSE:WMT ) ",https://www.benzinga.com/analyst-ratings/analyst-color/23/05/32366764/ai-run-etf-dumps-apple-in-favor-of-this-chip-stock-and-hints-at-new-opportunity-bre,2023-05-12 15:11:24,"Apple, Inc. AAPL is often touted as an all-weather stock but one exchange-traded fund, powered by artificial intelligence, has deemed it fit to dump its entire Apple holdings and switched its allegiance to a chipmaker. What Happened: QRAFT AI-Enhanced U.S.",REGN,0.249106,0.194412,Somewhat-Bullish
"CAGR of 5.6%, Red Biotechnology Market Expected to Surpass USD 609.6 Billion by 2031 - Exclusive Study by TMR",https://www.benzinga.com/pressreleases/23/05/g32362861/cagr-of-5-6-red-biotechnology-market-expected-to-surpass-usd-609-6-billion-by-2031-exclusive-study,2023-05-12 12:30:00,"Wilmington, Delaware, United States, May 12, 2023 ( GLOBE NEWSWIRE ) -- The global red biotechnology market size stood at USD 357.2 Bn in 2021 and is anticipated to surpass value of USD 609.6 Bn by 2031. The global industry is anticipated to expand at a CAGR of 5.6% between 2022 and 2031.",REGN,0.044551,-0.157838,Somewhat-Bearish
Decibel Therapeutics Announces Approval of Clinical Trial Application by the Spanish Agency of Medicines and Medical Devices  ( AEMPS )  to Initiate Clinical Development of Lead Gene Therapy Candidate DB-OTO - Decibel Therapeutics  ( NASDAQ:DBTX ) ,https://www.benzinga.com/pressreleases/23/05/g32360731/decibel-therapeutics-announces-approval-of-clinical-trial-application-by-the-spanish-agency-of-med,2023-05-12 11:00:00,"BOSTON, May 12, 2023 ( GLOBE NEWSWIRE ) -- Decibel Therapeutics DBTX, a clinical-stage biotechnology company dedicated to discovering and developing transformative treatments to restore and improve hearing and balance, today announced approval of its Clinical Trial Application ( CTA ) by the ...",REGN,0.037681,0.107697,Neutral
Regeneron Pharmaceuticals Unusual Options Activity - Regeneron Pharmaceuticals  ( NASDAQ:REGN ) ,https://www.benzinga.com/markets/options/23/05/32632128/regeneron-pharmaceuticals-unusual-options-activity,2023-05-30 18:30:59,A whale with a lot of money to spend has taken a noticeably bearish stance on Regeneron Pharmaceuticals. Looking at options history for Regeneron Pharmaceuticals REGN we detected 12 strange trades.,REGN,0.784481,0.090916,Neutral
Diabetic Retinopathy Clinical Trial Pipeline Space Brims With Novel Emerging Therapies with Over 50 Key Companies Working in the Domain | DelveInsight,https://www.prnewswire.com/news-releases/diabetic-retinopathy-clinical-trial-pipeline-space-brims-with-novel-emerging-therapies-with-over-50-key-companies-working-in-the-domain--delveinsight-301836337.html,2023-05-29 15:00:00,Diabetic Retinopathy Clinical Trial Pipeline Space Brims With Novel ... PR ...,REGN,0.021106,0.002652,Neutral
Regeneron  ( REGN )  Posts Upbeat Data From Multiple Myeloma Study,https://www.zacks.com/stock/news/2100449/regeneron-regn-posts-upbeat-data-from-multiple-myeloma-study,2023-05-26 15:04:00,A mid-stage study data shows that treatment with Regeneron's (REGN) experimental antibody achieved a 71% objective response rate in heavily pre-treated multiple myeloma patients.,REGN,0.148121,0.0,Neutral
"Regeneron Reveals Updated Data From Multiple Myeloma Study, Showing Response Rate Of 71% - Regeneron Pharmaceuticals  ( NASDAQ:REGN ) ",https://www.benzinga.com/general/biotech/23/05/32590555/regeneron-reveals-updated-data-from-multiple-myeloma-study-showing-response-rate-of-71,2023-05-26 10:40:22,"Regeneron Pharmaceuticals Inc REGN announced updated data from two Phase 2 expansion dose cohorts of linvoseltamab ( formerly REGN5458 ) in patients with heavily pre-treated, relapsed/refractory multiple myeloma.",REGN,0.40348,0.163141,Somewhat-Bullish
Should You Invest in the First Trust NYSE Arca Biotechnology ETF  ( FBT ) ?,https://www.zacks.com/stock/news/2100032/should-you-invest-in-the-first-trust-nyse-arca-biotechnology-etf-fbt,2023-05-26 10:20:05,Sector ETF report for ...,REGN,0.130926,0.070514,Neutral
"Updated Linvoseltamab  ( BCMAxCD3 )  Data from Pivotal Trial Demonstrates Early, Deep and Durable Responses in Patients with Heavily Pre-treated Multiple Myeloma",https://www.globenewswire.com/news-release/2023/05/25/2676777/0/en/Updated-Linvoseltamab-BCMAxCD3-Data-from-Pivotal-Trial-Demonstrates-Early-Deep-and-Durable-Responses-in-Patients-with-Heavily-Pre-treated-Multiple-Myeloma.html,2023-05-25 21:05:00,"71% objective response rate, with 59% of patients achieving a very good partial response or better at the recommended 200 mg dose, per new data to be shared in an oral session at ...",REGN,0.046969,0.048733,Neutral
