title,url,time_published,summary,ticker,relevance_score,ticker_sentiment_score,ticker_sentiment_label
Synchrony  ( SYF )  Launches Outdoors Credit Card for Powersports,https://www.zacks.com/stock/news/2064257/synchrony-syf-launches-outdoors-credit-card-for-powersports,2023-03-10 16:18:00,Synchrony Financial's (SYF) new Outdoors Credit Card to help solidify its existing position in powersports and make aftermarket purchases for consumers easy and affordable.,SYF,0.323078,0.55767,Bullish
Synchrony  ( SYF )  & AGD Extend Partnership With 20-Year Deal,https://www.zacks.com/stock/news/2063139/synchrony-syf-agd-extend-partnership-with-20-year-deal,2023-03-08 17:19:00,Synchrony's (SYF) CareCredit is to be The Academy of General Dentistry's exclusive patient financing solution following the extension of their 20-year agreement.,SYF,0.298567,0.471876,Bullish
U.S. CFPB's bid to curb late credit card fees faces strong opposition,https://www.reuters.com/business/retail-consumer/us-cfpbs-bid-curb-late-credit-card-fees-faces-strong-opposition-2023-03-06/,2023-03-06 16:01:00,"March 06 ( Reuters ) - A U.S. consumer watchdog's proposal to slash late fees on credit cards is facing a rough road ahead as lenders gear up for what could turn out to be a fierce battle with the agency, industry experts and analysts said.",SYF,0.088472,-0.180305,Somewhat-Bearish
"Francis Chou Buys Buffett's Ally Financial, Trims 2 Top Holdings",https://www.forbes.com/sites/gurufocus/2023/03/03/francis-chou-buys-buffetts-ally-financial-trims-2-top-holdings/,2023-03-03 19:30:52,Canadian investor reveals 4th-quarter portfolio ...,SYF,0.149842,0.068287,Neutral
PRA Group  ( PRAA )  Q4 Earnings Beat on a Declining Expense Base,https://www.zacks.com/stock/news/2059985/pra-group-praa-q4-earnings-beat-on-a-declining-expense-base,2023-02-28 18:49:00,"PRA Group's (PRAA) fourth-quarter results indicate a decline in other operating expenses as well as compensation and employee services, partly offset by reduced portfolio income.",SYF,0.282777,0.132582,Neutral
MoneyGram  ( MGI )  Q4 Earnings Beat on Record Digital Revenues,https://www.zacks.com/stock/news/2059452/moneygram-mgi-q4-earnings-beat-on-record-digital-revenues,2023-02-27 18:42:00,MoneyGram International's (MGI) Q4 results reflect record-high digital revenues and digital transactions growth. The company benefits from lower operating expenses and increased investment income.,SYF,0.187827,0.209332,Somewhat-Bullish
"Owl Rock Capital  ( ORCC )  Q4 Earnings Beat, Revenues Rise Y/Y",https://www.zacks.com/stock/news/2058344/owl-rock-capital-orcc-q4-earnings-beat-revenues-rise-yy,2023-02-23 18:40:00,"Owl Rock Capital Q4 results reflect record high net investment income on the back of increased portfolio average yield, partially offset by an increase in operating expenses.",SYF,0.204936,0.207578,Somewhat-Bullish
Synchrony  ( SYF )  Down 1.1% Since Last Earnings Report: Can It Rebound?,https://www.zacks.com/stock/news/2057581/synchrony-syf-down-11-since-last-earnings-report-can-it-rebound,2023-02-22 16:30:09,Synchrony (SYF) reported earnings 30 days ago. What's next for the stock? We take a look at earnings estimates for some clues.,SYF,0.309973,0.251711,Somewhat-Bullish
"Synchrony Financial  ( NYSE:SYF )  Downgraded to ""Hold"" at StockNews.com",https://www.defenseworld.net/2023/02/21/synchrony-financial-nysesyf-downgraded-to-hold-at-stocknews-com.html,2023-02-21 09:30:42,"Synchrony Financial ( NYSE:SYF ) Downgraded to ""Hold"" at ... Defense World ...",SYF,0.819522,0.276918,Somewhat-Bullish
"The Zacks Analyst Blog Highlights Intel, Synopsys, FedEx, First Solar and Synchrony Financial",https://www.zacks.com/stock/news/2054006/the-zacks-analyst-blog-highlights-intel-synopsys-fedex-first-solar-and-synchrony-financial,2023-02-14 14:29:00,"Intel, Synopsys, FedEx, First Solar and Synchrony Financial are part of the Zacks top Analyst Blog.",SYF,0.733479,0.0,Neutral
Financial Synchrony  ( NYSE:SYF )  StockNews.com has upgraded it to Buy.,https://beststocks.com/financial-synchrony-nysesyf-stocknews-com-has/,2023-02-13 20:02:25,Financial Synchrony ( NYSE:SYF ) StockNews.com has upgraded it ... Best Stocks ...,SYF,0.689185,0.436536,Bullish
"Top Analyst Reports for Intel, Synopsys & FedEx",https://www.zacks.com/research-daily/2053325/top-analyst-reports-for-intel-synopsys-fedex,2023-02-13 16:40:00,"Today's Research Daily features new research reports on 16 major stocks, including Intel Corporation (INTC), Synopsys, Inc. (SNPS) and FedEx Corporation (FDX).",SYF,0.12165,0.061261,Neutral
Synchrony Financial  ( NYSE:SYF )  Rating Increased to Buy at StockNews.com,https://www.defenseworld.net/2023/02/12/synchrony-financial-nysesyf-rating-increased-to-buy-at-stocknews-com.html,2023-02-12 09:00:46,Synchrony Financial ( NYSE:SYF ) Rating Increased to Buy at ... Defense World ...,SYF,0.825264,0.430259,Bullish
Synchrony Financial  ( NYSE:SYF )  Rating Increased to Buy at StockNews.com,https://reporter.am/2023/02/12/synchrony-financial-nysesyf-rating-increased-to-buy-at-stocknews-com.html,2023-02-12 09:00:45,Synchrony Financial ( NYSE:SYF ) Rating Increased to Buy at ... Armenian Reporter ...,SYF,0.825264,0.430259,Bullish
Euronet  ( EEFT )  Q4 Earnings Beat Mark on Segmental Strength,https://www.zacks.com/stock/news/2051797/euronet-eeft-q4-earnings-beat-mark-on-segmental-strength,2023-02-08 16:53:00,Euronet (EEFT) fourth-quarter results reflect revenue growth on strong contributions from EFT Processing and Money Transfer segments. Management expects 23% year-over-year growth in Q1 adjusted EPS.,SYF,0.189175,0.11771,Neutral
Synchrony Financial  ( NYSE:SYF )  Upgraded to Buy by StockNews.com,https://www.etfdailynews.com/2023/02/04/synchrony-financial-nysesyf-upgraded-to-buy-by-stocknews-com/,2023-02-04 07:10:48,"Synchrony Financial ( NYSE:SYF - Get Rating ) was upgraded by analysts at StockNews.com from a ""hold"" rating to a ""buy"" rating in a research note issued to investors on Thursday.",SYF,0.731618,0.373392,Bullish
Synchrony Financial  ( NYSE:SYF )  Stock Rating Upgraded by StockNews.com,https://www.defenseworld.net/2023/02/04/synchrony-financial-nysesyf-stock-rating-upgraded-by-stocknews-com.html,2023-02-04 07:10:46,Synchrony Financial ( NYSE:SYF ) Stock Rating Upgraded by ... Defense World ...,SYF,0.821384,0.461753,Bullish
"Stocks making the biggest moves midday: 3M, Paccar, Bed Bath & Beyond, AMD and more",https://www.cnbc.com/2023/01/24/stocks-making-the-biggest-moves-midday-lyft-3m-lululemon-and-more.html,2023-01-24 18:21:05,These are the stocks posting the biggest moves during midday trading.,SYF,0.072,0.109319,Neutral
Synchrony Financial  ( SYF )  Q4 2022 Earnings Call Transcript,https://www.fool.com/earnings/call-transcripts/2023/01/23/synchrony-financial-syf-q4-2022-earnings-call-tran/,2023-01-24 03:00:29,"SYF earnings call for the period ending December 31, 2022.",SYF,0.007836,0.078355,Neutral
Nasdaq Rises 1.5%; Pliant Therapeutics Shares Spike Higher,https://www.benzinga.com/news/earnings/23/01/30531581/nasdaq-rises-1-5-pliant-therapeutics-shares-spike-higher,2023-01-23 20:03:27,"U.S. stocks traded higher toward the end of trading, with the Nasdaq Composite gaining more than 150 points on Monday. The Dow traded up 0.46% to 33,527.51 while the NASDAQ rose 1.55% to 11,313.03. The S&P 500 also rose, gaining, 0.85% to 4,006.43. Information technology shares jumped by 2.4% on ...",SYF,0.146916,0.166897,Somewhat-Bullish
Synchrony Financial  ( SYF )  Q4 Earnings Beat on Loan Growth,https://www.zacks.com/stock/news/2042743/synchrony-financial-syf-q4-earnings-beat-on-loan-growth,2023-01-23 16:08:00,"Synchrony Financial's (SYF) Q4 results reflect improved net interest income and an expanding loan receivables portfolio, partly offset by an elevated expense base.",SYF,0.390747,0.281568,Somewhat-Bullish
US Stocks Mostly Higher; Synchrony Financial Earnings Top Views,https://www.benzinga.com/news/earnings/23/01/30525034/us-stocks-mostly-higher-synchrony-financial-earnings-top-views,2023-01-23 15:06:02,"U.S. stocks traded mostly higher this morning, with the Nasdaq Composite gaining around 90 points on Monday. Following the market opening Monday, the Dow traded up 0.11% to 33,411.62 while the NASDAQ rose 0.79% to 11,228.13. The S&P 500 also rose, gaining, 0.40% to 3,988.54.",SYF,0.227716,0.223216,Somewhat-Bullish
"Discover Financial, Kimberly Clark, Johnson & Johnson and Synchrony Financial are part of Zacks Earnings Preview",https://www.zacks.com/stock/news/2042621/discover-financial-kimberly-clark-johnson-johnson-and-synchrony-financial-are-part-of-zacks-earnings-preview,2023-01-23 14:05:00,"Discover Financial, Kimberly Clark, Johnson & Johnson and Synchrony Financial are highlights of Zacks Earnings Preview article.",SYF,0.16099,0.032746,Neutral
"Baker Hughes, Synchrony Financial And 3 Stocks To Watch Heading Into Monday",https://www.benzinga.com/news/earnings/23/01/30517763/baker-hughes-synchrony-financial-and-3-stocks-to-watch-heading-into-monday,2023-01-23 09:02:41,"With US stock futures trading slightly lower this morning on Monday, some of the stocks that may grab investor focus today are as follows: Wall Street expects Baker Hughes Company BKR to post quarterly earnings at $0.40 per share on revenue of $6.06 billion before the opening bell.",SYF,0.518022,0.107955,Neutral
Fear & Greed Index Moves To 'Greed' Zone As Nasdaq Record Gains For Third Straight Week,https://www.benzinga.com/news/earnings/23/01/30517616/fear-greed-index-moves-to-greed-zone-as-nasdaq-record-gains-for-third-straight-week,2023-01-23 08:11:04,"The CNN Money Fear and Greed index moved to the ""Greed"" zone after US stocks closed higher on Friday. The Dow Jones and S&P 500 recorded gains on Friday, snapping a three-session losing streak. The Nasdaq recorded sharp gains for the week, adding 0.55% gain to record its third positive week in a ...",SYF,0.366061,0.0,Neutral
Wall Street drifts as earning reporting season ramps up,https://apnews.com/article/inflation-financial-markets-netflix-inc-economy-business-3718a9babd11bbe079d61d932d4fbd22,2023-01-23 03:47:07,"NEW YORK ( AP ) - Wall Street is ticking higher on Monday, as stocks drift upward following weeks of back-and-forth trading driven by hopes for cooling inflation and worries about the economy. The S&P 500 was 0.5% higher after flitting between small gains and losses, roughly in the same place ...",SYF,0.058759,-0.01104,Neutral
"Wall Street rises as earnings ramp up, Fed rate move nears",https://apnews.com/article/inflation-financial-markets-netflix-inc-economy-business-3718a9babd11bbe079d61d932d4fbd22,2023-01-23 03:47:07,Wall Street drifts as earning reporting season ramps up The Associated Press - en ...,SYF,0.052801,-0.011005,Neutral
"Tesla, Microsoft, Boeing earnings, along with GDP top week ahead",https://www.foxbusiness.com/markets/tesla-microsoft-boeing-earnings-gdp-top-week-ahead,2023-01-22 22:22:33,"This week will be a busy one for investors with earnings from defense, credit cards and airline companies all reporting quarterly results. The stock market is coming off a mixed week with the Dow Jones Industrial Average falling over 2%, while the S&P slipped marginally as the Nasdaq Composite ...",SYF,0.05654,0.0,Neutral
Making Sense of the Early Q4 Results: Is An Earnings Cliff Coming?,https://www.zacks.com/commentary/2042184/making-sense-of-the-early-q4-results-is-an-earnings-cliff-coming,2023-01-20 19:36:00,"By the end of this week, we will have seen quarterly results from about 28% of all S&P 500 members and will have a very good sense of whether the earnings-cliff narrative has started unfolding or been further pushed out.",SYF,0.101797,0.038102,Neutral
Synchrony  ( SYF )  to Post Q4 Earnings: What You Should Know,https://www.zacks.com/stock/news/2041572/synchrony-syf-to-post-q4-earnings-what-you-should-know,2023-01-19 17:57:00,Synchrony's (SYF) fourth-quarter results are likely to reflect higher information processing expenses and lower net interest margins.,SYF,0.297661,0.248419,Somewhat-Bullish
ABBV: 3 Safe Dividend Stocks to Buy Today and Hold Forever,https://stocknews.com/news/abbv-mpx-bset-3-safe-dividend-stocks-to-buy-today-and-hold-forever/,2023-01-13 18:44:38,"The Consumer Price Index ( CPI ) for December 2022 declined further, marking the sixth consecutive month of cooling inflation. CPI rose 6.5% from a year ago, the smallest annual increase since October 2021. This is raising the possibility of slower rate hikes ahead.",SYF,0.07887,0.044583,Neutral
Synchrony  ( SYF )  to Offer Financing Options at Bassett's Stores,https://www.zacks.com/stock/news/2038670/synchrony-syf-to-offer-financing-options-at-bassetts-stores,2023-01-13 15:03:00,Synchrony (SYF) aims to extend promotional financing options to customers visiting Bassett Furniture stores and also engage in data sharing with the latter.,SYF,0.175433,0.294113,Somewhat-Bullish
Should First Trust Large Cap Value AlphaDEX ETF  ( FTA )  Be on Your Investing Radar?,https://www.zacks.com/stock/news/2036573/should-first-trust-large-cap-value-alphadex-etf-fta-be-on-your-investing-radar,2023-01-09 11:20:07,Style Box ETF report for ...,SYF,0.117774,0.067245,Neutral
"Stocks making the biggest moves premarket: World Wrestling Entertainment, Bed Bath & Beyond, Tesla, Costco and more",https://www.cnbc.com/2023/01/06/stocks-making-the-biggest-moves-premarket-world-wrestling-entertainment-bed-bath-beyond-tesla-costco.html,2023-01-06 12:57:36,These are the stocks posting the largest moves in premarket trading.,SYF,0.103331,-0.237345,Somewhat-Bearish
This Week In Credit Card News: Interest Rates Expected To Keep Rising; Credit Card Trends In 2023,https://www.forbes.com/sites/billhardekopf/2023/01/05/this-week-in-credit-card-news-interest-rates-expected-to-keep-rising-credit-card-trends-in-2023/,2023-01-05 17:34:09,What took place this week in the credit card and payment industries ...,SYF,0.028355,0.026437,Neutral
Here's Why Investors Should Retain Genpact  ( G )  Stock Now,https://www.zacks.com/stock/news/2034956/heres-why-investors-should-retain-genpact-g-stock-now,2023-01-04 11:30:00,Investor-friendly steps and strong clientele boost Genpact (G) stock.,SYF,0.102888,0.167647,Somewhat-Bullish
