title,url,time_published,summary,ticker,relevance_score,ticker_sentiment_score,ticker_sentiment_label
Synchrony  ( SYF )  and Floor & Decor Partner for Financing Options,https://www.zacks.com/stock/news/2133740/synchrony-syf-and-floor-decor-partner-for-financing-options,2023-08-08 15:25:00,Synchrony's (SYF) multi-year partnership with Floor & Decor is expected to provide customers with suitable financing and payment options.,SYF,0.449219,0.687795,Bullish
Are These 2 Bank Stocks Screaming Buys After Their Dividend Raises?,https://www.fool.com/investing/2023/08/08/are-these-2-bank-stocks-screaming-buys-after-their/,2023-08-08 12:15:00,There's still time for investors to take advantage of one of these hikes.,SYF,0.198493,0.040611,Neutral
Rithm Capital  ( RITM )  Shares Dip 0.5% Despite Q2 Earnings Beat,https://www.zacks.com/stock/news/2133245/rithm-capital-ritm-shares-dip-05-despite-q2-earnings-beat,2023-08-07 15:55:00,"Rithm Capital's (RITM) Q2 results indicate strong contributions from the Residential Securities, Properties and Loans unit, partly offset by escalating general and administrative costs.",SYF,0.188193,0.100375,Neutral
Stocks Generating Improved Relative Strength: Synchrony Financial,https://www.investors.com/ibd-data-stories/stocks-generating-improved-relative-strength-synchrony-financial-2/,2023-08-04 07:00:00,"Synchrony Financial ( SYF ) had its Relative Strength ( RS ) Rating upgraded from 67 to 72 Friday -- a welcome improvement, but still short of the 80 or higher score you prefer to see. When looking for the best stocks to buy and watch, one factor to watch closely is relative price strength.",SYF,0.443626,0.536459,Bullish
CNO Financial's  ( CNO )  Q2 Earnings Miss on Higher Expenses,https://www.zacks.com/stock/news/2130609/cno-financials-cno-q2-earnings-miss-on-higher-expenses,2023-08-01 16:55:00,"CNO Financial (CNO) expects 2023 EPS in the range of $2.65-$2.85, indicating a decline from the 2022 figure of $3.06.",SYF,0.255106,0.112017,Neutral
AMERISAFE  ( AMSF )  Shares Fall 5.2% Despite Q2 Earnings Beat,https://www.zacks.com/stock/news/2130025/amerisafe-amsf-shares-fall-52-despite-q2-earnings-beat,2023-07-31 16:46:00,AMERISAFE's (AMSF) second-quarter results benefit from lower expenses. Improved net investment income acted as a partial offset.,SYF,0.250902,0.110535,Neutral
Principal Financial  ( PFG )  Q2 Earnings Miss on Higher Expenses,https://www.zacks.com/stock/news/2129644/principal-financial-pfg-q2-earnings-miss-on-higher-expenses,2023-07-28 17:30:00,Principal Financial's (PFG) second-quarter results are affected by deteriorating performances in most segments coupled with higher expenses.,SYF,0.210092,0.117409,Neutral
Repairs At Home? - Synchrony's Expanded Roto-Rooter Partnership Offers Financing Access For Plumbing Services - Synchrony Finl  ( NYSE:SYF ) ,https://www.benzinga.com/markets/equities/23/07/33443980/repairs-at-home-synchronys-expanded-roto-rooter-partnership-offers-financing-access-for-plumbing,2023-07-28 16:56:21,"Synchrony Financial SYF has entered into an expanded partnership with the plumbing and drain cleaning services provider, Roto-Rooter. The expanded partnership aims to provide homeowners with new financing options for their home repair needs.",SYF,0.608634,0.017815,Neutral
"Globe Life  ( GL )  Q2 Earnings Top Estimates, Premiums Rise Y/Y",https://www.zacks.com/stock/news/2128843/globe-life-gl-q2-earnings-top-estimates-premiums-rise-yy,2023-07-27 14:42:00,Globe Life's (GL) second-quarter results reflect higher premiums and increased net investment income. Higher expenses and lower insurance underwriting income are the offsets.,SYF,0.169378,0.062427,Neutral
"Synchrony Financial  ( NYSE:SYF )  Upgraded to ""Buy"" by StockNews.com",https://www.defenseworld.net/2023/07/26/synchrony-financial-nysesyf-upgraded-to-buy-by-stocknews-com.html,2023-07-26 19:28:43,"Synchrony Financial ( NYSE:SYF - Get Free Report ) was upgraded by equities researchers at StockNews.com from a ""hold"" rating to a ""buy"" rating in a report issued on Wednesday. Other equities research analysts have also recently issued reports about the company.",SYF,0.747616,0.425599,Bullish
Euronet's  ( EEFT )  Q2 Earnings Beat on Strong epay Segment,https://www.zacks.com/stock/news/2128151/euronets-eeft-q2-earnings-beat-on-strong-epay-segment,2023-07-26 16:09:00,"Euronet's (EEFT) Q2 results were aided by improved domestic and international cash withdrawal transactions and, promotional activity benefits, partly offset by higher direct operating expenses.",SYF,0.173333,0.103294,Neutral
"[Latest] Global Credit Card Payments Market Size/Share Worth USD 286.5 Billion by 2032 at a 9.1% CAGR: Custom Market Insights  ( Analysis, Outlook, Leaders, Report, Trends, Forecast, Segmentation, Growth, Growth Rate, Value ) ",https://www.benzinga.com/pressreleases/23/07/g33373930/latest-global-credit-card-payments-market-sizeshare-worth-usd-286-5-billion-by-2032-at-a-9-1-cagr-,2023-07-25 16:30:00,"Austin, TX, USA, July 25, 2023 ( GLOBE NEWSWIRE ) -- Custom Market Insights has published a new research report titled ""Credit Card Payments Market Size, Trends and Insights By Card Type ( General Purpose Credit Cards, Specialty & Other Credit Cards ) , By Application ( Food & Groceries, Health ...",SYF,0.026127,0.244946,Somewhat-Bullish
Stock Upgrades: Synchrony Financial Shows Rising Relative Strength,https://www.investors.com/ibd-data-stories/stock-upgrades-synchrony-financial-shows-rising-relative-strength/,2023-07-25 07:00:00,"Synchrony Financial ( SYF ) saw a welcome improvement to its Relative Strength ( RS ) Rating on Tuesday, rising from 66 to 76. X When looking for the best stocks to buy and watch, one factor to watch closely is relative price strength.",SYF,0.501398,0.667773,Bullish
Synchrony Financial  ( SYF )  Hikes Quarterly Dividend Payout by 9%,https://www.zacks.com/stock/news/2126348/synchrony-financial-syf-hikes-quarterly-dividend-payout-by-9,2023-07-24 16:24:00,Synchrony Financial's (SYF) recent dividend hike of 9% reflects its intention to enhance shareholders' value supported by its strong financial position.,SYF,0.223522,0.421081,Bullish
Synchrony Financial  ( SYF )  Q2 2023 Earnings Call Transcript,https://www.fool.com/earnings/call-transcripts/2023/07/18/synchrony-financial-syf-q2-2023-earnings-call-tran/,2023-07-18 19:00:25,"SYF earnings call for the period ending June 30, 2023.",SYF,0.008378,0.078677,Neutral
Synchrony  ( SYF )  Q2 Earnings Beat on Growing Interest Income,https://www.zacks.com/stock/news/2123164/synchrony-syf-q2-earnings-beat-on-growing-interest-income,2023-07-18 16:28:00,Synchrony Financial's (SYF) average active accounts have increased 1% year over year to 69.5 million in the second quarter.,SYF,0.348103,0.20036,Somewhat-Bullish
Are Investors Undervaluing StoneX Group  ( SNEX )  Right Now?,https://www.zacks.com/stock/news/2122820/are-investors-undervaluing-stonex-group-snex-right-now,2023-07-18 13:40:12,"Here at Zacks, our focus is on the proven Zacks Rank system, which emphasizes earnings estimates and estimate revisions to find great stocks. Nevertheless, we are always paying attention to the latest value, growth, and momentum trends to underscore strong picks.",SYF,0.533481,0.40679,Bullish
"Synchrony Financial Q2 Highlights: EPS Beats Consensus, Revenue In-Line, 2023 Outlook Revised - Synchrony Finl  ( NYSE:SYF ) ",https://www.benzinga.com/news/earnings/23/07/33262833/synchrony-financial-q2-highlights-eps-beats-consensus-revenue-in-line-2023-outlook-revised,2023-07-18 11:32:24,"Synchrony Financial SYF reported Q2 sales of $4.12 billion, in line with the consensus. Net interest income rose 8% Y/Y to $4.1 billion, led by higher interest and fees on loans, partly offset by higher interest expense from higher benchmark rates and increased funding liabilities.",SYF,0.419733,0.302563,Somewhat-Bullish
"Masimo, Acumen Pharmaceuticals And Other Big Stocks Moving Lower In Tuesday's Pre-Market Session - Acumen Pharmaceuticals  ( NASDAQ:ABOS ) , Faraday Future  ( NASDAQ:FFIE ) ",https://www.benzinga.com/news/23/07/33262881/masimo-acumen-pharmaceuticals-and-other-big-stocks-moving-lower-in-tuesdays-pre-market-session,2023-07-18 10:46:31,"Masimo Corporation MASI shares dipped 27.3% to $106.95 in pre-market trading after the company reported weak preliminary revenue results for the second quarter. Acumen Pharmaceuticals, Inc. ABOS tumbled 9.5% to $8.80 in pre-market trading after reporting a proposed public offering of common stock.",SYF,0.495015,-0.160085,Somewhat-Bearish
Synchrony Financial reports strong quarter on higher interest income,https://www.reuters.com/business/finance/synchrony-financial-reports-strong-quarter-higher-interest-income-2023-07-18/,2023-07-18 10:41:51,"July 18 ( Reuters ) - Credit card company Synchrony Financial ( SYF.N ) beat second-quarter profit estimates on Tuesday, as the U.S. Federal Reserve's rapid rate hikes helped boost interest earned from borrowers, offsetting a hit from bigger rainy-day funds.",SYF,0.31482,0.542519,Bullish
"Morning Bid: Retail, housing and banks test jaunty July",https://www.reuters.com/markets/us/global-markets-view-usa-2023-07-18/,2023-07-18 10:02:00,A look at the day ahead in U.S. and global markets from Mike Dolan The benign July investment environment gets tested on Tuesday by updates on U.S. retail sales and housing while the corporate earnings season kicks back into gear with another sweep of bank reports.,SYF,0.075161,0.0,Neutral
Synchrony Financial  ( NYSE:SYF )  Downgraded by StockNews.com to Hold,https://www.defenseworld.net/2023/07/18/synchrony-financial-nysesyf-downgraded-by-stocknews-com-to-hold.html,2023-07-18 05:26:44,"Synchrony Financial ( NYSE:SYF - Get Free Report ) was downgraded by stock analysts at StockNews.com from a ""buy"" rating to a ""hold"" rating in a report released on Tuesday. SYF has been the subject of a number of other reports.",SYF,0.871004,0.480092,Bullish
"FactSet Appoints Catrina Harding as Executive Vice President, Chief People Officer",https://www.globenewswire.com/news-release/2023/07/17/2705989/7768/en/FactSet-Appoints-Catrina-Harding-as-Executive-Vice-President-Chief-People-Officer.html,2023-07-17 20:30:00,"NORWALK, Conn., July 17, 2023 ( GLOBE NEWSWIRE ) -- FactSet ( NYSE: FDS | NASDAQ: FDS ) , a global financial digital platform and enterprise solutions provider, announced the appointment of Catrina Harding as Executive Vice President, Chief People Officer, effective July 17, 2023.",SYF,0.082677,-0.043829,Neutral
"FactSet Appoints Catrina Harding as Executive Vice President, Chief People Officer - FactSet Research Systems  ( NYSE:FDS ) ",https://www.benzinga.com/pressreleases/23/07/g33256305/factset-appoints-catrina-harding-as-executive-vice-president-chief-people-officer,2023-07-17 20:30:00,"NORWALK, Conn., July 17, 2023 ( GLOBE NEWSWIRE ) -- FactSet FDSFDS, a global financial digital platform and enterprise solutions provider, announced the appointment of Catrina Harding as Executive Vice President, Chief People Officer, effective July 17, 2023.",SYF,0.081276,-0.042709,Neutral
Why Earnings Season Could Be Great for Synchrony Financial  ( SYF ) ,https://www.zacks.com/stock/news/2121951/why-earnings-season-could-be-great-for-synchrony-financial-syf,2023-07-17 12:30:00,Synchrony Financial (SYF) is seeing favorable earnings estimate revision activity and has a positive Zacks Earnings ESP heading into earnings season.,SYF,0.902573,0.709937,Bullish
"Investing Action Plan: Tesla, Netflix And Airlines Fly Into The Q2 Season",https://www.investors.com/research/investing-action-plan/stock-market-action-plan-tesla-netflix-and-airlines-fly-into-the-q2-earnings-season/,2023-07-14 21:54:00,"After a rousing week of stock market gains, earnings season is upon us. Analysts and companies have lowered their expectations for second-quarter earnings. Early rounds of reports, however, have shown investors briskly rewarding performances that top those low targets.",SYF,0.036615,-0.070342,Neutral
Analyst Downgrades Synchrony Financial Despite Raising EPS Estimate: Here's Why - Synchrony Finl  ( NYSE:SYF ) ,https://www.benzinga.com/analyst-ratings/analyst-color/23/07/33232904/analyst-downgrades-synchrony-financial-despite-raising-eps-estimate-heres-why,2023-07-14 16:53:38,"Oppenheimer analyst Dominick Gabriele downgraded the rating on Synchrony Financial SYF to Perform from Outperform, rescinding the price target. The analyst sees the downgrade as a result of 'a short-term dislocation in the market' and expects pressured volumes despite loan growth on movement away ...",SYF,0.737923,-0.27292,Somewhat-Bearish
Synchrony  ( SYF )  & JAB Partner to Grow Pet Insurance Footprint,https://www.zacks.com/stock/news/2121431/synchrony-syf-jab-partner-to-grow-pet-insurance-footprint,2023-07-14 15:20:00,"Synchrony Financial's (SYF) Pets Best Insurance Services business is set to grow, benefiting from Independence American Insurance Company's underwriting services.",SYF,0.269776,0.503975,Bullish
Will Rising Costs Affect Synchrony's  ( SYF )  Q2 Earnings?,https://www.zacks.com/stock/news/2120700/will-rising-costs-affect-synchronys-syf-q2-earnings,2023-07-13 14:26:00,Synchrony's (SYF) second-quarter results are likely to reflect lower net interest margins and higher purchase volume.,SYF,0.244109,0.195649,Somewhat-Bullish
Synchrony Financial  ( NYSE:SYF )  Upgraded by StockNews.com to Buy,https://www.defenseworld.net/2023/07/11/synchrony-financial-nysesyf-upgraded-by-stocknews-com-to-buy.html,2023-07-11 08:08:42,StockNews.com upgraded shares of Synchrony Financial ( NYSE:SYF - Free Report ) from a hold rating to a buy rating in a research report released on Monday.,SYF,0.759672,0.498535,Bullish
Synchrony  ( SYF )  & Nextech Partner for CareCredit's Integration,https://www.zacks.com/stock/news/2115441/synchrony-syf-nextech-partner-for-carecredits-integration,2023-06-30 15:38:00,"Synchrony Financial's (SYF) CareCredit is set to be integrated in Nextech's software solutions, improving payment experience for customers.",SYF,0.531594,0.58151,Bullish
Synchrony Financial  ( SYF )  Expands Longstanding Ties With CCA,https://www.zacks.com/stock/news/2112554/synchrony-financial-syf-expands-longstanding-ties-with-cca,2023-06-23 16:32:00,Synchrony Financial (SYF) renews its partnership with CCA Global Partners in a bid to offer SYF's advanced digital tools to the latter's member businesses.,SYF,0.455978,0.451822,Bullish
Synchrony Financial Sees Relative Strength Rating Climb To 74,https://www.investors.com/ibd-data-stories/synchrony-financial-sees-relative-strength-rating-climb-to-74/,2023-06-23 07:00:00,"Synchrony Financial ( SYF ) had its Relative Strength ( RS ) Rating upgraded from 68 to 74 Friday -- a welcome improvement, but still short of the 80 or higher score you look for. As you try to find the best stocks to buy and watch, keep a close on eye on relative price strength.",SYF,0.622414,0.568513,Bullish
FDIC studying plan to include smaller U.S. banks in Basel III capital requirements after failures in early 2023,https://www.marketwatch.com/story/fdic-studying-plan-to-include-smaller-u-s-banks-in-basel-iii-capital-requirements-after-failures-in-early-2023-6b204a89,2023-06-22 15:42:00,FDIC Chairman Martin Gruenberg pushes back on claims that new capital requirements will cause U.S. banks to tighten lending activities.,SYF,0.118354,0.068507,Neutral
Synchrony  ( SYF )  Ties Up to Better Serve the Hearing Care Space,https://www.zacks.com/stock/news/2111431/synchrony-syf-ties-up-to-better-serve-the-hearing-care-space,2023-06-21 18:14:00,Synchrony Financial (SYF) aims to extend financing options to customers of Miracle-Ear who are in need of quality hearing care.,SYF,0.340915,0.60757,Bullish
Centrical Unveils Employee Performance Experience at Customer Contact Week Las Vegas 2023,https://www.prnewswire.com/news-releases/centrical-unveils-employee-performance-experience-at-customer-contact-week-las-vegas-2023-301855754.html,2023-06-20 17:52:00,"• Centrical, a category-leading, global software as a service company, releases Employee Performance Experience at Customer Contact Week in . • Today, frontline employees expect ""more recognition, opportunities to learn, fair treatment, clearer goals and better managers"". ( Gallup State of the ...",SYF,0.03792,0.050715,Neutral
A Fintech Vision For The Vision Pro,https://www.forbes.com/sites/davidbirch/2023/06/18/a-fintech-vision-for-the-vision-pro/,2023-06-18 14:20:39,"Apple has entered the virtual reality (VR) and augmented reality (AR) field with its Vision Pro headset, fintechs should look at their metaverse strategies.",SYF,0.049732,0.04684,Neutral
"Synchrony  ( SYF )  Solidifies Ties, Offers Perks for TCS Clients",https://www.zacks.com/stock/news/2106609/synchrony-syf-solidifies-ties-offers-perks-for-tcs-clients,2023-06-09 17:45:00,Synchrony Financial (SYF) strengthens its bond with The Container Store to bring enriched check-out capabilities for TCS mobile app users and also extend affordable financing options.,SYF,0.513494,0.604691,Bullish
"Top 5 Financial Stocks That May Implode In Q2 - AvidXchange Holdings  ( NASDAQ:AVDX ) , Greenhill & Co  ( NYSE:GHL ) ",https://www.benzinga.com/news/23/06/32714243/top-5-financial-stocks-that-may-implode-in-q2,2023-06-05 12:39:28,"The most overbought stocks in the financial sector presents an opportunity to go short on these overvalued companies. The RSI is a momentum indicator, which compares a stock's strength on days when prices go up to its strength on days when prices go down.",SYF,0.221819,0.241871,Somewhat-Bullish
"Synchrony  ( SYF )  Renews Tie-Up, Strengthens Jewelry Space Foothold",https://www.zacks.com/stock/news/2102781/synchrony-syf-renews-tie-up-strengthens-jewelry-space-foothold,2023-06-01 15:37:00,Synchrony (SYF) renews its alliance with JTV to bring diversified financing options as the means to advance the JTV Preferred Account credit card.,SYF,0.445352,0.41686,Bullish
Synchrony Financial  ( NYSE:SYF )  Lowered to Hold at StockNews.com,https://www.defenseworld.net/2023/05/23/synchrony-financial-nysesyf-lowered-to-hold-at-stocknews-com.html,2023-05-23 05:18:46,"Synchrony Financial ( NYSE:SYF - Get Rating ) was downgraded by investment analysts at StockNews.com from a ""buy"" rating to a ""hold"" rating in a research report issued to clients and investors on Tuesday.",SYF,0.795641,0.411813,Bullish
Here's Why Hold Strategy is Apt for Synchrony  ( SYF )  Stock Now,https://www.zacks.com/stock/news/2097612/heres-why-hold-strategy-is-apt-for-synchrony-syf-stock-now,2023-05-19 17:06:00,Synchrony (SYF) expects total loan receivables growth to be more than 10% for 2023.,SYF,0.263231,0.27412,Somewhat-Bullish
Why Is Synchrony  ( SYF )  Up 0.5% Since Last Earnings Report?,https://www.zacks.com/stock/news/2097475/why-is-synchrony-syf-up-05-since-last-earnings-report,2023-05-19 15:30:27,Synchrony (SYF) reported earnings 30 days ago. What's next for the stock? We take a look at earnings estimates for some clues.,SYF,0.241855,0.022536,Neutral
Synchrony Financial  ( NYSE:SYF )  Upgraded by StockNews.com to Buy,https://www.defenseworld.net/2023/05/16/synchrony-financial-nysesyf-upgraded-by-stocknews-com-to-buy.html,2023-05-16 09:20:49,StockNews.com upgraded shares of Synchrony Financial ( NYSE:SYF - Get Rating ) from a hold rating to a buy rating in a report released on Monday morning. A number of other equities research analysts have also weighed in on the company.,SYF,0.75061,0.469818,Bullish
Euronet  ( EEFT )  Stock Down 2.2% Despite Q1 Earnings Beat,https://www.zacks.com/stock/news/2090952/euronet-eeft-stock-down-22-despite-q1-earnings-beat,2023-05-05 13:29:00,"Euronet (EEFT) expects adjusted earnings to be around $2 per share in the second quarter of 2023, which indicates an improvement of 29% year over year.",SYF,0.075279,-0.084699,Neutral
AYI: 3 Home Improvement Stocks Profiting from Home Renovation Boom,https://stocknews.com/news/ayi-ttsh-bset-syf-3-home-improvement-stocks-profiting-from-home-renovation-boom/,2023-04-24 17:12:26,AYI: 3 Home Improvement Stocks Profiting from Home Renovation ... ...,SYF,0.061315,0.15505,Somewhat-Bullish
Synchrony Announces Quarterly Common Stock Dividend of $0.23 Per Share,https://www.prnewswire.com/news-releases/synchrony-announces-quarterly-common-stock-dividend-of-0-23-per-share-301803534.html,2023-04-20 20:30:00,Synchrony Announces Quarterly Common Stock Dividend of $0.23 ... PR ...,SYF,0.416844,0.326503,Somewhat-Bullish
Stock Market Trims Losses At Midday; This Nasdaq 100 Stock Soars On Earnings,https://www.investors.com/market-trend/stock-market-today/stock-market-lower-as-bank-other-earnings-pour-in-tesla-falls-after-another-price-cut/,2023-04-19 16:01:00,"Stock Market Lower As Bank, Other Earnings Pour In. Tesla Falls ... Investor's Business Daily ...",SYF,0.093289,0.242602,Somewhat-Bullish
Synchrony Financial  ( SYF )  Q1 Earnings Miss on Elevated Expenses,https://www.zacks.com/stock/news/2081451/synchrony-financial-syf-q1-earnings-miss-on-elevated-expenses,2023-04-19 14:38:00,"Synchrony Financial's (SYF) Q1 results hurt by escalating employee costs and lower average active accounts, partly offset by record purchase volume and improved net interest income.",SYF,0.327366,0.047529,Neutral
Morning Bid: Crowded bonds unnerved,https://www.reuters.com/markets/us/global-markets-view-usa-2023-04-19/,2023-04-19 10:04:00,"A look at the day ahead in U.S. and global markets from Mike Dolan For an investment world now so convinced of looming recession and substantially positioned for it, the incoming growth, inflation, banking and earnings pictures still won't play ball.",SYF,0.045655,0.0,Neutral
Can Higher Expenses Affect Synchrony's  ( SYF )  Q1 Earnings?,https://www.zacks.com/stock/news/2079172/can-higher-expenses-affect-synchronys-syf-q1-earnings,2023-04-14 15:28:00,Synchrony's (SYF) first-quarter results are likely to reflect higher information processing expenses and lower net interest margins.,SYF,0.230454,0.169081,Somewhat-Bullish
"Meta Platforms To Rally Over 16%? Here Are 10 Other Analyst Forecasts For Wednesday - Apple  ( NASDAQ:AAPL ) , Arista Networks  ( NYSE:ANET ) ",https://www.benzinga.com/news/23/04/31676390/meta-platforms-to-rally-over-16-here-are-10-other-analyst-forecasts-for-wednesday,2023-04-05 12:03:23,Morgan Stanley cut the price target for Bank of America Corporation BAC from $37 to $31. Morgan Stanley analyst Betsy Graseck maintained an Equal-Weight rating on the stock. Bank of America shares fell 0.4% to $27.87 in pre-market trading. Goldman Sachs boosted the price target for Arista ...,SYF,0.272788,-0.185555,Somewhat-Bearish
ChargeAfter Expands Lender Network in Canada with Leading B2B BNPL Provider Tabit,https://www.prnewswire.com/news-releases/chargeafter-expands-lender-network-in-canada-with-leading-b2b-bnpl-provider-tabit-301789707.html,2023-04-04 13:36:00,ChargeAfter Expands Lender Network in Canada with Leading B2B ... PR ...,SYF,0.066598,0.053076,Neutral
ChargeAfter Expands Lender Network in Canada with Leading B2B BNPL Provider Tabit,https://www.prnewswire.com/il/news-releases/chargeafter-expands-lender-network-in-canada-with-leading-b2b-bnpl-provider-tabit-878735905.html,2023-04-04 13:36:00,ChargeAfter Expands Lender Network in Canada with Leading B2B ... PR ...,SYF,0.066598,0.053076,Neutral
ChargeAfter Expands Lender Network in Canada with Leading B2B BNPL Provider Tabit,https://www.newswire.ca/news-releases/chargeafter-expands-lender-network-in-canada-with-leading-b2b-bnpl-provider-tabit-878735905.html,2023-04-04 13:36:00,ChargeAfter Expands Lender Network in Canada with Leading B2B ... Canada ...,SYF,0.066598,0.053076,Neutral
ChargeAfter Expands Lender Network in Canada with Leading B2B BNPL Provider Tabit,https://www.benzinga.com/pressreleases/23/04/n31657074/chargeafter-expands-lender-network-in-canada-with-leading-b2b-bnpl-provider-tabit,2023-04-04 13:36:00,"By adding more B2B lenders to its point-of-sale financing platform, ChargeAfter enables merchants in Canada to provide their business customers with additional B2B financing options",SYF,0.06179,0.053002,Neutral
ChargeAfter Expands Lender Network in Canada with Leading B2B BNPL Provider Tabit,https://www.prnewswire.com/news-releases/chargeafter-expands-lender-network-in-canada-with-leading-b2b-bnpl-provider-tabit-301789455.html,2023-04-04 13:00:00,ChargeAfter Expands Lender Network in Canada with Leading B2B ... PR ...,SYF,0.066598,0.053076,Neutral
ChargeAfter Expands Lender Network in Canada with Leading B2B BNPL Provider Tabit,https://www.prnewswire.com/il/news-releases/chargeafter-expands-lender-network-in-canada-with-leading-b2b-bnpl-provider-tabit-301789455.html,2023-04-04 13:00:00,ChargeAfter Expands Lender Network in Canada with Leading B2B ... PR ...,SYF,0.066598,0.053076,Neutral
The Good And Bad: Synchrony Financial & Koss Corp,https://www.forbes.com/sites/greatspeculations/2023/03/24/the-good-and-bad-synchrony-financial--koss-corp/,2023-03-24 13:45:41,See two of the featured stocks from this month's model portfolios.,SYF,0.225251,0.057861,Neutral
Synchrony Financial  ( NYSE:SYF )  Research Coverage Started at StockNews.com,https://www.defenseworld.net/2023/03/19/synchrony-financial-nysesyf-research-coverage-started-at-stocknews-com.html,2023-03-19 09:56:41,Synchrony Financial ( NYSE:SYF ) Research Coverage Started at ... Defense World ...,SYF,0.845171,0.478883,Bullish
Why Bank Stocks Ranging From Ally Financial to U.S. Bank Are Crashing  ( Again )  Today,https://www.fool.com/investing/2023/03/13/why-bank-stocks-ranging-from-ally-financial-to-us/,2023-03-13 17:49:43,The failure of Silicon Valley Bank is sparking concerns that its woes may be more common than had been previously believed.,SYF,0.173749,-0.044618,Neutral
